Sheet: Sheet1
A1: Function Evaluation Test Cases for SEJ
A3: Name | B3: Expected | C3: Actual | D3: # of Inputs | E3: Inputs
A5: Constant basic operators | B5: 3 | C5: =1+2 -> 3
B6: 7 | C6: =1+2*3 -> 7
B7: 8 | C7: =10-4/2 -> 8
B8: -2 | C8: =-5 - -3 -> -2
B9: 0.09 | C9: =(3+4)% + 2% -> 9.0000000000000011E-2
B10: 24 | C10: =2^3 + 2^(1+3) -> 24
A12: String operators (&) | B12: 23 | C12: =2 & 3 -> 23
B13: ABC | C13: ABC
B14: ABC | C14: ="ABC" -> ABC
B15: ABC | C15: ="AB" & "C" -> ABC
B16: AB1 | C16: ="AB" & 1 -> AB1
B17: AB-2.34 | C17: ="AB" & -2.34 -> AB-2.34
B18: AB1 | C18: ="AB" & RC[2] -> AB1 | D18: 1 | E18: 1
A20: Constant comparisons | B20: 1 | C20: =IF( 1 = 1, 1, 0 ) -> 1
B21: 0 | C21: =IF( 1 = 2, 1, 0 ) -> 0
B22: 0 | C22: =IF( 1 <> 1, 1, 0 ) -> 0
B23: 1 | C23: =IF( 1 <> 2, 1, 0 ) -> 1
B24: 0 | C24: =IF( 1 > 2, 1, 0 ) -> 0
B25: 1 | C25: =IF( 2 > 1, 1, 0 ) -> 1
B26: 1 | C26: =IF( 1 < 2, 1, 0 ) -> 1
B27: 0 | C27: =IF( 2 < 1, 1, 0 ) -> 0
B28: 1 | C28: =IF( 1 >= 1, 1, 0 ) -> 1
B29: 0 | C29: =IF( 1 >= 2, 1, 0 ) -> 0
B30: 1 | C30: =IF( 2 >= 1, 1, 0 ) -> 1
B31: 1 | C31: =IF( 1 <= 1, 1, 0 ) -> 1
B32: 1 | C32: =IF( 1 <= 2, 1, 0 ) -> 1
B33: 0 | C33: =IF( 2 <= 1, 1, 0 ) -> 0
A35: Precision | B35: 0.21 | C35: =RC[2]+RC[3] -> 0.20799999999999999 | D35: 2 | E35: 0.104 | F35: 0.104
A37: Sums | B37: 6 | C37: =SUM(RC[2]:RC[4]) -> 6 | D37: 3 | E37: 1 | F37: 2 | G37: 3
B38: 15 | C38: =SUM(RC[2]:RC[4]) -> 15 | D38: 3 | E38: 4 | F38: 5 | G38: 6
B39: 16 | C39: =SUM(RC[2]:RC[4]) -> 16 | D39: 3 | E39: 4 | F39: =R[-2]C -> 2 | G39: 10
B41: 1 | C41: =SUM(RC[2]) -> 1 | D41: 1 | E41: 1
B43: 3 | C43: =SUM(RC[2],RC[3]) -> 3 | D43: 2 | E43: 1 | F43: 2
B44: 9 | C44: =SUM(RC[2],RC[3]) -> 9 | D44: 2 | E44: 4 | F44: 5
B45: 21 | C45: =SUM(RC[2],RC[3]) -> 21 | D45: 2 | E45: =R[-2]C -> 1 | F45: 20
B47: 6 | C47: =SUM(RC[2],RC[3],RC[4]) -> 6 | D47: 3 | E47: 1 | F47: 2 | G47: 3
B49: 10 | C49: =SUM(RC[2],RC[3],RC[4],RC[5]) -> 10 | D49: 4 | E49: 1 | F49: 2 | G49: 3 | H49: 4
A51: Sum with 2D range | B51: 21 | C51: =SUM(R[-14]C[2]:R[-13]C[4]) -> 21
A53: Sum with range past right edge | B53: 3 | C53: =SUM(RC[2]:RC[7]) -> 3 | D53: 6 | E53: 1 | F53: 2
A55: Computation involving empty cells | B55: 1 | C55: =RC[2]+RC[3]-RC[4] -> 1 | D55: 3 | E55: 1
B56: 17 | C56: =RC[2]+RC[3]-RC[4] -> 17 | D56: 3 | F56: 17
B57: 2 | C57: =RC[2]+RC[3]-RC[4] -> 2 | D57: 3 | E57: 2
B59: 0 | C59: =RC[2]*RC[3] -> 0 | D59: 2 | E59: 3
A61: Sum involving empty cells | B61: 1 | C61: =SUM(RC[2]:RC[4],RC[6],RC[8]) -> 1 | D61: 7 | E61: 1
B62: 6 | C62: =SUM(RC[2]:RC[4],RC[6],RC[8]) -> 6 | F62: 2 | I62: 4
A64: Products | B64: 6 | C64: =PRODUCT(RC[2]:RC[4]) -> 6 | D64: 3 | E64: 1 | F64: 2 | G64: 3
B65: 120 | C65: =PRODUCT(RC[2]:RC[4]) -> 120 | D65: 3 | E65: 4 | F65: 5 | G65: 6
B66: 80 | C66: =PRODUCT(RC[2]:RC[4]) -> 80 | D66: 3 | E66: 4 | F66: =R[-2]C -> 2 | G66: 10
B68: 1 | C68: =PRODUCT(RC[2]) -> 1 | D68: 1 | E68: 1
B70: 2 | C70: =PRODUCT(RC[2],RC[3]) -> 2 | D70: 2 | E70: 1 | F70: 2
B71: 20 | C71: =PRODUCT(RC[2],RC[3]) -> 20 | D71: 2 | E71: 4 | F71: 5
B72: 20 | C72: =PRODUCT(RC[2],RC[3]) -> 20 | D72: 2 | E72: =R[-2]C -> 1 | F72: 20
B74: 6 | C74: =PRODUCT(RC[2],RC[3],RC[4]) -> 6 | D74: 3 | E74: 1 | F74: 2 | G74: 3
B76: 24 | C76: =PRODUCT(RC[2],RC[3],RC[4],RC[5]) -> 24 | D76: 4 | E76: 1 | F76: 2 | G76: 3 | H76: 4
A78: Averages | B78: 2 | C78: =AVERAGE(RC[2]:RC[4]) -> 2 | D78: 3 | E78: 1 | F78: 2 | G78: 3
B79: 5 | C79: =AVERAGE(RC[2]:RC[4]) -> 5 | D79: 3 | E79: 4 | F79: 5 | G79: 6
B80: 5.333333333333333 | C80: =AVERAGE(RC[2]:RC[4]) -> 5.333333333333333 | D80: 3 | E80: 4 | F80: =R[-2]C -> 2 | G80: 10
B82: 1 | C82: =AVERAGE(RC[2]) -> 1 | D82: 1 | E82: 1
B84: 1.5 | C84: =AVERAGE(RC[2],RC[3]) -> 1.5 | D84: 2 | E84: 1 | F84: 2
B85: 4.5 | C85: =AVERAGE(RC[2],RC[3]) -> 4.5 | D85: 2 | E85: 4 | F85: 5
B86: 10.5 | C86: =AVERAGE(RC[2],RC[3]) -> 10.5 | D86: 2 | E86: =R[-2]C -> 1 | F86: 20
B88: 2 | C88: =AVERAGE(RC[2],RC[3],RC[4]) -> 2 | D88: 3 | E88: 1 | F88: 2 | G88: 3
B90: 2.5 | C90: =AVERAGE(RC[2],RC[3],RC[4],RC[5]) -> 2.5 | D90: 4 | E90: 1 | F90: 2 | G90: 3 | H90: 4
A94: Operator precedence | B94: 7 | C94: =RC[2]+RC[3]*RC[4] -> 7 | D94: 3 | E94: 1 | F94: 2 | G94: 3
B95: 34 | C95: =RC[2]+RC[3]*RC[4] -> 34 | D95: 3 | E95: 4 | F95: 5 | G95: 6
B96: 11 | C96: =RC[2]+RC[3]*RC[4] -> 11 | D96: 3 | E96: 5 | F96: =R[-2]C -> 2 | G96: =R[-2]C -> 3
B97: 5 | C97: =RC[2]+RC[3]*RC[4] -> 5 | D97: 3 | E97: 3 | F97: =R[-3]C -> 2 | G97: 1
A99: Parenthesis to override precedence | B99: 9 | C99: =(RC[2]+RC[3])*RC[4] -> 9 | D99: 3 | E99: 1 | F99: 2 | G99: 3
B100: 54 | C100: =(RC[2]+RC[3])*RC[4] -> 54 | D100: 3 | E100: 4 | F100: 5 | G100: 6
B101: 21 | C101: =(RC[2]+RC[3])*RC[4] -> 21 | D101: 3 | E101: 5 | F101: =R[-2]C -> 2 | G101: =R[-2]C -> 3
B102: 5 | C102: =(RC[2]+RC[3])*RC[4] -> 5 | D102: 3 | E102: 3 | F102: =R[-3]C -> 2 | G102: 1
A104: Negation and subtraction | B104: -1 | C104: =-RC[2]--2--RC[3] -> -1 | D104: 2 | E104: -2 | F104: -5
B105: 5 | C105: =-RC[2]--2--RC[3] -> 5 | D105: 2 | E105: 2 | F105: 5