Sheet: UHL
A1: MatchConsts | B1: =MATCH(RC[1],RC[2]:RC[6]) -> 2 | C1: 15 | D1: 10 | E1: 15 | F1: 20 | G1: 25 | H1: 30
A2: MatchInputs | B2: =MATCH(RC[1],RC[2]:RC[6]) -> 2 | C2: 15 | D2: 10 | E2: 15 | F2: 20 | G2: 25 | H2: 30
A4: IndexConsts | B4: =INDEX(RC[2]:RC[6],1,RC[1]) -> 20 | C4: 3 | D4: 10 | E4: 15 | F4: 20 | G4: 25 | H4: 30
A5: IndexInputs | B5: =INDEX(RC[2]:RC[6],1,RC[1]) -> 20 | C5: 3 | D5: 10 | E5: 15 | F5: 20 | G5: 25 | H5: 30
A7: LookupConsts | B7: =LOOKUP(RC[1],RC[2]:RC[4],RC[5]:RC[7]) -> 12 | C7: 2 | D7: 1 | E7: 2 | F7: 3 | G7: 11 | H7: 12 | I7: 13
A8: LookupInputs | B8: =LOOKUP(RC[1],RC[2]:RC[4],RC[5]:RC[7]) -> 12 | C8: 2 | D8: 1 | E8: 2 | F8: 3 | G8: 11 | H8: 12 | I8: 13
A10: IndexMatchConsts | B10: =INDEX(RC[5]:RC[7],1,MATCH(RC[1],RC[2]:RC[4])) -> 12 | C10: 2 | D10: 1 | E10: 2 | F10: 3 | G10: 11 | H10: 12 | I10: 13
A12: MultiMatchConsts | B12: =MATCH(RC[1],RC[2]:RC[6]) -> 2 | C12: 15 | D12: 10 | E12: 15 | F12: 20 | G12: 25 | H12: 30
B13: =MATCH(RC[1],R[-1]C[2]:R[-1]C[6]) -> 4 | C13: 27
A14: MultiIndexConsts | B14: =INDEX(RC[2]:RC[6],1,RC[1]) -> 15 | C14: 2 | D14: 10 | E14: 15 | F14: 20 | G14: 25 | H14: 30
B15: =INDEX(R[-1]C[2]:R[-1]C[6],1,RC[1]) -> 20 | C15: 3
A16: MultiLookupConsts | B16: =LOOKUP(RC[1],RC[2]:RC[4],RC[5]:RC[7]) -> 12 | C16: 2 | D16: 1 | E16: 2 | F16: 3 | G16: 11 | H16: 12 | I16: 13
B17: =LOOKUP(RC[1],R[-1]C[2]:R[-1]C[4],R[-1]C[5]:R[-1]C[7]) -> 13 | C17: 3
A19: SubArrayConsts | B19: =HLOOKUP(RC[1],RC[2]:R[2]C[5],2) -> 12 | C19: 19 | D19: 10 | E19: 15 | F19: 20 | G19: 25
B20: =HLOOKUP(R[-1]C[1],R[-1]C[2]:R[1]C[5],3) -> 22 | D20: 11 | E20: 12 | F20: 13 | G20: 14
B21: =MATCH(R[-2]C[1],R[-2]C[2]:R[-2]C[5]) -> 2 | D21: 21 | E21: 22 | F21: 23 | G21: 24
A23: HLookupInputs | B23: =HLOOKUP(RC[1],RC[2]:R[2]C[5],RC[6]) -> 12 | C23: 19 | D23: 10 | E23: 15 | F23: 20 | G23: 25 | H23: 2
B24: =HLOOKUP(R[-1]C[1],R[-1]C[2]:R[1]C[5],RC[6]) -> 22 | D24: 11 | E24: 12 | F24: 13 | G24: 14 | H24: 3
D25: 21 | E25: 22 | F25: 23 | G25: 24