Sheet: Sheet1
A1: Repeating Section Test Cases for SEJ | B1: Look at the formulas in this column to see what SEJ supports!
B2: Use "Tools > Formula Auditing > Formula Auditing Mode" to show them all at once.
A4: Name | B4: Actual | C4: Range | D4: Section
A6: Grow horizontally | B6: =SUM(H_ONE) -> 6 | C6: H_ONE | D6: 1 | E6: 2 | F6: 3
D7: 1 | E7: 3 | F7: 6
A9: Grow vertically | B9: =SUM(R[1]C[2]:R[3]C[2]) -> 6 | C9: V_ONE
D10: 1 | E10: 1
D11: 2 | E11: 3
D12: 3 | E12: 6
A14: Two high, growing horizontally | B14: =SUM(RC[2]:R[1]C[4]) -> 21 | C14: H_TWO | D14: 1 | E14: 2 | F14: 3
D15: 4 | E15: 5 | F15: 6
D16: 5 | E16: 12 | F16: 21
A18: Two wide, growing vertically | B18: =SUM(R[1]C[2]:R[3]C[3]) -> 21 | C18: V_TWO
D19: 1 | E19: 2 | F19: 3
D20: 3 | E20: 4 | F20: 10
D21: 5 | E21: 6 | F21: 21
A23: Three high, SUM | B23: =SUM(RC[2]:R[2]C[4]) -> 45 | C23: H_THREE | D23: 1 | E23: 2 | F23: 3
D24: 4 | E24: 5 | F24: 6
D25: 7 | E25: 8 | F25: 9
D26: 12 | E26: 27 | F26: 45
A28: Three high, PRODUCT | B28: =PRODUCT(RC[2]:R[2]C[4]) -> 362880 | C28: H_THREE_PROD | D28: 1 | E28: 2 | F28: 3
D29: 4 | E29: 5 | F29: 6
D30: 7 | E30: 8 | F30: 9
D31: 28 | E31: 2240 | F31: 362880
A33: Three high, COUNT | B33: =COUNT(RC[2]:R[2]C[4]) -> 9 | C33: H_THREE_COUNT | D33: 1 | E33: 2 | F33: 3
D34: 4 | E34: 5 | F34: 6
D35: 7 | E35: 8 | F35: 9
D36: 3 | E36: 6 | F36: 9
A38: Derived column | B38: =SUM(R[1]C[2]:R[1]C[4]) -> 12 | C38: H_DERIVED | D38: 1 | E38: 2 | F38: 3
D39: =R[-1]C*2 -> 2 | E39: =R[-1]C*2 -> 4 | F39: =R[-1]C*2 -> 6
D40: 2 | E40: 6 | F40: 12
A42: Derived column with outer ref | B42: =SUM(R[1]C[2]:R[1]C[4]) -> 18 | C42: H_OUTER | D42: 1 | E42: 2 | F42: 3
D43: =R[-1]C*RC8 -> 3 | E43: =R[-1]C*RC8 -> 6 | F43: =R[-1]C*RC8 -> 9 | H43: 3
D44: 3 | E44: 9 | F44: 18
A46: Derived column with constant outer ref | B46: =SUM(R[1]C[2]:R[1]C[4]) -> 18 | C46: H_OUTER_CST | D46: 1 | E46: 2 | F46: 3
D47: =R[-1]C*RC8 -> 3 | E47: =R[-1]C*RC8 -> 6 | F47: =R[-1]C*RC8 -> 9 | H47: 3
D48: 3 | E48: 9 | F48: 18
A50: Mixed sum | B50: =SUM(RC[2]:RC[4],RC[6]:RC[7]) -> 15 | C50: H_MIXED | D50: 1 | E50: 2 | F50: 3 | H50: 4 | I50: 5
D51: 10 | E51: 12 | F51: 15
A53: Two separate sums | B53: =SUM(RC[2]:RC[4])+SUM(R[1]C[2]:R[1]C[4]) -> 21 | C53: H_SEPARATE | D53: 1 | E53: 2 | F53: 3
D54: 4 | E54: 5 | F54: 6
D55: 5 | E55: 12 | F55: 21
A57: Sum overlapping both section bounds | B57: =SUM(RC[2]:R[4]C[3]) -> 55 | C57: V_SUM_OVERLAP_BOTH | D57: 1 | E57: 6
D58: 2 | E58: 7 | F58: 44
D59: 3 | E59: 8 | F59: 55
D60: 4 | E60: 9
D61: 5 | E61: 10
A63: Sum overlapping left section bound | B63: =SUM(RC[2]:R[4]C[3]) -> 55 | C63: V_SUM_OVERLAP_LEFT | D63: 1 | E63: 6
D64: 2 | E64: 7 | F64: 16
D65: 3 | E65: 8 | F65: 27
D66: 4 | E66: 9 | F66: 40
D67: 5 | E67: 10 | F67: 55
A69: Sum overlapping right section bound | B69: =SUM(RC[2]:R[4]C[3]) -> 55 | C69: V_SUM_OVERLAP_RIGHT | D69: 1 | E69: 6 | F69: 35
D70: 2 | E70: 7 | F70: 44
D71: 3 | E71: 8 | F71: 55
D72: 4 | E72: 9
D73: 5 | E73: 10
A75: DSUM with repeating data | B75: =DSUM(RC[2]:R[5]C[4],"Yield",R[7]C[2]:R[8]C[3]) -> 50 | C75: V_DSUM | D75: Kind | E75: Age | F75: Yield | G75: Expected
D76: 1 | E76: 12 | F76: 28 | G76: 28
D77: 1 | E77: 8 | F77: 16 | G77: 28
D78: 2 | E78: 9 | F78: 28 | G78: 28
D79: 2 | E79: 10 | F79: 30 | G79: 28
D80: 1 | E80: 10 | F80: 22 | G80: 50
D82: Kind | E82: Age
D83: 1 | E83: >8
A85: DSUM with partial repeating data | B85: =DSUM(RC[2]:R[5]C[4],"Yield",R[7]C[2]:R[8]C[3]) -> 68 | C85: V_DSUM_PART | D85: Kind | E85: Age | F85: Yield | G85: Expected
D86: 1 | E86: 12 | F86: 28
D87: 1 | E87: 8 | F87: 16 | G87: 38
D88: 2 | E88: 9 | F88: 28 | G88: 38
D89: 1 | E89: 9 | F89: 30 | G89: 68
D90: 1 | E90: 5 | F90: 22
D92: Kind | E92: Age
D93: 1 | E93: <=9