Sheet: Sheet1
A1: Function Evaluation Test Cases for SEJ
A3: Name | B3: Expected | C3: Actual | D3: # of Inputs | E3: Inputs
A5: Product involving empty cells (unsupported because empty cells are zero!) | B5: 8 | C5: =PRODUCT(RC[2],RC[3],RC[4],RC[5]) -> 8 | D5: 4 | E5: 4 | F5: 2
A7: Sum over range delimited by named cells | B7: 15 | C7: =SUM(START:END) -> 15 | D7: 3 | E7: 4 | F7: 5 | G7: 6
B8: 9 | C8: =SUM(RC[2]:RC[4]) -> 9 | D8: 3 | E8: 1 | F8: =R[-1]C -> 5 | G8: 3
A10: Sum over range delimited by one named cell | B10: 9 | C10: =SUM(START:R[-3]C[3]) -> 9
B11: 11 | C11: =SUM(R[-4]C[3]:END) -> 11
A13: Average with holes (SEJ does not yet support NULL!) | B13: 2 | C13: =AVERAGE(RC[2],RC[3],RC[4],RC[5]) -> 2 | D13: 4 | E13: 1 | F13: 2 | H13: 3
A15: Sum involving strings | B15: 2 | C15: =SUM(RC[2]:RC[4]) -> 2 | D15: 3 | E15: Hello | F15: world! | G15: 2