Sheet: Sheet1
A1: Expected | B1: Actual | C1: Inputs | J1: # of Inputs | K1: Name | L1: Highlight | M1: Excel says | N1: Skip for
A2: 6 | B2: =PRODUCT(RC[1]:RC[3]) -> 6 | C2: 1 | D2: 2 | E2: 3 | J2: 3 | K2: PRODUCT (does not support blanks!) | L2: PRODUCT
A3: 120 | B3: =PRODUCT(RC[1]:RC[3]) -> 120 | C3: 4 | D3: 5 | E3: 6 | J3: 3 | K3: ...
A5: 720 | B5: =PRODUCT(RC[1]:R[1]C[3]) -> 720 | C5: 1 | D5: 2 | E5: 3 | J5: 3
A6: 14400 | B6: =PRODUCT(RC[1]:RC[3])^2 -> 14400 | C6: 4 | D6: 5 | E6: 6 | J6: 3 | K6: ...
A8: 1 | B8: =PRODUCT(RC[1]) -> 1 | C8: 1 | J8: 1
A9: 4 | B9: =PRODUCT(RC[1]) -> 4 | C9: 4 | J9: 1 | K9: ...
A11: 2 | B11: =PRODUCT(RC[1],RC[2]) -> 2 | C11: 1 | D11: 2 | J11: 2
A12: 20 | B12: =PRODUCT(RC[1],RC[2]) -> 20 | C12: 4 | D12: 5 | J12: 2 | K12: ...
A14: 6 | B14: =PRODUCT(RC[1],RC[2],RC[3]) -> 6 | C14: 1 | D14: 2 | E14: 3 | J14: 3
A15: 120 | B15: =PRODUCT(RC[1],RC[2],RC[3]) -> 120 | C15: 4 | D15: 5 | E15: 6 | J15: 3 | K15: ...
A17: 70 | B17: =PRODUCT(RC[1],RC[5],RC[2],RC[7]) -> 70 | C17: 1 | D17: 2 | E17: 3 | F17: 4 | G17: 5 | H17: 6 | I17: 7 | J17: 7
A18: 126 | B18: =PRODUCT(RC[1],RC[5],RC[2],RC[7]) -> 126 | C18: 7 | D18: 6 | E18: 5 | F18: 4 | G18: 3 | H18: 2 | I18: 1 | J18: 7 | K18: ...
A20: 4 | B20: =PRODUCT(RC[2],RC[1],RC[1],RC[2]) -> 4 | C20: 1 | D20: 2 | J20: 2
A21: 400 | B21: =PRODUCT(RC[2],RC[1],RC[1],RC[2]) -> 400 | C21: 4 | D21: 5 | J21: 2 | K21: ...
A23: 120 | B23: =PRODUCT(ProductRange) -> 120 | C23: 4 | D23: 5 | E23: 6 | J23: 3
A24: 6 | B24: =PRODUCT(RC[1]:RC[3]) -> 6 | C24: 1 | D24: 2 | E24: 3 | J24: 3 | K24: ...
A26: 210 | B26: =PRODUCT(RC[1]:RC[3],RC[5],RC[7]) -> 210 | C26: 1 | D26: 2 | E26: 3 | F26: 100 | G26: 5 | H26: 200 | I26: 7 | J26: 7
A27: 30240 | B27: =PRODUCT(RC[1]:RC[3],RC[5],RC[7]) -> 30240 | C27: 6 | D27: 7 | E27: 8 | F27: 80 | G27: 9 | I27: 10 | J27: 7 | K27: ...
A29: 3 | B29: =COUNT(RC[1]:RC[3]) -> 3 | C29: 1 | D29: 2 | E29: 3 | J29: 3 | K29: COUNT (does not support blanks!) | L29: COUNT
A30: 3 | B30: =COUNT(RC[1]:RC[3]) -> 3 | C30: 4 | D30: 5 | E30: 6 | J30: 3 | K30: ...
A32: 6 | B32: =COUNT(RC[1]:R[1]C[3]) -> 6 | C32: 1 | D32: 2 | E32: 3 | J32: 3
A33: 6 | B33: =COUNT(RC[1]:RC[3])*2 -> 6 | C33: 4 | D33: 5 | E33: 6 | J33: 3 | K33: ...
A35: 1 | B35: =COUNT(RC[1]) -> 1 | C35: 1 | J35: 1
A36: 1 | B36: =COUNT(RC[1]) -> 1 | C36: 4 | J36: 1 | K36: ...
A38: 2 | B38: =COUNT(RC[1],RC[2]) -> 2 | C38: 1 | D38: 2 | J38: 2
A39: 2 | B39: =COUNT(RC[1],RC[2]) -> 2 | C39: 4 | D39: 5 | J39: 2 | K39: ...
A41: 3 | B41: =COUNT(RC[1],RC[2],RC[3]) -> 3 | C41: 1 | D41: 2 | E41: 3 | J41: 3
A42: 3 | B42: =COUNT(RC[1],RC[2],RC[3]) -> 3 | C42: 4 | D42: 5 | E42: 6 | J42: 3 | K42: ...
A44: 4 | B44: =COUNT(RC[1],RC[5],RC[2],RC[7]) -> 4 | C44: 1 | D44: 2 | E44: 3 | F44: 4 | G44: 5 | H44: 6 | I44: 7 | J44: 7
A45: 4 | B45: =COUNT(RC[1],RC[5],RC[2],RC[7]) -> 4 | C45: 7 | D45: 6 | E45: 5 | F45: 4 | G45: 3 | H45: 2 | I45: 1 | J45: 7 | K45: ...
A47: 4 | B47: =COUNT(RC[2],RC[1],RC[1],RC[2]) -> 4 | C47: 1 | D47: 2 | J47: 2
A48: 4 | B48: =COUNT(RC[2],RC[1],RC[1],RC[2]) -> 4 | C48: 4 | D48: 5 | J48: 2 | K48: ...
A50: 3 | B50: =COUNT(CountRange) -> 3 | C50: 4 | D50: 5 | E50: 6 | J50: 3
A51: 3 | B51: =COUNT(RC[1]:RC[3]) -> 3 | C51: 1 | D51: 2 | E51: 3 | J51: 3 | K51: ...
A53: 5 | B53: =COUNT(RC[1]:RC[3],RC[5],RC[7]) -> 5 | C53: 1 | D53: 2 | E53: 3 | F53: 100 | G53: 5 | H53: 200 | I53: 7 | J53: 7
A54: 5 | B54: =COUNT(RC[1]:RC[3],RC[5],RC[7]) -> 5 | C54: 6 | D54: 7 | E54: 8 | F54: 80 | G54: 9 | I54: 10 | J54: 7 | K54: ...
A56: 3 | B56: =COUNTA(RC[1]:RC[3]) -> 3 | C56: 1 | E56: 1 | J56: 3 | K56: COUNTA | L56: COUNTA
A57: 3 | B57: =COUNTA(RC[1]:RC[3]) -> 3 | C57: 0 | D57: 5 | E57: Hello | J57: 3 | K57: ...
A59: 2 | B59: =AVERAGE(RC[1]:RC[3]) -> 2 | C59: 1 | D59: 2 | E59: 3 | J59: 3 | K59: AVERAGE (does not support blanks!) | L59: AVERAGE
A60: 5 | B60: =AVERAGE(RC[1]:RC[3]) -> 5 | C60: 4 | D60: 5 | E60: 6 | J60: 3 | K60: ...
A62: 3.5 | B62: =AVERAGE(RC[1]:R[1]C[3]) -> 3.5 | C62: 1 | D62: 2 | E62: 3 | J62: 3
A63: 5 | B63: =AVERAGE(RC[1]:RC[3],RC[1]:RC[3]) -> 5 | C63: 4 | D63: 5 | E63: 6 | J63: 3 | K63: ...
A65: 1 | B65: =AVERAGE(RC[1]) -> 1 | C65: 1 | J65: 1
A66: 4 | B66: =AVERAGE(RC[1]) -> 4 | C66: 4 | J66: 1 | K66: ...
A68: 1.5 | B68: =AVERAGE(RC[1],RC[2]) -> 1.5 | C68: 1 | D68: 2 | J68: 2
A69: 4.5 | B69: =AVERAGE(RC[1],RC[2]) -> 4.5 | C69: 4 | D69: 5 | J69: 2 | K69: ...
A71: 2 | B71: =AVERAGE(RC[1],RC[2],RC[3]) -> 2 | C71: 1 | D71: 2 | E71: 3 | J71: 3
A72: 5 | B72: =AVERAGE(RC[1],RC[2],RC[3]) -> 5 | C72: 4 | D72: 5 | E72: 6 | J72: 3 | K72: ...
A74: 3.75 | B74: =AVERAGE(RC[1],RC[5],RC[2],RC[7]) -> 3.75 | C74: 1 | D74: 2 | E74: 3 | F74: 4 | G74: 5 | H74: 6 | I74: 7 | J74: 7
A75: 4.25 | B75: =AVERAGE(RC[1],RC[5],RC[2],RC[7]) -> 4.25 | C75: 7 | D75: 6 | E75: 5 | F75: 4 | G75: 3 | H75: 2 | I75: 1 | J75: 7 | K75: ...
A77: 1.5 | B77: =AVERAGE(RC[2],RC[1],RC[1],RC[2]) -> 1.5 | C77: 1 | D77: 2 | J77: 2
A78: 4.5 | B78: =AVERAGE(RC[2],RC[1],RC[1],RC[2]) -> 4.5 | C78: 4 | D78: 5 | J78: 2 | K78: ...
A80: 5 | B80: =AVERAGE(AverageRange) -> 5 | C80: 4 | D80: 5 | E80: 6 | J80: 3
A81: 2 | B81: =AVERAGE(RC[1]:RC[3]) -> 2 | C81: 1 | D81: 2 | E81: 3 | J81: 3 | K81: ...
A83: 3.6 | B83: =AVERAGE(RC[1]:RC[3],RC[5],RC[7]) -> 3.6 | C83: 1 | D83: 2 | E83: 3 | F83: 100 | G83: 5 | H83: 200 | I83: 7 | J83: 7
A84: 8 | B84: =AVERAGE(RC[1]:RC[3],RC[5],RC[7]) -> 8 | C84: 6 | D84: 7 | E84: 8 | F84: 80 | G84: 9 | I84: 10 | J84: 7 | K84: ...
A86: -1 | B86: =MIN(RC[1]:RC[3]) -> -1 | C86: -1 | D86: 2 | E86: -1 | J86: 3 | K86: MIN (does not support blanks!) | L86: MIN
A87: 4 | B87: =MIN(RC[1]:RC[3]) -> 4 | C87: 4 | D87: 5 | E87: 6 | J87: 3 | K87: ...
A89: 1 | B89: =MIN(RC[1]:R[1]C[3]) -> 1 | C89: 1 | D89: 2 | E89: 3 | J89: 3
A90: 4 | B90: =MIN(RC[1]:RC[3]) -> 4 | C90: 4 | D90: 5 | E90: 6 | J90: 3 | K90: ...
A92: 1 | B92: =MIN(RC[1]) -> 1 | C92: 1 | J92: 1
A93: 4 | B93: =MIN(RC[1]) -> 4 | C93: 4 | J93: 1 | K93: ...
A95: 1 | B95: =MIN(RC[1],RC[2]) -> 1 | C95: 1 | D95: 2 | J95: 2
A96: 4 | B96: =MIN(RC[1],RC[2]) -> 4 | C96: 4 | D96: 5 | J96: 2 | K96: ...
A98: 1 | B98: =MIN(RC[1],RC[2],RC[3]) -> 1 | C98: 1 | D98: 2 | E98: 3 | J98: 3
A99: -6 | B99: =MIN(RC[1],RC[2],RC[3]) -> -6 | C99: -4 | D99: -5 | E99: -6 | J99: 3 | K99: ...
A101: 1 | B101: =MIN(RC[1],RC[5],RC[2],RC[7]) -> 1 | C101: 1 | D101: 2 | E101: 3 | F101: 4 | G101: 5 | H101: 6 | I101: 7 | J101: 7
A102: 1 | B102: =MIN(RC[1],RC[5],RC[2],RC[7]) -> 1 | C102: 7 | D102: 6 | E102: 5 | F102: 4 | G102: 3 | H102: 2 | I102: 1 | J102: 7 | K102: ...
A104: 1 | B104: =MIN(RC[2],RC[1],RC[1],RC[2]) -> 1 | C104: 1 | D104: 2 | J104: 2
A105: 4 | B105: =MIN(RC[2],RC[1],RC[1],RC[2]) -> 4 | C105: 4 | D105: 5 | J105: 2 | K105: ...
A107: 4 | B107: =MIN(MinRange) -> 4 | C107: 4 | D107: 5 | E107: 6 | J107: 3
A108: 1 | B108: =MIN(RC[1]:RC[3]) -> 1 | C108: 1 | D108: 2 | E108: 3 | J108: 3 | K108: ...
A110: 1 | B110: =MIN(RC[1]:RC[3],RC[5],RC[7]) -> 1 | C110: 1 | D110: 2 | E110: 3 | F110: 100 | G110: 5 | H110: 200 | I110: 7 | J110: 7
A111: 6 | B111: =MIN(RC[1]:RC[3],RC[5],RC[7]) -> 6 | C111: 6 | D111: 7 | E111: 8 | F111: 80 | G111: 9 | I111: 10 | J111: 7 | K111: ...
A113: 2 | B113: =MAX(RC[1]:RC[3]) -> 2 | C113: -1 | D113: 2 | E113: -1 | J113: 3 | K113: MAX (does not support blanks!) | L113: MAX
A114: 6 | B114: =MAX(RC[1]:RC[3]) -> 6 | C114: 4 | D114: 5 | E114: 6 | J114: 3 | K114: ...
A116: 6 | B116: =MAX(RC[1]:R[1]C[3]) -> 6 | C116: 1 | D116: 2 | E116: 3 | J116: 3
A117: 6 | B117: =MAX(RC[1]:RC[3]) -> 6 | C117: 4 | D117: 5 | E117: 6 | J117: 3 | K117: ...
A119: 1 | B119: =MAX(RC[1]) -> 1 | C119: 1 | J119: 1
A120: 4 | B120: =MAX(RC[1]) -> 4 | C120: 4 | J120: 1 | K120: ...
A122: 2 | B122: =MAX(RC[1],RC[2]) -> 2 | C122: 1 | D122: 2 | J122: 2
A123: 5 | B123: =MAX(RC[1],RC[2]) -> 5 | C123: 4 | D123: 5 | J123: 2 | K123: ...
A125: 3 | B125: =MAX(RC[1],RC[2],RC[3]) -> 3 | C125: 1 | D125: 2 | E125: 3 | J125: 3
A126: -4 | B126: =MAX(RC[1],RC[2],RC[3]) -> -4 | C126: -4 | D126: -5 | E126: -6 | J126: 3 | K126: ...
A128: 7 | B128: =MAX(RC[1],RC[5],RC[2],RC[7]) -> 7 | C128: 1 | D128: 2 | E128: 3 | F128: 4 | G128: 5 | H128: 6 | I128: 7 | J128: 7
A129: 7 | B129: =MAX(RC[1],RC[5],RC[2],RC[7]) -> 7 | C129: 7 | D129: 6 | E129: 5 | F129: 4 | G129: 3 | H129: 2 | I129: 1 | J129: 7 | K129: ...
A131: 2 | B131: =MAX(RC[2],RC[1],RC[1],RC[2]) -> 2 | C131: 1 | D131: 2 | J131: 2
A132: 5 | B132: =MAX(RC[2],RC[1],RC[1],RC[2]) -> 5 | C132: 4 | D132: 5 | J132: 2 | K132: ...
A134: 6 | B134: =MAX(MaxRange) -> 6 | C134: 4 | D134: 5 | E134: 6 | J134: 3
A135: 3 | B135: =MAX(RC[1]:RC[3]) -> 3 | C135: 1 | D135: 2 | E135: 3 | J135: 3 | K135: ...
A137: 7 | B137: =MAX(RC[1]:RC[3],RC[5],RC[7]) -> 7 | C137: 1 | D137: 2 | E137: 3 | F137: 100 | G137: 5 | H137: 200 | I137: 7 | J137: 7
A138: 10 | B138: =MAX(RC[1]:RC[3],RC[5],RC[7]) -> 10 | C138: 6 | D138: 7 | E138: 8 | F138: 80 | G138: 9 | I138: 10 | J138: 7 | K138: ...
A140: 0 | B140: =VARP(RC[1]) -> 0 | C140: 1 | J140: 1 | K140: VARP (does not support blanks!) | L140: VARP
A141: 0 | B141: =VARP(RC[1]) -> 0 | C141: 4 | J141: 1 | K141: ...
A143: 0.25 | B143: =VARP(RC[1],RC[2]) -> 0.25 | C143: 1 | D143: 2 | J143: 2
A144: 0.25 | B144: =VARP(RC[1],RC[2]) -> 0.25 | C144: 4 | D144: 5 | J144: 2 | K144: ...
A146: 4.64 | B146: =VARP(RC[1]:RC[3],RC[5],RC[7]) -> 4.64 | C146: 1 | D146: 2 | E146: 3 | F146: 100 | G146: 5 | H146: 200 | I146: 7 | J146: 7
A147: 2 | B147: =VARP(RC[1]:RC[3],RC[5],RC[7]) -> 2 | C147: 6 | D147: 7 | E147: 8 | F147: 80 | G147: 9 | I147: 10 | J147: 7 | K147: ...
A149: 0.5 | B149: =VAR(RC[1],RC[2]) -> 0.5 | C149: 1 | D149: 2 | J149: 2 | K149: VAR (does not support blanks!) | L149: VAR
A150: 0.5 | B150: =VAR(RC[1],RC[2]) -> 0.5 | C150: 4 | D150: 5 | J150: 2 | K150: ...
A152: 5.8 | B152: =VAR(RC[1]:RC[3],RC[5],RC[7]) -> 5.8000000000000007 | C152: 1 | D152: 2 | E152: 3 | F152: 100 | G152: 5 | H152: 200 | I152: 7 | J152: 7
A153: 2.5 | B153: =VAR(RC[1]:RC[3],RC[5],RC[7]) -> 2.5 | C153: 6 | D153: 7 | E153: 8 | F153: 80 | G153: 9 | I153: 10 | J153: 7 | K153: ...
A155: 2.8284271247461903 | B155: =STDEV(RC[1],RC[2]) -> 2.8284271247461903 | C155: -1 | D155: 3 | J155: 2 | K155: STDEV (does not support blanks!) | L155: STDEV
A156: 2.0816659994661326 | B156: =STDEV(RC[1],RC[2],RC[3]) -> 2.0816659994661326 | C156: -1 | D156: 0 | E156: 3 | J156: 3
A158: 40.688718279617696 | B158: =STDEV(RC[1]:RC[3],RC[4]:RC[6],RC[7]) -> 40.688718279617696 | C158: -1 | D158: 0 | E158: 5.45 | F158: 7.62 | G158: 12.7 | H158: 14.5 | I158: -100 | J158: 7
A159: 4.1518785191880596 | B159: =STDEV(RC[1]:RC[3],RC[4]:RC[6],RC[7]) -> 4.1518785191880596 | C159: -10 | D159: 0 | E159: 1 | F159: 0 | G159: -1 | H159: -2 | I159: 3 | J159: 7 | K159: ...
A161: 0 | B161: =STDEVP(RC[1]) -> 0 | C161: 7 | J161: 1 | K161: STDEVP (does not support blanks!) | L161: STDEVP
A162: 1.5 | B162: =STDEVP(RC[1],RC[2]) -> 1.5 | C162: 2 | D162: 5 | J162: 2
A163: 2.0548046676563256 | B163: =STDEVP(RC[1],RC[2],RC[3]) -> 2.0548046676563256 | C163: 2 | D163: 0 | E163: 5 | J163: 3
A165: 37.670433217252899 | B165: =STDEVP(RC[1]:RC[3],RC[4]:RC[6],RC[7]) -> 37.670433217252899 | C165: -1 | D165: 0 | E165: 5.45 | F165: 7.62 | G165: 12.7 | H165: 14.5 | I165: -100 | J165: 7
A166: 3.8438925848782031 | B166: =STDEVP(RC[1]:RC[3],RC[4]:RC[6],RC[7]) -> 3.8438925848782031 | C166: -10 | D166: 0 | E166: 1 | F166: 0 | G166: -1 | H166: -2 | I166: 3 | J166: 7 | K166: ... | N166: bigdecimal
A168: 0 | B168: =AVEDEV(RC[1]) -> 0 | C168: 40 | J168: 1 | K168: AVEDEV (does not support blanks!) | L168: AVEDEV
A169: 2 | B169: =AVEDEV(RC[1],RC[2]) -> 2 | C169: -1 | D169: 3 | J169: 2
A170: 1.5555555555555554 | B170: =AVEDEV(RC[1],RC[2],RC[3]) -> 1.5555555555555554 | C170: -1 | D170: 0 | E170: 3 | J170: 3
A172: 26.092653061224492 | B172: =AVEDEV(RC[1]:RC[3],RC[4]:RC[6],RC[7]) -> 26.092653061224492 | C172: -1 | D172: 0 | E172: 5.45 | F172: 7.62 | G172: 12.7 | H172: 14.5 | I172: -100 | J172: 7
A173: 2.693877551020408 | B173: =AVEDEV(RC[1]:RC[3],RC[4]:RC[6],RC[7]) -> 2.693877551020408 | C173: -10 | D173: 0 | E173: 1 | F173: 0 | G173: -1 | H173: -2 | I173: 3 | J173: 7 | K173: ...
A175: 0 | B175: =DEVSQ(RC[1]) -> 0 | C175: 40 | J175: 1 | K175: DEVSQ (does not support blanks!) | L175: DEVSQ
A176: 8 | B176: =DEVSQ(RC[1],RC[2]) -> 8 | C176: -1 | D176: 3 | J176: 2
A177: 8.6666666666666679 | B177: =DEVSQ(RC[1],RC[2],RC[3]) -> 8.6666666666666679 | C177: -1 | D177: 0 | E177: 3 | J177: 3 | N177: long
A179: 9933.4307714285715 | B179: =DEVSQ(RC[1]:RC[3],RC[4]:RC[6],RC[7]) -> 9933.4307714285715 | C179: -1 | D179: 0 | E179: 5.45 | F179: 7.62 | G179: 12.7 | H179: 14.5 | I179: -100 | J179: 7 | N179: long, bigdecimal
A180: 103.4285714285714 | B180: =DEVSQ(RC[1]:RC[3],RC[4]:RC[6],RC[7]) -> 103.4285714285714 | C180: -10 | D180: 0 | E180: 1 | F180: 0 | G180: -1 | H180: -2 | I180: 3 | J180: 7 | K180: ... | N180: long, bigdecimal
A182: 0.93521952958282351 | B182: =SKEW(RC[1],RC[2],RC[3]) -> 0.93521952958282351 | C182: 1 | D182: 2 | E182: 4 | J182: 3 | K182: SKEW (does not support blanks!) | L182: SKEW | N182: bigdecimal
A184: -2.5327066435041319 | B184: =SKEW(RC[1]:RC[3],RC[4]:RC[6],RC[7]) -> -2.5327066435041319 | C184: -1 | D184: 0 | E184: 5.45 | F184: 7.62 | G184: 12.7 | H184: 14.5 | I184: -100 | J184: 7
A185: -1.8491263727532468 | B185: =SKEW(RC[1]:RC[3],RC[4]:RC[6],RC[7]) -> -1.8491263727532468 | C185: -10 | D185: 0 | E185: 1 | F185: 0 | G185: -1 | H185: -2 | I185: 3 | J185: 7 | K185: ...
A187: 0.39053254437869889 | B187: =KURT(RC[1],RC[2],RC[3],RC[4]) -> 0.39053254437869889 | C187: 1 | D187: 2 | E187: 4 | F187: -1 | J187: 4 | K187: KURT (does not support blanks!) | L187: KURT | N187: long, bigdecimal
A189: 6.5478454980828005 | B189: =KURT(RC[1]:RC[3],RC[4]:RC[6],RC[7]) -> 6.5478454980828005 | C189: -1 | D189: 0 | E189: 5.45 | F189: 7.62 | G189: 12.7 | H189: 14.5 | I189: -100 | J189: 7 | N189: long, bigdecimal
A190: 4.2380757608131585 | B190: =KURT(RC[1]:RC[3],RC[4]:RC[6],RC[7]) -> 4.2380757608131585 | C190: -10 | D190: 0 | E190: 1 | F190: 0 | G190: -1 | H190: -2 | I190: 3 | J190: 7 | K190: ... | N190: long, bigdecimal
A192: 49 | B192: =SUMSQ(RC[1]) -> 49 | C192: 7 | J192: 1 | K192: SUMSQ | L192: SUMSQ
A193: 29 | B193: =SUMSQ(RC[1],RC[2]) -> 29 | C193: 2 | D193: 5 | J193: 2
A194: 29 | B194: =SUMSQ(RC[1],RC[2],RC[3]) -> 29 | C194: 2 | E194: 5 | J194: 3
A196: 10460.3069 | B196: =SUMSQ(RC[1]:RC[3],RC[4]:RC[6],RC[7]) -> 10460.3069 | C196: -1 | D196: 0 | E196: 5.45 | F196: 7.62 | G196: 12.7 | H196: 14.5 | I196: -100 | J196: 7
A197: 115 | B197: =SUMSQ(RC[1]:RC[3],RC[4]:RC[6],RC[7]) -> 115 | C197: -10 | E197: 1 | F197: 0 | G197: -1 | H197: -2 | I197: 3 | J197: 7 | K197: ... | N197: bigdecimal