Sheet: MainSheet
A1: Expected | B1: Actual | C1: Inputs | J1: # of Inputs | K1: Name | L1: Highlight
A2: 1 | B2: =RC[1] -> 1 | C2: 1 | J2: 1 | K2: Relative reference
A3: 6 | B3: =R3C3+RC3+R3C[1] -> 6 | C3: 2 | J3: 1 | K3: Absolute references | L3: $
A4: 3 | B4: =MYCELL -> 3 | C4: 3 | J4: 1 | K4: Simple name | L4: xx
A5: 8 | B5: =_MY_CELL_ + _MY_CELL -> 8 | C5: 4 | J5: 1 | K5: Two names for same cell
A6: 5 | B6: =_MY.CELL.1X -> 5 | C6: 5 | J6: 1 | K6: Unconventional names
A7: 6 | B7: =MY23.43CELL -> 6 | C7: 6 | J7: 1
A8: 7 | B8: =_12345 -> 7 | C8: 7 | J8: 1
A9: 400 | B9: =A1B+A1_+A1.1+A_1+A.1 -> 400 | C9: 100 | D9: 90 | E9: 80 | F9: 70 | G9: 60 | J9: 5
A11: 6 | B11: =SUM(RC[1]:RC[3]) -> 6 | C11: 1 | D11: 2 | E11: 3 | J11: 3 | K11: Range with cell references
A12: 15 | B12: =SUM(Range) -> 15 | C12: 4 | D12: 5 | E12: 6 | J12: 3 | K12: Range name
A14: 30 | B14: =SecondSheet!R[-13]C+CellOnThirdSheet -> 30 | C14: 10 | D14: 20 | J14: 2 | K14: References to other sheets

Sheet: SecondSheet
A1: Explicitly referenced cell | B1: =MainSheet!R[13]C[1] -> 10

Sheet: ThirdSheet
A1: Cell referenced by name | B1: =MainSheet!R[13]C[2] -> 20