Sheet: Sheet1
A1: Expected | B1: Actual | C1: Inputs | J1: # of Inputs | K1: Name | L1: Highlight | M1: Excel says | N1: Skip for
A2: 123 | B2: =VALUE(RC[1]) -> 123 | C2: 123 | J2: 1 | K2: VALUE (does not support blanks!) | L2: VALUE
A3: 123 | B3: =VALUE(RC[1]) -> 123 | C3: 123 | J3: 1
A4: 123.55 | B4: =VALUE(RC[1]) -> 123.55 | C4: 123.55 | J4: 1
A5: -23 | B5: =VALUE(RC[1]) -> -23 | C5: -23 | J5: 1
A6: 100000000 | B6: =VALUE(RC[1]) -> 100000000 | C6: 100,000,000 | J6: 1
A7: 0.2 | B7: =VALUE(RC[1]) -> 0.2 | C7: 20% | J7: 1
A8: 1234567000 | B8: =VALUE(RC[1]) -> 1234567000 | C8: 1,234.567e6 | J8: 1
A9: -1.2345E-6 | B9: =VALUE(RC[1]) -> -1.2345E-6 | C9: -12345e-10 | J9: 1
A10: -1.2345599999999999E-7 | B10: =VALUE(RC[1]) -> -1.2345599999999999E-7 | C10: -123,456E-12 | J10: 1
A11: 12.345000000000001 | B11: =VALUE(RC[1]) -> 12.345000000000001 | C11: 12.345000000000001 | J11: 1
A12: 35981 | B12: =VALUE(RC[1]) -> 35981 | C12: 7/5/1998 | J12: 1
A13: 35981 | B13: =VALUE(RC[1]) -> 35981 | C13: 7/5/98 | J13: 1
A14: 35981.509027777778 | B14: =VALUE(RC[1]) -> 35981.509027777778 | C14: 7/5/1998 12:13 | J14: 1
A15: 35981.509189814817 | B15: =VALUE(RC[1]) -> 35981.509189814817 | C15: 7/5/98 12:13:14 | J15: 1
A16: 0.50902777777777775 | B16: =VALUE(RC[1]) -> 0.50902777777777775 | C16: 12:13 | J16: 1
A17: 0.50918981481481485 | B17: =VALUE(RC[1]) -> 0.50918981481481485 | C17: 12:13:14 | J17: 1
A18: 9.0277777777777787E-3 | B18: =VALUE(RC[1]) -> 9.0277777777777787E-3 | C18: 0:13 | J18: 1
A19: 9.1898148148148139E-3 | B19: =VALUE(RC[1]) -> 9.1898148148148139E-3 | C19: 0:13:14 | J19: 1
A20: 35981.509027777778 | B20: =VALUE(RC[1]) -> 35981.509027777778 | C20: 7/5/1998 12:13 PM | J20: 1
A21: 35981.509189814817 | B21: =VALUE(RC[1]) -> 35981.509189814817 | C21: 7/5/98 12:13:14 PM | J21: 1
A22: 0.50902777777777775 | B22: =VALUE(RC[1]) -> 0.50902777777777775 | C22: 12:13 PM | J22: 1
A23: 0.50918981481481485 | B23: =VALUE(RC[1]) -> 0.50918981481481485 | C23: 12:13:14 PM | J23: 1
A24: 0.50902777777777775 | B24: =VALUE(RC[1]) -> 0.50902777777777775 | C24: 0:13 PM | J24: 1
A25: 0.50918981481481485 | B25: =VALUE(RC[1]) -> 0.50918981481481485 | C25: 0:13:14 PM | J25: 1
A26: 9.0277777777777787E-3 | B26: =VALUE(RC[1]) -> 9.0277777777777787E-3 | C26: 12:13 AM | J26: 1
A27: 9.1898148148148139E-3 | B27: =VALUE(RC[1]) -> 9.1898148148148139E-3 | C27: 12:13:14 AM | J27: 1
A28: 9.0277777777777787E-3 | B28: =VALUE(RC[1]) -> 9.0277777777777787E-3 | C28: 0:13 AM | J28: 1
A29: 9.1898148148148139E-3 | B29: =VALUE(RC[1]) -> 9.1898148148148139E-3 | C29: 0:13:14 AM | J29: 1
A30: 10959 | B30: =VALUE(RC[1]) -> 10959 | C30: 1/1/30 | J30: 1
A31: 47483 | B31: =VALUE(RC[1]) -> 47483 | C31: 12/31/29 | J31: 1
A32: 35981 | B32: =VALUE(RC[1]) -> 35981 | C32: 1998/7/5 | J32: 1
A33: 35981.509027777778 | B33: =VALUE(RC[1]) -> 35981.509027777778 | C33: 1998/7/5 12:13 | J33: 1
A34: 35981.509189814817 | B34: =VALUE(RC[1]) -> 35981.509189814817 | C34: 1998/7/5 12:13:14 | J34: 1
A35: 35981 | B35: =VALUE(RC[1]) -> 35981 | C35: 1998-7-5 | J35: 1
A36: 35981.509027777778 | B36: =VALUE(RC[1]) -> 35981.509027777778 | C36: 1998-7-5 12:13 | J36: 1
A37: 35981.509189814817 | B37: =VALUE(RC[1]) -> 35981.509189814817 | C37: 1998-7-5 12:13:14 | J37: 1
A38: 0 | B38: =VALUE(RC[1]) -> #VALUE! | C38: This is not a number | J38: 1 | M38: #VALUE!
A40: 12.345000000000001 | B40: =N(RC[1]) -> 12.345000000000001 | C40: 12.345000000000001 | J40: 1 | K40: N (does not support blanks!) | L40: N
A41: 0 | B41: =N(RC[1]) -> 0 | C41: 12345 | J41: 1
A42: 39083 | B42: =N(RC[1]) -> 39083 | C42: 2007-01-01T00:00:00.000 | J42: 1
A43: 0 | B43: =N(RC[1]) -> 0 | C43: 1/1/2007 | J43: 1
A44: 1 | B44: =N(RC[1]) -> 1 | C44: 1 | J44: 1
A45: 0 | B45: =N(RC[1]) -> 0 | C45: 0 | J45: 1
A47: AaBbCcDd | B47: =T(RC[1]) -> AaBbCcDd | C47: AaBbCcDd | J47: 1 | K47: T (does not support blanks!) | L47: T
A48: АаБбВвГгДд | B48: =T(RC[1]) -> АаБбВвГгДд | C48: АаБбВвГгДд | J48: 1
B49: =T(RC[1]) ->  | C49: 123.45 | J49: 1
A50: 123.45 | B50: =T(RC[1]) -> 123.45 | C50: 123.45 | J50: 1
B51: =T(RC[1]) ->  | C51: 2007-01-01T00:00:00.000 | J51: 1
A52: 1/1/2007 | B52: =T(RC[1]) -> 1/1/2007 | C52: 1/1/2007 | J52: 1
B53: =T(RC[1]) ->  | C53: 1 | J53: 1
B54: =T(RC[1]) ->  | C54: 0 | J54: 1
A56: 0 | B56: =TEXT(RC[1],RC[2]) -> 0 | C56: 0 | D56: @ | J56: 2 | K56: TEXT (does not support blanks!) | L56: TEXT
A57: 99999999999 | B57: =TEXT(RC[1],RC[2]) -> 99999999999 | C57: 99999999999.499893 | D57: @ | J57: 2
A58: 1E+11 | B58: =TEXT(RC[1],RC[2]) -> 1E+11 | C58: 99999999999.5 | D58: @ | J58: 2
A59: 0.000000009 | B59: =TEXT(RC[1],RC[2]) -> 0.000000009 | C59: 8.9999999999999995E-9 | D59: @ | J59: 2 | N59: bigdecimal, long
A60: 9E-09 | B60: =TEXT(RC[1],RC[2]) -> 9E-09 | C60: 9.0000009999999998E-9 | D60: @ | J60: 2 | N60: bigdecimal, long
A61: 7.77778E-05 | B61: =TEXT(RC[1],RC[2]) -> 7.77778E-05 | C61: 7.77777777777777E-5 | D61: @ | J61: 2 | N61: bigdecimal, long
A62: 0.000777778 | B62: =TEXT(RC[1],RC[2]) -> 0.000777778 | C62: 7.7777777777777697E-4 | D62: @ | J62: 2 | N62: bigdecimal, long
A63: 0.007777778 | B63: =TEXT(RC[1],RC[2]) -> 0.007777778 | C63: 7.7777777777777697E-3 | D63: @ | J63: 2 | N63: bigdecimal, long
A64: 0.077777778 | B64: =TEXT(RC[1],RC[2]) -> 0.077777778 | C64: 7.7777777777777696E-2 | D64: @ | J64: 2 | N64: bigdecimal, long
A65: 0.777777778 | B65: =TEXT(RC[1],RC[2]) -> 0.777777778 | C65: 0.77777777777777701 | D65: @ | J65: 2 | N65: bigdecimal, long
A66: 7.777777778 | B66: =TEXT(RC[1],RC[2]) -> 7.777777778 | C66: 7.7777777777777697 | D66: @ | J66: 2 | N66: bigdecimal, long
A67: 77.77777778 | B67: =TEXT(RC[1],RC[2]) -> 77.77777778 | C67: 77.7777777777777 | D67: @ | J67: 2 | N67: long
A68: 777.7777778 | B68: =TEXT(RC[1],RC[2]) -> 777.7777778 | C68: 777.77777777777703 | D68: @ | J68: 2 | N68: long
A69: 7777.777778 | B69: =TEXT(RC[1],RC[2]) -> 7777.777778 | C69: 7777.7777777777701 | D69: @ | J69: 2
A70: 77777.77778 | B70: =TEXT(RC[1],RC[2]) -> 77777.77778 | C70: 77777.777777777694 | D70: @ | J70: 2
A71: 777777.7778 | B71: =TEXT(RC[1],RC[2]) -> 777777.7778 | C71: 777777.77777777705 | D71: @ | J71: 2
A72: 7777777.778 | B72: =TEXT(RC[1],RC[2]) -> 7777777.778 | C72: 7777777.7777777696 | D72: @ | J72: 2
A73: 77777777.78 | B73: =TEXT(RC[1],RC[2]) -> 77777777.78 | C73: 77777777.777777702 | D73: @ | J73: 2
A74: 777777777.8 | B74: =TEXT(RC[1],RC[2]) -> 777777777.8 | C74: 777777777.77777696 | D74: @ | J74: 2
A75: 7777777778 | B75: =TEXT(RC[1],RC[2]) -> 7777777778 | C75: 7777777777.77777 | D75: @ | J75: 2
A76: 77777777778 | B76: =TEXT(RC[1],RC[2]) -> 77777777778 | C76: 77777777777.777695 | D76: @ | J76: 2
A77: 7.77778E+11 | B77: =TEXT(RC[1],RC[2]) -> 7.77778E+11 | C77: 777777777777.77698 | D77: @ | J77: 2
A78: 7.77778E+12 | B78: =TEXT(RC[1],RC[2]) -> 7.77778E+12 | C78: 7777777777777.7695 | D78: @ | J78: 2
A79: 7.77778E+13 | B79: =TEXT(RC[1],RC[2]) -> 7.77778E+13 | C79: 77777777777777.703 | D79: @ | J79: 2 | N79: long
A80: 7.77778E+14 | B80: =TEXT(RC[1],RC[2]) -> 7.77778E+14 | C80: 777777777777777 | D80: @ | J80: 2 | N80: long
A81: -777777777.8 | B81: =TEXT(RC[1],RC[2]) -> -777777777.8 | C81: -777777777.77777696 | D81: @ | J81: 2
A82: -7777777778 | B82: =TEXT(RC[1],RC[2]) -> -7777777778 | C82: -7777777777.77777 | D82: @ | J82: 2
A83: -77777777778 | B83: =TEXT(RC[1],RC[2]) -> -77777777778 | C83: -77777777777.777695 | D83: @ | J83: 2
A84: -7.77778E+11 | B84: =TEXT(RC[1],RC[2]) -> -7.77778E+11 | C84: -777777777777.77698 | D84: @ | J84: 2
A85: 0.000000001 | B85: =TEXT(RC[1],RC[2]) -> 0.000000001 | C85: 1.0000000000000001E-9 | D85: @ | J85: 2 | N85: bigdecimal, long
A86: 0.000000011 | B86: =TEXT(RC[1],RC[2]) -> 0.000000011 | C86: 1.0999999999999999E-8 | D86: @ | J86: 2 | N86: bigdecimal, long
A87: 0.000000111 | B87: =TEXT(RC[1],RC[2]) -> 0.000000111 | C87: 1.11E-7 | D87: @ | J87: 2 | N87: bigdecimal, long
A88: 0.000001111 | B88: =TEXT(RC[1],RC[2]) -> 0.000001111 | C88: 1.111E-6 | D88: @ | J88: 2 | N88: bigdecimal, long
A89: 0.000011111 | B89: =TEXT(RC[1],RC[2]) -> 0.000011111 | C89: 1.1110999999999999E-5 | D89: @ | J89: 2 | N89: bigdecimal, long
A90: 0.000111111 | B90: =TEXT(RC[1],RC[2]) -> 0.000111111 | C90: 1.11111E-4 | D90: @ | J90: 2 | N90: bigdecimal, long
A91: 0.001111111 | B91: =TEXT(RC[1],RC[2]) -> 0.001111111 | C91: 1.1111109999999999E-3 | D91: @ | J91: 2 | N91: bigdecimal, long
A92: 0.011111111 | B92: =TEXT(RC[1],RC[2]) -> 0.011111111 | C92: 1.1111111E-2 | D92: @ | J92: 2 | N92: bigdecimal, long
A93: 0.111111111 | B93: =TEXT(RC[1],RC[2]) -> 0.111111111 | C93: 0.111111111 | D93: @ | J93: 2 | N93: bigdecimal, long
A94: 1E-11 | B94: =TEXT(RC[1],RC[2]) -> 1E-11 | C94: 9.9999999999999994E-12 | D94: @ | J94: 2 | N94: bigdecimal, long
A95: 1.1E-10 | B95: =TEXT(RC[1],RC[2]) -> 1.1E-10 | C95: 1.0999999999999999E-10 | D95: @ | J95: 2 | N95: bigdecimal, long
A96: 1.01E-09 | B96: =TEXT(RC[1],RC[2]) -> 1.01E-09 | C96: 1.01E-9 | D96: @ | J96: 2 | N96: bigdecimal, long
A97: 1.101E-08 | B97: =TEXT(RC[1],RC[2]) -> 1.101E-08 | C97: 1.1010000000000001E-8 | D97: @ | J97: 2 | N97: bigdecimal, long
A98: 1.1101E-07 | B98: =TEXT(RC[1],RC[2]) -> 1.1101E-07 | C98: 1.1101E-7 | D98: @ | J98: 2 | N98: bigdecimal, long
A99: 1.11101E-06 | B99: =TEXT(RC[1],RC[2]) -> 1.11101E-06 | C99: 1.1110100000000001E-6 | D99: @ | J99: 2 | N99: bigdecimal, long
A100: 1.1111E-05 | B100: =TEXT(RC[1],RC[2]) -> 1.1111E-05 | C100: 1.111101E-5 | D100: @ | J100: 2 | N100: bigdecimal, long
A101: 0.000111111 | B101: =TEXT(RC[1],RC[2]) -> 0.000111111 | C101: 1.1111101E-4 | D101: @ | J101: 2 | N101: bigdecimal, long
A102: 0.001111111 | B102: =TEXT(RC[1],RC[2]) -> 0.001111111 | C102: 1.1111110100000001E-3 | D102: @ | J102: 2 | N102: bigdecimal, long
A103: 0.011111111 | B103: =TEXT(RC[1],RC[2]) -> 0.011111111 | C103: 1.1111111010000001E-2 | D103: @ | J103: 2 | N103: bigdecimal, long
A104: 0.111111111 | B104: =TEXT(RC[1],RC[2]) -> 0.111111111 | C104: 0.11111111101 | D104: @ | J104: 2 | N104: bigdecimal, long
A105: 9.9E-10 | B105: =TEXT(RC[1],RC[2]) -> 9.9E-10 | C105: 9.900000000000001E-10 | D105: @ | J105: 2 | N105: bigdecimal, long
A106: 1.99E-09 | B106: =TEXT(RC[1],RC[2]) -> 1.99E-09 | C106: 1.99E-9 | D106: @ | J106: 2 | N106: bigdecimal, long
A107: 1.199E-08 | B107: =TEXT(RC[1],RC[2]) -> 1.199E-08 | C107: 1.199E-8 | D107: @ | J107: 2 | N107: bigdecimal, long
A108: 1.1199E-07 | B108: =TEXT(RC[1],RC[2]) -> 1.1199E-07 | C108: 1.1199E-7 | D108: @ | J108: 2 | N108: bigdecimal, long
A109: 1.11199E-06 | B109: =TEXT(RC[1],RC[2]) -> 1.11199E-06 | C109: 1.11199E-6 | D109: @ | J109: 2 | N109: bigdecimal, long
A110: 1.1112E-05 | B110: =TEXT(RC[1],RC[2]) -> 1.1112E-05 | C110: 1.1111990000000001E-5 | D110: @ | J110: 2 | N110: bigdecimal, long
A111: 0.000111112 | B111: =TEXT(RC[1],RC[2]) -> 0.000111112 | C111: 1.1111199E-4 | D111: @ | J111: 2 | N111: bigdecimal, long
A112: 0.001111112 | B112: =TEXT(RC[1],RC[2]) -> 0.001111112 | C112: 1.1111119900000001E-3 | D112: @ | J112: 2 | N112: bigdecimal, long
A113: 0.011111112 | B113: =TEXT(RC[1],RC[2]) -> 0.011111112 | C113: 1.111111199E-2 | D113: @ | J113: 2 | N113: bigdecimal, long
A114: 0.111111112 | B114: =TEXT(RC[1],RC[2]) -> 0.111111112 | C114: 0.11111111199 | D114: @ | J114: 2 | K114: ... | N114: bigdecimal, long
A115: AaBbCcDd | B115: =TEXT(RC[1],RC[2]) -> AaBbCcDd | C115: AaBbCcDd | D115: @ | J115: 2
A116: АаБбВвГгДд | B116: =TEXT(RC[1],RC[2]) -> АаБбВвГгДд | C116: АаБбВвГгДд | D116: @ | J116: 2
A118: 123.00 | B118: =FIXED(RC[1]) -> 123.00 | C118: 123 | J118: 1 | K118: FIXED | L118: FIXED
A119: 12.340 | B119: =FIXED(RC[1],RC[2]) -> 12.340 | C119: 12.34 | D119: 3 | J119: 2
A120: 12,345.340 | B120: =FIXED(RC[1],RC[2]) -> 12,345.340 | C120: 12345.34 | D120: 3 | J120: 2
A121: 123,456,789.123 | B121: =FIXED(RC[1],RC[2]) -> 123,456,789.123 | C121: 123456789.123456 | D121: 3 | J121: 2
A122: 12,300 | B122: =FIXED(RC[1],RC[2]) -> 12,300 | C122: 12345.34 | D122: -2 | J122: 2
A123: 12345.340 | B123: =FIXED(RC[1],RC[2],RC[3]) -> 12345.340 | C123: 12345.34 | D123: 3 | E123: 1 | J123: 3
A124: 12,345.340 | B124: =FIXED(RC[1],RC[2],RC[3]) -> 12,345.340 | C124: 12345.34 | D124: 3 | E124: 0 | J124: 3
A125: 1,234,567,891,234.56 | B125: =FIXED(RC[1],RC[2],RC[3]) -> 1,234,567,891,234.56 | C125: 1234567891234.5601 | D125: 2 | E125: 0 | J125: 3 | N125: long
A126: 123,456,789,123,400.00 | B126: =FIXED(RC[1],RC[2],RC[3]) -> 123,456,789,123,400.00 | C126: 123456789123400 | D126: 2 | E126: 0 | J126: 3 | N126: long
A127: 1,234.6 | B127: =FIXED(RC[1],RC[2]) -> 1,234.6 | C127: 1234.567 | D127: 1 | J127: 2
A128: -1,230 | B128: =FIXED(RC[1],RC[2]) -> -1,230 | C128: -1234.567 | D128: -1 | J128: 2
A129: 1230 | B129: =FIXED(RC[1],RC[2],RC[3]) -> 1230 | C129: 1234.567 | D129: -1 | E129: 1 | J129: 3
A130: -1230 | B130: =FIXED(RC[1],RC[2],RC[3]) -> -1230 | C130: -1234.567 | D130: -1 | E130: 1 | J130: 3 | K130: ...