Sheet: Sheet1
A1: Expected | B1: Actual | C1: Inputs | J1: # of Inputs | K1: Name | L1: Highlight | M1: Excel says | N1: Skip for
A2: 123 | B2: =VALUE(RC[1]) -> 123 | C2: 123 | J2: 1 | K2: VALUE (does not support blanks!) | L2: VALUE
A3: 123 | B3: =VALUE(RC[1]) -> 123 | C3: 123 | J3: 1
A4: 123.55 | B4: =VALUE(RC[1]) -> 123.55 | C4: 123.55 | J4: 1
A5: -23 | B5: =VALUE(RC[1]) -> -23 | C5: -23 | J5: 1
A6: 100000000 | B6: =VALUE(RC[1]) -> 100000000 | C6: 100'000'000 | J6: 1
A7: 0.2 | B7: =VALUE(RC[1]) -> 0.2 | C7: 20% | J7: 1
A8: 1234567000 | B8: =VALUE(RC[1]) -> 1234567000 | C8: 1'234.567e6 | J8: 1
A9: -1.2345E-6 | B9: =VALUE(RC[1]) -> -1.2345E-6 | C9: -12345e-10 | J9: 1
A10: -1.2345599999999999E-7 | B10: =VALUE(RC[1]) -> -1.2345599999999999E-7 | C10: -123'456E-12 | J10: 1 | K10: ...
A11: 12.345000000000001 | B11: =VALUE(RC[1]) -> 12.345000000000001 | C11: 12.345000000000001 | J11: 1
A13: 12.345000000000001 | B13: =N(RC[1]) -> 12.345000000000001 | C13: 12.345000000000001 | J13: 1 | K13: N (does not support blanks!) | L13: N
A14: 0 | B14: =N(RC[1]) -> 0 | C14: 12345 | J14: 1
A15: 39083 | B15: =N(RC[1]) -> 39083 | C15: 2007-01-01T00:00:00.000 | J15: 1
A16: 0 | B16: =N(RC[1]) -> 0 | C16: 01.01.2007 | J16: 1
A17: 1 | B17: =N(RC[1]) -> 1 | C17: 1 | J17: 1
A18: 0 | B18: =N(RC[1]) -> 0 | C18: 0 | J18: 1
A20: AaBbCcDd | B20: =T(RC[1]) -> AaBbCcDd | C20: AaBbCcDd | J20: 1 | K20: T (does not support blanks!) | L20: T
A21: АаБбВвГгДд | B21: =T(RC[1]) -> АаБбВвГгДд | C21: АаБбВвГгДд | J21: 1
B22: =T(RC[1]) ->  | C22: 123.45 | J22: 1
A23: 123.45 | B23: =T(RC[1]) -> 123.45 | C23: 123.45 | J23: 1
B24: =T(RC[1]) ->  | C24: 2007-01-01T00:00:00.000 | J24: 1
A25: 01.01.2007 | B25: =T(RC[1]) -> 01.01.2007 | C25: 01.01.2007 | J25: 1
B26: =T(RC[1]) ->  | C26: 1 | J26: 1
B27: =T(RC[1]) ->  | C27: 0 | J27: 1
A29: 0 | B29: =TEXT(RC[1],RC[2]) -> 0 | C29: 0 | D29: @ | J29: 2 | K29: TEXT (does not support blanks!) | L29: TEXT
A30: 99999999999 | B30: =TEXT(RC[1],RC[2]) -> 99999999999 | C30: 99999999999.499893 | D30: @ | J30: 2
A31: 1E+11 | B31: =TEXT(RC[1],RC[2]) -> 1E+11 | C31: 99999999999.5 | D31: @ | J31: 2
A32: 0.000000009 | B32: =TEXT(RC[1],RC[2]) -> 0.000000009 | C32: 8.9999999999999995E-9 | D32: @ | J32: 2 | N32: bigdecimal, long
A33: 9E-09 | B33: =TEXT(RC[1],RC[2]) -> 9E-09 | C33: 9.0000009999999998E-9 | D33: @ | J33: 2 | N33: bigdecimal, long
A34: 7.77778E-05 | B34: =TEXT(RC[1],RC[2]) -> 7.77778E-05 | C34: 7.77777777777777E-5 | D34: @ | J34: 2 | N34: bigdecimal, long
A35: 0.000777778 | B35: =TEXT(RC[1],RC[2]) -> 0.000777778 | C35: 7.7777777777777697E-4 | D35: @ | J35: 2 | N35: bigdecimal, long
A36: 0.007777778 | B36: =TEXT(RC[1],RC[2]) -> 0.007777778 | C36: 7.7777777777777697E-3 | D36: @ | J36: 2 | N36: bigdecimal, long
A37: 0.077777778 | B37: =TEXT(RC[1],RC[2]) -> 0.077777778 | C37: 7.7777777777777696E-2 | D37: @ | J37: 2 | N37: bigdecimal, long
A38: 0.777777778 | B38: =TEXT(RC[1],RC[2]) -> 0.777777778 | C38: 0.77777777777777701 | D38: @ | J38: 2 | N38: bigdecimal, long
A39: 7.777777778 | B39: =TEXT(RC[1],RC[2]) -> 7.777777778 | C39: 7.7777777777777697 | D39: @ | J39: 2 | N39: bigdecimal, long
A40: 77.77777778 | B40: =TEXT(RC[1],RC[2]) -> 77.77777778 | C40: 77.7777777777777 | D40: @ | J40: 2 | N40: long
A41: 777.7777778 | B41: =TEXT(RC[1],RC[2]) -> 777.7777778 | C41: 777.77777777777703 | D41: @ | J41: 2 | N41: long
A42: 7777.777778 | B42: =TEXT(RC[1],RC[2]) -> 7777.777778 | C42: 7777.7777777777701 | D42: @ | J42: 2
A43: 77777.77778 | B43: =TEXT(RC[1],RC[2]) -> 77777.77778 | C43: 77777.777777777694 | D43: @ | J43: 2
A44: 777777.7778 | B44: =TEXT(RC[1],RC[2]) -> 777777.7778 | C44: 777777.77777777705 | D44: @ | J44: 2
A45: 7777777.778 | B45: =TEXT(RC[1],RC[2]) -> 7777777.778 | C45: 7777777.7777777696 | D45: @ | J45: 2
A46: 77777777.78 | B46: =TEXT(RC[1],RC[2]) -> 77777777.78 | C46: 77777777.777777702 | D46: @ | J46: 2
A47: 777777777.8 | B47: =TEXT(RC[1],RC[2]) -> 777777777.8 | C47: 777777777.77777696 | D47: @ | J47: 2
A48: 7777777778 | B48: =TEXT(RC[1],RC[2]) -> 7777777778 | C48: 7777777777.77777 | D48: @ | J48: 2
A49: 77777777778 | B49: =TEXT(RC[1],RC[2]) -> 77777777778 | C49: 77777777777.777695 | D49: @ | J49: 2
A50: 7.77778E+11 | B50: =TEXT(RC[1],RC[2]) -> 7.77778E+11 | C50: 777777777777.77698 | D50: @ | J50: 2
A51: 7.77778E+12 | B51: =TEXT(RC[1],RC[2]) -> 7.77778E+12 | C51: 7777777777777.7695 | D51: @ | J51: 2
A52: 7.77778E+13 | B52: =TEXT(RC[1],RC[2]) -> 7.77778E+13 | C52: 77777777777777.703 | D52: @ | J52: 2 | N52: long
A53: 7.77778E+14 | B53: =TEXT(RC[1],RC[2]) -> 7.77778E+14 | C53: 777777777777777 | D53: @ | J53: 2 | N53: long
A54: -777777777.8 | B54: =TEXT(RC[1],RC[2]) -> -777777777.8 | C54: -777777777.77777696 | D54: @ | J54: 2
A55: -7777777778 | B55: =TEXT(RC[1],RC[2]) -> -7777777778 | C55: -7777777777.77777 | D55: @ | J55: 2
A56: -77777777778 | B56: =TEXT(RC[1],RC[2]) -> -77777777778 | C56: -77777777777.777695 | D56: @ | J56: 2
A57: -7.77778E+11 | B57: =TEXT(RC[1],RC[2]) -> -7.77778E+11 | C57: -777777777777.77698 | D57: @ | J57: 2
A58: 0.000000001 | B58: =TEXT(RC[1],RC[2]) -> 0.000000001 | C58: 1.0000000000000001E-9 | D58: @ | J58: 2 | N58: bigdecimal, long
A59: 0.000000011 | B59: =TEXT(RC[1],RC[2]) -> 0.000000011 | C59: 1.0999999999999999E-8 | D59: @ | J59: 2 | N59: bigdecimal, long
A60: 0.000000111 | B60: =TEXT(RC[1],RC[2]) -> 0.000000111 | C60: 1.11E-7 | D60: @ | J60: 2 | N60: bigdecimal, long
A61: 0.000001111 | B61: =TEXT(RC[1],RC[2]) -> 0.000001111 | C61: 1.111E-6 | D61: @ | J61: 2 | N61: bigdecimal, long
A62: 0.000011111 | B62: =TEXT(RC[1],RC[2]) -> 0.000011111 | C62: 1.1110999999999999E-5 | D62: @ | J62: 2 | N62: bigdecimal, long
A63: 0.000111111 | B63: =TEXT(RC[1],RC[2]) -> 0.000111111 | C63: 1.11111E-4 | D63: @ | J63: 2 | N63: bigdecimal, long
A64: 0.001111111 | B64: =TEXT(RC[1],RC[2]) -> 0.001111111 | C64: 1.1111109999999999E-3 | D64: @ | J64: 2 | N64: bigdecimal, long
A65: 0.011111111 | B65: =TEXT(RC[1],RC[2]) -> 0.011111111 | C65: 1.1111111E-2 | D65: @ | J65: 2 | N65: bigdecimal, long
A66: 0.111111111 | B66: =TEXT(RC[1],RC[2]) -> 0.111111111 | C66: 0.111111111 | D66: @ | J66: 2 | N66: bigdecimal, long
A67: 1E-11 | B67: =TEXT(RC[1],RC[2]) -> 1E-11 | C67: 9.9999999999999994E-12 | D67: @ | J67: 2 | N67: bigdecimal, long
A68: 1.1E-10 | B68: =TEXT(RC[1],RC[2]) -> 1.1E-10 | C68: 1.0999999999999999E-10 | D68: @ | J68: 2 | N68: bigdecimal, long
A69: 1.01E-09 | B69: =TEXT(RC[1],RC[2]) -> 1.01E-09 | C69: 1.01E-9 | D69: @ | J69: 2 | N69: bigdecimal, long
A70: 1.101E-08 | B70: =TEXT(RC[1],RC[2]) -> 1.101E-08 | C70: 1.1010000000000001E-8 | D70: @ | J70: 2 | N70: bigdecimal, long
A71: 1.1101E-07 | B71: =TEXT(RC[1],RC[2]) -> 1.1101E-07 | C71: 1.1101E-7 | D71: @ | J71: 2 | N71: bigdecimal, long
A72: 1.11101E-06 | B72: =TEXT(RC[1],RC[2]) -> 1.11101E-06 | C72: 1.1110100000000001E-6 | D72: @ | J72: 2 | N72: bigdecimal, long
A73: 1.1111E-05 | B73: =TEXT(RC[1],RC[2]) -> 1.1111E-05 | C73: 1.111101E-5 | D73: @ | J73: 2 | N73: bigdecimal, long
A74: 0.000111111 | B74: =TEXT(RC[1],RC[2]) -> 0.000111111 | C74: 1.1111101E-4 | D74: @ | J74: 2 | N74: bigdecimal, long
A75: 0.001111111 | B75: =TEXT(RC[1],RC[2]) -> 0.001111111 | C75: 1.1111110100000001E-3 | D75: @ | J75: 2 | N75: bigdecimal, long
A76: 0.011111111 | B76: =TEXT(RC[1],RC[2]) -> 0.011111111 | C76: 1.1111111010000001E-2 | D76: @ | J76: 2 | N76: bigdecimal, long
A77: 0.111111111 | B77: =TEXT(RC[1],RC[2]) -> 0.111111111 | C77: 0.11111111101 | D77: @ | J77: 2 | N77: bigdecimal, long
A78: 9.9E-10 | B78: =TEXT(RC[1],RC[2]) -> 9.9E-10 | C78: 9.900000000000001E-10 | D78: @ | J78: 2 | N78: bigdecimal, long
A79: 1.99E-09 | B79: =TEXT(RC[1],RC[2]) -> 1.99E-09 | C79: 1.99E-9 | D79: @ | J79: 2 | N79: bigdecimal, long
A80: 1.199E-08 | B80: =TEXT(RC[1],RC[2]) -> 1.199E-08 | C80: 1.199E-8 | D80: @ | J80: 2 | N80: bigdecimal, long
A81: 1.1199E-07 | B81: =TEXT(RC[1],RC[2]) -> 1.1199E-07 | C81: 1.1199E-7 | D81: @ | J81: 2 | N81: bigdecimal, long
A82: 1.11199E-06 | B82: =TEXT(RC[1],RC[2]) -> 1.11199E-06 | C82: 1.11199E-6 | D82: @ | J82: 2 | N82: bigdecimal, long
A83: 1.1112E-05 | B83: =TEXT(RC[1],RC[2]) -> 1.1112E-05 | C83: 1.1111990000000001E-5 | D83: @ | J83: 2 | N83: bigdecimal, long
A84: 0.000111112 | B84: =TEXT(RC[1],RC[2]) -> 0.000111112 | C84: 1.1111199E-4 | D84: @ | J84: 2 | N84: bigdecimal, long
A85: 0.001111112 | B85: =TEXT(RC[1],RC[2]) -> 0.001111112 | C85: 1.1111119900000001E-3 | D85: @ | J85: 2 | N85: bigdecimal, long
A86: 0.011111112 | B86: =TEXT(RC[1],RC[2]) -> 0.011111112 | C86: 1.111111199E-2 | D86: @ | J86: 2 | N86: bigdecimal, long
A87: 0.111111112 | B87: =TEXT(RC[1],RC[2]) -> 0.111111112 | C87: 0.11111111199 | D87: @ | J87: 2 | K87: ... | N87: bigdecimal, long
A88: AaBbCcDd | B88: =TEXT(RC[1],RC[2]) -> AaBbCcDd | C88: AaBbCcDd | D88: @ | J88: 2
A89: АаБбВвГгДд | B89: =TEXT(RC[1],RC[2]) -> АаБбВвГгДд | C89: АаБбВвГгДд | D89: @ | J89: 2
A91: 1'234.35 | B91: =FIXED(RC[1]) -> 1'234.35 | C91: 1234.3456000000001 | J91: 1 | K91: FIXED | L91: FIXED
A92: 12.340 | B92: =FIXED(RC[1],RC[2]) -> 12.340 | C92: 12.34 | D92: 3 | J92: 2
A93: 12'345.340 | B93: =FIXED(RC[1],RC[2]) -> 12'345.340 | C93: 12345.34 | D93: 3 | J93: 2
A94: 123'456'789.123 | B94: =FIXED(RC[1],RC[2]) -> 123'456'789.123 | C94: 123456789.123456 | D94: 3 | J94: 2
A95: 12'300 | B95: =FIXED(RC[1],RC[2]) -> 12'300 | C95: 12345.34 | D95: -2 | J95: 2
A96: 12345.340 | B96: =FIXED(RC[1],RC[2],RC[3]) -> 12345.340 | C96: 12345.34 | D96: 3 | E96: 1 | J96: 3
A97: 12'345.340 | B97: =FIXED(RC[1],RC[2],RC[3]) -> 12'345.340 | C97: 12345.34 | D97: 3 | E97: 0 | J97: 3
A98: 1'234'567'891'234.56 | B98: =FIXED(RC[1],RC[2],RC[3]) -> 1'234'567'891'234.56 | C98: 1234567891234.5601 | D98: 2 | E98: 0 | J98: 3 | N98: long
A99: 123'456'789'123'400.00 | B99: =FIXED(RC[1],RC[2],RC[3]) -> 123'456'789'123'400.00 | C99: 123456789123400 | D99: 2 | E99: 0 | J99: 3 | N99: long
A100: 1'234.6 | B100: =FIXED(RC[1],RC[2]) -> 1'234.6 | C100: 1234.567 | D100: 1 | J100: 2
A101: -1'230 | B101: =FIXED(RC[1],RC[2]) -> -1'230 | C101: -1234.567 | D101: -1 | J101: 2
A102: 1230 | B102: =FIXED(RC[1],RC[2],RC[3]) -> 1230 | C102: 1234.567 | D102: -1 | E102: 1 | J102: 3
A103: -1230 | B103: =FIXED(RC[1],RC[2],RC[3]) -> -1230 | C103: -1234.567 | D103: -1 | E103: 1 | J103: 3 | K103: ...