Sheet: Sheet1
A1: Expected | B1: Actual | C1: Inputs | J1: # of Inputs | K1: Name | L1: Highlight | M1: Excel says | N1: Skip for
A2: (now) | B2: =NOW() -> 2007-09-13T15:46:23.420 | J2: 0 | K2: NOW | L2: NOW
A4: (full days from 2006) | B4: =TODAY()-RC[1] -> 620 | C4: 2006-01-01T00:00:00.000 | J4: 1 | K4: TODAY (compared to 1.1.2006) | L4: TODAY
A6: 2007-12-31T00:00:00.000 | B6: =DATE(RC[1],RC[2],RC[3]) -> 2007-12-31T00:00:00.000 | C6: 2007 | D6: 12 | E6: 31 | J6: 3 | K6: DATE | L6: DATE
A7: 1961-04-12T00:00:00.000 | B7: =DATE(RC[1],RC[2],RC[3]) -> 1961-04-12T00:00:00.000 | C7: 1961 | D7: 4 | E7: 12 | J7: 3
A8: 1907-06-05T00:00:00.000 | B8: =DATE(RC[1],RC[2],RC[3]) -> 1907-06-05T00:00:00.000 | C8: 7 | D8: 6 | E8: 5 | J8: 3
A9: 2005-01-04T00:00:00.000 | B9: =DATE(RC[1],RC[2],RC[3]) -> 2005-01-04T00:00:00.000 | C9: 2003 | D9: 23 | E9: 65 | J9: 3
A10: 2006-11-19T00:00:00.000 | B10: =DATE(RC[1],RC[2],RC[3]) -> 2006-11-19T00:00:00.000 | C10: 2008 | D10: -10 | E10: -73 | J10: 3
A12: 1899-12-31T02:03:04.000 | B12: =TIME(RC[1],RC[2],RC[3]) -> 1899-12-31T02:03:04.000 | C12: 2 | D12: 3 | E12: 4 | J12: 3 | K12: TIME | L12: TIME
A13: 1899-12-31T16:55:59.000 | B13: =TIME(RC[1],RC[2],RC[3]) -> 1899-12-31T16:55:59.000 | C13: 16 | D13: 55 | E13: 59 | J13: 3
A14: 1899-12-31T16:19:16.000 | B14: =TIME(RC[1],RC[2],RC[3]) -> 1899-12-31T16:19:16.000 | C14: 39 | D14: 78 | E14: 76 | J14: 3
A15: 1899-12-31T23:33:20.000 | B15: =TIME(RC[1],RC[2],RC[3]) -> 1899-12-31T23:33:20.000 | C15: 100 | D15: -200 | E15: -4000 | J15: 3
A17: 45 | B17: =SECOND(RC[1]) -> 45 | C17: 1899-12-31T12:30:45.000 | J17: 1 | K17: SECOND | L17: SECOND
A18: 0 | B18: =SECOND(RC[1]) -> 0 | C18: 1996-06-06T12:00:00.000 | J18: 1
A19: 59 | B19: =SECOND(RC[1]) -> 59 | C19: 1909-12-31T23:59:59.000 | J19: 1
A20: 59 | B20: =SECOND(RC[1]) -> 59 | C20: 3653.9999939999998 | J20: 1
A21: 0 | B21: =SECOND(RC[1]) -> 0 | C21: 3653.9999950000001 | J21: 1
A23: 30 | B23: =MINUTE(RC[1]) -> 30 | C23: 1899-12-31T12:30:45.000 | J23: 1 | K23: MINUTE | L23: MINUTE
A24: 0 | B24: =MINUTE(RC[1]) -> 0 | C24: 1996-06-06T12:00:00.000 | J24: 1
A25: 59 | B25: =MINUTE(RC[1]) -> 59 | C25: 1909-12-31T23:59:59.000 | J25: 1
A26: 59 | B26: =MINUTE(RC[1]) -> 59 | C26: 3653.9999939999998 | J26: 1
A27: 0 | B27: =MINUTE(RC[1]) -> 0 | C27: 3653.9999950000001 | J27: 1
A29: 12 | B29: =HOUR(RC[1]) -> 12 | C29: 1899-12-31T12:30:45.000 | J29: 1 | K29: HOUR | L29: HOUR
A30: 12 | B30: =HOUR(RC[1]) -> 12 | C30: 1996-06-06T12:00:00.000 | J30: 1
A31: 23 | B31: =HOUR(RC[1]) -> 23 | C31: 1909-12-31T23:59:59.000 | J31: 1
A32: 23 | B32: =HOUR(RC[1]) -> 23 | C32: 3653.9999939999998 | J32: 1
A33: 0 | B33: =HOUR(RC[1]) -> 0 | C33: 3653.9999950000001 | J33: 1
A35: 7 | B35: =WEEKDAY(RC[1]) -> 7 | C35: 2008-01-05T00:00:00.000 | J35: 1 | K35: WEEKDAY | L35: WEEKDAY
A36: 1 | B36: =WEEKDAY(RC[1]) -> 1 | C36: 2008-01-06T00:00:00.000 | J36: 1
A37: 7 | B37: =WEEKDAY(RC[1],RC[2]) -> 7 | C37: 2008-01-05T00:00:00.000 | D37: 1 | J37: 2
A38: 1 | B38: =WEEKDAY(RC[1],RC[2]) -> 1 | C38: 2008-01-06T00:00:00.000 | D38: 1 | J38: 2
A39: 7 | B39: =WEEKDAY(RC[1],RC[2]) -> 7 | C39: 2008-01-06T00:00:00.000 | D39: 2 | J39: 2
A40: 1 | B40: =WEEKDAY(RC[1],RC[2]) -> 1 | C40: 2008-01-07T00:00:00.000 | D40: 2 | J40: 2
A41: 6 | B41: =WEEKDAY(RC[1],RC[2]) -> 6 | C41: 2008-01-06T00:00:00.000 | D41: 3 | J41: 2
A42: 0 | B42: =WEEKDAY(RC[1],RC[2]) -> 0 | C42: 2008-01-07T00:00:00.000 | D42: 3 | J42: 2
A44: 1 | B44: =DAY(RC[1]) -> 1 | C44: 2010-01-01T00:00:00.000 | J44: 1 | K44: DAY | L44: DAY
A45: 6 | B45: =DAY(RC[1]) -> 6 | C45: 1996-06-06T12:00:00.000 | J45: 1
A46: 31 | B46: =DAY(RC[1]) -> 31 | C46: 1909-12-31T00:00:00.000 | J46: 1
A48: 1 | B48: =MONTH(RC[1]) -> 1 | C48: 2010-01-01T00:00:00.000 | J48: 1 | K48: MONTH | L48: MONTH
A49: 6 | B49: =MONTH(RC[1]) -> 6 | C49: 1996-06-06T12:00:00.000 | J49: 1
A50: 12 | B50: =MONTH(RC[1]) -> 12 | C50: 1909-12-31T00:00:00.000 | J50: 1
A52: 2010 | B52: =YEAR(RC[1]) -> 2010 | C52: 2010-01-01T00:00:00.000 | J52: 1 | K52: YEAR | L52: YEAR
A53: 1996 | B53: =YEAR(RC[1]) -> 1996 | C53: 1996-06-06T12:00:00.000 | J53: 1
A54: 1909 | B54: =YEAR(RC[1]) -> 1909 | C54: 1909-12-31T00:00:00.000 | J54: 1