Sheet: Sheet1
A1: Expected | B1: Actual | C1: Inputs | J1: # of Inputs | K1: Name | L1: Highlight | M1: Excel says | N1: Skip for
A2: 1.1884434123352206 | B2: =NPV(RC[1],RC[2]:RC[5]) -> 1.1884434123352206 | C2: 0.1 | D2: -10 | E2: 3 | F2: 4.2 | G2: 6.8 | J2: 5 | K2: NPV | L2: NPV
A3: 1.9220615549323696 | B3: =NPV(RC[1],RC[3]:RC[7])+RC[2] -> 1.9220615549323696 | C3: 0.08 | D3: -40 | E3: 8 | F3: 9.2 | G3: 10 | H3: 12 | I3: 14.5 | J3: 7 | N3: long, bigdecimal
A5: 6.2522011677732303E-2 | B5: =MIRR(RC[1]:RC[5],RC[6],RC[7]) -> 6.2522011677732303E-2 | C5: -120 | D5: 39 | E5: 30 | F5: 21 | G5: 37 | H5: 0.1 | I5: 0.12 | J5: 7 | K5: MIRR | L5: MIRR | N5: bigdecimal
A7: 8.6630948036342512E-2 | B7: =IRR(RC[1]:RC[6]) -> 8.6630948036342512E-2 | C7: -70 | D7: 12 | E7: 15 | F7: 18 | G7: 21 | H7: 26 | J7: 6 | K7: IRR | L7: IRR
A8: -0.44350694133465396 | B8: =IRR(RC[1]:RC[3],RC[4]) -> -0.44350694133465396 | C8: -70 | D8: 12 | E8: 15 | F8: -0.1 | J8: 4
A9: 5.1881654954215053E-2 | B9: =IRR(RC[1]:RC[5]) -> 5.1881654954215053E-2 | C9: 100 | D9: -50 | E9: -30 | F9: -20 | G9: -10 | J9: 5
A11: 2752.9617600000001 | B11: =DB(RC[1],RC[2],RC[3],RC[4]) -> 2752.9617600000001 | C11: 12345.12 | D11: 987.65 | E11: 10 | F11: 1 | J11: 4 | K11: DB | L11: DB
A12: 1003.4234680309769 | B12: =DB(RC[1],RC[2],RC[3],RC[4]) -> 1003.4234680309769 | C12: 12345.12 | D12: 987.65 | E12: 10 | F12: 5 | J12: 4
A13: 284.17727671733377 | B13: =DB(RC[1],RC[2],RC[3],RC[4]) -> 284.17727671733377 | C13: 12345.12 | D13: 987.65 | E13: 10 | F13: 10 | J13: 4
A14: 1605.8943600000002 | B14: =DB(RC[1],RC[2],RC[3],RC[4],RC[5]) -> 1605.8943600000002 | C14: 12345.12 | D14: 987.65 | E14: 10 | F14: 1 | G14: 7 | J14: 5
A15: 1123.4167291693875 | B15: =DB(RC[1],RC[2],RC[3],RC[4],RC[5]) -> 1123.4167291693875 | C15: 12345.12 | D15: 987.65 | E15: 10 | F15: 5 | G15: 7 | J15: 5
A16: 103.0043955434808 | B16: =DB(RC[1],RC[2],RC[3],RC[4],RC[5]) -> 103.0043955434808 | C16: 12345.12 | D16: 987.65 | E16: 10 | F16: 11 | G16: 7 | J16: 5
A18: 2469.0240000000003 | B18: =DDB(RC[1],RC[2],RC[3],RC[4]) -> 2469.0240000000003 | C18: 12345.12 | D18: 987.65 | E18: 10 | F18: 1 | J18: 4 | K18: DDB | L18: DDB
A19: 904.5451574605321 | B19: =DDB(RC[1],RC[2],RC[3],RC[4]) -> 904.5451574605321 | C19: 12345.12 | D19: 987.65 | E19: 10 | F19: 5.5 | J19: 4
A20: 331.38679165747232 | B20: =DDB(RC[1],RC[2],RC[3],RC[4]) -> 331.38679165747232 | C20: 12345.12 | D20: 987.65 | E20: 10 | F20: 10 | J20: 4
A21: 1851.768 | B21: =DDB(RC[1],RC[2],RC[3],RC[4],RC[5]) -> 1851.768 | C21: 12345.12 | D21: 987.65 | E21: 10 | F21: 1 | G21: 1.5 | J21: 5
A22: 891.1929465967952 | B22: =DDB(RC[1],RC[2],RC[3],RC[4],RC[5]) -> 891.1929465967952 | C22: 12345.12 | D22: 987.65 | E22: 10 | F22: 5.5 | G22: 1.5 | J22: 5
A23: 428.90084938495431 | B23: =DDB(RC[1],RC[2],RC[3],RC[4],RC[5]) -> 428.90084938495431 | C23: 12345.12 | D23: 987.65 | E23: 10 | F23: 10 | G23: 1.5 | J23: 5
A24: 11357.47 | B24: =DDB(RC[1],RC[2],RC[3],RC[4],RC[5]) -> 11357.470000000001 | C24: 12345.12 | D24: 987.65 | E24: 10 | F24: 1 | G24: 10.1 | J24: 5
A25: 0 | B25: =DDB(RC[1],RC[2],RC[3],RC[4],RC[5]) -> 0 | C25: 12345.12 | D25: 987.65 | E25: 10 | F25: 1.0009999999999999 | G25: 10.1 | J25: 5
A27: 2250 | B27: =SLN(RC[1],RC[2],RC[3]) -> 2250 | C27: 30000 | D27: 7500 | E27: 10 | J27: 3 | K27: SLN | L27: SLN
A28: 2247.7722277722278 | B28: =SLN(RC[1],RC[2],RC[3]) -> 2247.7722277722278 | C28: 29999.95 | D28: 7499.75 | E28: 10.01 | J28: 3
A30: 4090.909090909091 | B30: =SYD(RC[1],RC[2],RC[3],RC[4]) -> 4090.909090909091 | C30: 30000 | D30: 7500 | E30: 10 | F30: 1 | J30: 4 | K30: SYD | L30: SYD
A31: 409.09090909090907 | B31: =SYD(RC[1],RC[2],RC[3],RC[4]) -> 409.09090909090907 | C31: 30000 | D31: 7500 | E31: 10 | F31: 10 | J31: 4
A32: 3270.6004622080918 | B32: =SYD(RC[1],RC[2],RC[3],RC[4]) -> 3270.6004622080918 | C32: 29999.95 | D32: 7499.75 | E32: 10.01 | F32: 3 | J32: 4
A34: 2581.4033740601185 | B34: =FV(RC[1],RC[2],RC[3],RC[4],RC[5]) -> 2581.4033740601185 | C34: 5.0000000000000001E-3 | D34: 10 | E34: -200 | F34: -500 | G34: 1 | J34: 5 | K34: FV | L34: FV | N34: long, bigdecimal
A35: 12682.503013196976 | B35: =FV(RC[1],RC[2],RC[3]) -> 12682.503013196976 | C35: 0.01 | D35: 12 | E35: -1000 | J35: 3 | N35: long, bigdecimal
A36: 82898.06514315684 | B36: =FV(RC[1],RC[2],RC[3],,RC[4]) -> 82898.06514315684 | C36: 9.1999999999999998E-3 | D36: 35 | E36: -2000 | F36: 1 | J36: 4 | N36: long, bigdecimal
A37: 2301.4018303408993 | B37: =FV(RC[1],RC[2],RC[3],RC[4],RC[5]) -> 2301.4018303408993 | C37: 5.0000000000000001E-3 | D37: 12 | E37: -100 | F37: -1000 | G37: 1 | J37: 5 | N37: long, bigdecimal
A38: 2295.2340491544501 | B38: =FV(RC[1],RC[2],RC[3],RC[4]) -> 2295.2340491544501 | C38: 5.0000000000000001E-3 | D38: 12 | E38: -100 | F38: -1000 | J38: 4 | N38: long, bigdecimal
A39: 2200 | B39: =FV(RC[1],RC[2],RC[3],RC[4]) -> 2200 | C39: 0 | D39: 12 | E39: -100 | F39: -1000 | J39: 4 | N39: long, bigdecimal
A41: 59.673865674294568 | B41: =NPER(RC[1],RC[2],RC[3],RC[4],RC[5]) -> 59.673865674294568 | C41: 0.01 | D41: -100 | E41: -1000 | F41: 10000 | G41: 1 | J41: 5 | K41: NPER | L41: NPER | N41: long, bigdecimal
A42: 60.082122853761661 | B42: =NPER(RC[1],RC[2],RC[3],RC[4]) -> 60.082122853761661 | C42: 0.01 | D42: -100 | E42: -1000 | F42: 10000 | J42: 4 | N42: long, bigdecimal
A43: 90 | B43: =NPER(RC[1],RC[2],RC[3],RC[4]) -> 90 | C43: 0 | D43: -100 | E43: -1000 | F43: 10000 | J43: 4 | N43: long, bigdecimal
A44: -9.5785940398131615 | B44: =NPER(RC[1],RC[2],RC[3]) -> -9.5785940398131615 | C44: 0.01 | D44: -100 | E44: -1000 | J44: 3 | N44: long, bigdecimal
A45: -9.4880950055058211 | B45: =NPER(RC[1],RC[2],RC[3],,RC[4]) -> -9.4880950055058211 | C45: 0.01 | D45: -100 | E45: -1000 | F45: 1 | J45: 4 | N45: long, bigdecimal
A47: -1512.0079920253022 | B47: =PMT(RC[1],RC[2],RC[3],RC[4],RC[5]) -> -1512.0079920253022 | C47: 6.6E-3 | D47: 10 | E47: 10000 | F47: 5000 | G47: 1 | J47: 5 | K47: PMT | L47: PMT | N47: long, bigdecimal
A48: -1500 | B48: =PMT(RC[1],RC[2],RC[3],RC[4]) -> -1500 | C48: 0 | D48: 10 | E48: 10000 | F48: 5000 | J48: 4 | N48: long, bigdecimal
A49: -1029.8610800534268 | B49: =PMT(RC[1],RC[2],RC[3],,RC[4]) -> -1029.8610800534268 | C49: 6.6E-3 | D49: 10 | E49: 10000 | F49: 1 | J49: 4 | N49: long, bigdecimal
A50: -1036.6581631817796 | B50: =PMT(RC[1],RC[2],RC[3]) -> -1036.6581631817796 | C50: 6.6E-3 | D50: 10 | E50: 10000 | J50: 3 | N50: long, bigdecimal
A51: -129.08116086799728 | B51: =PMT(RC[1],RC[2],RC[3],RC[4]) -> -129.08116086799728 | C51: 5.0000000000000001E-3 | D51: 216 | E51: 0 | F51: 50000 | J51: 4 | N51: long, bigdecimal
A52: -231.4814814814815 | B52: =PMT(RC[1],RC[2],RC[3],RC[4]) -> -231.4814814814815 | C52: 0 | D52: 216 | E52: 0 | F52: 50000 | J52: 4 | N52: long, bigdecimal
A54: -70842.651670974636 | B54: =PV(RC[1],RC[2],RC[3],RC[4],RC[5]) -> -70842.651670974636 | C54: 6.6E-3 | D54: 240 | E54: 500 | F54: 50000 | G54: 1 | J54: 5 | K54: PV | L54: PV | N54: long, bigdecimal
A55: -70445.76332409514 | B55: =PV(RC[1],RC[2],RC[3],RC[4]) -> -70445.76332409514 | C55: 6.6E-3 | D55: 240 | E55: 500 | F55: 50000 | J55: 4 | N55: long, bigdecimal
A56: -170000 | B56: =PV(RC[1],RC[2],RC[3],RC[4]) -> -170000 | C56: 0 | D56: 240 | E56: 500 | F56: 50000 | J56: 4 | N56: long, bigdecimal
A57: -60134.598012044538 | B57: =PV(RC[1],RC[2],RC[3]) -> -60134.598012044538 | C57: 6.6E-3 | D57: 240 | E57: 500 | J57: 3 | N57: long, bigdecimal
A58: -60531.486358924034 | B58: =PV(RC[1],RC[2],RC[3],,RC[4]) -> -60531.486358924034 | C58: 6.6E-3 | D58: 240 | E58: 500 | F58: 1 | J58: 4 | N58: long, bigdecimal
A59: -120000 | B59: =PV(RC[1],RC[2],RC[3]) -> -120000 | C59: 0 | D59: 240 | E59: 500 | J59: 3 | N59: long, bigdecimal
A61: 7.2520541970770448E-3 | B61: =RATE(RC[1],RC[2],RC[3],RC[4],RC[5],RC[6]) -> 7.2520541970750871E-3 | C61: 48 | D61: -200 | E61: 8000 | F61: 200 | G61: 1 | H61: 0 | J61: 6 | K61: RATE | L61: RATE
A62: 7.2520541970776146E-3 | B62: =RATE(RC[1],RC[2],RC[3],RC[4],RC[5]) -> 7.2520541970776146E-3 | C62: 48 | D62: -200 | E62: 8000 | F62: 200 | G62: 1 | J62: 5
A63: 6.9258280078605215E-3 | B63: =RATE(RC[1],RC[2],RC[3],RC[4]) -> 6.9258280078605215E-3 | C63: 48 | D63: -200 | E63: 8000 | F63: 200 | J63: 4
A64: 7.7014724882013682E-3 | B64: =RATE(RC[1],RC[2],RC[3]) -> 7.7014724882013682E-3 | C64: 48 | D64: -200 | E64: 8000 | J64: 3
A65: 7.7014724882020448E-3 | B65: =RATE(RC[1],RC[2],RC[3],,,RC[4]) -> 7.7014724881959056E-3 | C65: 48 | D65: -200 | E65: 8000 | F65: 0 | J65: 4
A66: 0 | B66: =RATE(RC[1],RC[2],RC[3],,,RC[4]) -> 0 | C66: 240 | D66: 500 | E66: -120000 | F66: 0 | J66: 4