Sheet: Sheet1
A1: Expected | B1: Actual | C1: Inputs | J1: # of Inputs | K1: Name | L1: Highlight
A2: 6 | B2: =SUM(RC[1]:RC[3]) -> 6 | C2: 1 | D2: 2 | E2: 3 | J2: 3 | K2: 1-dim range | L2: SUM
A3: 15 | B3: =SUM(RC[1]:RC[3]) -> 15 | C3: 4 | D3: 5 | E3: 6 | J3: 3 | K3: ...
A5: 21 | B5: =SUM(RC[1]:R[1]C[3]) -> 21 | C5: 1 | D5: 2 | E5: 3 | J5: 3 | K5: 2-dim range
A6: 30 | B6: =SUM(RC[1]:RC[3])*2 -> 30 | C6: 4 | D6: 5 | E6: 6 | J6: 3 | K6: ...
A8: 1 | B8: =SUM(RC[1]) -> 1 | C8: 1 | J8: 1 | K8: Single cell
A9: 4 | B9: =SUM(RC[1]) -> 4 | C9: 4 | J9: 1 | K9: ...
A11: 3 | B11: =SUM(RC[1],RC[2]) -> 3 | C11: 1 | D11: 2 | J11: 2 | K11: Multiple cells
A12: 9 | B12: =SUM(RC[1],RC[2]) -> 9 | C12: 4 | D12: 5 | J12: 2 | K12: ...
A14: 2 | B14: =SUM(RC[1],RC[2],RC[3]) -> 2 | D14: 2 | J14: 3 | K14: Three cells with blanks
A15: 10 | B15: =SUM(RC[1],RC[2],RC[3]) -> 10 | C15: 4 | E15: 6 | J15: 3 | K15: ...
A17: 15 | B17: =SUM(RC[1],RC[5],RC[2],RC[7]) -> 15 | C17: 1 | D17: 2 | E17: 3 | F17: 4 | G17: 5 | H17: 6 | I17: 7 | J17: 7 | K17: Non-contiguous cells
A18: 17 | B18: =SUM(RC[1],RC[5],RC[2],RC[7]) -> 17 | C18: 7 | D18: 6 | E18: 5 | F18: 4 | G18: 3 | H18: 2 | I18: 1 | J18: 7 | K18: ...
A20: 6 | B20: =SUM(RC[2],RC[1],RC[1],RC[2]) -> 6 | C20: 1 | D20: 2 | J20: 2 | K20: Cells referenced multiply
A21: 18 | B21: =SUM(RC[2],RC[1],RC[1],RC[2]) -> 18 | C21: 4 | D21: 5 | J21: 2 | K21: ...
A23: 15 | B23: =SUM(SumRange) -> 15 | C23: 4 | D23: 5 | E23: 6 | J23: 3 | K23: Named range
A24: 4 | B24: =SUM(RC[1]:RC[3]) -> 4 | C24: 1 | E24: 3 | J24: 3 | K24: ...
A26: 3 | B26: =SUM(RC[1]:RC[6]) -> 3 | C26: 1 | D26: 2 | J26: 6 | K26: Range with blanks
A27: 15 | B27: =SUM(RC[1]:RC[6]) -> 15 | D27: 4 | F27: 5 | G27: 6 | J27: 6 | K27: ...
A29: 9 | B29: =SUM(RC[1]:RC[3],RC[5],RC[7]) -> 9 | C29: 1 | F29: 100 | H29: 200 | I29: 8 | J29: 7 | K29: Mixture of ranges and cells with blanks
A30: 6 | B30: =SUM(RC[1]:RC[3],RC[5],RC[7]) -> 6 | D30: 2 | F30: 80 | G30: 4 | J30: 7 | K30: ...