Sheet: Sheet1
A1: Expected | B1: Actual | C1: Inputs | J1: # of Inputs | K1: Name | L1: Highlight
A2: 100 | B2: =IF(TRUE,100,10) -> 100 | K2: Constant condition | L2: IF
A3: 10 | B3: =IF(FALSE,100,10) -> 10
A5: 100 | B5: =IF(RC[1],100,10) -> 100 | C5: 1 | J5: 1 | K5: Reference condition
A6: 10 | B6: =IF(RC[1],100,10) -> 10 | C6: 0 | J6: 1
A8: 100 | B8: =IF(RC[1],RC[2],RC[3]) -> 100 | C8: 1 | D8: 100 | E8: 10 | J8: 3 | K8: Return reference
A9: 10 | B9: =IF(RC[1],RC[2],RC[3]) -> 10 | C9: 0 | D9: 100 | E9: 10 | J9: 3
A11: 110 | B11: =IF(RC[1],RC[2]+RC[3],RC[2]-RC[3]) -> 110 | C11: 1 | D11: 100 | E11: 10 | J11: 3 | K11: Return expression
A12: 90 | B12: =IF(RC[1],RC[2]+RC[3],RC[2]-RC[3]) -> 90 | C12: 0 | D12: 100 | E12: 10 | J12: 3
A14: yes | B14: =IF(RC[1],RC[2],RC[3]) -> yes | C14: 1 | D14: yes | E14: no | J14: 3 | K14: Return string | L14: IF
A15: no | B15: =IF(RC[1],RC[2],RC[3]) -> no | C15: 0 | D15: yes | E15: no | J15: 3
A17: 10 | B17: =IF(RC[1]>RC[2],100,10) -> 10 | C17: 10 | D17: 20 | J17: 2 | K17: Comparison condition
A18: 100 | B18: =IF(RC[1]>RC[2],100,10) -> 100 | C18: 50 | D18: 40 | J18: 2
A19: 10 | B19: =IF(RC[1]>RC[2],100,10) -> 10 | C19: 50 | D19: 50 | J19: 2
A20: 10 | B20: =IF(RC[1]>RC[2],100,10) -> 10 | C20: A | D20: B | J20: 2
A21: 100 | B21: =IF(RC[1]>RC[2],100,10) -> 100 | C21: A | D21: 10 | J21: 2
A22: 10 | B22: =IF(RC[1]>RC[2],100,10) -> 10 | C22: 10 | D22: B | J22: 2
A24: 100 | B24: =IF(RC[1]<RC[2],100,10) -> 100 | C24: 10 | D24: 20 | J24: 2
A25: 10 | B25: =IF(RC[1]<RC[2],100,10) -> 10 | C25: 50 | D25: 40 | J25: 2
A26: 10 | B26: =IF(RC[1]<RC[2],100,10) -> 10 | C26: 50 | D26: 50 | J26: 2
A27: 100 | B27: =IF(RC[1]<RC[2],100,10) -> 100 | C27: A | D27: B | J27: 2
A28: 10 | B28: =IF(RC[1]<RC[2],100,10) -> 10 | C28: A | D28: 10 | J28: 2
A29: 100 | B29: =IF(RC[1]<RC[2],100,10) -> 100 | C29: 10 | D29: B | J29: 2
A31: 10 | B31: =IF(RC[1]>=RC[2],100,10) -> 10 | C31: 10 | D31: 20 | J31: 2
A32: 100 | B32: =IF(RC[1]>=RC[2],100,10) -> 100 | C32: 50 | D32: 40 | J32: 2
A33: 100 | B33: =IF(RC[1]>=RC[2],100,10) -> 100 | C33: 50 | D33: 50 | J33: 2
A34: 10 | B34: =IF(RC[1]>=RC[2],100,10) -> 10 | C34: A | D34: B | J34: 2
A35: 100 | B35: =IF(RC[1]>=RC[2],100,10) -> 100 | C35: A | D35: 10 | J35: 2
A36: 10 | B36: =IF(RC[1]>=RC[2],100,10) -> 10 | C36: 10 | D36: B | J36: 2
A38: 100 | B38: =IF(RC[1]<=RC[2],100,10) -> 100 | C38: 10 | D38: 20 | J38: 2
A39: 10 | B39: =IF(RC[1]<=RC[2],100,10) -> 10 | C39: 50 | D39: 40 | J39: 2
A40: 100 | B40: =IF(RC[1]<=RC[2],100,10) -> 100 | C40: 50 | D40: 50 | J40: 2
A41: 100 | B41: =IF(RC[1]<=RC[2],100,10) -> 100 | C41: A | D41: B | J41: 2
A42: 10 | B42: =IF(RC[1]<=RC[2],100,10) -> 10 | C42: A | D42: 10 | J42: 2
A43: 100 | B43: =IF(RC[1]<=RC[2],100,10) -> 100 | C43: 10 | D43: B | J43: 2
A45: 10 | B45: =IF(RC[1]=RC[2],100,10) -> 10 | C45: 10 | D45: 20 | J45: 2
A46: 10 | B46: =IF(RC[1]=RC[2],100,10) -> 10 | C46: 50 | D46: 40 | J46: 2
A47: 100 | B47: =IF(RC[1]=RC[2],100,10) -> 100 | C47: 50 | D47: 50 | J47: 2
A48: 10 | B48: =IF(RC[1]=RC[2],100,10) -> 10 | C48: A | D48: B | J48: 2
A49: 10 | B49: =IF(RC[1]=RC[2],100,10) -> 10 | C49: A | D49: 10 | J49: 2
A50: 10 | B50: =IF(RC[1]=RC[2],100,10) -> 10 | C50: 10 | D50: B | J50: 2
A52: 100 | B52: =IF(RC[1]<>RC[2],100,10) -> 100 | C52: 10 | D52: 20 | J52: 2
A53: 100 | B53: =IF(RC[1]<>RC[2],100,10) -> 100 | C53: 50 | D53: 40 | J53: 2
A54: 10 | B54: =IF(RC[1]<>RC[2],100,10) -> 10 | C54: 50 | D54: 50 | J54: 2
A55: 100 | B55: =IF(RC[1]<>RC[2],100,10) -> 100 | C55: A | D55: B | J55: 2
A56: 100 | B56: =IF(RC[1]<>RC[2],100,10) -> 100 | C56: A | D56: 10 | J56: 2
A57: 100 | B57: =IF(RC[1]<>RC[2],100,10) -> 100 | C57: 10 | D57: B | J57: 2
A59: 10 | B59: =IF(NOT(RC[1]<>RC[2]),100,10) -> 10 | C59: 10 | D59: 20 | J59: 2 | K59: Boolean operator condition
A60: 10 | B60: =IF(NOT(RC[1]<>RC[2]),100,10) -> 10 | C60: 50 | D60: 40 | J60: 2
A61: 100 | B61: =IF(NOT(RC[1]<>RC[2]),100,10) -> 100 | C61: 50 | D61: 50 | J61: 2
A63: 100 | B63: =IF(NOT(RC[1]=RC[2]),100,10) -> 100 | C63: 10 | D63: 20 | J63: 2
A64: 100 | B64: =IF(NOT(RC[1]=RC[2]),100,10) -> 100 | C64: 50 | D64: 40 | J64: 2
A65: 10 | B65: =IF(NOT(RC[1]=RC[2]),100,10) -> 10 | C65: 50 | D65: 50 | J65: 2
A67: 100 | B67: =IF(AND(RC[1]=RC[2],RC[3]=RC[4]),100,10) -> 100 | C67: 10 | D67: 10 | E67: 20 | F67: 20 | J67: 4
A68: 10 | B68: =IF(AND(RC[1]=RC[2],RC[3]=RC[4]),100,10) -> 10 | C68: 5 | D68: 10 | E68: 20 | F68: 20 | J68: 4
A69: 10 | B69: =IF(AND(RC[1]=RC[2],RC[3]=RC[4]),100,10) -> 10 | C69: 5 | D69: 10 | E69: 15 | F69: 20 | J69: 4
A70: 10 | B70: =IF(AND(RC[1]=RC[2],RC[3]=RC[4]),100,10) -> 10 | C70: 10 | D70: 10 | E70: 15 | F70: 20 | J70: 4
A72: 100 | B72: =IF(OR(RC[1]=RC[2],RC[3]=RC[4]),100,10) -> 100 | C72: 10 | D72: 10 | E72: 20 | F72: 20 | J72: 4
A73: 100 | B73: =IF(OR(RC[1]=RC[2],RC[3]=RC[4]),100,10) -> 100 | C73: 5 | D73: 10 | E73: 20 | F73: 20 | J73: 4
A74: 10 | B74: =IF(OR(RC[1]=RC[2],RC[3]=RC[4]),100,10) -> 10 | C74: 5 | D74: 10 | E74: 15 | F74: 20 | J74: 4
A75: 100 | B75: =IF(OR(RC[1]=RC[2],RC[3]=RC[4]),100,10) -> 100 | C75: 10 | D75: 10 | E75: 15 | F75: 20 | J75: 4
A77: 100 | B77: =IF(OR(AND(RC[1]:RC[2]),RC[3]),100,10) -> 100 | C77: 1 | D77: 1 | E77: 1 | J77: 3
A78: 100 | B78: =IF(OR(AND(RC[1]:RC[2]),RC[3]),100,10) -> 100 | C78: 1 | D78: 1 | E78: 0 | J78: 3
A79: 100 | B79: =IF(OR(AND(RC[1]:RC[2]),RC[3]),100,10) -> 100 | C79: 1 | D79: 0 | E79: 1 | J79: 3
A80: 10 | B80: =IF(OR(AND(RC[1]:RC[2]),RC[3]),100,10) -> 10 | C80: 1 | D80: 0 | E80: 0 | J80: 3
A81: 100 | B81: =IF(OR(AND(RC[1]:RC[2]),RC[3]),100,10) -> 100 | C81: 0 | D81: 1 | E81: 1 | J81: 3
A82: 10 | B82: =IF(OR(AND(RC[1]:RC[2]),RC[3]),100,10) -> 10 | C82: 0 | D82: 1 | E82: 0 | J82: 3
A83: 100 | B83: =IF(OR(AND(RC[1]:RC[2]),RC[3]),100,10) -> 100 | C83: 0 | D83: 0 | E83: 1 | J83: 3
A84: 10 | B84: =IF(OR(AND(RC[1]:RC[2]),RC[3]),100,10) -> 10 | C84: 0 | D84: 0 | E84: 0 | J84: 3
A86: 100 | B86: =IF(AND(OR(RC[1]:RC[2]),RC[3]),100,10) -> 100 | C86: 1 | D86: 1 | E86: 1 | J86: 3
A87: 10 | B87: =IF(AND(OR(RC[1]:RC[2]),RC[3]),100,10) -> 10 | C87: 1 | D87: 1 | E87: 0 | J87: 3
A88: 100 | B88: =IF(AND(OR(RC[1]:RC[2]),RC[3]),100,10) -> 100 | C88: 1 | D88: 0 | E88: 1 | J88: 3
A89: 10 | B89: =IF(AND(OR(RC[1]:RC[2]),RC[3]),100,10) -> 10 | C89: 1 | D89: 0 | E89: 0 | J89: 3
A90: 100 | B90: =IF(AND(OR(RC[1]:RC[2]),RC[3]),100,10) -> 100 | C90: 0 | D90: 1 | E90: 1 | J90: 3
A91: 10 | B91: =IF(AND(OR(RC[1]:RC[2]),RC[3]),100,10) -> 10 | C91: 0 | D91: 1 | E91: 0 | J91: 3
A92: 10 | B92: =IF(AND(OR(RC[1]:RC[2]),RC[3]),100,10) -> 10 | C92: 0 | D92: 0 | E92: 1 | J92: 3
A93: 10 | B93: =IF(AND(OR(RC[1]:RC[2]),RC[3]),100,10) -> 10 | C93: 0 | D93: 0 | E93: 0 | J93: 3