Sheet: Sheet1
A1: Expected | B1: Actual | C1: Inputs | J1: # of Inputs | K1: Name | L1: Highlight | M1: Excel says
A2: 0 | B2: =MATCH(RC[1],RC[2]:RC[4],1) -> #N/A | C2: 99 | D2: 100 | E2: 200 | F2: 500 | J2: 4 | K2: MATCH (ascending) | L2: MATCH 1.0 | M2: #N/A
A3: 1 | B3: =MATCH(RC[1],RC[2]:RC[4],1) -> 1 | C3: 100 | D3: 100 | E3: 200 | F3: 500 | J3: 4
A4: 1 | B4: =MATCH(RC[1],RC[2]:RC[4],1) -> 1 | C4: 101 | D4: 100 | E4: 200 | F4: 500 | J4: 4
A5: 1 | B5: =MATCH(RC[1],RC[2]:RC[4],1) -> 1 | C5: 199 | D5: 100 | E5: 200 | F5: 500 | J5: 4
A6: 2 | B6: =MATCH(RC[1],RC[2]:RC[4],1) -> 2 | C6: 200 | D6: 100 | E6: 200 | F6: 500 | J6: 4
A7: 2 | B7: =MATCH(RC[1],RC[2]:RC[4],1) -> 2 | C7: 201 | D7: 100 | E7: 200 | F7: 500 | J7: 4
A8: 3 | B8: =MATCH(RC[1],RC[2]:RC[4],1) -> 3 | C8: 500 | D8: 100 | E8: 200 | F8: 500 | J8: 4
A9: 3 | B9: =MATCH(RC[1],RC[2]:RC[4],1) -> 3 | C9: 501 | D9: 100 | E9: 200 | F9: 500 | J9: 4
A10: 2 | B10: =MATCH(RC[1],RC[2]:RC[4]) -> 2 | C10: 25 | D10: 10 | E10: 20 | F10: 30 | J10: 4
A11: 1 | B11: =MATCH(RC[1],RC[2]:RC[4]) -> 1 | C11: 15 | D11: 10 | E11: 20 | F11: 30 | J11: 4 | K11: ...
A13: 3 | B13: =MATCH(RC[1],RC[2]:RC[4],-1) -> 3 | C13: 99 | D13: 500 | E13: 200 | F13: 100 | J13: 4 | K13: MATCH (descending) | L13: MATCH -1.0
A14: 3 | B14: =MATCH(RC[1],RC[2]:RC[4],-1) -> 3 | C14: 100 | D14: 500 | E14: 200 | F14: 100 | J14: 4
A15: 2 | B15: =MATCH(RC[1],RC[2]:RC[4],-1) -> 2 | C15: 101 | D15: 500 | E15: 200 | F15: 100 | J15: 4
A16: 2 | B16: =MATCH(RC[1],RC[2]:RC[4],-1) -> 2 | C16: 199 | D16: 500 | E16: 200 | F16: 100 | J16: 4
A17: 2 | B17: =MATCH(RC[1],RC[2]:RC[4],-1) -> 2 | C17: 200 | D17: 500 | E17: 200 | F17: 100 | J17: 4
A18: 1 | B18: =MATCH(RC[1],RC[2]:RC[4],-1) -> 1 | C18: 201 | D18: 500 | E18: 200 | F18: 100 | J18: 4
A19: 1 | B19: =MATCH(RC[1],RC[2]:RC[4],-1) -> 1 | C19: 500 | D19: 500 | E19: 200 | F19: 100 | J19: 4
A20: 0 | B20: =MATCH(RC[1],RC[2]:RC[4],-1) -> #N/A | C20: 501 | D20: 500 | E20: 200 | F20: 100 | J20: 4 | M20: #N/A
A21: 1 | B21: =MATCH(RC[1],RC[2]:RC[4],-1) -> 1 | C21: 25 | D21: 30 | E21: 20 | F21: 10 | J21: 4
A22: 2 | B22: =MATCH(RC[1],RC[2]:RC[4],-1) -> 2 | C22: 15 | D22: 30 | E22: 20 | F22: 10 | J22: 4 | K22: ...
A24: 0 | B24: =MATCH(RC[1],RC[2]:RC[4],0) -> #N/A | C24: 99 | D24: 100 | E24: 200 | F24: 500 | J24: 4 | K24: MATCH (equality) | L24: MATCH 0.0 | M24: #N/A
A25: 1 | B25: =MATCH(RC[1],RC[2]:RC[4],0) -> 1 | C25: 100 | D25: 100 | E25: 200 | F25: 500 | J25: 4
A26: 0 | B26: =MATCH(RC[1],RC[2]:RC[4],0) -> #N/A | C26: 101 | D26: 100 | E26: 200 | F26: 500 | J26: 4 | M26: #N/A
A27: 0 | B27: =MATCH(RC[1],RC[2]:RC[4],0) -> #N/A | C27: 199 | D27: 100 | E27: 200 | F27: 500 | J27: 4 | M27: #N/A
A28: 2 | B28: =MATCH(RC[1],RC[2]:RC[4],0) -> 2 | C28: 200 | D28: 100 | E28: 200 | F28: 500 | J28: 4
A29: 0 | B29: =MATCH(RC[1],RC[2]:RC[4],0) -> #N/A | C29: 201 | D29: 100 | E29: 200 | F29: 500 | J29: 4 | M29: #N/A
A30: 3 | B30: =MATCH(RC[1],RC[2]:RC[4],0) -> 3 | C30: 500 | D30: 100 | E30: 200 | F30: 500 | J30: 4
A31: 0 | B31: =MATCH(RC[1],RC[2]:RC[4],0) -> #N/A | C31: 501 | D31: 100 | E31: 200 | F31: 500 | J31: 4 | M31: #N/A
A32: 0 | B32: =MATCH(RC[1],RC[2]:RC[4],0) -> #N/A | C32: 25 | D32: 10 | E32: 20 | F32: 30 | J32: 4 | M32: #N/A
A33: 2 | B33: =MATCH(RC[1],RC[2]:RC[4],0) -> 2 | C33: 20 | D33: 10 | E33: 20 | F33: 30 | J33: 4 | K33: ...
A34: 2 | B34: =MATCH(RC[1],RC[2]:RC[4],0) -> 2 | C34: 20 | D34: 30 | E34: 20 | F34: 10 | J34: 4 | K34: ...
A37: 6 | B37: =INDEX(RC[1]:RC[3],2) -> 6 | C37: 5 | D37: 6 | E37: 7 | J37: 3 | K37: INDEX (1-dim) | L37: INDEX
A38: 9 | B38: =INDEX(RC[1]:RC[3],2) -> 9 | C38: 8 | D38: 9 | E38: 10 | J38: 3 | K38: ...
A40: 5 | B40: =INDEX(RC[2]:RC[4],RC[1]) -> 5 | C40: 2 | D40: 4 | E40: 5 | F40: 6 | J40: 4
A41: 8 | B41: =INDEX(RC[2]:RC[4],RC[1]) -> 8 | C41: 3 | D41: 6 | E41: 7 | F41: 8 | J41: 4
A42: 6 | B42: =INDEX(RC[2]:RC[4],RC[1]) -> 6 | C42: 1 | D42: 6 | E42: 7 | F42: 8 | J42: 4
A43: 0 | B43: =INDEX(RC[2]:RC[4],RC[1]) -> #VALUE! | C43: 0 | D43: 6 | E43: 7 | F43: 8 | J43: 4 | M43: #VALUE!
A44: 0 | B44: =INDEX(RC[2]:RC[4],RC[1]) -> #REF! | C44: 4 | D44: 6 | E44: 7 | F44: 8 | J44: 4 | M44: #REF!
A46: 0 | B46: =INDEX(RC[2]:RC[4],RC[1]) -> 0 | C46: 2 | J46: 4
A47: 5 | B47: =INDEX(RC[2]:RC[4],RC[1]) -> 5 | C47: 2 | E47: 5 | J47: 4
A49: 9 | B49: =INDEX(RC[1]:R[1]C[3],2,2) -> 9 | C49: 5 | D49: 6 | E49: 7 | J49: 3 | K49: INDEX (2-dim)
A50: 9 | B50: =INDEX(RC[1]:RC[3],1,2) -> 9 | C50: 8 | D50: 9 | E50: 10 | J50: 3 | K50: ...
A52: 11 | B52: =INDEX(R52C[4]:R53C[5],RC[1],RC[2]) -> 11 | C52: 1 | D52: 1 | F52: 11 | G52: 13 | J52: 2
A53: 13 | B53: =INDEX(R52C[4]:R53C[5],RC[1],RC[2]) -> 13 | C53: 1 | D53: 2 | F53: 12 | G53: 14 | J53: 2
A54: 12 | B54: =INDEX(R52C[4]:R53C[5],RC[1],RC[2]) -> 12 | C54: 2 | D54: 1 | J54: 2
A55: 14 | B55: =INDEX(R52C[4]:R53C[5],RC[1],RC[2]) -> 14 | C55: 2 | D55: 2 | J55: 2
A57: 11 | B57: =INDEX(RC[1]:R[1]C[2],1,1) -> 11 | C57: 11 | D57: 13 | J57: 2
A58: 12 | B58: =INDEX(RC[1]:RC[2],1,1) -> 12 | C58: 12 | D58: 14 | J58: 2 | K58: ...
A60: 11 | B60: =INDEX(R60C[4]:R61C[5],RC[1],RC[2]) -> 11 | C60: 1 | D60: 1 | F60: 11 | G60: 13 | J60: 5
A61: 14 | B61: =INDEX(R61C[4]:R61C[5],RC[1],RC[2]) -> 14 | C61: 1 | D61: 2 | F61: 12 | G61: 14 | J61: 5 | K61: ...
A64: 0 | B64: =INDEX(R66C[3]:R67C[4],RC[1],1) -> #VALUE! | C64: -1 | J64: 1 | M64: #VALUE!
A65: 0 | B65: =INDEX(R66C[3]:R67C[4],RC[1],1) -> #VALUE! | C65: 0 | J65: 1 | M65: #VALUE!
A66: 11 | B66: =INDEX(R66C[3]:R67C[4],RC[1],1) -> 11 | C66: 1 | E66: 11 | F66: 13 | J66: 1
A67: 12 | B67: =INDEX(R66C[3]:R67C[4],RC[1],1) -> 12 | C67: 2 | E67: 12 | F67: 14 | J67: 1
A68: 0 | B68: =INDEX(R66C[3]:R67C[4],RC[1],1) -> #REF! | C68: 3 | J68: 1 | M68: #REF!
A70: one | B70: =INDEX(RC[2]:RC[3],RC[1]) -> one | C70: 1 | D70: one | E70: two | J70: 3 | K70: INDEX (return string)
A71: two | B71: =INDEX(RC[2]:RC[3],RC[1]) -> two | C71: 2 | D71: one | E71: two | J71: 3
A73: 12 | B73: =LOOKUP(RC[1],RC[2]:RC[4],RC[5]:RC[7]) -> 12 | C73: 20 | D73: 10 | E73: 20 | F73: 30 | G73: 11 | H73: 12 | I73: 13 | J73: 7 | K73: LOOKUP (vectors horiz.) | L73: LOOKUP
A74: 11 | B74: =LOOKUP(RC[1],RC[2]:RC[4],RC[5]:RC[7]) -> 11 | C74: 19 | D74: 10 | E74: 20 | F74: 30 | G74: 11 | H74: 12 | I74: 13 | J74: 7 | K74: ...
A75: 12 | B75: =LOOKUP(RC[1],RC[2]:RC[4],RC[5]:RC[7]) -> 12 | C75: 21 | D75: 10 | E75: 20 | F75: 30 | G75: 11 | H75: 12 | I75: 13 | J75: 7 | K75: ...
A76: 0 | B76: =LOOKUP(RC[1],RC[2]:RC[4],RC[5]:RC[7]) -> #N/A | C76: 9 | D76: 10 | E76: 20 | F76: 30 | G76: 11 | H76: 12 | I76: 13 | J76: 7 | K76: ... | M76: #N/A
A78: 11 | B78: =LOOKUP(RC[1],R78C[2]:R80C[2],R78C[3]:R80C[3]) -> 11 | C78: 19 | D78: 10 | E78: 11 | J78: 3 | K78: LOOKUP (vectors vert.)
A79: 12 | B79: =LOOKUP(RC[1],R78C[2]:R80C[2],R78C[3]:R80C[3]) -> 12 | C79: 20 | D79: 20 | E79: 12 | J79: 1
A80: 12 | B80: =LOOKUP(RC[1],R78C[2]:R80C[2],R78C[3]:R80C[3]) -> 12 | C80: 21 | D80: 30 | E80: 13 | J80: 1
A81: 0 | B81: =LOOKUP(RC[1],R78C[2]:R80C[2],R78C[3]:R80C[3]) -> #N/A | C81: 9 | J81: 1 | M81: #N/A
A83: 22 | B83: =LOOKUP(RC[1],R83C[2]:R85C[5]) -> 22 | C83: 29 | D83: 10 | E83: 20 | F83: 30 | G83: 40 | J83: 5 | K83: LOOKUP (array horiz)
A84: 23 | B84: =LOOKUP(RC[1],R83C[2]:R85C[5]) -> 23 | C84: 30 | D84: 11 | E84: 12 | F84: 13 | G84: 14 | J84: 1
A85: 23 | B85: =LOOKUP(RC[1],R83C[2]:R85C[5]) -> 23 | C85: 31 | D85: 21 | E85: 22 | F85: 23 | G85: 24 | J85: 1
A87: 21 | B87: =LOOKUP(RC[1],R87C[2]:R89C[4]) -> 21 | C87: 19 | D87: 10 | E87: 11 | F87: 21 | J87: 4 | K87: LOOKUP (array square)
A88: 22 | B88: =LOOKUP(RC[1],R87C[2]:R89C[4]) -> 22 | C88: 20 | D88: 20 | E88: 12 | F88: 22 | J88: 1
A89: 22 | B89: =LOOKUP(RC[1],R87C[2]:R89C[4]) -> 22 | C89: 21 | D89: 30 | E89: 13 | F89: 23 | J89: 1
A91: 21 | B91: =LOOKUP(RC[1],R91C[2]:R94C[4]) -> 21 | C91: 19 | D91: 10 | E91: 11 | F91: 21 | J91: 4 | K91: LOOKUP (array vert)
A92: 22 | B92: =LOOKUP(RC[1],R91C[2]:R94C[4]) -> 22 | C92: 20 | D92: 20 | E92: 12 | F92: 22 | J92: 1
A93: 22 | B93: =LOOKUP(RC[1],R91C[2]:R94C[4]) -> 22 | C93: 21 | D93: 30 | E93: 13 | F93: 23 | J93: 1
A94: 23 | B94: =LOOKUP(RC[1],R91C[2]:R94C[4]) -> 23 | C94: 30 | D94: 40 | E94: 14 | F94: 24 | J94: 1
A96: 22 | B96: =HLOOKUP(RC[1],R96C[2]:R98C[5],3) -> 22 | C96: 29 | D96: 10 | E96: 20 | F96: 30 | G96: 40 | J96: 5 | K96: HLOOKUP | L96: HLOOKUP
A97: 23 | B97: =HLOOKUP(RC[1],R96C[2]:R98C[5],3) -> 23 | C97: 30 | D97: 11 | E97: 12 | F97: 13 | G97: 14 | J97: 1
A98: 23 | B98: =HLOOKUP(RC[1],R96C[2]:R98C[5],3) -> 23 | C98: 31 | D98: 21 | E98: 22 | F98: 23 | G98: 24 | J98: 1
A99: 20 | B99: =HLOOKUP(RC[1],R96C[2]:R98C[5],RC[2]) -> 20 | C99: 29 | D99: 1 | J99: 2
A100: 13 | B100: =HLOOKUP(RC[1],R96C[2]:R98C[5],RC[2]) -> 13 | C100: 30 | D100: 2 | J100: 2
A101: 23 | B101: =HLOOKUP(RC[1],R96C[2]:R98C[5],RC[2]) -> 23 | C101: 31 | D101: 3 | J101: 2
A102: 0 | B102: =HLOOKUP(RC[1],R96C[2]:R98C[5],RC[2]) -> #VALUE! | C102: 31 | D102: 0 | J102: 2 | M102: #VALUE!
A103: 0 | B103: =HLOOKUP(RC[1],R96C[2]:R98C[5],RC[2]) -> #REF! | C103: 31 | D103: 4 | J103: 2 | M103: #REF!
A105: 22 | B105: =VLOOKUP(RC[1],R105C[2]:R107C[4],3) -> 22 | C105: 29 | D105: 10 | E105: 11 | F105: 21 | J105: 4 | K105: VLOOKUP | L105: VLOOKUP
A106: 23 | B106: =VLOOKUP(RC[1],R105C[2]:R107C[4],3) -> 23 | C106: 30 | D106: 20 | E106: 12 | F106: 22 | J106: 1
A107: 23 | B107: =VLOOKUP(RC[1],R105C[2]:R107C[4],3) -> 23 | C107: 31 | D107: 30 | E107: 13 | F107: 23 | J107: 1
A108: 20 | B108: =VLOOKUP(RC[1],R105C[2]:R107C[4],RC[2]) -> 20 | C108: 29 | D108: 1 | J108: 2
A109: 13 | B109: =VLOOKUP(RC[1],R105C[2]:R107C[4],RC[2]) -> 13 | C109: 30 | D109: 2 | J109: 2
A110: 23 | B110: =VLOOKUP(RC[1],R105C[2]:R107C[4],RC[2]) -> 23 | C110: 31 | D110: 3 | J110: 2
A111: 0 | B111: =VLOOKUP(RC[1],R105C[2]:R107C[4],RC[2]) -> #VALUE! | C111: 31 | D111: 0 | J111: 2 | M111: #VALUE!
A112: 0 | B112: =VLOOKUP(RC[1],R105C[2]:R107C[4],RC[2]) -> #REF! | C112: 31 | D112: 4 | J112: 2 | M112: #REF!
A114: 11 | B114: =CHOOSE(RC[1],RC[2],RC[3],RC[4]) -> 11 | C114: 1 | D114: 11 | E114: 12 | F114: 13 | J114: 4 | K114: CHOOSE | L114: CHOOSE
A115: 22 | B115: =CHOOSE(RC[1],RC[2],RC[3],RC[4]) -> 22 | C115: 2 | D115: 21 | E115: 22 | F115: 23 | J115: 4
A116: 33 | B116: =CHOOSE(RC[1],RC[2],RC[3],RC[4]) -> 33 | C116: 3 | D116: 31 | E116: 32 | F116: 33 | J116: 4
A117: 0 | B117: =CHOOSE(RC[1],RC[2],RC[3],RC[4]) -> #VALUE! | C117: 4 | D117: 11 | E117: 12 | F117: 13 | J117: 4 | M117: #VALUE!
A118: 0 | B118: =CHOOSE(RC[1],RC[2],RC[3],RC[4]) -> #VALUE! | C118: 0 | D118: 11 | E118: 12 | F118: 13 | J118: 4 | M118: #VALUE!
A119: 12 | B119: =CHOOSE(RC[1],RC[2],RC[3],RC[4]) -> 12 | C119: 2.99 | D119: 11 | E119: 12 | F119: 13 | J119: 4