Sheet: Sheet1
A1: Expected | B1: Actual | C1: Inputs | J1: # of Inputs | K1: Name | L1: Highlight | M1: Excel says | N1: Skip for
A2: 3 | B2: =RC[1]+RC[2] -> 3 | C2: 1 | D2: 2 | J2: 2 | K2: Addition (+) | L2: +
A3: 12 | B3: =RC[1]+RC[2]+RC[3] -> 12 | C3: 5 | D3: 4 | E3: 3 | J3: 3
A4: 6.6 | B4: =RC[1]+RC[2]+RC[3] -> 6.6 | C4: 1.1 | D4: 2.2 | E4: 3.3 | J4: 3 | K4: ...
A6: 2 | B6: =RC[1]-RC[2] -> 2 | C6: 3 | D6: 1 | J6: 2 | K6: Subtraction (-) | L6: -
A7: 1 | B7: =RC[1]-RC[2]-RC[3] -> 1 | C7: 5 | D7: 3 | E7: 1 | J7: 3
A8: -4.4 | B8: =RC[1]-RC[2]-RC[3] -> -4.4 | C8: 1.1 | D8: 2.2 | E8: 3.3 | J8: 3 | K8: ...
A10: 35 | B10: =RC[1]*RC[2] -> 35 | C10: 5 | D10: 7 | J10: 2 | K10: Multiplication (*) | L10: *
A11: 0.2 | B11: =RC[1]*RC[2] -> 0.2 | C11: 0.4 | D11: 0.5 | J11: 2 | K11: ...
A13: 7 | B13: =RC[1]+RC[2]*RC[3] -> 7 | C13: 1 | D13: 2 | E13: 3 | J13: 3 | K13: Precedence (* before +) | L13: * ( )
A14: 9 | B14: =(RC[1]+RC[2])*RC[3] -> 9 | C14: 1 | D14: 2 | E14: 3 | J14: 3
A16: 2.5 | B16: =RC[1]/RC[2] -> 2.5 | C16: 10 | D16: 4 | J16: 2 | K16: Division (/) | L16: /
A17: 8 | B17: =RC[1]-RC[2]/RC[3] -> 8 | C17: 10 | D17: 4 | E17: 2 | J17: 3
A18: 7 | B18: =RC[1]-RC[2]/RC[3] -> 7 | C18: 10 | D18: 9 | E18: 3 | J18: 3 | K18: ...
A19: 9.6666666669999994 | B19: =RC[1]-RC[2]/RC[3] -> 9.6666666666666661 | C19: 10 | D19: 1 | E19: 3 | J19: 3
A20: Infinity | B20: =RC[1]/RC[2] -> #DIV/0! | C20: 1 | D20: 0 | J20: 2 | K20: Division by zero for DOUBLE | L20: / | M20: #DIV/0! | N20: long big bprec
A22: -10 | B22: =-RC[1] -> -10 | C22: 10 | J22: 1 | K22: Negation (-) | L22: -
A23: -2 | B23: =-RC[1]--RC[2] -> -2 | C23: 5 | D23: 3 | J23: 2
A24: -1 | B24: =-RC[1]--RC[2] -> -1 | C24: -3 | D24: -4 | J24: 2 | K24: ...
A26: 0.15 | B26: =RC[1]% -> 0.15 | C26: 15 | J26: 1 | K26: Percentage (%) | L26: %
A27: 5.13 | B27: =(RC[1]+RC[2])%+RC[3]+RC[4]% -> 5.13 | C27: 3 | D27: 4 | E27: 5 | F27: 6 | J27: 4
A28: 3.3769999999999998 | B28: =(RC[1]+RC[2])%+RC[3]+RC[4]% -> 3.3769999999999998 | C28: 1.1 | D28: 2.2 | E28: 3.3 | F28: 4.4 | J28: 4 | K28: ...
A30: 256 | B30: =RC[1]^RC[2] -> 256 | C30: 2 | D30: 8 | J30: 2 | K30: Exponentiation (^) | L30: ^
A31: 24 | B31: =RC[1]^RC[2]+RC[3]^(RC[4]+RC[5]) -> 24 | C31: 2 | D31: 3 | E31: 2 | F31: 1 | G31: 3 | J31: 5
A32: 1240 | B32: =RC[1]^RC[2]+RC[3]^(RC[4]+RC[5]) -> 1240 | C32: 4 | D32: 5 | E32: 6 | F32: 2 | G32: 1 | J32: 5 | K32: ...
A34: 1 | B34: =RC[1]+RC[2]-RC[3] -> 1 | C34: 1 | J34: 3 | K34: Empty cells are 0
A35: 17 | B35: =RC[1]+RC[2]-RC[3] -> 17 | D35: 17 | J35: 3
A36: -2 | B36: =RC[1]+RC[2]-RC[3] -> -2 | C36: 2 | E36: 4 | J36: 3
A37: 0 | B37: =RC[1]*RC[2] -> 0 | C37: 3 | J37: 2