Sheet: Sheet1
A1: Expected | B1: Actual | C1: Inputs | J1: # of Inputs | K1: Name | L1: Highlight | M1: Excel says | N1: Skip for
A2: 1 | B2: =ABS(RC[1]) -> 1 | C2: -1 | J2: 1 | K2: ABS | L2: ABS
A3: 0 | B3: =ABS(RC[1]) -> 0 | C3: 0 | J3: 1
A4: 1 | B4: =ABS(RC[1]) -> 1 | C4: 1 | J4: 1
A5: 1.9999 | B5: =ABS(RC[1]) -> 1.9999 | C5: -1.9999 | J5: 1
A6: 1.9999 | B6: =ABS(RC[1]) -> 1.9999 | C6: 1.9999 | J6: 1
A7: 0 | B7: =ABS(RC[1]) -> 0 | C7: 0 | J7: 1
A8: 1 | B8: =ABS(RC[1]) -> 1 | C8: 1 | J8: 1
A9: 3 | B9: =ABS(RC[1]) -> 3 | C9: -3 | J9: 1
A10: 4 | B10: =ABS(RC[1]) -> 4 | C10: -4 | J10: 1 | K10: ...
A12: 3.1415926535897931 | B12: =ACOS(RC[1]) -> 3.1415926535897931 | C12: -1 | J12: 1 | K12: ACOS | L12: ACOS
A13: 3.1274504001122811 | B13: =ACOS(RC[1]) -> 3.1274504001122811 | C13: -0.99990000000000001 | J13: 1
A14: 2.0943951023931957 | B14: =ACOS(RC[1]) -> 2.0943951023931957 | C14: -0.5 | J14: 1
A15: 1.5708963267950633 | B15: =ACOS(RC[1]) -> 1.5708963267950633 | C15: -1E-4 | J15: 1
A16: 1.5707963267948966 | B16: =ACOS(RC[1]) -> 1.5707963267948966 | C16: 0 | J16: 1
A17: 1.5706963267947298 | B17: =ACOS(RC[1]) -> 1.5706963267947298 | C17: 1E-4 | J17: 1
A18: 1.0471975511965976 | B18: =ACOS(RC[1]) -> 1.0471975511965976 | C18: 0.5 | J18: 1
A19: 1.4142253477511968E-2 | B19: =ACOS(RC[1]) -> 1.4142253477511968E-2 | C19: 0.99990000000000001 | J19: 1 | K19: ...
A20: 0 | B20: =ACOS(RC[1]) -> 0 | C20: 1 | J20: 1
A21: 0 | B21: =ACOS(RC[1]) -> #NUM! | C21: -1.0001 | J21: 1 | M21: #NUM!
A22: 0 | B22: =ACOS(RC[1]) -> #NUM! | C22: 1.0001 | J22: 1 | M22: #NUM!
A24: 0 | B24: =ACOSH(RC[1]) -> 0 | C24: 1 | J24: 1 | K24: ACOSH | L24: ACOSH
A25: 1.3169578969248166 | B25: =ACOSH(RC[1]) -> 1.3169578969248166 | C25: 2 | J25: 1
A26: 1.7627471740390861 | B26: =ACOSH(RC[1]) -> 1.7627471740390861 | C26: 3 | J26: 1
A27: 2.1615809409653055 | B27: =ACOSH(RC[1]) -> 2.1615809409653055 | C27: 4.4 | J27: 1
A28: 3.0630757460972857 | B28: =ACOSH(RC[1]) -> 3.0630757460972857 | C28: 10.72 | J28: 1
A29: 3.7053778312166519 | B29: =ACOSH(RC[1]) -> 3.7053778312166519 | C29: 20.344999999999999 | J29: 1
A30: 5.298292365610485 | B30: =ACOSH(RC[1]) -> 5.298292365610485 | C30: 100 | J30: 1
A31: 7.6009022095419887 | B31: =ACOSH(RC[1]) -> 7.6009022095419887 | C31: 1000 | J31: 1 | K31: ...
A32: 9.9034875500361288 | B32: =ACOSH(RC[1]) -> 9.9034875500361288 | C32: 10000 | J32: 1
A33: 12.206072645505174 | B33: =ACOSH(RC[1]) -> 12.206072645505174 | C33: 100000 | J33: 1 | M33: #NUM!
A34: 14.508657738523969 | B34: =ACOSH(RC[1]) -> 14.508657738523969 | C34: 1000000 | J34: 1 | M34: #NUM!
A37: -1.5707963267948966 | B37: =ASIN(RC[1]) -> -1.5707963267948966 | C37: -1 | J37: 1 | K37: ASIN | L37: ASIN
A38: -1.5566540733173846 | B38: =ASIN(RC[1]) -> -1.5566540733173846 | C38: -0.99990000000000001 | J38: 1
A39: -0.52359877559829893 | B39: =ASIN(RC[1]) -> -0.52359877559829893 | C39: -0.5 | J39: 1
A40: -1.0000000016666668E-4 | B40: =ASIN(RC[1]) -> -1.0000000016666668E-4 | C40: -1E-4 | J40: 1
A41: 0 | B41: =ASIN(RC[1]) -> 0 | C41: 0 | J41: 1
A42: 1.0000000016666668E-4 | B42: =ASIN(RC[1]) -> 1.0000000016666668E-4 | C42: 1E-4 | J42: 1
A43: 0.52359877559829893 | B43: =ASIN(RC[1]) -> 0.52359877559829893 | C43: 0.5 | J43: 1
A44: 1.5566540733173846 | B44: =ASIN(RC[1]) -> 1.5566540733173846 | C44: 0.99990000000000001 | J44: 1
A45: 1.5707963267948966 | B45: =ASIN(RC[1]) -> 1.5707963267948966 | C45: 1 | J45: 1
A46: 0 | B46: =ASIN(RC[1]) -> #NUM! | C46: -1.0001 | J46: 1 | M46: #NUM!
A47: 0 | B47: =ASIN(RC[1]) -> #NUM! | C47: 1.0001 | J47: 1 | K47: ... | M47: #NUM!
A49: 0 | B49: =ASINH(RC[1]) -> 0 | C49: 0 | J49: 1 | K49: ASINH | L49: ASINH
A50: 0.48121182505960347 | B50: =ASINH(RC[1]) -> 0.48121182505960347 | C50: 0.5 | J50: 1
A51: -0.48121182505960336 | B51: =ASINH(RC[1]) -> -0.48121182505960336 | C51: -0.5 | J51: 1
A52: 1.4436354751788103 | B52: =ASINH(RC[1]) -> 1.4436354751788103 | C52: 2 | J52: 1
A53: -1.4436354751788099 | B53: =ASINH(RC[1]) -> -1.4436354751788099 | C53: -2 | J53: 1
A54: 1.8184464592320668 | B54: =ASINH(RC[1]) -> 1.8184464592320668 | C54: 3 | J54: 1
A55: 2.3124383412727525 | B55: =ASINH(RC[1]) -> 2.3124383412727525 | C55: 5 | J55: 1
A56: 2.9982229502979698 | B56: =ASINH(RC[1]) -> 2.9982229502979698 | C56: 10 | J56: 1
A57: 5.2983423656105888 | B57: =ASINH(RC[1]) -> 5.2983423656105888 | C57: 100 | J57: 1
A58: 12.206072645555174 | B58: =ASINH(RC[1]) -> 12.206072645555174 | C58: 100000 | J58: 1
A59: -12.206073762186564 | B59: =ASINH(RC[1]) -> -12.206073762186564 | C59: -100000 | J59: 1 | K59: ...
A61: -1.5707963257948967 | B61: =ATAN(RC[1]) -> -1.5707963257948967 | C61: -1000000000 | J61: 1 | K61: ATAN | L61: ATAN
A62: -1.5697963271282298 | B62: =ATAN(RC[1]) -> -1.5697963271282298 | C62: -1000 | J62: 1
A63: -0.78539816339744828 | B63: =ATAN(RC[1]) -> -0.78539816339744828 | C63: -1 | J63: 1
A64: -9.9668652491162038E-2 | B64: =ATAN(RC[1]) -> -9.9668652491162038E-2 | C64: -0.1 | J64: 1
A65: -9.9999966666686679E-4 | B65: =ATAN(RC[1]) -> -9.9999966666686679E-4 | C65: -1E-3 | J65: 1
A66: 0 | B66: =ATAN(RC[1]) -> 0 | C66: 0 | J66: 1
A67: 9.9999966666686679E-4 | B67: =ATAN(RC[1]) -> 9.9999966666686679E-4 | C67: 1E-3 | J67: 1
A68: 9.9668652491162038E-2 | B68: =ATAN(RC[1]) -> 9.9668652491162038E-2 | C68: 0.1 | J68: 1
A69: 0.78539816339744828 | B69: =ATAN(RC[1]) -> 0.78539816339744828 | C69: 1 | J69: 1
A70: 1.5697963271282298 | B70: =ATAN(RC[1]) -> 1.5697963271282298 | C70: 1000 | J70: 1
A71: 1.5707963257948967 | B71: =ATAN(RC[1]) -> 1.5707963257948967 | C71: 1000000000 | J71: 1 | K71: ...
A73: 0 | B73: =ATANH(RC[1]) -> 0 | C73: 0 | J73: 1 | K73: ATANH | L73: ATANH
A74: 0.10033534773107562 | B74: =ATANH(RC[1]) -> 0.10033534773107562 | C74: 0.1 | J74: 1
A75: -0.10033534773107562 | B75: =ATANH(RC[1]) -> -0.10033534773107562 | C75: -0.1 | J75: 1
A76: 0.54930614433405489 | B76: =ATANH(RC[1]) -> 0.54930614433405489 | C76: 0.5 | J76: 1
A77: -0.54930614433405489 | B77: =ATANH(RC[1]) -> -0.54930614433405489 | C77: -0.5 | J77: 1
A78: 0.86730052769405319 | B78: =ATANH(RC[1]) -> 0.86730052769405319 | C78: 0.7 | J78: 1
A79: -0.86730052769405308 | B79: =ATANH(RC[1]) -> -0.86730052769405308 | C79: -0.7 | J79: 1
A80: 0 | B80: =ATANH(RC[1]) -> #NUM! | C80: 1 | J80: 1 | M80: #NUM!
A81: 0 | B81: =ATANH(RC[1]) -> #NUM! | C81: -1 | J81: 1 | M81: #NUM!
A82: 0 | B82: =ATANH(RC[1]) -> #NUM! | C82: 2 | J82: 1 | M82: #NUM!
A83: 0 | B83: =ATANH(RC[1]) -> #NUM! | C83: 1000 | J83: 1 | K83: ... | M83: #NUM!
A85: -2.3561944901923448 | B85: =ATAN2(RC[1],RC[2]) -> -2.3561944901923448 | C85: -1 | D85: -1 | J85: 2 | K85: ATAN2 | L85: ATAN2
A86: -0.78539816339744828 | B86: =ATAN2(RC[1],RC[2]) -> -0.78539816339744828 | C86: 1 | D86: -1 | J86: 2
A87: -1.5707963267948966 | B87: =ATAN2(RC[1],RC[2]) -> -1.5707963267948966 | C87: 0 | D87: -1 | J87: 2
A88: 2.3561944901923448 | B88: =ATAN2(RC[1],RC[2]) -> 2.3561944901923448 | C88: -1 | D88: 1 | J88: 2
A89: 0.78539816339744828 | B89: =ATAN2(RC[1],RC[2]) -> 0.78539816339744828 | C89: 1 | D89: 1 | J89: 2
A90: 1.5707963267948966 | B90: =ATAN2(RC[1],RC[2]) -> 1.5707963267948966 | C90: 0 | D90: 1 | J90: 2
A91: 3.1415926535897931 | B91: =ATAN2(RC[1],RC[2]) -> 3.1415926535897931 | C91: -1 | D91: 0 | J91: 2
A92: 0 | B92: =ATAN2(RC[1],RC[2]) -> 0 | C92: 1 | D92: 0 | J92: 2
A93: 0 | B93: =ATAN2(RC[1],RC[2]) -> #DIV/0! | C93: 0 | D93: 0 | J93: 2 | M93: #DIV/0!
A94: -9.9999966666686679E-4 | B94: =ATAN2(RC[1],RC[2]) -> -9.9999966666686679E-4 | C94: 1000 | D94: -1 | J94: 2
A95: 9.9999966666686679E-4 | B95: =ATAN2(RC[1],RC[2]) -> 9.9999966666686679E-4 | C95: 1000 | D95: 1 | J95: 2 | K95: ...
A97: 1 | B97: =GEOMEAN(RC[1],RC[2]) -> 1 | C97: 1 | D97: 1 | J97: 2 | K97: GEOMEAN | L97: GEOMEAN
A98: 3 | B98: =GEOMEAN(RC[1],RC[2]) -> 3.0000000000000004 | C98: 3 | D98: 3 | J98: 2
A99: 5 | B99: =GEOMEAN(RC[1],RC[2],RC[3]:RC[4]) -> 4.9999999999999991 | C99: 5 | D99: 5 | E99: 5 | F99: 5 | J99: 4
A100: 2.4494897427831779 | B100: =GEOMEAN(RC[1],RC[2]) -> 2.4494897427831779 | C100: 2 | D100: 3 | J100: 2
A101: 3 | B101: =GEOMEAN(RC[1],RC[2],RC[3]:RC[4]) -> 3.0000000000000004 | C101: 9 | D101: 3 | E101: 3 | F101: 1 | J101: 4
A102: 4.9492320038397652 | B102: =GEOMEAN(RC[1],RC[2],RC[3]:RC[4]) -> 4.9492320038397652 | C102: 50 | D102: 2 | E102: 3 | F102: 2 | J102: 4
A103: 12 | B103: =GEOMEAN(RC[1],RC[2]) -> 12 | C103: 2 | D103: 72 | J103: 2
A104: 1.7211914478058505 | B104: =GEOMEAN(RC[1],RC[2]) -> 1.7211914478058505 | C104: 1.25 | D104: 2.37 | J104: 2
A105: 0 | B105: =GEOMEAN(RC[1],RC[2]) -> #NUM! | C105: 0 | D105: -1 | J105: 2 | K105: ... | M105: =GEOMEAN(RC[1],RC[2]) -> #NUM!
A107: 4 | B107: =HARMEAN(RC[1],RC[2]) -> 4 | C107: 4 | D107: 4 | J107: 2 | K107: HARMEAN | L107: HARMEAN
A108: 1 | B108: =HARMEAN(RC[1],RC[2]) -> 1 | C108: 1 | D108: 1 | J108: 2
A109: 3.2 | B109: =HARMEAN(RC[1],RC[2],RC[3]:RC[4]) -> 3.2 | C109: 2 | D109: 2 | E109: 8 | F109: 8 | J109: 4
A110: 3.2 | B110: =HARMEAN(RC[1],RC[2]) -> 3.2 | C110: 2 | D110: 8 | J110: 2
A111: 2.2068965517241379 | B111: =HARMEAN(RC[1],RC[2],RC[3]:RC[4]) -> 2.2068965517241379 | C111: 16 | D111: 4 | E111: 2 | F111: 1 | J111: 4
A112: 2.6666666666666665 | B112: =HARMEAN(RC[1],RC[2],RC[3]:RC[4]) -> 2.6666666666666665 | C112: 4 | D112: 2 | E112: 4 | F112: 2 | J112: 4
A113: 2.6666666666666665 | B113: =HARMEAN(RC[1],RC[2]) -> 2.6666666666666665 | C113: 2 | D113: 4 | J113: 2
A114: 1.6367403314917126 | B114: =HARMEAN(RC[1],RC[2]) -> 1.6367403314917126 | C114: 1.25 | D114: 2.37 | J114: 2
A115: 0 | B115: =HARMEAN(RC[1],RC[2]) -> #NUM! | C115: 0 | D115: -1 | J115: 2 | K115: ... | M115: #NUM!
A117: 2 | B117: =PERMUT(RC[1],RC[2]) -> 2 | C117: 2 | D117: 1 | J117: 2 | K117: PERMUT | L117: PERMUT
A118: 6 | B118: =PERMUT(RC[1],RC[2]) -> 6 | C118: 3 | D118: 3 | J118: 2
A119: 1 | B119: =PERMUT(RC[1],RC[2]) -> 1 | C119: 1.1 | D119: 1.3 | J119: 2
A120: 2520 | B120: =PERMUT(RC[1],RC[2]) -> 2520 | C120: 7 | D120: 5 | J120: 2
A121: 6 | B121: =PERMUT(RC[1],RC[2]) -> 6 | C121: 3.4 | D121: 2.1 | J121: 2
A122: 0 | B122: =PERMUT(RC[1],RC[2]) -> #NUM! | C122: 0 | D122: 1 | J122: 2 | M122: #NUM!
A123: 1 | B123: =PERMUT(RC[1],RC[2]) -> 1 | C123: 0 | D123: 0 | J123: 2
A124: 0 | B124: =PERMUT(RC[1],RC[2]) -> #NUM! | C124: 1 | D124: -1 | J124: 2 | M124: #NUM!
A125: 0 | B125: =PERMUT(RC[1],RC[2]) -> #NUM! | C125: -1 | D125: 1 | J125: 2 | M125: #NUM!
A126: 0 | B126: =PERMUT(RC[1],RC[2]) -> #NUM! | C126: 0 | D126: -1 | J126: 2 | K126: ... | M126: #NUM!
A128: 1 | B128: =RAND()<1 -> 1 | J128: 0 | K128: RAND | L128: RAND
A129: 1 | B129: =RAND()<1 -> 1 | J129: 0 | N129: double, BigDecimal, long
A130: 1 | B130: =RAND()>0 -> 1 | J130: 0
A131: 1 | B131: =RAND()>0 -> 1 | J131: 0
A132: 1 | B132: =((RAND()+RAND()+RAND()+RAND()+RAND()+RAND()+RAND()+RAND()+RAND()+RAND())/10)>0 -> 1 | J132: 0
A133: 1 | B133: =((RAND()+RAND()+RAND()+RAND()+RAND()+RAND()+RAND()+RAND()+RAND()+RAND())/10)<1 -> 1 | J133: 0
A134: 0 | B134: =RAND()=RAND() -> 0 | J134: 0
A135: 0 | B135: =RAND()=RAND() -> 0 | J135: 0 | K135: ...
A137: 0.93675212753313919 | B137: =COS(RC[1]) -> 0.93675212753313919 | C137: -1000000 | J137: 1 | K137: COS | L137: COS
A138: -0.99999999997301514 | B138: =COS(RC[1]) -> -0.99999999997301514 | C138: -3.1415999999999999 | J138: 1
A139: -0.99999999999647926 | B139: =COS(RC[1]) -> -0.99999999999647926 | C139: -3.1415899999999999 | J139: 1
A140: 0.99500416527802582 | B140: =COS(RC[1]) -> 0.99500416527802582 | C140: -0.1 | J140: 1
A141: 0.99999950000004167 | B141: =COS(RC[1]) -> 0.99999950000004167 | C141: -1E-3 | J141: 1
A142: 1 | B142: =COS(RC[1]) -> 1 | C142: 0 | J142: 1
A143: 0.99999950000004167 | B143: =COS(RC[1]) -> 0.99999950000004167 | C143: 1E-3 | J143: 1
A144: 0.99500416527802582 | B144: =COS(RC[1]) -> 0.99500416527802582 | C144: 0.1 | J144: 1
A145: -0.99999999999647926 | B145: =COS(RC[1]) -> -0.99999999999647926 | C145: 3.1415899999999999 | J145: 1
A146: -0.99999999997301514 | B146: =COS(RC[1]) -> -0.99999999997301514 | C146: 3.1415999999999999 | J146: 1
A147: 0.93675212753313919 | B147: =COS(RC[1]) -> 0.93675212753313919 | C147: 1000000 | J147: 1 | K147: ...
A149: 1 | B149: =COSH(RC[1]) -> 1 | C149: 0 | J149: 1 | K149: COSH | L149: COSH
A150: 1.5430806348152437 | B150: =COSH(RC[1]) -> 1.5430806348152437 | C150: 1 | J150: 1
A151: 3.7621956910836314 | B151: =COSH(RC[1]) -> 3.7621956910836314 | C151: 2 | J151: 1
A152: 3.7621956910836314 | B152: =COSH(RC[1]) -> 3.7621956910836314 | C152: -2 | J152: 1
A153: 1.3440585709080678E+43 | B153: =COSH(RC[1]) -> 1.3440585709080678E+43 | C153: 100 | J153: 1
A154: 1.8865101504649698E+260 | B154: =COSH(RC[1]) -> 1.8865101504649698E+260 | C154: 600 | J154: 1
A155: 1.8865101504649698E+260 | B155: =COSH(RC[1]) -> 1.8865101504649698E+260 | C155: -600 | J155: 1 | K155: ...
A157: 0 | B157: =SIGN(RC[1]) -> 0 | C157: 0 | J157: 1 | K157: SIGN | L157: SIGN
A158: 1 | B158: =SIGN(RC[1]) -> 1 | C158: 1 | J158: 1
A159: 1 | B159: =SIGN(RC[1]) -> 1 | C159: 2 | J159: 1
A160: -1 | B160: =SIGN(RC[1]) -> -1 | C160: -1 | J160: 1
A161: -1 | B161: =SIGN(RC[1]) -> -1 | C161: -2 | J161: 1
A162: 1 | B162: =SIGN(RC[1]) -> 1 | C162: 10000 | J162: 1
A163: -1 | B163: =SIGN(RC[1]) -> -1 | C163: -10000 | J163: 1 | K163: ...
A165: 0.34999350217130792 | B165: =SIN(RC[1]) -> 0.34999350217130792 | C165: -1000000 | J165: 1 | K165: SIN | L165: SIN
A166: 7.3464102066435371E-6 | B166: =SIN(RC[1]) -> 7.3464102066435371E-6 | C166: -3.1415999999999999 | J166: 1
A167: -2.6535897933527804E-6 | B167: =SIN(RC[1]) -> -2.6535897933527804E-6 | C167: -3.1415899999999999 | J167: 1
A168: -9.9833416646828155E-2 | B168: =SIN(RC[1]) -> -9.9833416646828155E-2 | C168: -0.1 | J168: 1
A169: -9.9999983333334168E-4 | B169: =SIN(RC[1]) -> -9.9999983333334168E-4 | C169: -1E-3 | J169: 1
A170: 0 | B170: =SIN(RC[1]) -> 0 | C170: 0 | J170: 1
A171: 9.9999983333334168E-4 | B171: =SIN(RC[1]) -> 9.9999983333334168E-4 | C171: 1E-3 | J171: 1
A172: 9.9833416646828155E-2 | B172: =SIN(RC[1]) -> 9.9833416646828155E-2 | C172: 0.1 | J172: 1
A173: 2.6535897933527804E-6 | B173: =SIN(RC[1]) -> 2.6535897933527804E-6 | C173: 3.1415899999999999 | J173: 1
A174: -7.3464102066435371E-6 | B174: =SIN(RC[1]) -> -7.3464102066435371E-6 | C174: 3.1415999999999999 | J174: 1
A175: -0.34999350217130792 | B175: =SIN(RC[1]) -> -0.34999350217130792 | C175: 1000000 | J175: 1 | K175: ...
A177: 0 | B177: =SINH(RC[1]) -> 0 | C177: 0 | J177: 1 | K177: SINH | L177: SINH
A178: 1.1752011936438014 | B178: =SINH(RC[1]) -> 1.1752011936438014 | C178: 1 | J178: 1
A179: 11.530292030410109 | B179: =SINH(RC[1]) -> 11.530292030410109 | C179: 3.14 | J179: 1
A180: -1.1752011936438014 | B180: =SINH(RC[1]) -> -1.1752011936438014 | C180: -1 | J180: 1
A181: -74.203210577788752 | B181: =SINH(RC[1]) -> -74.203210577788752 | C181: -5 | J181: 1
A182: 1.3440585709080678E+43 | B182: =SINH(RC[1]) -> 1.3440585709080678E+43 | C182: 100 | J182: 1
A183: 3.6129868840628745E+86 | B183: =SINH(RC[1]) -> 3.6129868840628745E+86 | C183: 200 | J183: 1
A184: -3.6129868840628745E+86 | B184: =SINH(RC[1]) -> -3.6129868840628745E+86 | C184: -200 | J184: 1
A185: 1.5199748986808874E+43 | B185: =SINH(RC[1]) -> 1.5199748986808874E+43 | C185: 100.123 | J185: 1
A186: 4.1092037307774862E+307 | B186: =SINH(RC[1]) -> 4.1092037307774862E+307 | C186: 709 | J186: 1
A187: 0 | B187: =SINH(RC[1]) -> #NUM! | C187: 710 | J187: 1 | K187: ... | M187: #NUM!
A189: 0.37362445398761723 | B189: =TAN(RC[1]) -> 0.37362445398761723 | C189: -1000000 | J189: 1 | K189: TAN | L189: TAN
A190: -7.3464102068417793E-6 | B190: =TAN(RC[1]) -> -7.3464102068417793E-6 | C190: -3.1415999999999999 | J190: 1
A191: 2.6535897933621231E-6 | B191: =TAN(RC[1]) -> 2.6535897933621231E-6 | C191: -3.1415899999999999 | J191: 1
A192: -0.10033467208545055 | B192: =TAN(RC[1]) -> -0.10033467208545055 | C192: -0.1 | J192: 1
A193: -1.0000003333334668E-3 | B193: =TAN(RC[1]) -> -1.0000003333334668E-3 | C193: -1E-3 | J193: 1
A194: 0 | B194: =TAN(RC[1]) -> 0 | C194: 0 | J194: 1
A195: 1.0000003333334668E-3 | B195: =TAN(RC[1]) -> 1.0000003333334668E-3 | C195: 1E-3 | J195: 1
A196: 0.10033467208545055 | B196: =TAN(RC[1]) -> 0.10033467208545055 | C196: 0.1 | J196: 1
A197: -2.6535897933621231E-6 | B197: =TAN(RC[1]) -> -2.6535897933621231E-6 | C197: 3.1415899999999999 | J197: 1
A198: 7.3464102068417793E-6 | B198: =TAN(RC[1]) -> 7.3464102068417793E-6 | C198: 3.1415999999999999 | J198: 1
A199: -0.37362445398761723 | B199: =TAN(RC[1]) -> -0.37362445398761723 | C199: 1000000 | J199: 1 | K199: ...
A201: 0 | B201: =TANH(RC[1]) -> 0 | C201: 0 | J201: 1 | K201: TANH | L201: TANH
A202: 0.76159415595576485 | B202: =TANH(RC[1]) -> 0.76159415595576485 | C202: 1 | J202: 1
A203: -0.76159415595576485 | B203: =TANH(RC[1]) -> -0.76159415595576485 | C203: -1 | J203: 1
A204: 0.99999999587769262 | B204: =TANH(RC[1]) -> 0.99999999587769262 | C204: 10 | J204: 1
A205: -0.99999999587769262 | B205: =TANH(RC[1]) -> -0.99999999587769262 | C205: -10 | J205: 1
A206: 1 | B206: =TANH(RC[1]) -> 1 | C206: 100 | J206: 1
A207: -1 | B207: =TANH(RC[1]) -> -1 | C207: -100 | J207: 1
A208: 1 | B208: =TANH(RC[1]) -> 1 | C208: 10000 | J208: 1
A209: -1 | B209: =TANH(RC[1]) -> -1 | C209: -1000 | J209: 1
A210: 0.99728296009914219 | B210: =TANH(RC[1]) -> 0.99728296009914219 | C210: 3.3 | J210: 1
A211: -0.99728296009914219 | B211: =TANH(RC[1]) -> -0.99728296009914219 | C211: -3.3 | J211: 1 | K211: ...
A213: -57295779.513082325 | B213: =DEGREES(RC[1]) -> -57295779.513082325 | C213: -1000000 | J213: 1 | K213: DEGREES | L213: DEGREES
A214: -180.00042091829943 | B214: =DEGREES(RC[1]) -> -180.00042091829943 | C214: -3.1415999999999999 | J214: 1
A215: -179.99469134034814 | B215: =DEGREES(RC[1]) -> -179.99469134034814 | C215: -3.1415000000000002 | J215: 1
A216: -5.729577951308233 | B216: =DEGREES(RC[1]) -> -5.729577951308233 | C216: -0.1 | J216: 1
A217: -5.7295779513082325E-2 | B217: =DEGREES(RC[1]) -> -5.7295779513082325E-2 | C217: -1E-3 | J217: 1
A218: 0 | B218: =DEGREES(RC[1]) -> 0 | C218: 0 | J218: 1
A219: 5.7295779513082325E-2 | B219: =DEGREES(RC[1]) -> 5.7295779513082325E-2 | C219: 1E-3 | J219: 1
A220: 5.729577951308233 | B220: =DEGREES(RC[1]) -> 5.729577951308233 | C220: 0.1 | J220: 1
A221: 179.99469134034814 | B221: =DEGREES(RC[1]) -> 179.99469134034814 | C221: 3.1415000000000002 | J221: 1
A222: 180.00042091829943 | B222: =DEGREES(RC[1]) -> 180.00042091829943 | C222: 3.1415999999999999 | J222: 1
A223: 57295779.513082325 | B223: =DEGREES(RC[1]) -> 57295779.513082325 | C223: 1000000 | J223: 1 | K223: ...
A225: -17453.292519943294 | B225: =RADIANS(RC[1]) -> -17453.292519943294 | C225: -1000000 | J225: 1 | K225: RADIANS | L225: RADIANS
A226: -6.2831853071795862 | B226: =RADIANS(RC[1]) -> -6.2831853071795862 | C226: -360 | J226: 1
A227: -3.1415926535897931 | B227: =RADIANS(RC[1]) -> -3.1415926535897931 | C227: -180 | J227: 1
A228: -0.52359877559829882 | B228: =RADIANS(RC[1]) -> -0.52359877559829882 | C228: -30 | J228: 1
A229: -1.7453292519943296E-3 | B229: =RADIANS(RC[1]) -> -1.7453292519943296E-3 | C229: -0.1 | J229: 1
A230: 0 | B230: =RADIANS(RC[1]) -> 0 | C230: 0 | J230: 1
A231: 1.7453292519943296E-3 | B231: =RADIANS(RC[1]) -> 1.7453292519943296E-3 | C231: 0.1 | J231: 1
A232: 0.52359877559829882 | B232: =RADIANS(RC[1]) -> 0.52359877559829882 | C232: 30 | J232: 1
A233: 3.1415926535897931 | B233: =RADIANS(RC[1]) -> 3.1415926535897931 | C233: 180 | J233: 1
A234: 6.2831853071795862 | B234: =RADIANS(RC[1]) -> 6.2831853071795862 | C234: 360 | J234: 1
A235: 17453.292519943294 | B235: =RADIANS(RC[1]) -> 17453.292519943294 | C235: 1000000 | J235: 1 | K235: ...
A237: 3.1415926535897931 | B237: =PI() -> 3.1415926535897931 | J237: 0 | K237: PI | L237: PI
A239: 0 | B239: =CEILING(RC[1],RC[2]) -> 0 | C239: 0 | D239: 0.03 | J239: 2 | K239: CEILING | L239: CEILING
A240: 0.03 | B240: =CEILING(RC[1],RC[2]) -> 0.03 | C240: 2.9989999999999999E-2 | D240: 0.03 | J240: 2
A241: 0.03 | B241: =CEILING(RC[1],RC[2]) -> 0.03 | C241: 0.03 | D241: 0.03 | J241: 2
A242: 0.06 | B242: =CEILING(RC[1],RC[2]) -> 0.06 | C242: 3.0009999999999998E-2 | D242: 0.03 | J242: 2
A243: 640000 | B243: =CEILING(RC[1],RC[2]) -> 640000 | C243: 512000.1 | D243: 128000 | J243: 2
A244: 0 | B244: =CEILING(RC[1],RC[2]) -> 0 | C244: 0 | D244: -0.03 | J244: 2
A245: -0.03 | B245: =CEILING(RC[1],RC[2]) -> -0.03 | C245: -2.9989999999999999E-2 | D245: -0.03 | J245: 2
A246: -0.06 | B246: =CEILING(RC[1],RC[2]) -> -0.06 | C246: -3.0009999999999998E-2 | D246: -0.03 | J246: 2
A247: 0 | B247: =CEILING(RC[1],RC[2]) -> #NUM! | C247: 3.0009999999999998E-2 | D247: -0.03 | J247: 2 | M247: #NUM!
A249: 0 | B249: =FLOOR(RC[1],RC[2]) -> 0 | C249: 0 | D249: 0.03 | J249: 2 | K249: FLOOR | L249: FLOOR
A250: 0 | B250: =FLOOR(RC[1],RC[2]) -> 0 | C250: 2.9989999999999999E-2 | D250: 0.03 | J250: 2
A251: 0.03 | B251: =FLOOR(RC[1],RC[2]) -> 0.03 | C251: 0.03 | D251: 0.03 | J251: 2
A252: 0.03 | B252: =FLOOR(RC[1],RC[2]) -> 0.03 | C252: 3.0009999999999998E-2 | D252: 0.03 | J252: 2
A253: 512000 | B253: =FLOOR(RC[1],RC[2]) -> 512000 | C253: 639999.9 | D253: 128000 | J253: 2
A254: 0 | B254: =FLOOR(RC[1],RC[2]) -> 0 | C254: 0 | D254: -0.03 | J254: 2
A255: 0 | B255: =FLOOR(RC[1],RC[2]) -> 0 | C255: -2.9989999999999999E-2 | D255: -0.03 | J255: 2
A256: -0.03 | B256: =FLOOR(RC[1],RC[2]) -> -0.03 | C256: -3.0009999999999998E-2 | D256: -0.03 | J256: 2
A257: 0 | B257: =FLOOR(RC[1],RC[2]) -> #NUM! | C257: 3.0009999999999998E-2 | D257: -0.03 | J257: 2 | M257: #NUM!
A259: 12 | B259: =ROUND(RC[1],RC[2]) -> 12 | C259: 12.004899999999999 | D259: 2 | J259: 2 | K259: ROUND | L259: ROUND
A260: 12.01 | B260: =ROUND(RC[1],RC[2]) -> 12.01 | C260: 12.005000000000001 | D260: 2 | J260: 2
A261: 13 | B261: =ROUND(RC[1],RC[2]) -> 13 | C261: 12.999000000000001 | D261: 2 | J261: 2
A262: 12 | B262: =ROUND(RC[1],RC[2]) -> 12 | C262: 12.0001 | D262: 2 | J262: 2
A263: -12 | B263: =ROUND(RC[1],RC[2]) -> -12 | C263: -12.004899999999999 | D263: 2 | J263: 2
A264: -12.01 | B264: =ROUND(RC[1],RC[2]) -> -12.01 | C264: -12.005000000000001 | D264: 2 | J264: 2
A265: -13 | B265: =ROUND(RC[1],RC[2]) -> -13 | C265: -12.999000000000001 | D265: 2 | J265: 2
A266: -12 | B266: =ROUND(RC[1],RC[2]) -> -12 | C266: -12.0001 | D266: 2 | J266: 2
A267: 12300 | B267: =ROUND(RC[1],RC[2]) -> 12300 | C267: 12345 | D267: -2 | J267: 2 | K267: ROUND to left of decimal point
A268: 10000 | B268: =ROUND(RC[1],RC[2]) -> 10000 | C268: 12345 | D268: -4 | J268: 2 | K268: ...
A270: 3 | B270: =ROUNDDOWN(RC[1],RC[2]) -> 3 | C270: 3.2 | D270: 0 | J270: 2 | K270: ROUNDDOWN | L270: ROUNDDOWN
A271: 120 | B271: =ROUNDDOWN(RC[1],RC[2]) -> 120 | C271: 123.456 | D271: -1 | J271: 2
A272: 3.141 | B272: =ROUNDDOWN(RC[1],RC[2]) -> 3.141 | C272: 3.1415899999999999 | D272: 3 | J272: 2
A273: 3.1415000000000002 | B273: =ROUNDDOWN(RC[1],RC[2]) -> 3.1415000000000002 | C273: 3.1415899999999999 | D273: 4 | J273: 2
A274: -3.141 | B274: =ROUNDDOWN(RC[1],RC[2]) -> -3.141 | C274: -3.1415899999999999 | D274: 3 | J274: 2
A275: -3.1415000000000002 | B275: =ROUNDDOWN(RC[1],RC[2]) -> -3.1415000000000002 | C275: -3.1415899999999999 | D275: 4 | J275: 2
A277: 4 | B277: =ROUNDUP(RC[1],RC[2]) -> 4 | C277: 3.2 | D277: 0 | J277: 2 | K277: ROUNDUP | L277: ROUNDUP
A278: 130 | B278: =ROUNDUP(RC[1],RC[2]) -> 130 | C278: 123.456 | D278: -1 | J278: 2
A279: 3.1419999999999999 | B279: =ROUNDUP(RC[1],RC[2]) -> 3.1419999999999999 | C279: 3.1415899999999999 | D279: 3 | J279: 2
A280: 3.1416000000000004 | B280: =ROUNDUP(RC[1],RC[2]) -> 3.1416000000000004 | C280: 3.1415899999999999 | D280: 4 | J280: 2
A281: -3.1419999999999999 | B281: =ROUNDUP(RC[1],RC[2]) -> -3.1419999999999999 | C281: -3.1415899999999999 | D281: 3 | J281: 2
A282: -3.1416000000000004 | B282: =ROUNDUP(RC[1],RC[2]) -> -3.1416000000000004 | C282: -3.1415899999999999 | D282: 4 | J282: 2
A284: 12 | B284: =TRUNC(RC[1]) -> 12 | C284: 12.999000000000001 | J284: 1 | K284: TRUNC | L284: TRUNC
A285: 12 | B285: =TRUNC(RC[1]) -> 12 | C285: 12 | J285: 1
A286: -12 | B286: =TRUNC(RC[1]) -> -12 | C286: -12 | J286: 1
A287: -12 | B287: =TRUNC(RC[1]) -> -12 | C287: -12.999000000000001 | J287: 1
A288: 0 | B288: =TRUNC(RC[1]) -> 0 | C288: 0 | J288: 1
A289: 0 | B289: =TRUNC(RC[1]) -> 0 | C289: 0.999 | J289: 1
A290: 0 | B290: =TRUNC(RC[1]) -> 0 | C290: -0.999 | J290: 1
A291: 12 | B291: =TRUNC(RC[1],RC[2]) -> 12 | C291: 12.009 | D291: 2 | J291: 2
A292: 12.01 | B292: =TRUNC(RC[1],RC[2]) -> 12.01 | C292: 12.01 | D292: 2 | J292: 2
A293: 12.99 | B293: =TRUNC(RC[1],RC[2]) -> 12.99 | C293: 12.999000000000001 | D293: 2 | J293: 2
A294: 12 | B294: =TRUNC(RC[1],RC[2]) -> 12 | C294: 12.000999999999999 | D294: 2 | J294: 2
A295: -12 | B295: =TRUNC(RC[1],RC[2]) -> -12 | C295: -12 | D295: 2 | J295: 2
A296: -12 | B296: =TRUNC(RC[1],RC[2]) -> -12 | C296: -12.009 | D296: 2 | J296: 2
A297: -12.01 | B297: =TRUNC(RC[1],RC[2]) -> -12.01 | C297: -12.01 | D297: 2.9 | J297: 2
A298: -12 | B298: =TRUNC(RC[1],RC[2]) -> -12 | C298: -12.000999999999999 | D298: 2 | J298: 2
A299: 12300 | B299: =TRUNC(RC[1],RC[2]) -> 12300 | C299: 12345 | D299: -2 | J299: 2
A300: 10000 | B300: =TRUNC(RC[1],RC[2]) -> 10000 | C300: 12345 | D300: -4 | J300: 2 | K300: ...
A302: -4 | B302: =EVEN(RC[1]) -> -4 | C302: -3 | J302: 1 | K302: EVEN | L302: EVEN
A303: -4 | B303: =EVEN(RC[1]) -> -4 | C303: -2.0009999999999999 | J303: 1
A304: -2 | B304: =EVEN(RC[1]) -> -2 | C304: -2 | J304: 1
A305: -2 | B305: =EVEN(RC[1]) -> -2 | C305: -1.0009999999999999 | J305: 1
A306: -2 | B306: =EVEN(RC[1]) -> -2 | C306: -1 | J306: 1
A307: 0 | B307: =EVEN(RC[1]) -> 0 | C307: 0 | J307: 1
A308: 2 | B308: =EVEN(RC[1]) -> 2 | C308: 1 | J308: 1
A309: 2 | B309: =EVEN(RC[1]) -> 2 | C309: 1.0009999999999999 | J309: 1
A310: 2 | B310: =EVEN(RC[1]) -> 2 | C310: 2 | J310: 1
A311: 4 | B311: =EVEN(RC[1]) -> 4 | C311: 2.0009999999999999 | J311: 1
A312: 4 | B312: =EVEN(RC[1]) -> 4 | C312: 3 | J312: 1 | K312: ...
A314: -3 | B314: =ODD(RC[1]) -> -3 | C314: -3 | J314: 1 | K314: ODD | L314: ODD
A315: -3 | B315: =ODD(RC[1]) -> -3 | C315: -2 | J315: 1
A316: -3 | B316: =ODD(RC[1]) -> -3 | C316: -1.0009999999999999 | J316: 1
A317: -1 | B317: =ODD(RC[1]) -> -1 | C317: -1 | J317: 1
A318: -1 | B318: =ODD(RC[1]) -> -1 | C318: -1E-3 | J318: 1
A319: 1 | B319: =ODD(RC[1]) -> 1 | C319: 0 | J319: 1
A320: 1 | B320: =ODD(RC[1]) -> 1 | C320: 1E-3 | J320: 1
A321: 1 | B321: =ODD(RC[1]) -> 1 | C321: 1 | J321: 1
A322: 3 | B322: =ODD(RC[1]) -> 3 | C322: 1.0009999999999999 | J322: 1
A323: 3 | B323: =ODD(RC[1]) -> 3 | C323: 2 | J323: 1
A324: 3 | B324: =ODD(RC[1]) -> 3 | C324: 3 | J324: 1 | K324: ...
A326: -3 | B326: =INT(RC[1]) -> -3 | C326: -3 | J326: 1 | K326: INT | L326: INT
A327: -3 | B327: =INT(RC[1]) -> -3 | C327: -2.5 | J327: 1
A328: -2 | B328: =INT(RC[1]) -> -2 | C328: -2 | J328: 1
A329: -2 | B329: =INT(RC[1]) -> -2 | C329: -1.5 | J329: 1
A330: -1 | B330: =INT(RC[1]) -> -1 | C330: -1 | J330: 1
A331: 0 | B331: =INT(RC[1]) -> 0 | C331: 0 | J331: 1
A332: 1 | B332: =INT(RC[1]) -> 1 | C332: 1 | J332: 1
A333: 1 | B333: =INT(RC[1]) -> 1 | C333: 1.5 | J333: 1
A334: 2 | B334: =INT(RC[1]) -> 2 | C334: 2 | J334: 1
A335: 2 | B335: =INT(RC[1]) -> 2 | C335: 2.5 | J335: 1
A336: 3 | B336: =INT(RC[1]) -> 3 | C336: 3 | J336: 1 | K336: ...
A338: 4.9787068367863944E-2 | B338: =EXP(RC[1]) -> 4.9787068367863944E-2 | C338: -3 | J338: 1 | K338: EXP | L338: EXP
A339: 8.20849986238988E-2 | B339: =EXP(RC[1]) -> 8.20849986238988E-2 | C339: -2.5 | J339: 1
A340: 0.1353352832366127 | B340: =EXP(RC[1]) -> 0.1353352832366127 | C340: -2 | J340: 1
A341: 0.22313016014842982 | B341: =EXP(RC[1]) -> 0.22313016014842982 | C341: -1.5 | J341: 1
A342: 0.36787944117144233 | B342: =EXP(RC[1]) -> 0.36787944117144233 | C342: -1 | J342: 1
A343: 1 | B343: =EXP(RC[1]) -> 1 | C343: 0 | J343: 1
A344: 2.71828182845905 | B344: =EXP(RC[1]) -> 2.7182818284590451 | C344: 1 | J344: 1
A345: 4.4816890703380645 | B345: =EXP(RC[1]) -> 4.4816890703380645 | C345: 1.5 | J345: 1
A346: 7.3890560989306504 | B346: =EXP(RC[1]) -> 7.3890560989306504 | C346: 2 | J346: 1
A347: 12.182493960703473 | B347: =EXP(RC[1]) -> 12.182493960703473 | C347: 2.5 | J347: 1
A348: 20.085536923187668 | B348: =EXP(RC[1]) -> 20.085536923187668 | C348: 3 | J348: 1 | K348: ...
A350: 65536 | B350: =POWER(RC[1],RC[2]) -> 65536 | C350: 256 | D350: 2 | J350: 2 | K350: POWER | L350: POWER
A351: -184528125 | B351: =POWER(RC[1],RC[2]) -> -184528125 | C351: -45 | D351: 5 | J351: 2
A352: 20959.155637813903 | B352: =POWER(RC[1],RC[2]) -> 20959.155637813903 | C352: 1.01 | D352: 1000 | J352: 2
A353: 16 | B353: =POWER(RC[1],RC[2]) -> 16 | C353: 256 | D353: 0.5 | J353: 2
A354: 40.315403854658385 | B354: =POWER(RC[1],RC[2]) -> 40.315403854658385 | C354: 20 | D354: 1.234 | J354: 2
A355: 21145.169098491155 | B355: =POWER(RC[1],RC[2]) -> 21145.169098491155 | C355: 1.01 | D355: 1000.888 | J355: 2
A356: 9.0909090909090912E-2 | B356: =POWER(RC[1],RC[2]) -> 9.0909090909090912E-2 | C356: 11 | D356: -1 | J356: 2
A357: 0.44444444444444442 | B357: =POWER(RC[1],RC[2]) -> 0.44444444444444442 | C357: 1.5 | D357: -2 | J357: 2
A358: 5.0833666228200514E-3 | B358: =POWER(RC[1],RC[2]) -> 5.0833666228200514E-3 | C358: 2 | D358: -7.62 | J358: 2 | K358: ...
A359: 1 | B359: =POWER(RC[1],RC[2]) -> #NUM! | C359: 0 | D359: 0 | J359: 2 | M359: #NUM!
A360: 0 | B360: =POWER(RC[1],RC[2]) -> #NUM! | C360: -4 | D360: 0.5 | J360: 2 | M360: #NUM!
A362: -6.9077552789821368 | B362: =LN(RC[1]) -> -6.9077552789821368 | C362: 1E-3 | J362: 1 | K362: LN | L362: LN
A363: -2.3025850929940455 | B363: =LN(RC[1]) -> -2.3025850929940455 | C363: 0.1 | J363: 1
A364: 0 | B364: =LN(RC[1]) -> 0 | C364: 1 | J364: 1
A365: 9.950330853168092E-3 | B365: =LN(RC[1]) -> 9.950330853168092E-3 | C365: 1.01 | J365: 1
A366: 0.99989631572895199 | B366: =LN(RC[1]) -> 0.99989631572895199 | C366: 2.718 | J366: 1
A367: 1.0002641656503337 | B367: =LN(RC[1]) -> 1.0002641656503337 | C367: 2.7189999999999999 | J367: 1
A368: 20.72326583694641 | B368: =LN(RC[1]) -> 20.72326583694641 | C368: 1000000000 | J368: 1 | K368: ...
A369: 0 | B369: =LN(RC[1]) -> #NUM! | C369: 0 | J369: 1 | M369: #NUM!
A370: 0 | B370: =LN(RC[1]) -> #NUM! | C370: -5 | J370: 1 | M370: #NUM!
A372: -3 | B372: =LOG(RC[1]) -> -3 | C372: 1E-3 | J372: 1 | K372: LOG | L372: LOG
A373: 0 | B373: =LOG(RC[1]) -> 0 | C373: 1 | J373: 1
A374: 1 | B374: =LOG(RC[1]) -> 1 | C374: 10 | J374: 1
A375: 1.0413926851582251 | B375: =LOG(RC[1]) -> 1.0413926851582251 | C375: 11 | J375: 1
A376: -2.0959032742893844 | B376: =LOG(RC[1],RC[2]) -> -2.0959032742893844 | C376: 0.1 | D376: 3 | J376: 2
A377: 0 | B377: =LOG(RC[1],RC[2]) -> 0 | C377: 1 | D377: 3 | J377: 2
A378: 2.0959032742893848 | B378: =LOG(RC[1],RC[2]) -> 2.0959032742893848 | C378: 10 | D378: 3 | J378: 2
A379: -0.91632558304921041 | B379: =LOG(RC[1],RC[2]) -> -0.91632558304921041 | C379: 0.1 | D379: 12.34 | J379: 2
A380: 0.91632558304921063 | B380: =LOG(RC[1],RC[2]) -> 0.91632558304921063 | C380: 10 | D380: 12.34 | J380: 2
A381: 0.65665109786263109 | B381: =LOG(RC[1],RC[2]) -> 0.65665109786263109 | C381: 0.1 | D381: 0.03 | J381: 2
A382: -0.65665109786263132 | B382: =LOG(RC[1],RC[2]) -> -0.65665109786263132 | C382: 10 | D382: 0.03 | J382: 2 | K382: ...
A383: 0 | B383: =LOG(RC[1]) -> #NUM! | C383: 0 | J383: 1 | M383: #NUM!
A384: 0 | B384: =LOG(RC[1]) -> #NUM! | C384: -2 | J384: 1 | M384: #NUM!
A385: 0 | B385: =LOG(RC[1],RC[2]) -> #NUM! | C385: 10 | D385: 0 | J385: 2 | M385: #NUM!
A386: 0 | B386: =LOG(RC[1],RC[2]) -> #NUM! | C386: 10 | D386: -2 | J386: 2 | M386: #NUM!
A387: 0 | B387: =LOG(RC[1],RC[2]) -> #NUM! | C387: 0 | D387: 10 | J387: 2 | M387: #NUM!
A388: 0 | B388: =LOG(RC[1],RC[2]) -> #NUM! | C388: -2 | D388: 10 | J388: 2 | M388: #NUM!
A389: 0 | B389: =LOG(RC[1],RC[2]) -> #DIV/0! | C389: 2 | D389: 1 | J389: 2 | M389: #DIV/0!
A391: -3 | B391: =LOG10(RC[1]) -> -3 | C391: 1E-3 | J391: 1 | K391: LOG10 | L391: LOG10
A392: -0.69897000433601875 | B392: =LOG10(RC[1]) -> -0.69897000433601875 | C392: 0.2 | J392: 1
A393: 0 | B393: =LOG10(RC[1]) -> 0 | C393: 1 | J393: 1
A394: 4.3213737826425782E-3 | B394: =LOG10(RC[1]) -> 4.3213737826425782E-3 | C394: 1.01 | J394: 1
A395: 1 | B395: =LOG10(RC[1]) -> 1 | C395: 10 | J395: 1
A396: 1.0004340774793186 | B396: =LOG10(RC[1]) -> 1.0004340774793186 | C396: 10.01 | J396: 1
A397: 9 | B397: =LOG10(RC[1]) -> 9 | C397: 1000000000 | J397: 1 | K397: ...
A398: 0 | B398: =LOG10(RC[1]) -> #NUM! | C398: 0 | J398: 1 | M398: #NUM!
A399: 0 | B399: =LOG10(RC[1]) -> #NUM! | C399: -2 | J399: 1 | M399: #NUM!
A401: 0 | B401: =MOD(RC[1],RC[2]) -> 0 | C401: 33 | D401: -3 | J401: 2 | K401: MOD | L401: MOD
A402: 2 | B402: =MOD(RC[1],RC[2]) -> 2 | C402: 17 | D402: 5 | J402: 2
A403: -3 | B403: =MOD(RC[1],RC[2]) -> -3 | C403: 17 | D403: -5 | J403: 2
A404: 3 | B404: =MOD(RC[1],RC[2]) -> 3 | C404: -17 | D404: 5 | J404: 2
A405: -2 | B405: =MOD(RC[1],RC[2]) -> -2 | C405: -17 | D405: -5 | J405: 2
A406: 0.5 | B406: =MOD(RC[1],RC[2]) -> 0.5 | C406: 17 | D406: 5.5 | J406: 2
A407: 1.84 | B407: =MOD(RC[1],RC[2]) -> 1.8400000000000034 | C407: 34 | D407: 2.01 | J407: 2 | K407: ...
A408: 0 | B408: =MOD(RC[1],RC[2]) -> #DIV/0! | C408: 10 | D408: 0 | J408: 2 | M408: #DIV/0!
A410: 3.1622776601683791E-2 | B410: =SQRT(RC[1]) -> 3.1622776601683791E-2 | C410: 1E-3 | J410: 1 | K410: SQRT | L410: SQRT
A411: 0.1 | B411: =SQRT(RC[1]) -> 0.1 | C411: 0.01 | J411: 1
A412: 0.99498743710661997 | B412: =SQRT(RC[1]) -> 0.99498743710661997 | C412: 0.99 | J412: 1
A413: 1 | B413: =SQRT(RC[1]) -> 1 | C413: 1 | J413: 1
A414: 1.004987562112089 | B414: =SQRT(RC[1]) -> 1.004987562112089 | C414: 1.01 | J414: 1
A415: 3.1622776601683795 | B415: =SQRT(RC[1]) -> 3.1622776601683795 | C415: 10 | J415: 1
A416: 10 | B416: =SQRT(RC[1]) -> 10 | C416: 100 | J416: 1
A417: 316.22776601683796 | B417: =SQRT(RC[1]) -> 316.22776601683796 | C417: 100000 | J417: 1
A418: 0 | B418: =SQRT(RC[1]) -> 0 | C418: 0 | J418: 1 | K418: ...
A419: 0 | B419: =SQRT(RC[1]) -> #NUM! | C419: -1 | J419: 1 | M419: #NUM!
A421: 0 | B421: =FACT(RC[1]) -> #NUM! | C421: -1 | J421: 1 | K421: FACT | L421: FACT | M421: #NUM!
A422: 1 | B422: =FACT(RC[1]) -> 1 | C422: 0 | J422: 1
A423: 1 | B423: =FACT(RC[1]) -> 1 | C423: 1 | J423: 1
A424: 2 | B424: =FACT(RC[1]) -> 2 | C424: 2 | J424: 1
A425: 6 | B425: =FACT(RC[1]) -> 6 | C425: 3 | J425: 1
A426: 24 | B426: =FACT(RC[1]) -> 24 | C426: 4 | J426: 1
A427: 120 | B427: =FACT(RC[1]) -> 120 | C427: 5 | J427: 1 | K427: ...
A428: 720 | B428: =FACT(RC[1]) -> 720 | C428: 6 | J428: 1
A429: 5040 | B429: =FACT(RC[1]) -> 5040 | C429: 7 | J429: 1
A430: 40320 | B430: =FACT(RC[1]) -> 40320 | C430: 8 | J430: 1
A431: 362880 | B431: =FACT(RC[1]) -> 362880 | C431: 9 | J431: 1
A432: 3628800 | B432: =FACT(RC[1]) -> 3628800 | C432: 10 | J432: 1
A433: 39916800 | B433: =FACT(RC[1]) -> 39916800 | C433: 11 | J433: 1
A434: 479001600 | B434: =FACT(RC[1]) -> 479001600 | C434: 12 | J434: 1
A435: 6227020800 | B435: =FACT(RC[1]) -> 6227020800 | C435: 13 | J435: 1 | N435: long
A436: 87178291200 | B436: =FACT(RC[1]) -> 87178291200 | C436: 14 | J436: 1 | N436: long
A437: 1307674368000 | B437: =FACT(RC[1]) -> 1307674368000 | C437: 15 | J437: 1 | N437: long
A438: 2.43290200817664E+18 | B438: =FACT(RC[1]) -> 2.43290200817664E+18 | C438: 20 | J438: 1 | N438: long
A439: 1 | B439: =FACT(RC[1]) -> 1 | C439: 1.1 | J439: 1
A440: 1 | B440: =FACT(RC[1]) -> 1 | C440: 1.9 | J440: 1
A441: 2 | B441: =FACT(RC[1]) -> 2 | C441: 2.1 | J441: 1
A443: 1 | B443: =COMBIN(RC[1],RC[2]) -> 1 | C443: 1 | D443: 0 | J443: 2 | K443: COMBIN | L443: COMBIN
A444: 1 | B444: =COMBIN(RC[1],RC[2]) -> 1 | C444: 1 | D444: 1 | J444: 2
A445: 1 | B445: =COMBIN(RC[1],RC[2]) -> 1 | C445: 2 | D445: 0 | J445: 2
A446: 2 | B446: =COMBIN(RC[1],RC[2]) -> 2 | C446: 2 | D446: 1 | J446: 2
A447: 1 | B447: =COMBIN(RC[1],RC[2]) -> 1 | C447: 2 | D447: 2 | J447: 2
A448: 1 | B448: =COMBIN(RC[1],RC[2]) -> 1 | C448: 3 | D448: 0 | J448: 2
A449: 3 | B449: =COMBIN(RC[1],RC[2]) -> 3 | C449: 3 | D449: 1 | J449: 2
A450: 3 | B450: =COMBIN(RC[1],RC[2]) -> 3 | C450: 3 | D450: 2 | J450: 2
A451: 1 | B451: =COMBIN(RC[1],RC[2]) -> 1 | C451: 3 | D451: 3 | J451: 2
A452: 10 | B452: =COMBIN(RC[1],RC[2]) -> 10 | C452: 10 | D452: 1 | J452: 2
A453: 252 | B453: =COMBIN(RC[1],RC[2]) -> 252 | C453: 10 | D453: 5 | J453: 2
A454: 120 | B454: =COMBIN(RC[1],RC[2]) -> 120 | C454: 10 | D454: 7 | J454: 2 | K454: ...
A455: 0 | B455: =COMBIN(RC[1],RC[2]) -> #NUM! | C455: 0 | D455: 1 | J455: 2 | M455: #NUM!
A456: 0 | B456: =COMBIN(RC[1],RC[2]) -> #NUM! | C456: 1 | D456: -1 | J456: 2 | M456: #NUM!
A457: 0 | B457: =COMBIN(RC[1],RC[2]) -> #NUM! | C457: -1 | D457: 1 | J457: 2 | M457: #NUM!