Sheet: Sheet1
A1: Expected | B1: Actual | C1: Inputs | J1: # of Inputs | K1: Name | L1: Highlight
A2: 12 | B2: =12.34 -> 12.34 | K2: Precision
A3: 12.3 | B3: =12.34 -> 12.34
A4: 12.34 | B4: =12.34 -> 12.34
A5: 12.34 | B5: =12.34 -> 12.34
A7: 12 | B7: =12.0049 -> 12.004899999999999 | K7: Rounding
A8: 12.01 | B8: =12.005 -> 12.005000000000001
A9: 13 | B9: =12.999 -> 12.999000000000001
A10: 12.01 | B10: =12.0149 -> 12.014900000000001
A11: 12.02 | B11: =12.015 -> 12.015000000000001
A12: 12 | B12: =12.0001 -> 12.0001
A13: -12 | B13: =-12.0049 -> -12.004899999999999
A14: -12.01 | B14: =-12.005 -> -12.005000000000001
A15: -13 | B15: =-12.999 -> -12.999000000000001
A16: -12 | B16: =-12.0001 -> -12.0001
A18: 0.21 | B18: =RC[1]+RC[2] -> 0.20799999999999999 | C18: 0.104 | D18: 0.104 | J18: 2 | K18: Intermediate values have full precision
A19: 0.41 | B19: =RC[1]+RC[2] -> 0.40799999999999997 | C19: 0.20399999999999999 | D19: 0.20399999999999999 | J19: 2 | K19: ...