Sheet: Sheet1
A1: Expected | B1: Actual | C1: Inputs | J1: # of Inputs | K1: Name | L1: Highlight | M1: Excel says | N1: Skip for
A2: 5 | B2: =RANK(RC[1],RC[2]:RC[6]) -> 5 | C2: -1 | D2: 2 | E2: 0 | F2: -1 | G2: 2 | H2: 4 | J2: 6 | K2: RANK | L2: RANK
A3: 4 | B3: =RANK(RC[1],RC[2]:RC[6]) -> 4 | C3: 0 | D3: 2 | E3: 0 | F3: -1 | G3: 2 | H3: 4 | J3: 6
A4: 2 | B4: =RANK(RC[1],RC[2]:RC[6]) -> 2 | C4: 2 | D4: 2 | E4: 0 | F4: -1 | G4: 2 | H4: 4 | J4: 6
A5: 1 | B5: =RANK(RC[1],RC[2]:RC[6]) -> 1 | C5: 4 | D5: 2 | E5: 0 | F5: -1 | G5: 2 | H5: 4 | J5: 6 | K5: ...
A7: 5 | B7: =RANK(RC[1],RC[2]:RC[6],RC[7]) -> 5 | C7: -1 | D7: 2 | E7: 0 | F7: -1 | G7: 2 | H7: 4 | I7: 0 | J7: 7
A8: 1 | B8: =RANK(RC[1],RC[2]:RC[6],RC[7]) -> 1 | C8: -1 | D8: 2 | E8: 0 | F8: -1 | G8: 2 | H8: 4 | I8: 1 | J8: 7
A9: 2 | B9: =RANK(RC[1],RC[2]:RC[6],RC[7]) -> 2 | C9: 0 | D9: 2 | E9: 0 | F9: -1 | G9: 2 | H9: 4 | I9: 1 | J9: 7
A10: 3 | B10: =RANK(RC[1],RC[2]:RC[6],RC[7]) -> 3 | C10: 2 | D10: 2 | E10: 0 | F10: -1 | G10: 2 | H10: 4 | I10: 1 | J10: 7
A11: 5 | B11: =RANK(RC[1],RC[2]:RC[6],RC[7]) -> 5 | C11: 4 | D11: 2 | E11: 0 | F11: -1 | G11: 2 | H11: 4 | I11: 1 | J11: 7 | K11: ...
A13: 1 | B13: =RANK(RC[1],RC[2]) -> 1 | C13: 6 | D13: 6 | J13: 2
A15: 0 | B15: =VARP(RC[1]) -> 0 | C15: 1 | J15: 1 | K15: VARP (does not support blanks!) | L15: VARP
A16: 0 | B16: =VARP(RC[1]) -> 0 | C16: 4 | J16: 1 | K16: ...
A18: 0.25 | B18: =VARP(RC[1],RC[2]) -> 0.25 | C18: 1 | D18: 2 | J18: 2
A19: 0.25 | B19: =VARP(RC[1],RC[2]) -> 0.25 | C19: 4 | D19: 5 | J19: 2 | K19: ...
A21: 4.64 | B21: =VARP(RC[1]:RC[3],RC[5],RC[7]) -> 4.64 | C21: 1 | D21: 2 | E21: 3 | F21: 100 | G21: 5 | H21: 200 | I21: 7 | J21: 7
A22: 2 | B22: =VARP(RC[1]:RC[3],RC[5],RC[7]) -> 2 | C22: 6 | D22: 7 | E22: 8 | F22: 80 | G22: 9 | I22: 10 | J22: 7 | K22: ...
A24: 0.5 | B24: =VAR(RC[1],RC[2]) -> 0.5 | C24: 1 | D24: 2 | J24: 2 | K24: VAR (does not support blanks!) | L24: VAR
A25: 0.5 | B25: =VAR(RC[1],RC[2]) -> 0.5 | C25: 4 | D25: 5 | J25: 2 | K25: ...
A27: 5.8 | B27: =VAR(RC[1]:RC[3],RC[5],RC[7]) -> 5.8000000000000007 | C27: 1 | D27: 2 | E27: 3 | F27: 100 | G27: 5 | H27: 200 | I27: 7 | J27: 7
A28: 2.5 | B28: =VAR(RC[1]:RC[3],RC[5],RC[7]) -> 2.5 | C28: 6 | D28: 7 | E28: 8 | F28: 80 | G28: 9 | I28: 10 | J28: 7 | K28: ...
A30: 2.8284271247461903 | B30: =STDEV(RC[1],RC[2]) -> 2.8284271247461903 | C30: -1 | D30: 3 | J30: 2 | K30: STDEV (does not support blanks!) | L30: STDEV
A31: 2.0816659994661326 | B31: =STDEV(RC[1],RC[2],RC[3]) -> 2.0816659994661326 | C31: -1 | D31: 0 | E31: 3 | J31: 3
A33: 40.688718279617696 | B33: =STDEV(RC[1]:RC[3],RC[4]:RC[6],RC[7]) -> 40.688718279617696 | C33: -1 | D33: 0 | E33: 5.45 | F33: 7.62 | G33: 12.7 | H33: 14.5 | I33: -100 | J33: 7
A34: 4.1518785191880596 | B34: =STDEV(RC[1]:RC[3],RC[4]:RC[6],RC[7]) -> 4.1518785191880596 | C34: -10 | D34: 0 | E34: 1 | F34: 0 | G34: -1 | H34: -2 | I34: 3 | J34: 7 | K34: ...
A36: 0 | B36: =STDEVP(RC[1]) -> 0 | C36: 7 | J36: 1 | K36: STDEVP (does not support blanks!) | L36: STDEVP
A37: 1.5 | B37: =STDEVP(RC[1],RC[2]) -> 1.5 | C37: 2 | D37: 5 | J37: 2
A38: 2.0548046676563256 | B38: =STDEVP(RC[1],RC[2],RC[3]) -> 2.0548046676563256 | C38: 2 | D38: 0 | E38: 5 | J38: 3
A40: 37.670433217252899 | B40: =STDEVP(RC[1]:RC[3],RC[4]:RC[6],RC[7]) -> 37.670433217252899 | C40: -1 | D40: 0 | E40: 5.45 | F40: 7.62 | G40: 12.7 | H40: 14.5 | I40: -100 | J40: 7
A41: 3.8438925848782031 | B41: =STDEVP(RC[1]:RC[3],RC[4]:RC[6],RC[7]) -> 3.8438925848782031 | C41: -10 | D41: 0 | E41: 1 | F41: 0 | G41: -1 | H41: -2 | I41: 3 | J41: 7 | K41: ... | N41: bigdecimal
A43: 0 | B43: =AVEDEV(RC[1]) -> 0 | C43: 40 | J43: 1 | K43: AVEDEV (does not support blanks!) | L43: AVEDEV
A44: 2 | B44: =AVEDEV(RC[1],RC[2]) -> 2 | C44: -1 | D44: 3 | J44: 2
A45: 1.5555555555555554 | B45: =AVEDEV(RC[1],RC[2],RC[3]) -> 1.5555555555555554 | C45: -1 | D45: 0 | E45: 3 | J45: 3
A47: 26.092653061224492 | B47: =AVEDEV(RC[1]:RC[3],RC[4]:RC[6],RC[7]) -> 26.092653061224492 | C47: -1 | D47: 0 | E47: 5.45 | F47: 7.62 | G47: 12.7 | H47: 14.5 | I47: -100 | J47: 7
A48: 2.693877551020408 | B48: =AVEDEV(RC[1]:RC[3],RC[4]:RC[6],RC[7]) -> 2.693877551020408 | C48: -10 | D48: 0 | E48: 1 | F48: 0 | G48: -1 | H48: -2 | I48: 3 | J48: 7 | K48: ...
A50: 0 | B50: =DEVSQ(RC[1]) -> 0 | C50: 40 | J50: 1 | K50: DEVSQ (does not support blanks!) | L50: DEVSQ
A51: 8 | B51: =DEVSQ(RC[1],RC[2]) -> 8 | C51: -1 | D51: 3 | J51: 2
A52: 8.6666666666666679 | B52: =DEVSQ(RC[1],RC[2],RC[3]) -> 8.6666666666666679 | C52: -1 | D52: 0 | E52: 3 | J52: 3 | N52: long
A54: 9933.4307714285715 | B54: =DEVSQ(RC[1]:RC[3],RC[4]:RC[6],RC[7]) -> 9933.4307714285715 | C54: -1 | D54: 0 | E54: 5.45 | F54: 7.62 | G54: 12.7 | H54: 14.5 | I54: -100 | J54: 7 | N54: long, bigdecimal
A55: 103.4285714285714 | B55: =DEVSQ(RC[1]:RC[3],RC[4]:RC[6],RC[7]) -> 103.4285714285714 | C55: -10 | D55: 0 | E55: 1 | F55: 0 | G55: -1 | H55: -2 | I55: 3 | J55: 7 | K55: ... | N55: long, bigdecimal
A57: 0.93521952958282351 | B57: =SKEW(RC[1],RC[2],RC[3]) -> 0.93521952958282351 | C57: 1 | D57: 2 | E57: 4 | J57: 3 | K57: SKEW (does not support blanks!) | L57: SKEW | N57: bigdecimal
A59: -2.5327066435041319 | B59: =SKEW(RC[1]:RC[3],RC[4]:RC[6],RC[7]) -> -2.5327066435041319 | C59: -1 | D59: 0 | E59: 5.45 | F59: 7.62 | G59: 12.7 | H59: 14.5 | I59: -100 | J59: 7
A60: -1.8491263727532468 | B60: =SKEW(RC[1]:RC[3],RC[4]:RC[6],RC[7]) -> -1.8491263727532468 | C60: -10 | D60: 0 | E60: 1 | F60: 0 | G60: -1 | H60: -2 | I60: 3 | J60: 7 | K60: ...
A62: 0.39053254437869889 | B62: =KURT(RC[1],RC[2],RC[3],RC[4]) -> 0.39053254437869889 | C62: 1 | D62: 2 | E62: 4 | F62: -1 | J62: 4 | K62: KURT (does not support blanks!) | L62: KURT | N62: long, bigdecimal
A64: 6.5478454980828005 | B64: =KURT(RC[1]:RC[3],RC[4]:RC[6],RC[7]) -> 6.5478454980828005 | C64: -1 | D64: 0 | E64: 5.45 | F64: 7.62 | G64: 12.7 | H64: 14.5 | I64: -100 | J64: 7 | N64: long, bigdecimal
A65: 4.2380757608131585 | B65: =KURT(RC[1]:RC[3],RC[4]:RC[6],RC[7]) -> 4.2380757608131585 | C65: -10 | D65: 0 | E65: 1 | F65: 0 | G65: -1 | H65: -2 | I65: 3 | J65: 7 | K65: ... | N65: long, bigdecimal
A67: 7.9332823554878473E-7 | B67: =NORMDIST(RC[1],RC[2],RC[3],RC[4]) -> 7.9332823554878473E-7 | C67: -10 | D67: 2 | E67: 2.5 | F67: 1 | J67: 4 | K67: NORMDIST | L67: NORMDIST | N67: bigdecimal
A68: 3.1671241836783715E-5 | B68: =NORMDIST(RC[1],RC[2],RC[3],RC[4]) -> 3.1671241836783715E-5 | C68: -8 | D68: 2 | E68: 2.5 | F68: 1 | J68: 4
A69: 6.8713793791586042E-4 | B69: =NORMDIST(RC[1],RC[2],RC[3],RC[4]) -> 6.8713793791586042E-4 | C69: -6 | D69: 2 | E69: 2.5 | F69: 1 | J69: 4
A70: 8.1975359245960444E-3 | B70: =NORMDIST(RC[1],RC[2],RC[3],RC[4]) -> 8.1975359245960444E-3 | C70: -4 | D70: 2 | E70: 2.5 | F70: 1 | J70: 4
A71: 5.4799291699557995E-2 | B71: =NORMDIST(RC[1],RC[2],RC[3],RC[4]) -> 5.4799291699557995E-2 | C71: -2 | D71: 2 | E71: 2.5 | F71: 1 | J71: 4
A72: 0.21185539858339675 | B72: =NORMDIST(RC[1],RC[2],RC[3],RC[4]) -> 0.21185539858339675 | C72: 0 | D72: 2 | E72: 2.5 | F72: 1 | J72: 4
A73: 0.5 | B73: =NORMDIST(RC[1],RC[2],RC[3],RC[4]) -> 0.5 | C73: 2 | D73: 2 | E73: 2.5 | F73: 1 | J73: 4
A74: 0.78814460141660325 | B74: =NORMDIST(RC[1],RC[2],RC[3],RC[4]) -> 0.78814460141660325 | C74: 4 | D74: 2 | E74: 2.5 | F74: 1 | J74: 4
A75: 0.94520070830044201 | B75: =NORMDIST(RC[1],RC[2],RC[3],RC[4]) -> 0.94520070830044201 | C75: 6 | D75: 2 | E75: 2.5 | F75: 1 | J75: 4
A76: 0.99180246407540396 | B76: =NORMDIST(RC[1],RC[2],RC[3],RC[4]) -> 0.99180246407540396 | C76: 8 | D76: 2 | E76: 2.5 | F76: 1 | J76: 4
A77: 0.99931286206208414 | B77: =NORMDIST(RC[1],RC[2],RC[3],RC[4]) -> 0.99931286206208414 | C77: 10 | D77: 2 | E77: 2.5 | F77: 1 | J77: 4
A78: 0.99996832875816322 | B78: =NORMDIST(RC[1],RC[2],RC[3],RC[4]) -> 0.99996832875816322 | C78: 12 | D78: 2 | E78: 2.5 | F78: 1 | J78: 4
A79: 0.99999920667176445 | B79: =NORMDIST(RC[1],RC[2],RC[3],RC[4]) -> 0.99999920667176445 | C79: 14 | D79: 2 | E79: 2.5 | F79: 1 | J79: 4 | N79: bigdecimal
A80: 0.34457825838967582 | B80: =NORMDIST(RC[1],RC[2],RC[3],RC[4]) -> 0.34457825838967582 | C80: -3.5 | D80: -2.5 | E80: 2.5 | F80: 1 | J80: 4
A81: 0.36944134018176367 | B81: =NORMDIST(RC[1],RC[2],RC[3],RC[4]) -> 0.36944134018176367 | C81: -3.5 | D81: -2.5 | E81: 3 | F81: 1 | J81: 4
A82: 1.58451963641283E-6 | B82: =NORMDIST(RC[1],RC[2],RC[3],RC[4]) -> 1.58451963641283E-6 | C82: -10 | D82: 2 | E82: 2.5 | F82: 0 | J82: 4
A83: 5.3532090305954136E-5 | B83: =NORMDIST(RC[1],RC[2],RC[3],RC[4]) -> 5.3532090305954136E-5 | C83: -8 | D83: 2 | E83: 2.5 | F83: 0 | J83: 4
A84: 9.5363528058593696E-4 | B84: =NORMDIST(RC[1],RC[2],RC[3],RC[4]) -> 9.5363528058593696E-4 | C84: -6 | D84: 2 | E84: 2.5 | F84: 0 | J84: 4 | N84: bigdecimal
A85: 8.9578121179371591E-3 | B85: =NORMDIST(RC[1],RC[2],RC[3],RC[4]) -> 8.9578121179371591E-3 | C85: -4 | D85: 2 | E85: 2.5 | F85: 0 | J85: 4
A86: 4.4368333871782219E-2 | B86: =NORMDIST(RC[1],RC[2],RC[3],RC[4]) -> 4.4368333871782219E-2 | C86: -2 | D86: 2 | E86: 2.5 | F86: 0 | J86: 4
A87: 0.11587662110459308 | B87: =NORMDIST(RC[1],RC[2],RC[3],RC[4]) -> 0.11587662110459308 | C87: 0 | D87: 2 | E87: 2.5 | F87: 0 | J87: 4
A88: 0.15957691216057307 | B88: =NORMDIST(RC[1],RC[2],RC[3],RC[4]) -> 0.15957691216057307 | C88: 2 | D88: 2 | E88: 2.5 | F88: 0 | J88: 4
A89: 0.11587662110459308 | B89: =NORMDIST(RC[1],RC[2],RC[3],RC[4]) -> 0.11587662110459308 | C89: 4 | D89: 2 | E89: 2.5 | F89: 0 | J89: 4
A90: 4.4368333871782219E-2 | B90: =NORMDIST(RC[1],RC[2],RC[3],RC[4]) -> 4.4368333871782219E-2 | C90: 6 | D90: 2 | E90: 2.5 | F90: 0 | J90: 4
A91: 8.9578121179371591E-3 | B91: =NORMDIST(RC[1],RC[2],RC[3],RC[4]) -> 8.9578121179371591E-3 | C91: 8 | D91: 2 | E91: 2.5 | F91: 0 | J91: 4
A92: 9.5363528058593696E-4 | B92: =NORMDIST(RC[1],RC[2],RC[3],RC[4]) -> 9.5363528058593696E-4 | C92: 10 | D92: 2 | E92: 2.5 | F92: 0 | J92: 4 | N92: bigdecimal
A93: 5.3532090305954136E-5 | B93: =NORMDIST(RC[1],RC[2],RC[3],RC[4]) -> 5.3532090305954136E-5 | C93: 12 | D93: 2 | E93: 2.5 | F93: 0 | J93: 4
A94: 1.58451963641283E-6 | B94: =NORMDIST(RC[1],RC[2],RC[3],RC[4]) -> 1.58451963641283E-6 | C94: 14 | D94: 2 | E94: 2.5 | F94: 0 | J94: 4
A95: 0.1473080561213293 | B95: =NORMDIST(RC[1],RC[2],RC[3],RC[4]) -> 0.1473080561213293 | C95: -3.5 | D95: -2.5 | E95: 2.5 | F95: 0 | J95: 4
A96: 0.12579440923099772 | B96: =NORMDIST(RC[1],RC[2],RC[3],RC[4]) -> 0.12579440923099772 | C96: -3.5 | D96: -2.5 | E96: 3 | F96: 0 | J96: 4
A97: 0 | B97: =NORMDIST(RC[1],RC[2],RC[3],RC[4]) -> #NUM! | C97: -3.5 | D97: -2.5 | E97: 0 | F97: 1 | J97: 4 | M97: #NUM!
A98: 0 | B98: =NORMDIST(RC[1],RC[2],RC[3],RC[4]) -> #NUM! | C98: -3.5 | D98: -2.5 | E98: -1 | F98: 1 | J98: 4 | M98: #NUM!
A99: 0 | B99: =NORMDIST(RC[1],RC[2],RC[3],RC[4]) -> #NUM! | C99: -3.5 | D99: -2.5 | E99: 0 | F99: 0 | J99: 4 | M99: #NUM!
A100: 0 | B100: =NORMDIST(RC[1],RC[2],RC[3],RC[4]) -> #NUM! | C100: -3.5 | D100: -2.5 | E100: -1 | F100: 0 | J100: 4 | K100: ... | M100: #NUM!
A102: 1.2798125438858271E-12 | B102: =NORMSDIST(RC[1]) -> 1.2798125438858271E-12 | C102: -7 | J102: 1 | K102: NORMSDIST | L102: NORMSDIST
A103: 9.8658764503751384E-10 | B103: =NORMSDIST(RC[1]) -> 9.8658764503751384E-10 | C103: -6 | J103: 1
A104: 2.8665157187701349E-7 | B104: =NORMSDIST(RC[1]) -> 2.8665157187701349E-7 | C104: -5 | J104: 1
A105: 3.1671241836783715E-5 | B105: =NORMSDIST(RC[1]) -> 3.1671241836783715E-5 | C105: -4 | J105: 1
A106: 1.3498980316301035E-3 | B106: =NORMSDIST(RC[1]) -> 1.3498980316301035E-3 | C106: -3 | J106: 1
A107: 2.275013194817932E-2 | B107: =NORMSDIST(RC[1]) -> 2.275013194817932E-2 | C107: -2 | J107: 1
A108: 0.15865525393145707 | B108: =NORMSDIST(RC[1]) -> 0.15865525393145707 | C108: -1 | J108: 1 | N108: bigdecimal
A109: 0.18406012534675953 | B109: =NORMSDIST(RC[1]) -> 0.18406012534675953 | C109: -0.9 | J109: 1 | N109: bigdecimal
A110: 0.21185539858339675 | B110: =NORMSDIST(RC[1]) -> 0.21185539858339675 | C110: -0.8 | J110: 1
A111: 0.24196365222307303 | B111: =NORMSDIST(RC[1]) -> 0.24196365222307303 | C111: -0.7 | J111: 1
A112: 0.27425311775007366 | B112: =NORMSDIST(RC[1]) -> 0.27425311775007366 | C112: -0.6 | J112: 1 | N112: bigdecimal
A113: 0.30853753872598688 | B113: =NORMSDIST(RC[1]) -> 0.30853753872598688 | C113: -0.5 | J113: 1
A114: 0.34457825838967582 | B114: =NORMSDIST(RC[1]) -> 0.34457825838967582 | C114: -0.4 | J114: 1
A115: 0.38208857781104744 | B115: =NORMSDIST(RC[1]) -> 0.38208857781104744 | C115: -0.3 | J115: 1
A116: 0.42074029056089701 | B116: =NORMSDIST(RC[1]) -> 0.42074029056089701 | C116: -0.2 | J116: 1
A117: 0.46017216272297101 | B117: =NORMSDIST(RC[1]) -> 0.46017216272297101 | C117: -0.1 | J117: 1
A118: 0.5 | B118: =NORMSDIST(RC[1]) -> 0.5 | C118: 0 | J118: 1
A119: 0.53982783727702899 | B119: =NORMSDIST(RC[1]) -> 0.53982783727702899 | C119: 0.1 | J119: 1
A120: 0.57925970943910299 | B120: =NORMSDIST(RC[1]) -> 0.57925970943910299 | C120: 0.2 | J120: 1
A121: 0.61791142218895256 | B121: =NORMSDIST(RC[1]) -> 0.61791142218895256 | C121: 0.3 | J121: 1
A122: 0.65542174161032418 | B122: =NORMSDIST(RC[1]) -> 0.65542174161032418 | C122: 0.4 | J122: 1
A123: 0.69146246127401312 | B123: =NORMSDIST(RC[1]) -> 0.69146246127401312 | C123: 0.5 | J123: 1
A124: 0.72574688224992634 | B124: =NORMSDIST(RC[1]) -> 0.72574688224992634 | C124: 0.6 | J124: 1 | N124: bigdecimal
A125: 0.75803634777692697 | B125: =NORMSDIST(RC[1]) -> 0.75803634777692697 | C125: 0.7 | J125: 1
A126: 0.78814460141660325 | B126: =NORMSDIST(RC[1]) -> 0.78814460141660325 | C126: 0.8 | J126: 1
A127: 0.81593987465324047 | B127: =NORMSDIST(RC[1]) -> 0.81593987465324047 | C127: 0.9 | J127: 1 | N127: bigdecimal
A128: 0.84134474606854293 | B128: =NORMSDIST(RC[1]) -> 0.84134474606854293 | C128: 1 | J128: 1 | N128: bigdecimal
A129: 0.97724986805182068 | B129: =NORMSDIST(RC[1]) -> 0.97724986805182068 | C129: 2 | J129: 1
A130: 0.9986501019683699 | B130: =NORMSDIST(RC[1]) -> 0.9986501019683699 | C130: 3 | J130: 1
A131: 0.99996832875816322 | B131: =NORMSDIST(RC[1]) -> 0.99996832875816322 | C131: 4 | J131: 1
A132: 0.99999971334842808 | B132: =NORMSDIST(RC[1]) -> 0.99999971334842808 | C132: 5 | J132: 1
A133: 0.9999999990134123 | B133: =NORMSDIST(RC[1]) -> 0.9999999990134123 | C133: 6 | J133: 1
A134: 0.99999999999872013 | B134: =NORMSDIST(RC[1]) -> 0.99999999999872013 | C134: 7 | J134: 1 | K134: ...
A136: 2.8627425764402581E-3 | B136: =LOGNORMDIST(RC[1],RC[2],RC[3]) -> 2.8627425764402581E-3 | C136: 1E-3 | D136: 0 | E136: 2.5 | J136: 3 | K136: LOGNORMDIST | L136: LOGNORMDIST | N136: bigdecimal
A137: 3.2732596490962385E-2 | B137: =LOGNORMDIST(RC[1],RC[2],RC[3]) -> 3.2732596490962385E-2 | C137: 0.01 | D137: 0 | E137: 2.5 | J137: 3
A138: 0.17851632837994402 | B138: =LOGNORMDIST(RC[1],RC[2],RC[3]) -> 0.17851632837994402 | C138: 0.1 | D138: 0 | E138: 2.5 | J138: 3
A139: 0.25986062021413336 | B139: =LOGNORMDIST(RC[1],RC[2],RC[3]) -> 0.25986062021413336 | C139: 0.2 | D139: 0 | E139: 2.5 | J139: 3
A140: 0.39079066861911438 | B140: =LOGNORMDIST(RC[1],RC[2],RC[3]) -> 0.39079066861911438 | C140: 0.5 | D140: 0 | E140: 2.5 | J140: 3
A141: 0.5 | B141: =LOGNORMDIST(RC[1],RC[2],RC[3]) -> 0.5 | C141: 1 | D141: 0 | E141: 2.5 | J141: 3
A142: 0.60920933138088562 | B142: =LOGNORMDIST(RC[1],RC[2],RC[3]) -> 0.60920933138088562 | C142: 2 | D142: 0 | E142: 2.5 | J142: 3
A143: 0.74013937978586664 | B143: =LOGNORMDIST(RC[1],RC[2],RC[3]) -> 0.74013937978586664 | C143: 5 | D143: 0 | E143: 2.5 | J143: 3
A144: 0.82148367162005598 | B144: =LOGNORMDIST(RC[1],RC[2],RC[3]) -> 0.82148367162005598 | C144: 10 | D144: 0 | E144: 2.5 | J144: 3
A145: 0.96726740350903762 | B145: =LOGNORMDIST(RC[1],RC[2],RC[3]) -> 0.96726740350903762 | C145: 100 | D145: 0 | E145: 2.5 | J145: 3
A146: 0.99713725742355974 | B146: =LOGNORMDIST(RC[1],RC[2],RC[3]) -> 0.99713725742355974 | C146: 1000 | D146: 0 | E146: 2.5 | J146: 3 | N146: bigdecimal
A147: 0.32860257279352023 | B147: =LOGNORMDIST(RC[1],RC[2],RC[3]) -> 0.32860257279352023 | C147: 0.2 | D147: -0.5 | E147: 2.5 | J147: 3
A148: 0.4026314416565423 | B148: =LOGNORMDIST(RC[1],RC[2],RC[3]) -> 0.4026314416565423 | C148: 0.2 | D148: -0.5 | E148: 4.5 | J148: 3
A149: 0 | B149: =LOGNORMDIST(RC[1],RC[2],RC[3]) -> #NUM! | C149: 0 | D149: -0.5 | E149: 2.5 | J149: 3 | M149: #NUM!
A150: 0 | B150: =LOGNORMDIST(RC[1],RC[2],RC[3]) -> #NUM! | C150: -1 | D150: -0.5 | E150: 2.5 | J150: 3 | M150: #NUM! | N150: bigdecimal
A151: 0 | B151: =LOGNORMDIST(RC[1],RC[2],RC[3]) -> #NUM! | C151: 0.2 | D151: -0.5 | E151: 0 | J151: 3 | M151: #NUM!
A152: 0 | B152: =LOGNORMDIST(RC[1],RC[2],RC[3]) -> #NUM! | C152: 0.2 | D152: -0.5 | E152: -1 | J152: 3 | K152: ... | M152: #NUM!
A154: 1.3755319528560164 | B154: =CONFIDENCE(RC[1],RC[2],RC[3]) -> 1.3755319528560164 | C154: 1E-4 | D154: 2.5 | E154: 50 | J154: 3 | K154: CONFIDENCE | L154: CONFIDENCE | N154: long, bigdecimal
A155: 0.69295191217483887 | B155: =CONFIDENCE(RC[1],RC[2],RC[3]) -> 0.69295191217483887 | C155: 0.05 | D155: 2.5 | E155: 50 | J155: 3 | N155: long, bigdecimal
A156: 0.58154357683833691 | B156: =CONFIDENCE(RC[1],RC[2],RC[3]) -> 0.58154357683833691 | C156: 0.1 | D156: 2.5 | E156: 50 | J156: 3 | N156: long, bigdecimal
A157: 0.50895123241601403 | B157: =CONFIDENCE(RC[1],RC[2],RC[3]) -> 0.50895123241601403 | C157: 0.15 | D157: 2.5 | E157: 50 | J157: 3 | N157: long, bigdecimal
A158: 0.45309690121841151 | B158: =CONFIDENCE(RC[1],RC[2],RC[3]) -> 0.45309690121841151 | C158: 0.2 | D158: 2.5 | E158: 50 | J158: 3 | N158: long, bigdecimal
A159: 0.36643453897960848 | B159: =CONFIDENCE(RC[1],RC[2],RC[3]) -> 0.36643453897960848 | C159: 0.3 | D159: 2.5 | E159: 50 | J159: 3 | N159: long, bigdecimal
A160: 0.23846813810223486 | B160: =CONFIDENCE(RC[1],RC[2],RC[3]) -> 0.23846813810223486 | C160: 0.5 | D160: 2.5 | E160: 50 | J160: 3 | N160: long, bigdecimal
A161: 8.9571727310645791E-2 | B161: =CONFIDENCE(RC[1],RC[2],RC[3]) -> 8.9571727310645791E-2 | C161: 0.8 | D161: 2.5 | E161: 50 | J161: 3 | N161: long, bigdecimal
A162: 4.4427995247128836E-2 | B162: =CONFIDENCE(RC[1],RC[2],RC[3]) -> 4.4427995247128836E-2 | C162: 0.9 | D162: 2.5 | E162: 50 | J162: 3 | N162: long, bigdecimal
A163: 2.2170193955002714E-2 | B163: =CONFIDENCE(RC[1],RC[2],RC[3]) -> 2.2170193955002714E-2 | C163: 0.95 | D163: 2.5 | E163: 50 | J163: 3 | N163: long, bigdecimal
A164: 4.4311346388590672E-5 | B164: =CONFIDENCE(RC[1],RC[2],RC[3]) -> 4.4311346388590672E-5 | C164: 0.99990000000000001 | D164: 2.5 | E164: 50 | J164: 3 | N164: long, bigdecimal
A165: 0.8141610075736716 | B165: =CONFIDENCE(RC[1],RC[2],RC[3]) -> 0.8141610075736716 | C165: 0.1 | D165: 3.5 | E165: 50 | J165: 3 | N165: long, bigdecimal
A166: 0.26007419393777875 | B166: =CONFIDENCE(RC[1],RC[2],RC[3]) -> 0.26007419393777875 | C166: 0.1 | D166: 2.5 | E166: 250 | J166: 3 | N166: long, bigdecimal
A167: 0.26007419393777875 | B167: =CONFIDENCE(RC[1],RC[2],RC[3]) -> 0.26007419393777875 | C167: 0.1 | D167: 2.5 | E167: 250.9 | J167: 3 | N167: long, bigdecimal
A168: 0 | B168: =CONFIDENCE(RC[1],RC[2],RC[3]) -> #NUM! | C168: 0 | D168: 2.5 | E168: 50 | J168: 3 | M168: #NUM! | N168: long, bigdecimal
A169: 0 | B169: =CONFIDENCE(RC[1],RC[2],RC[3]) -> #NUM! | C169: -1 | D169: 2.5 | E169: 50 | J169: 3 | M169: #NUM! | N169: long, bigdecimal
A170: 0 | B170: =CONFIDENCE(RC[1],RC[2],RC[3]) -> #NUM! | C170: 1 | D170: 2.5 | E170: 50 | J170: 3 | M170: #NUM! | N170: long, bigdecimal
A171: 0 | B171: =CONFIDENCE(RC[1],RC[2],RC[3]) -> #NUM! | C171: 0.5 | D171: 0 | E171: 50 | J171: 3 | M171: #NUM! | N171: long, bigdecimal
A172: 0 | B172: =CONFIDENCE(RC[1],RC[2],RC[3]) -> #NUM! | C172: 0.5 | D172: -1 | E172: 50 | J172: 3 | M172: #NUM! | N172: long, bigdecimal
A173: 0 | B173: =CONFIDENCE(RC[1],RC[2],RC[3]) -> #NUM! | C173: 0.5 | D173: 2.5 | E173: 0 | J173: 3 | K173: ... | M173: #NUM! | N173: long, bigdecimal
A175: 81.202458786356729 | B175: =NORMINV(RC[1],RC[2],RC[3]) -> 81.202458786356729 | C175: 1E-4 | D175: 90.5 | E175: 2.5 | J175: 3 | K175: NORMINV | L175: NORMINV | N175: long, bigdecimal
A176: 86.38786593262131 | B176: =NORMINV(RC[1],RC[2],RC[3]) -> 86.38786593262131 | C176: 0.05 | D176: 90.5 | E176: 2.5 | J176: 3 | N176: long, bigdecimal
A177: 87.296121086138498 | B177: =NORMINV(RC[1],RC[2],RC[3]) -> 87.296121086138498 | C177: 0.1 | D177: 90.5 | E177: 2.5 | J177: 3 | N177: long, bigdecimal
A178: 88.395946916067714 | B178: =NORMINV(RC[1],RC[2],RC[3]) -> 88.395946916067714 | C178: 0.2 | D178: 90.5 | E178: 2.5 | J178: 3 | N178: long, bigdecimal
A179: 90.5 | B179: =NORMINV(RC[1],RC[2],RC[3]) -> 90.5 | C179: 0.5 | D179: 90.5 | E179: 2.5 | J179: 3 | N179: long, bigdecimal
A180: 92.604053083932286 | B180: =NORMINV(RC[1],RC[2],RC[3]) -> 92.604053083932286 | C180: 0.8 | D180: 90.5 | E180: 2.5 | J180: 3 | N180: long, bigdecimal
A181: 93.703878913861502 | B181: =NORMINV(RC[1],RC[2],RC[3]) -> 93.703878913861502 | C181: 0.9 | D181: 90.5 | E181: 2.5 | J181: 3 | N181: long, bigdecimal
A182: 94.612134067378676 | B182: =NORMINV(RC[1],RC[2],RC[3]) -> 94.612134067378676 | C182: 0.95 | D182: 90.5 | E182: 2.5 | J182: 3 | N182: long, bigdecimal
A183: 99.797541213643271 | B183: =NORMINV(RC[1],RC[2],RC[3]) -> 99.797541213643271 | C183: 0.99990000000000001 | D183: 90.5 | E183: 2.5 | J183: 3 | N183: long, bigdecimal
A184: -89.188998718229897 | B184: =NORMINV(RC[1],RC[2],RC[3]) -> -89.188998718229897 | C184: 0.7 | D184: -90.5 | E184: 2.5 | J184: 3 | N184: long, bigdecimal
A185: -87.877997436459793 | B185: =NORMINV(RC[1],RC[2],RC[3]) -> -87.877997436459793 | C185: 0.7 | D185: -90.5 | E185: 5 | J185: 3 | N185: long, bigdecimal
A186: 0 | B186: =NORMINV(RC[1],RC[2],RC[3]) -> #NUM! | C186: 0 | D186: 90.5 | E186: 2.5 | J186: 3 | M186: #NUM! | N186: long, bigdecimal
A187: 0 | B187: =NORMINV(RC[1],RC[2],RC[3]) -> #NUM! | C187: -1 | D187: 90.5 | E187: 2.5 | J187: 3 | M187: #NUM! | N187: long, bigdecimal
A188: 0 | B188: =NORMINV(RC[1],RC[2],RC[3]) -> #NUM! | C188: 1 | D188: 90.5 | E188: 2.5 | J188: 3 | M188: #NUM! | N188: long, bigdecimal
A189: 0 | B189: =NORMINV(RC[1],RC[2],RC[3]) -> #NUM! | C189: 0.7 | D189: 90.5 | E189: 0 | J189: 3 | M189: #NUM! | N189: long, bigdecimal
A190: 0 | B190: =NORMINV(RC[1],RC[2],RC[3]) -> #NUM! | C190: 0.7 | D190: 90.5 | E190: -1 | J190: 3 | K190: ... | M190: #NUM! | N190: long, bigdecimal
A192: -3.719016485457308 | B192: =NORMSINV(RC[1]) -> -3.719016485457308 | C192: 1E-4 | J192: 1 | K192: NORMSINV | L192: NORMSINV | N192: long, bigdecimal
A193: -3.0902323061677874 | B193: =NORMSINV(RC[1]) -> -3.0902323061677874 | C193: 1E-3 | J193: 1 | N193: long, bigdecimal
A194: -2.3263478740408488 | B194: =NORMSINV(RC[1]) -> -2.3263478740408488 | C194: 0.01 | J194: 1 | N194: long, bigdecimal
A195: -1.9599639845400545 | B195: =NORMSINV(RC[1]) -> -1.9599639845400545 | C195: 2.5000000000000001E-2 | J195: 1 | N195: long, bigdecimal
A196: -1.6448536269514742 | B196: =NORMSINV(RC[1]) -> -1.6448536269514742 | C196: 0.05 | J196: 1 | N196: long, bigdecimal
A197: -1.2815515655446004 | B197: =NORMSINV(RC[1]) -> -1.2815515655446004 | C197: 0.1 | J197: 1 | N197: long, bigdecimal
A198: -1.0364333894937903 | B198: =NORMSINV(RC[1]) -> -1.0364333894937903 | C198: 0.15 | J198: 1 | N198: long, bigdecimal
A199: -0.8416212335729143 | B199: =NORMSINV(RC[1]) -> -0.8416212335729143 | C199: 0.2 | J199: 1 | N199: long, bigdecimal
A200: -0.67448975019608182 | B200: =NORMSINV(RC[1]) -> -0.67448975019608182 | C200: 0.25 | J200: 1 | N200: long, bigdecimal
A201: -0.52440051270804089 | B201: =NORMSINV(RC[1]) -> -0.52440051270804089 | C201: 0.3 | J201: 1 | N201: long, bigdecimal
A202: -0.38532046640756779 | B202: =NORMSINV(RC[1]) -> -0.38532046640756779 | C202: 0.35 | J202: 1 | N202: long, bigdecimal
A203: -0.25334710313579989 | B203: =NORMSINV(RC[1]) -> -0.25334710313579989 | C203: 0.4 | J203: 1 | N203: long, bigdecimal
A204: -0.12566134685507402 | B204: =NORMSINV(RC[1]) -> -0.12566134685507402 | C204: 0.45 | J204: 1 | N204: long, bigdecimal
A205: -1.392137635291833E-16 | B205: =NORMSINV(RC[1]) -> -1.392137635291833E-16 | C205: 0.5 | J205: 1 | N205: long, bigdecimal
A206: 0.12566134685507402 | B206: =NORMSINV(RC[1]) -> 0.12566134685507402 | C206: 0.55 | J206: 1 | N206: long, bigdecimal
A207: 0.25334710313579967 | B207: =NORMSINV(RC[1]) -> 0.25334710313579967 | C207: 0.6 | J207: 1 | N207: long, bigdecimal
A208: 0.38532046640756756 | B208: =NORMSINV(RC[1]) -> 0.38532046640756756 | C208: 0.65 | J208: 1 | N208: long, bigdecimal
A209: 0.52440051270804044 | B209: =NORMSINV(RC[1]) -> 0.52440051270804044 | C209: 0.7 | J209: 1 | N209: long, bigdecimal
A210: 0.67448975019608159 | B210: =NORMSINV(RC[1]) -> 0.67448975019608159 | C210: 0.75 | J210: 1 | N210: long, bigdecimal
A211: 0.8416212335729143 | B211: =NORMSINV(RC[1]) -> 0.8416212335729143 | C211: 0.8 | J211: 1 | N211: long, bigdecimal
A212: 1.0364333894937898 | B212: =NORMSINV(RC[1]) -> 1.0364333894937898 | C212: 0.85 | J212: 1 | N212: long, bigdecimal
A213: 1.2815515655446004 | B213: =NORMSINV(RC[1]) -> 1.2815515655446004 | C213: 0.9 | J213: 1 | N213: long, bigdecimal
A214: 1.6448536269514724 | B214: =NORMSINV(RC[1]) -> 1.6448536269514724 | C214: 0.95 | J214: 1 | N214: long, bigdecimal
A215: 1.959963984540054 | B215: =NORMSINV(RC[1]) -> 1.959963984540054 | C215: 0.97499999999999998 | J215: 1 | N215: long, bigdecimal
A216: 2.3263478740408399 | B216: =NORMSINV(RC[1]) -> 2.3263478740408399 | C216: 0.99 | J216: 1 | N216: long, bigdecimal
A217: 3.0902323061677848 | B217: =NORMSINV(RC[1]) -> 3.0902323061677848 | C217: 0.999 | J217: 1 | N217: long, bigdecimal
A218: 3.719016485457308 | B218: =NORMSINV(RC[1]) -> 3.719016485457308 | C218: 0.99990000000000001 | J218: 1 | N218: long, bigdecimal
A219: 0 | B219: =NORMSINV(RC[1]) -> #NUM! | C219: 0 | J219: 1 | M219: #NUM! | N219: long, bigdecimal
A220: 0 | B220: =NORMSINV(RC[1]) -> #NUM! | C220: -1 | J220: 1 | M220: #NUM! | N220: long, bigdecimal
A221: 0 | B221: =NORMSINV(RC[1]) -> #NUM! | C221: 1 | J221: 1 | K221: ... | M221: #NUM! | N221: long, bigdecimal
A223: 1.9781746262642497E-3 | B223: =LOGINV(RC[1],RC[2],RC[3]) -> 1.9781746262642497E-3 | C223: 1E-3 | D223: 1.5 | E223: 2.5 | J223: 3 | K223: LOGINV | L223: LOGINV | N223: long, bigdecimal
A224: 7.3377783420066719E-2 | B224: =LOGINV(RC[1],RC[2],RC[3]) -> 7.3377783420066719E-2 | C224: 0.05 | D224: 1.5 | E224: 2.5 | J224: 3 | N224: long, bigdecimal
A225: 0.18197628294943885 | B225: =LOGINV(RC[1],RC[2],RC[3]) -> 0.18197628294943885 | C225: 0.1 | D225: 1.5 | E225: 2.5 | J225: 3 | N225: long, bigdecimal
A226: 0.54659175818458317 | B226: =LOGINV(RC[1],RC[2],RC[3]) -> 0.54659175818458317 | C226: 0.2 | D226: 1.5 | E226: 2.5 | J226: 3 | N226: long, bigdecimal
A227: 4.4816890703380627 | B227: =LOGINV(RC[1],RC[2],RC[3]) -> 4.4816890703380627 | C227: 0.5 | D227: 1.5 | E227: 2.5 | J227: 3 | N227: long, bigdecimal
A228: 36.746871174747596 | B228: =LOGINV(RC[1],RC[2],RC[3]) -> 36.746871174747596 | C228: 0.8 | D228: 1.5 | E228: 2.5 | J228: 3 | N228: long, bigdecimal
A229: 110.37447626495552 | B229: =LOGINV(RC[1],RC[2],RC[3]) -> 110.37447626495552 | C229: 0.9 | D229: 1.5 | E229: 2.5 | J229: 3 | N229: long, bigdecimal
A230: 273.72776863814039 | B230: =LOGINV(RC[1],RC[2],RC[3]) -> 273.72776863814039 | C230: 0.95 | D230: 1.5 | E230: 2.5 | J230: 3 | N230: long, bigdecimal
A231: 10153.571204741784 | B231: =LOGINV(RC[1],RC[2],RC[3]) -> 10153.571204741784 | C231: 0.999 | D231: 1.5 | E231: 2.5 | J231: 3 | N231: long, bigdecimal
A232: 0.82778756772740802 | B232: =LOGINV(RC[1],RC[2],RC[3]) -> 0.82778756772740802 | C232: 0.7 | D232: -1.5 | E232: 2.5 | J232: 3 | N232: long, bigdecimal
A233: 3.070997918113044 | B233: =LOGINV(RC[1],RC[2],RC[3]) -> 3.070997918113044 | C233: 0.7 | D233: -1.5 | E233: 5 | J233: 3 | N233: long, bigdecimal
A234: 0 | B234: =LOGINV(RC[1],RC[2],RC[3]) -> #NUM! | C234: 0 | D234: 1.5 | E234: 2.5 | J234: 3 | M234: #NUM! | N234: long, bigdecimal
A235: 0 | B235: =LOGINV(RC[1],RC[2],RC[3]) -> #NUM! | C235: -1 | D235: 1.5 | E235: 2.5 | J235: 3 | M235: #NUM! | N235: long, bigdecimal
A236: 0 | B236: =LOGINV(RC[1],RC[2],RC[3]) -> #NUM! | C236: 1 | D236: 1.5 | E236: 2.5 | J236: 3 | M236: #NUM! | N236: long, bigdecimal
A237: 0 | B237: =LOGINV(RC[1],RC[2],RC[3]) -> #NUM! | C237: 0.7 | D237: 1.5 | E237: 0 | J237: 3 | M237: #NUM! | N237: long, bigdecimal
A238: 0 | B238: =LOGINV(RC[1],RC[2],RC[3]) -> #NUM! | C238: 0.7 | D238: 1.5 | E238: -1 | J238: 3 | K238: ... | M238: #NUM! | N238: long, bigdecimal
A240: 0.2522154925789305 | B240: =BETADIST(RC[1],RC[2],RC[3]) -> 0.2522154925789305 | C240: 0.6 | D240: 1.5 | E240: 0.5 | J240: 3 | K240: BETADIST | L240: BETADIST | N240: bigdecimal
A241: 0 | B241: =BETADIST(RC[1],RC[2],RC[3]) -> 0 | C241: 0 | D241: 1.5 | E241: 0.5 | J241: 3
A242: 1 | B242: =BETADIST(RC[1],RC[2],RC[3]) -> 1 | C242: 1 | D242: 1.5 | E242: 0.5 | J242: 3
A243: 0 | B243: =BETADIST(RC[1],RC[2],RC[3]) -> #NUM! | C243: -1E-3 | D243: 1.5 | E243: 0.5 | J243: 3 | M243: #NUM!
A244: 0 | B244: =BETADIST(RC[1],RC[2],RC[3]) -> #NUM! | C244: 1.0009999999999999 | D244: 1.5 | E244: 0.5 | J244: 3 | M244: #NUM!
A245: 0 | B245: =BETADIST(RC[1],RC[2],RC[3]) -> #NUM! | C245: 0.6 | D245: 0 | E245: 0.5 | J245: 3 | M245: #NUM!
A246: 0 | B246: =BETADIST(RC[1],RC[2],RC[3]) -> #NUM! | C246: 0.6 | D246: 1.5 | E246: 0 | J246: 3 | K246: ... | M246: #NUM!
A248: 2.6900917354660405E-2 | B248: =BETADIST(RC[1],RC[2],RC[3],RC[4]) -> 2.6900917354660405E-2 | C248: -0.1 | D248: 1.5 | E248: 0.5 | F248: -0.3 | J248: 4
A250: 3.4896984506197104E-2 | B250: =BETADIST(RC[1],RC[2],RC[3],RC[4],RC[5]) -> 3.4896984506197104E-2 | C250: -0.1 | D250: 1.5 | E250: 0.5 | F250: -0.3 | G250: 0.8 | J250: 5 | N250: bigdecimal
A251: 0 | B251: =BETADIST(RC[1],RC[2],RC[3],RC[4],RC[5]) -> 0 | C251: -0.3 | D251: 1.5 | E251: 0.5 | F251: -0.3 | G251: 0.8 | J251: 5 | N251: bigdecimal
A252: 1 | B252: =BETADIST(RC[1],RC[2],RC[3],RC[4],RC[5]) -> 1 | C252: 0.8 | D252: 1.5 | E252: 0.5 | F252: -0.3 | G252: 0.8 | J252: 5 | N252: bigdecimal
A253: 0 | B253: =BETADIST(RC[1],RC[2],RC[3],RC[4],RC[5]) -> #NUM! | C253: 0.2 | D253: 1.5 | E253: 0.5 | F253: 0.3 | G253: 0.8 | J253: 5 | M253: #NUM! | N253: bigdecimal
A254: 0 | B254: =BETADIST(RC[1],RC[2],RC[3],RC[4],RC[5]) -> #NUM! | C254: 0.9 | D254: 1.5 | E254: 0.5 | F254: 0.3 | G254: 0.8 | J254: 5 | M254: #NUM! | N254: bigdecimal
A255: 0 | B255: =BETADIST(RC[1],RC[2],RC[3],RC[4],RC[5]) -> #NUM! | C255: 0.9 | D255: 1.5 | E255: 0.5 | F255: 0.9 | G255: 0.9 | J255: 5 | K255: ... | M255: #NUM! | N255: bigdecimal
A257: 1 | B257: =BINOMDIST(RC[1],RC[2],RC[3],RC[4]) -> 1 | C257: 2 | D257: 3 | E257: 0 | F257: 1 | J257: 4 | K257: BINOMDIST | L257: BINOMDIST
A258: 0.51200000000000012 | B258: =BINOMDIST(RC[1],RC[2],RC[3],RC[4]) -> 0.51200000000000012 | C258: 0 | D258: 3 | E258: 0.2 | F258: 1 | J258: 4
A259: 0.89600000000000013 | B259: =BINOMDIST(RC[1],RC[2],RC[3],RC[4]) -> 0.89600000000000013 | C259: 1 | D259: 3 | E259: 0.2 | F259: 1 | J259: 4
A260: 0.99200000000000021 | B260: =BINOMDIST(RC[1],RC[2],RC[3],RC[4]) -> 0.99200000000000021 | C260: 2 | D260: 3 | E260: 0.2 | F260: 1 | J260: 4
A261: 1 | B261: =BINOMDIST(RC[1],RC[2],RC[3],RC[4]) -> 1.0000000000000002 | C261: 3 | D261: 3 | E261: 0.2 | F261: 1 | J261: 4
A262: 0.64 | B262: =BINOMDIST(RC[1],RC[2],RC[3],RC[4]) -> 0.64 | C262: 0 | D262: 2 | E262: 0.2 | F262: 1 | J262: 4
A263: 0.36 | B263: =BINOMDIST(RC[1],RC[2],RC[3],RC[4]) -> 0.36 | C263: 1 | D263: 2 | E263: 0.8 | F263: 1 | J263: 4
A264: 1 | B264: =BINOMDIST(RC[1],RC[2],RC[3],RC[4]) -> 1 | C264: 2 | D264: 2 | E264: 0.8 | F264: 1 | J264: 4
A265: 0 | B265: =BINOMDIST(RC[1],RC[2],RC[3],RC[4]) -> 0 | C265: 1 | D265: 2 | E265: 1 | F265: 1 | J265: 4
A266: 1 | B266: =BINOMDIST(RC[1],RC[2],RC[3],RC[4]) -> 1 | C266: 2 | D266: 2 | E266: 1 | F266: 1 | J266: 4
A267: 0.51200000000000012 | B267: =BINOMDIST(RC[1],RC[2],RC[3],RC[4]) -> 0.51200000000000012 | C267: 0.9 | D267: 3.9 | E267: 0.2 | F267: 1 | J267: 4
A268: 0 | B268: =BINOMDIST(RC[1],RC[2],RC[3],RC[4]) -> 0 | C268: 2 | D268: 3 | E268: 0 | F268: 0 | J268: 4
A269: 0.51200000000000012 | B269: =BINOMDIST(RC[1],RC[2],RC[3],RC[4]) -> 0.51200000000000012 | C269: 0 | D269: 3 | E269: 0.2 | F269: 0 | J269: 4
A270: 0.38400000000000006 | B270: =BINOMDIST(RC[1],RC[2],RC[3],RC[4]) -> 0.38400000000000006 | C270: 1 | D270: 3 | E270: 0.2 | F270: 0 | J270: 4
A271: 9.600000000000003E-2 | B271: =BINOMDIST(RC[1],RC[2],RC[3],RC[4]) -> 9.600000000000003E-2 | C271: 2 | D271: 3 | E271: 0.2 | F271: 0 | J271: 4
A272: 8.0000000000000036E-3 | B272: =BINOMDIST(RC[1],RC[2],RC[3],RC[4]) -> 8.0000000000000036E-3 | C272: 3 | D272: 3 | E272: 0.2 | F272: 0 | J272: 4
A273: 0.64 | B273: =BINOMDIST(RC[1],RC[2],RC[3],RC[4]) -> 0.64 | C273: 0 | D273: 2 | E273: 0.2 | F273: 0 | J273: 4
A274: 0.32 | B274: =BINOMDIST(RC[1],RC[2],RC[3],RC[4]) -> 0.32 | C274: 1 | D274: 2 | E274: 0.8 | F274: 0 | J274: 4
A275: 0.64 | B275: =BINOMDIST(RC[1],RC[2],RC[3],RC[4]) -> 0.64 | C275: 2 | D275: 2 | E275: 0.8 | F275: 0 | J275: 4
A276: 0 | B276: =BINOMDIST(RC[1],RC[2],RC[3],RC[4]) -> 0 | C276: 1 | D276: 2 | E276: 1 | F276: 0 | J276: 4
A277: 1 | B277: =BINOMDIST(RC[1],RC[2],RC[3],RC[4]) -> 1 | C277: 2 | D277: 2 | E277: 1 | F277: 0 | J277: 4
A278: 9.600000000000003E-2 | B278: =BINOMDIST(RC[1],RC[2],RC[3],RC[4]) -> 9.600000000000003E-2 | C278: 2.9 | D278: 3.9 | E278: 0.2 | F278: 0 | J278: 4
A279: 0 | B279: =BINOMDIST(RC[1],RC[2],RC[3],RC[4]) -> #NUM! | C279: -1 | D279: 3 | E279: 0.2 | F279: 1 | J279: 4 | M279: #NUM!
A280: 0 | B280: =BINOMDIST(RC[1],RC[2],RC[3],RC[4]) -> #NUM! | C280: 4 | D280: 3 | E280: 0.2 | F280: 1 | J280: 4 | M280: #NUM!
A281: 0 | B281: =BINOMDIST(RC[1],RC[2],RC[3],RC[4]) -> #NUM! | C281: 1 | D281: 3 | E281: -1E-3 | F281: 1 | J281: 4 | M281: #NUM!
A282: 0 | B282: =BINOMDIST(RC[1],RC[2],RC[3],RC[4]) -> #NUM! | C282: 1 | D282: 3 | E282: 1.0009999999999999 | F282: 1 | J282: 4 | K282: ... | M282: #NUM!
A284: 0.8 | B284: =NEGBINOMDIST(RC[1],RC[2],RC[3]) -> 0.8 | C284: 0 | D284: 1 | E284: 0.8 | J284: 3 | K284: NEGBINOMDIST | L284: NEGBINOMDIST
A285: 0.16 | B285: =NEGBINOMDIST(RC[1],RC[2],RC[3]) -> 0.16 | C285: 1 | D285: 1 | E285: 0.8 | J285: 3
A286: 3.1999999999999994E-2 | B286: =NEGBINOMDIST(RC[1],RC[2],RC[3]) -> 3.1999999999999994E-2 | C286: 2 | D286: 1 | E286: 0.8 | J286: 3
A287: 6.3999999999999977E-3 | B287: =NEGBINOMDIST(RC[1],RC[2],RC[3]) -> 6.3999999999999977E-3 | C287: 3 | D287: 1 | E287: 0.8 | J287: 3
A288: 0.64 | B288: =NEGBINOMDIST(RC[1],RC[2],RC[3]) -> 0.64 | C288: 0 | D288: 2 | E288: 0.8 | J288: 3
A289: 0.25600000000000001 | B289: =NEGBINOMDIST(RC[1],RC[2],RC[3]) -> 0.25600000000000001 | C289: 1 | D289: 2 | E289: 0.8 | J289: 3
A290: 7.6799999999999979E-2 | B290: =NEGBINOMDIST(RC[1],RC[2],RC[3]) -> 7.6799999999999979E-2 | C290: 2 | D290: 2 | E290: 0.8 | J290: 3
A291: 2.0479999999999991E-2 | B291: =NEGBINOMDIST(RC[1],RC[2],RC[3]) -> 2.0479999999999991E-2 | C291: 3 | D291: 2 | E291: 0.8 | J291: 3
A292: 0.51200000000000012 | B292: =NEGBINOMDIST(RC[1],RC[2],RC[3]) -> 0.51200000000000012 | C292: 0 | D292: 3 | E292: 0.8 | J292: 3
A293: 0.30720000000000003 | B293: =NEGBINOMDIST(RC[1],RC[2],RC[3]) -> 0.30720000000000003 | C293: 1 | D293: 3 | E293: 0.8 | J293: 3
A294: 0.12287999999999999 | B294: =NEGBINOMDIST(RC[1],RC[2],RC[3]) -> 0.12287999999999999 | C294: 2 | D294: 3 | E294: 0.8 | J294: 3
A295: 4.0959999999999989E-2 | B295: =NEGBINOMDIST(RC[1],RC[2],RC[3]) -> 4.0959999999999989E-2 | C295: 3 | D295: 3 | E295: 0.8 | J295: 3
A296: 0.04 | B296: =NEGBINOMDIST(RC[1],RC[2],RC[3]) -> 4.0000000000000008E-2 | C296: 0 | D296: 2 | E296: 0.2 | J296: 3
A297: 6.4000000000000015E-2 | B297: =NEGBINOMDIST(RC[1],RC[2],RC[3]) -> 6.4000000000000015E-2 | C297: 1 | D297: 2 | E297: 0.2 | J297: 3
A298: 7.6800000000000007E-2 | B298: =NEGBINOMDIST(RC[1],RC[2],RC[3]) -> 7.6800000000000007E-2 | C298: 2 | D298: 2 | E298: 0.2 | J298: 3
A299: 8.1920000000000034E-2 | B299: =NEGBINOMDIST(RC[1],RC[2],RC[3]) -> 8.1920000000000034E-2 | C299: 3 | D299: 2 | E299: 0.2 | J299: 3
A300: 8.1920000000000034E-2 | B300: =NEGBINOMDIST(RC[1],RC[2],RC[3]) -> 8.1920000000000034E-2 | C300: 3.9 | D300: 2.9 | E300: 0.2 | J300: 3
A301: 0 | B301: =NEGBINOMDIST(RC[1],RC[2],RC[3]) -> #NUM! | C301: 3 | D301: 2 | E301: 0 | J301: 3 | M301: #NUM!
A302: 0 | B302: =NEGBINOMDIST(RC[1],RC[2],RC[3]) -> #NUM! | C302: 3 | D302: 2 | E302: -0.1 | J302: 3 | M302: #NUM!
A303: 0 | B303: =NEGBINOMDIST(RC[1],RC[2],RC[3]) -> #NUM! | C303: 3 | D303: 2 | E303: 1 | J303: 3 | M303: #NUM!
A304: 0 | B304: =NEGBINOMDIST(RC[1],RC[2],RC[3]) -> #NUM! | C304: 3 | D304: 2 | E304: 1.1 | J304: 3 | M304: #NUM!
A305: 0 | B305: =NEGBINOMDIST(RC[1],RC[2],RC[3]) -> #NUM! | C305: -1 | D305: 2 | E305: 0.8 | J305: 3 | M305: #NUM!
A306: 0 | B306: =NEGBINOMDIST(RC[1],RC[2],RC[3]) -> #NUM! | C306: 3 | D306: 0 | E306: 0.8 | J306: 3 | K306: ... | M306: #NUM!
A308: 1 | B308: =CHIDIST(RC[1],RC[2]) -> 1 | C308: 0 | D308: 1 | J308: 2 | K308: CHIDIST | L308: CHIDIST
A309: 0.75182963429462546 | B309: =CHIDIST(RC[1],RC[2]) -> 0.75182963429462546 | C309: 0.1 | D309: 1 | J309: 2
A310: 0.4795001239653619 | B310: =CHIDIST(RC[1],RC[2]) -> 0.4795001239653619 | C310: 0.5 | D310: 1 | J310: 2
A311: 1.5654023378513151E-3 | B311: =CHIDIST(RC[1],RC[2]) -> 1.5654023378513151E-3 | C311: 10 | D311: 1 | J311: 2
A312: 1 | B312: =CHIDIST(RC[1],RC[2]) -> 1 | C312: 0 | D312: 2 | J312: 2
A313: 0.9512294245194709 | B313: =CHIDIST(RC[1],RC[2]) -> 0.9512294245194709 | C313: 0.1 | D313: 2 | J313: 2
A314: 0.77880078336530478 | B314: =CHIDIST(RC[1],RC[2]) -> 0.77880078336530478 | C314: 0.5 | D314: 2 | J314: 2
A315: 0.60653066313170978 | B315: =CHIDIST(RC[1],RC[2]) -> 0.60653066313170978 | C315: 1 | D315: 2 | J315: 2
A316: 6.7379469993665486E-3 | B316: =CHIDIST(RC[1],RC[2]) -> 6.7379469993665486E-3 | C316: 10 | D316: 2 | J316: 2
A317: 1 | B317: =CHIDIST(RC[1],RC[2]) -> 1 | C317: 0 | D317: 3 | J317: 2
A318: 0.99183742373313488 | B318: =CHIDIST(RC[1],RC[2]) -> 0.99183742373313488 | C318: 0.1 | D318: 3 | J318: 2
A319: 0.91889141170056499 | B319: =CHIDIST(RC[1],RC[2]) -> 0.91889141170056499 | C319: 0.5 | D319: 3 | J319: 2
A320: 0.80125195766424573 | B320: =CHIDIST(RC[1],RC[2]) -> 0.80125195766424573 | C320: 1 | D320: 3 | J320: 2
A321: 1.8566135277077619E-2 | B321: =CHIDIST(RC[1],RC[2]) -> 1.8566135277077619E-2 | C321: 10 | D321: 3 | J321: 2
A322: 1 | B322: =CHIDIST(RC[1],RC[2]) -> 1 | C322: 0 | D322: 5 | J322: 2
A323: 0.99983768338807244 | B323: =CHIDIST(RC[1],RC[2]) -> 0.99983768338807244 | C323: 0.1 | D323: 5 | J323: 2
A324: 0.99212329328296056 | B324: =CHIDIST(RC[1],RC[2]) -> 0.99212329328296056 | C324: 0.5 | D324: 5 | J324: 2
A325: 0.96256577328018977 | B325: =CHIDIST(RC[1],RC[2]) -> 0.96256577328018977 | C325: 1 | D325: 5 | J325: 2
A326: 7.5235246710813622E-2 | B326: =CHIDIST(RC[1],RC[2]) -> 7.5235246710813622E-2 | C326: 10 | D326: 5 | J326: 2
A327: 1 | B327: =CHIDIST(RC[1],RC[2]) -> 1 | C327: 0 | D327: 10 | J327: 2
A328: 0.99999999750204871 | B328: =CHIDIST(RC[1],RC[2]) -> 0.99999999750204871 | C328: 0.1 | D328: 10 | J328: 2
A329: 0.99999338828944262 | B329: =CHIDIST(RC[1],RC[2]) -> 0.99999338828944262 | C329: 0.5 | D329: 10 | J329: 2
A330: 0.99982788437033721 | B330: =CHIDIST(RC[1],RC[2]) -> 0.99982788437033721 | C330: 1 | D330: 10 | J330: 2
A331: 0.44049328513798774 | B331: =CHIDIST(RC[1],RC[2]) -> 0.44049328513798774 | C331: 10 | D331: 10 | J331: 2
A332: 2.9252688081794043E-2 | B332: =CHIDIST(RC[1],RC[2]) -> 2.9252688081794043E-2 | C332: 20 | D332: 10 | J332: 2
A333: 8.5664121091682914E-4 | B333: =CHIDIST(RC[1],RC[2]) -> 8.5664121091682914E-4 | C333: 30 | D333: 10 | J333: 2
A334: 8.5664121091682914E-4 | B334: =CHIDIST(RC[1],RC[2]) -> 8.5664121091682914E-4 | C334: 30 | D334: 10.9 | J334: 2
A335: 0 | B335: =CHIDIST(RC[1],RC[2]) -> #NUM! | C335: -0.1 | D335: 3 | J335: 2 | M335: #NUM!
A336: 0 | B336: =CHIDIST(RC[1],RC[2]) -> #NUM! | C336: 0.5 | D336: 0 | J336: 2 | M336: #NUM!
A337: 0 | B337: =CHIDIST(RC[1],RC[2]) -> #NUM! | C337: 0.5 | D337: -1 | J337: 2 | K337: ... | M337: #NUM!
A339: 1 | B339: =FDIST(RC[1],RC[2],RC[3]) -> 1 | C339: 0 | D339: 1 | E339: 1 | J339: 3 | K339: FDIST | L339: FDIST
A340: 1 | B340: =FDIST(RC[1],RC[2],RC[3]) -> 1 | C340: 0 | D340: 1 | E340: 2 | J340: 3
A341: 1 | B341: =FDIST(RC[1],RC[2],RC[3]) -> 1 | C341: 0 | D341: 2 | E341: 1 | J341: 3
A342: 0.80501777099132787 | B342: =FDIST(RC[1],RC[2],RC[3]) -> 0.80501777099132787 | C342: 0.1 | D342: 1 | E342: 1 | J342: 3
A343: 0.78178210978321894 | B343: =FDIST(RC[1],RC[2],RC[3]) -> 0.78178210978321894 | C343: 0.1 | D343: 1 | E343: 2 | J343: 3 | N343: long, bigdecimal
A344: 0.9128709291846353 | B344: =FDIST(RC[1],RC[2],RC[3]) -> 0.9128709291846353 | C344: 0.1 | D344: 2 | E344: 1 | J344: 3
A345: 6.345103485022717E-2 | B345: =FDIST(RC[1],RC[2],RC[3]) -> 6.345103485022717E-2 | C345: 100 | D345: 1 | E345: 1 | J345: 3 | N345: long
A346: 9.8524570224581623E-3 | B346: =FDIST(RC[1],RC[2],RC[3]) -> 9.8524570224581623E-3 | C346: 100 | D346: 1 | E346: 2 | J346: 3
A347: 7.0534561579650115E-2 | B347: =FDIST(RC[1],RC[2],RC[3]) -> 7.0534561579650115E-2 | C347: 100 | D347: 2 | E347: 1 | J347: 3 | N347: long, bigdecimal
A348: 9.9009900989867738E-3 | B348: =FDIST(RC[1],RC[2],RC[3]) -> 9.9009900989867738E-3 | C348: 100 | D348: 2 | E348: 2 | J348: 3
A349: 2.9444089366273379E-2 | B349: =FDIST(RC[1],RC[2],RC[3]) -> 2.9444089366273379E-2 | C349: 5.5 | D349: 1 | E349: 20 | J349: 3
A350: 0.32563029803551891 | B350: =FDIST(RC[1],RC[2],RC[3]) -> 0.32563029803551891 | C350: 5.5 | D350: 20 | E350: 1 | J350: 3 | N350: long, bigdecimal
A351: 1.7831313228083739E-4 | B351: =FDIST(RC[1],RC[2],RC[3]) -> 1.7831313228083739E-4 | C351: 5.5 | D351: 20 | E351: 20 | J351: 3
A352: 4.2345901953123096E-3 | B352: =FDIST(RC[1],RC[2],RC[3]) -> 4.2345901953123096E-3 | C352: 5.5 | D352: 20.9 | E352: 10.9 | J352: 3
A353: 0 | B353: =FDIST(RC[1],RC[2],RC[3]) -> #NUM! | C353: -1 | D353: 2 | E353: 2 | J353: 3 | M353: #NUM!
A354: 0 | B354: =FDIST(RC[1],RC[2],RC[3]) -> #NUM! | C354: 1 | D354: 0 | E354: 1 | J354: 3 | M354: #NUM!
A355: 0 | B355: =FDIST(RC[1],RC[2],RC[3]) -> #NUM! | C355: 1 | D355: 1 | E355: 0 | J355: 3 | K355: ... | M355: #NUM!
A357: 0 | B357: =GAMMADIST(RC[1],RC[2],RC[3],RC[4]) -> 0 | C357: 0 | D357: 1.5 | E357: 0.5 | F357: 1 | J357: 4 | K357: GAMMADIST | L357: GAMMADIST
A358: 0.50636537543474258 | B358: =GAMMADIST(RC[1],RC[2],RC[3],RC[4]) -> 0.50636537543474258 | C358: 0.6 | D358: 1.5 | E358: 0.5 | F358: 1 | J358: 4
A359: 0.6009248024834053 | B359: =GAMMADIST(RC[1],RC[2],RC[3],RC[4]) -> 0.6009248024834053 | C359: 1.6 | D359: 0.5 | E359: 4.5 | F359: 1 | J359: 4
A360: 0.92636171691386771 | B360: =GAMMADIST(RC[1],RC[2],RC[3],RC[4]) -> 0.92636171691386771 | C360: 1.6 | D360: 0.5 | E360: 1 | F360: 1 | J360: 4 | N360: bigdecimal
A361: 0 | B361: =GAMMADIST(RC[1],RC[2],RC[3],RC[4]) -> 0 | C361: 0 | D361: 1.5 | E361: 0.5 | F361: 0 | J361: 4
A362: 0.74459874475479892 | B362: =GAMMADIST(RC[1],RC[2],RC[3],RC[4]) -> 0.74459874475479892 | C362: 0.6 | D362: 1.5 | E362: 0.5 | F362: 0 | J362: 4
A363: 0.14734757732691886 | B363: =GAMMADIST(RC[1],RC[2],RC[3],RC[4]) -> 0.14734757732691886 | C363: 1.6 | D363: 0.5 | E363: 4.5 | F363: 0 | J363: 4
A364: 9.0052111674541857E-2 | B364: =GAMMADIST(RC[1],RC[2],RC[3],RC[4]) -> 9.0052111674541857E-2 | C364: 1.6 | D364: 0.5 | E364: 1 | F364: 0 | J364: 4
A365: 0 | B365: =GAMMADIST(RC[1],RC[2],RC[3],RC[4]) -> #NUM! | C365: -0.1 | D365: 0.5 | E365: 0.5 | F365: 1 | J365: 4 | M365: #NUM! | N365: bigdecimal
A366: 0 | B366: =GAMMADIST(RC[1],RC[2],RC[3],RC[4]) -> #NUM! | C366: 1.6 | D366: 0 | E366: 0.5 | F366: 1 | J366: 4 | M366: #NUM!
A367: 0 | B367: =GAMMADIST(RC[1],RC[2],RC[3],RC[4]) -> #NUM! | C367: 1.6 | D367: -1 | E367: 0.5 | F367: 0 | J367: 4 | M367: #NUM!
A368: 0 | B368: =GAMMADIST(RC[1],RC[2],RC[3],RC[4]) -> #NUM! | C368: 1.6 | D368: 0.5 | E368: 0 | F368: 1 | J368: 4 | M368: #NUM!
A369: 0 | B369: =GAMMADIST(RC[1],RC[2],RC[3],RC[4]) -> #NUM! | C369: 1.6 | D369: 0.5 | E369: -1 | F369: 0 | J369: 4 | K369: ... | M369: #NUM!
A371: 1 | B371: =POISSON(RC[1],RC[2],RC[3]) -> 1 | C371: 0 | D371: 0 | E371: 1 | J371: 3 | K371: POISSON | L371: POISSON
A372: 1 | B372: =POISSON(RC[1],RC[2],RC[3]) -> 1 | C372: 1 | D372: 0 | E372: 1 | J372: 3
A373: 1 | B373: =POISSON(RC[1],RC[2],RC[3]) -> 1 | C373: 2 | D373: 0 | E373: 1 | J373: 3
A374: 1 | B374: =POISSON(RC[1],RC[2],RC[3]) -> 1 | C374: 3 | D374: 0 | E374: 1 | J374: 3
A375: 0.36787944117144911 | B375: =POISSON(RC[1],RC[2],RC[3]) -> 0.36787944117144911 | C375: 0 | D375: 1 | E375: 1 | J375: 3
A376: 0.73575888234289821 | B376: =POISSON(RC[1],RC[2],RC[3]) -> 0.73575888234289821 | C376: 1 | D376: 1 | E376: 1 | J376: 3
A377: 0.91969860292862282 | B377: =POISSON(RC[1],RC[2],RC[3]) -> 0.91969860292862282 | C377: 2 | D377: 1 | E377: 1 | J377: 3
A378: 0.98101184312386447 | B378: =POISSON(RC[1],RC[2],RC[3]) -> 0.98101184312386447 | C378: 3 | D378: 1 | E378: 1 | J378: 3
A379: 0.13533528323661353 | B379: =POISSON(RC[1],RC[2],RC[3]) -> 0.13533528323661353 | C379: 0 | D379: 2 | E379: 1 | J379: 3
A380: 0.4060058497098406 | B380: =POISSON(RC[1],RC[2],RC[3]) -> 0.4060058497098406 | C380: 1 | D380: 2 | E380: 1 | J380: 3
A381: 0.67667641618306762 | B381: =POISSON(RC[1],RC[2],RC[3]) -> 0.67667641618306762 | C381: 2 | D381: 2 | E381: 1 | J381: 3
A382: 0.85712346049855237 | B382: =POISSON(RC[1],RC[2],RC[3]) -> 0.85712346049855237 | C382: 3 | D382: 2 | E382: 1 | J382: 3
A383: 2.732372244729319E-2 | B383: =POISSON(RC[1],RC[2],RC[3]) -> 2.732372244729319E-2 | C383: 0 | D383: 3.6 | E383: 1 | J383: 3
A384: 0.12568912325754869 | B384: =POISSON(RC[1],RC[2],RC[3]) -> 0.12568912325754869 | C384: 1 | D384: 3.6 | E384: 1 | J384: 3
A385: 0.30274684471600855 | B385: =POISSON(RC[1],RC[2],RC[3]) -> 0.30274684471600855 | C385: 2 | D385: 3.6 | E385: 1 | J385: 3
A386: 0.51521611046616045 | B386: =POISSON(RC[1],RC[2],RC[3]) -> 0.51521611046616045 | C386: 3 | D386: 3.6 | E386: 1 | J386: 3
A387: 0.51521611046616045 | B387: =POISSON(RC[1],RC[2],RC[3]) -> 0.51521611046616045 | C387: 3.9 | D387: 3.6 | E387: 1 | J387: 3
A388: 1 | B388: =POISSON(RC[1],RC[2],RC[3]) -> 1 | C388: 0 | D388: 0 | E388: 0 | J388: 3
A389: 0 | B389: =POISSON(RC[1],RC[2],RC[3]) -> 0 | C389: 1 | D389: 0 | E389: 0 | J389: 3
A390: 0 | B390: =POISSON(RC[1],RC[2],RC[3]) -> 0 | C390: 2 | D390: 0 | E390: 0 | J390: 3
A391: 0 | B391: =POISSON(RC[1],RC[2],RC[3]) -> 0 | C391: 3 | D391: 0 | E391: 0 | J391: 3
A392: 0.36787944117144911 | B392: =POISSON(RC[1],RC[2],RC[3]) -> 0.36787944117144911 | C392: 0 | D392: 1 | E392: 0 | J392: 3
A393: 0.36787944117144911 | B393: =POISSON(RC[1],RC[2],RC[3]) -> 0.36787944117144911 | C393: 1 | D393: 1 | E393: 0 | J393: 3
A394: 0.18393972058572455 | B394: =POISSON(RC[1],RC[2],RC[3]) -> 0.18393972058572455 | C394: 2 | D394: 1 | E394: 0 | J394: 3
A395: 6.1313240195241515E-2 | B395: =POISSON(RC[1],RC[2],RC[3]) -> 6.1313240195241515E-2 | C395: 3 | D395: 1 | E395: 0 | J395: 3
A396: 0.13533528323661353 | B396: =POISSON(RC[1],RC[2],RC[3]) -> 0.13533528323661353 | C396: 0 | D396: 2 | E396: 0 | J396: 3
A397: 0.27067056647322707 | B397: =POISSON(RC[1],RC[2],RC[3]) -> 0.27067056647322707 | C397: 1 | D397: 2 | E397: 0 | J397: 3
A398: 0.27067056647322707 | B398: =POISSON(RC[1],RC[2],RC[3]) -> 0.27067056647322707 | C398: 2 | D398: 2 | E398: 0 | J398: 3
A399: 0.18044704431548469 | B399: =POISSON(RC[1],RC[2],RC[3]) -> 0.18044704431548469 | C399: 3 | D399: 2 | E399: 0 | J399: 3
A400: 2.732372244729319E-2 | B400: =POISSON(RC[1],RC[2],RC[3]) -> 2.732372244729319E-2 | C400: 0 | D400: 3.6 | E400: 0 | J400: 3
A401: 9.8365400810255493E-2 | B401: =POISSON(RC[1],RC[2],RC[3]) -> 9.8365400810255493E-2 | C401: 1 | D401: 3.6 | E401: 0 | J401: 3
A402: 0.17705772145845985 | B402: =POISSON(RC[1],RC[2],RC[3]) -> 0.17705772145845985 | C402: 2 | D402: 3.6 | E402: 0 | J402: 3
A403: 0.21246926575015185 | B403: =POISSON(RC[1],RC[2],RC[3]) -> 0.21246926575015185 | C403: 3 | D403: 3.6 | E403: 0 | J403: 3
A404: 0.21246926575015185 | B404: =POISSON(RC[1],RC[2],RC[3]) -> 0.21246926575015185 | C404: 3.9 | D404: 3.6 | E404: 0 | J404: 3
A405: 0 | B405: =POISSON(RC[1],RC[2],RC[3]) -> #NUM! | C405: -1 | D405: 2 | E405: 1 | J405: 3 | M405: #NUM!
A406: 0 | B406: =POISSON(RC[1],RC[2],RC[3]) -> #NUM! | C406: -1 | D406: 2 | E406: 0 | J406: 3 | M406: #NUM!
A407: 0 | B407: =POISSON(RC[1],RC[2],RC[3]) -> #NUM! | C407: 2 | D407: -1 | E407: 1 | J407: 3 | M407: #NUM!
A408: 0 | B408: =POISSON(RC[1],RC[2],RC[3]) -> #NUM! | C408: 2 | D408: -1 | E408: 0 | J408: 3 | K408: ... | M408: #NUM!
A411: 0.5 | B411: =TDIST(RC[1],RC[2],RC[3]) -> 0.5 | C411: 0 | D411: 1 | E411: 1 | J411: 3 | K411: TDIST | L411: TDIST
A412: 1 | B412: =TDIST(RC[1],RC[2],RC[3]) -> 1 | C412: 0 | D412: 1 | E412: 2 | J412: 3
A413: 0.5 | B413: =TDIST(RC[1],RC[2],RC[3]) -> 0.5 | C413: 0 | D413: 10 | E413: 1 | J413: 3
A414: 0.46827448257488641 | B414: =TDIST(RC[1],RC[2],RC[3]) -> 0.46827448257488641 | C414: 0.1 | D414: 1 | E414: 1 | J414: 3
A415: 0.93654896514977282 | B415: =TDIST(RC[1],RC[2],RC[3]) -> 0.93654896514977282 | C415: 0.1 | D415: 1 | E415: 2 | J415: 3
A416: 0.46473271921017539 | B416: =TDIST(RC[1],RC[2],RC[3]) -> 0.46473271921017539 | C416: 0.1 | D416: 2 | E416: 1 | J416: 3
A417: 0.46027226555046619 | B417: =TDIST(RC[1],RC[2],RC[3]) -> 0.46027226555046619 | C417: 0.1 | D417: 100 | E417: 1 | J417: 3
A418: 3.1829927643624726E-3 | B418: =TDIST(RC[1],RC[2],RC[3]) -> 3.1829927643624726E-3 | C418: 100 | D418: 1 | E418: 1 | J418: 3
A419: 4.9992501245380026E-5 | B419: =TDIST(RC[1],RC[2],RC[3]) -> 4.9992501245380026E-5 | C419: 100 | D419: 2 | E419: 1 | J419: 3
A420: 5.7249147038858604E-2 | B420: =TDIST(RC[1],RC[2],RC[3]) -> 5.7249147038858604E-2 | C420: 5.5 | D420: 1 | E420: 1 | J420: 3
A421: 1.5752001519251217E-2 | B421: =TDIST(RC[1],RC[2],RC[3]) -> 1.5752001519251217E-2 | C421: 5.5 | D421: 2 | E421: 1 | J421: 3
A422: 1.4617107210140738E-7 | B422: =TDIST(RC[1],RC[2],RC[3]) -> 1.4617107210140738E-7 | C422: 5.5 | D422: 100 | E422: 1 | J422: 3
A423: 1.4617107210140738E-7 | B423: =TDIST(RC[1],RC[2],RC[3]) -> 1.4617107210140738E-7 | C423: 5.5 | D423: 100.9 | E423: 1 | J423: 3
A424: 1.4617107210140738E-7 | B424: =TDIST(RC[1],RC[2],RC[3]) -> 1.4617107210140738E-7 | C424: 5.5 | D424: 100 | E424: 1.9 | J424: 3
A425: 2.9234214420281476E-7 | B425: =TDIST(RC[1],RC[2],RC[3]) -> 2.9234214420281476E-7 | C425: 5.5 | D425: 100 | E425: 2.9 | J425: 3
A426: 0 | B426: =TDIST(RC[1],RC[2],RC[3]) -> #NUM! | C426: -1 | D426: 2 | E426: 1 | J426: 3 | M426: #NUM!
A427: 0 | B427: =TDIST(RC[1],RC[2],RC[3]) -> #NUM! | C427: 1 | D427: 0 | E427: 1 | J427: 3 | M427: #NUM!
A428: 0 | B428: =TDIST(RC[1],RC[2],RC[3]) -> #NUM! | C428: 1 | D428: 2 | E428: 0 | J428: 3 | M428: #NUM!
A429: 0 | B429: =TDIST(RC[1],RC[2],RC[3]) -> #NUM! | C429: 1 | D429: 2 | E429: 3 | J429: 3 | K429: ... | M429: #NUM!
A431: 0.89779734611509998 | B431: =BETAINV(RC[1],RC[2],RC[3]) -> 0.8977973461151123 | C431: 0.6 | D431: 1.5 | E431: 0.5 | J431: 3 | K431: BETAINV | L431: BETAINV | N431: bigdecimal
A432: 0 | B432: =BETAINV(RC[1],RC[2],RC[3]) -> #NUM! | C432: 0.6 | D432: 0 | E432: 0.5 | J432: 3 | M432: #NUM!
A433: 0 | B433: =BETAINV(RC[1],RC[2],RC[3]) -> #NUM! | C433: 0.6 | D433: 1.5 | E433: 0 | J433: 3 | M433: #NUM!
A434: 0.36008882522583008 | B434: =BETAINV(RC[1],RC[2],RC[3]) -> 0.36008882522583008 | C434: 0.45 | D434: 2.2 | E434: 3.3 | J434: 3 | K434: ... | N434: bigdecimal
A436: 0.36008882522583008 | B436: =BETAINV(RC[1],RC[2],RC[3],RC[4],RC[5]) -> 0.36008882522583008 | C436: 0.45 | D436: 2.2 | E436: 3.3 | F436: 0 | G436: 1 | J436: 5 | N436: bigdecimal
A437: 0 | B437: =BETAINV(RC[1],RC[2],RC[3],RC[4],RC[5]) -> #NUM! | C437: 0.45 | D437: 2.2 | E437: 3.3 | F437: 3 | G437: 1 | J437: 5 | M437: #NUM!
A438: 0.7488986730575562 | B438: =BETAINV(RC[1],RC[2],RC[3],RC[4],RC[5]) -> 0.7488986730575562 | C438: 0.6 | D438: 1.5 | E438: 0.5 | F438: 0.3 | G438: 0.8 | J438: 5 | N438: bigdecimal
A439: 0.36008882522583008 | B439: =BETAINV(RC[1],RC[2],RC[3],RC[4],RC[5]) -> 0.36008882522583008 | C439: 0.45 | D439: 2.2 | E439: 3.3 | F439: 0 | G439: 1 | J439: 5 | N439: bigdecimal
A440: 0 | B440: =BETAINV(RC[1],RC[2],RC[3],RC[4],RC[5]) -> #NUM! | C440: 1.1 | D440: 2.2 | E440: 3.3 | F440: 0 | G440: 1 | J440: 5 | M440: #NUM!
A441: 0 | B441: =BETAINV(RC[1],RC[2],RC[3],RC[4],RC[5]) -> #NUM! | C441: -0.1 | D441: 2.2 | E441: 3.3 | F441: 0 | G441: 1 | J441: 5 | K441: ... | M441: #NUM!
A443: 0.92845814228057866 | B443: =BETAINV(RC[1],RC[2],RC[3],RC[4]) -> 0.92845814228057866 | C443: 0.6 | D443: 1.5 | E443: 0.5 | F443: 0.3 | J443: 4
A445: 3.2188758249516325 | B445: =CHIINV(RC[1],RC[2]) -> 3.2188758249516325 | C445: 0.2 | D445: 2.4 | J445: 2 | K445: CHIINV | L445: CHIINV
A446: 0.41389331157281367 | B446: =CHIINV(RC[1],RC[2]) -> 0.41389331157281367 | C446: 0.52 | D446: 1 | J446: 2
A447: 2.8051184564879357 | B447: =CHIINV(RC[1],RC[2]) -> 2.8051184564879357 | C447: 0.73 | D447: 5 | J447: 2 | N447: bigdecimal
A448: 2.8051184564879357 | B448: =CHIINV(RC[1],RC[2]) -> 2.8051184564879357 | C448: 0.73 | D448: 5.42 | J448: 2 | N448: bigdecimal
A449: 5.7494096892744677 | B449: =CHIINV(RC[1],RC[2]) -> 5.7494096892744677 | C449: 0.99990000000000001 | D449: 23 | J449: 2 | N449: bigdecimal
A450: 32.006899668662996 | B450: =CHIINV(RC[1],RC[2]) -> 32.006899668662996 | C450: 0.1 | D450: 23 | J450: 2 | N450: bigdecimal
A451: 35.997362273827306 | B451: =CHIINV(RC[1],RC[2]) -> 35.997362273827306 | C451: 0.33 | D451: 33 | J451: 2 | N451: bigdecimal
A452: 78.749524251002299 | B452: =CHIINV(RC[1],RC[2]) -> 78.749524251002299 | C452: 1E-3 | D452: 44 | J452: 2 | N452: bigdecimal
A453: 2.4079456087353042 | B453: =CHIINV(RC[1],RC[2]) -> 2.4079456087353042 | C453: 0.3 | D453: 2.4 | J453: 2
A454: 13.815510558047702 | B454: =CHIINV(RC[1],RC[2]) -> 13.815510558047702 | C454: 1E-3 | D454: 2 | J454: 2
A455: 0 | B455: =CHIINV(RC[1],RC[2]) -> #NUM! | C455: 0.2 | D455: 0.99 | J455: 2 | M455: #NUM!
A456: 0 | B456: =CHIINV(RC[1],RC[2]) -> #NUM! | C456: 0.2 | D456: 100000000000 | J456: 2 | K456: ... | M456: #NUM!
A458: 0.66666666682317799 | B458: =FINV(RC[1],RC[2],RC[3]) -> 0.66666666682317799 | C458: 0.5 | D458: 1.9 | E458: 2.4 | J458: 3 | K458: FINV | L458: FINV
A459: 0 | B459: =FINV(RC[1],RC[2],RC[3]) -> 0 | C459: 1 | D459: 4 | E459: 2.4 | J459: 3
A460: 1000000000 | B460: =FINV(RC[1],RC[2],RC[3]) -> 1000000000 | C460: 0 | D460: 1 | E460: 2 | J460: 3
A461: 8.4512850532154502 | B461: =FINV(RC[1],RC[2],RC[3]) -> 8.4512850532154502 | C461: 0.01 | D461: 3.6 | E461: 7.9 | J461: 3
A462: 0.62323513415735854 | B462: =FINV(RC[1],RC[2],RC[3]) -> 0.62323513415735854 | C462: 0.7 | D462: 5 | E462: 3 | J462: 3 | N462: bigdecimal
A463: 18.772269815522307 | B463: =FINV(RC[1],RC[2],RC[3]) -> 18.772269815522307 | C463: 1E-3 | D463: 3.6 | E463: 7.9 | J463: 3
A464: 0 | B464: =FINV(RC[1],RC[2],RC[3]) -> #NUM! | C464: -0.01 | D464: 1.9 | E464: 2.4 | J464: 3 | M464: #NUM!
A465: 0 | B465: =FINV(RC[1],RC[2],RC[3]) -> #NUM! | C465: 0.5 | D465: 0.7 | E465: 2.4 | J465: 3 | M465: #NUM!
A466: 0 | B466: =FINV(RC[1],RC[2],RC[3]) -> #NUM! | C466: 0.5 | D466: 1.9 | E466: 100000000000 | J466: 3 | K466: ... | M466: #NUM!
A468: 0.6043677771171635 | B468: =FISHERINV(RC[1]) -> 0.6043677771171635 | C468: 0.7 | J468: 1 | K468: FISHERINV | L468: FISHERINV
A469: 0 | B469: =FISHERINV(RC[1]) -> 0 | C469: 0 | J469: 1
A470: 0.76117386166056999 | B470: =FISHERINV(RC[1]) -> 0.76117386166056999 | C470: 0.999 | J470: 1
A471: 9.999666679999443E-3 | B471: =FISHERINV(RC[1]) -> 9.999666679999443E-3 | C471: 0.01 | J471: 1
A472: 0.46211715726000974 | B472: =FISHERINV(RC[1]) -> 0.46211715726000974 | C472: 0.5 | J472: 1
A473: -0.46211715726000974 | B473: =FISHERINV(RC[1]) -> -0.46211715726000974 | C473: -0.5 | J473: 1
A474: 0.22982054821431688 | B474: =FISHERINV(RC[1]) -> 0.22982054821431688 | C474: 0.23400000000000001 | J474: 1
A475: 0.99990920426259511 | B475: =FISHERINV(RC[1]) -> 0.99990920426259511 | C475: 5 | J475: 1
A476: 0.99999999944210638 | B476: =FISHERINV(RC[1]) -> 0.99999999944210638 | C476: 11 | J476: 1 | N476: long
A477: -0.99999999944210638 | B477: =FISHERINV(RC[1]) -> -0.99999999944210638 | C477: -11 | J477: 1 | K477: ...
A479: 4.9519155473157959 | B479: =GAMMAINV(RC[1],RC[2],RC[3]) -> 4.9519155473157959 | C479: 6.5000000000000002E-2 | D479: 9 | E479: 1 | J479: 3 | K479: GAMMAINV | L479: GAMMAINV | N479: bigdecimal
A480: 1.5141277326714913 | B480: =GAMMAINV(RC[1],RC[2],RC[3]) -> 1.5141277326714913 | C480: 0.78 | D480: 1 | E480: 1 | J480: 3
A481: 0 | B481: =GAMMAINV(RC[1],RC[2],RC[3]) -> 0 | C481: 0 | D481: 3 | E481: 2 | J481: 3
A482: 18.417894393294752 | B482: =GAMMAINV(RC[1],RC[2],RC[3]) -> 18.417894393294752 | C482: 0.7 | D482: 8 | E482: 2 | J482: 3
A483: 3.0154804227868324 | B483: =GAMMAINV(RC[1],RC[2],RC[3]) -> 3.0154804227868324 | C483: 0.35 | D483: 1 | E483: 7 | J483: 3 | N483: bigdecimal
A484: 80.865402328797416 | B484: =GAMMAINV(RC[1],RC[2],RC[3]) -> 80.865402328797416 | C484: 0.98 | D484: 9 | E484: 5 | J484: 3
A485: 134.79313771398529 | B485: =GAMMAINV(RC[1],RC[2],RC[3]) -> 134.79313771398529 | C485: 0.99 | D485: 23.2 | E485: 3.76 | J485: 3 | N485: bigdecimal
A486: 0 | B486: =GAMMAINV(RC[1],RC[2],RC[3]) -> #NUM! | C486: -0.01 | D486: 9 | E486: 1 | J486: 3 | M486: #NUM!
A487: 0 | B487: =GAMMAINV(RC[1],RC[2],RC[3]) -> #NUM! | C487: 1.01 | D487: 9 | E487: 1 | J487: 3 | M487: #NUM!
A488: 0 | B488: =GAMMAINV(RC[1],RC[2],RC[3]) -> #NUM! | C488: 0.77 | D488: 9 | E488: -1 | J488: 3 | M488: #NUM!
A489: 0 | B489: =GAMMAINV(RC[1],RC[2],RC[3]) -> #NUM! | C489: 0.35 | D489: -0.01 | E489: 100 | J489: 3 | M489: #NUM!
A490: 0 | B490: =GAMMAINV(RC[1],RC[2],RC[3]) -> #NUM! | C490: 0.35 | D490: 0 | E490: 100 | J490: 3 | K490: ... | M490: #NUM!
A492: 1.8797510544618512 | B492: =TINV(RC[1],RC[2]) -> 1.8797510544618512 | C492: 6.5000000000000002E-2 | D492: 60 | J492: 2 | K492: TINV | L492: TINV | N492: bigdecimal
A493: 8.4314274026127722E-8 | B493: =TINV(RC[1],RC[2]) -> 8.4314274026127722E-8 | C493: 1 | D493: 123 | J493: 2 | N493: bigdecimal
A494: 1 | B494: =TINV(RC[1],RC[2]) -> 0.99999999999999978 | C494: 0.5 | D494: 1 | J494: 2
A495: 0.81649658102356915 | B495: =TINV(RC[1],RC[2]) -> 0.81649658102356915 | C495: 0.5 | D495: 2 | J495: 2
A496: 0.5095254497089412 | B496: =TINV(RC[1],RC[2]) -> 0.5095254497089412 | C496: 0.7 | D496: 1 | J496: 2
A497: 2.9467128828348832 | B497: =TINV(RC[1],RC[2]) -> 2.9467128828348832 | C497: 0.01 | D497: 15 | J497: 2
A498: 0 | B498: =TINV(RC[1],RC[2]) -> #NUM! | C498: 1.1 | D498: 60 | J498: 2 | M498: #NUM!
A499: 0 | B499: =TINV(RC[1],RC[2]) -> #NUM! | C499: 6.5000000000000002E-2 | D499: -1 | J499: 2 | M499: #NUM!
A500: 0 | B500: =TINV(RC[1],RC[2]) -> #NUM! | C500: 6.5000000000000002E-2 | D500: 0 | J500: 2 | M500: #NUM!
A501: 0 | B501: =TINV(RC[1],RC[2]) -> #NUM! | C501: -0.01 | D501: 2 | J501: 2 | M501: #NUM!
A502: 0 | B502: =TINV(RC[1],RC[2]) -> #NUM! | C502: 1.01 | D502: 3 | J502: 2 | K502: ... | M502: #NUM!
A504: 1 | B504: =HYPGEOMDIST(RC[1],RC[2],RC[3],RC[4]) -> 1 | C504: 3 | D504: 5 | E504: 3 | F504: 5 | J504: 4 | K504: HYPGEOMDIST | L504: HYPGEOMDIST
A505: 1 | B505: =HYPGEOMDIST(RC[1],RC[2],RC[3],RC[4]) -> 1 | C505: 5 | D505: 5 | E505: 5 | F505: 5 | J505: 4
A506: 1 | B506: =HYPGEOMDIST(RC[1],RC[2],RC[3],RC[4]) -> 1 | C506: 2 | D506: 2 | E506: 4 | F506: 4 | J506: 4
A507: 0.1 | B507: =HYPGEOMDIST(RC[1],RC[2],RC[3],RC[4]) -> 0.1 | C507: 3 | D507: 3 | E507: 3 | F507: 5 | J507: 4
A508: 2.0545438947367722E-2 | B508: =HYPGEOMDIST(RC[1],RC[2],RC[3],RC[4]) -> 2.0545438947367722E-2 | C508: 1420 | D508: 5000 | E508: 2000 | F508: 7000 | J508: 4
A509: 0.39912280701754399 | B509: =HYPGEOMDIST(RC[1],RC[2],RC[3],RC[4]) -> 0.39912280701754399 | C509: 12.5 | D509: 15.8 | E509: 17 | F509: 20 | J509: 4
A510: 1.4734987713545556E-143 | B510: =HYPGEOMDIST(RC[1],RC[2],RC[3],RC[4]) -> 4.008407827379104E-219 | C510: 200 | D510: 200 | E510: 200 | F510: 1027 | J510: 4
A511: 3.1158540466480204E-2 | B511: =HYPGEOMDIST(RC[1],RC[2],RC[3],RC[4]) -> 3.1158540466480204E-2 | C511: 150 | D511: 500 | E511: 200 | F511: 700 | J511: 4
A512: 0.46233230134158926 | B512: =HYPGEOMDIST(RC[1],RC[2],RC[3],RC[4]) -> 0.46233230134158926 | C512: 1 | D512: 4 | E512: 4 | F512: 20 | J512: 4
A513: 0.46052631578947373 | B513: =HYPGEOMDIST(RC[1],RC[2],RC[3],RC[4]) -> 0.46052631578947373 | C513: 1 | D513: 5 | E513: 3 | F513: 20 | J513: 4
A514: 0.13157894736842107 | B514: =HYPGEOMDIST(RC[1],RC[2],RC[3],RC[4]) -> 0.13157894736842107 | C514: 2 | D514: 5 | E514: 3 | F514: 20 | J514: 4
A515: 8.7719298245614048E-3 | B515: =HYPGEOMDIST(RC[1],RC[2],RC[3],RC[4]) -> 8.7719298245614048E-3 | C515: 3 | D515: 5 | E515: 3 | F515: 20 | J515: 4
A516: 3.9824620818412155E-308 | B516: =HYPGEOMDIST(RC[1],RC[2],RC[3],RC[4]) -> 3.9824620818412155E-308 | C516: 500 | D516: 500 | E516: 500 | F516: 1027 | J516: 4
A517: 1.8756333854232614E-9 | B517: =HYPGEOMDIST(RC[1],RC[2],RC[3],RC[4]) -> 1.8756333854232614E-9 | C517: 12 | D517: 23 | E517: 45 | F517: 654 | J517: 4
A518: 3.1158540466480204E-2 | B518: =HYPGEOMDIST(RC[1],RC[2],RC[3],RC[4]) -> 3.1158540466480204E-2 | C518: 150.5 | D518: 500.3 | E518: 200.7 | F518: 700 | J518: 4
A519: 2.0545438947367722E-2 | B519: =HYPGEOMDIST(RC[1],RC[2],RC[3],RC[4]) -> 2.0545438947367722E-2 | C519: 1420 | D519: 5000 | E519: 2000 | F519: 7000 | J519: 4
A520: 4.008407827379104E-219 | B520: =HYPGEOMDIST(RC[1],RC[2],RC[3],RC[4]) -> 4.008407827379104E-219 | C520: 200 | D520: 200 | E520: 200 | F520: 1027 | J520: 4
A521: 0.14285714285714285 | B521: =HYPGEOMDIST(RC[1],RC[2],RC[3],RC[4]) -> 0.14285714285714285 | C521: 1 | D521: 5 | E521: 3 | F521: 7 | J521: 4 | K521: ...
A523: 1 | B523: =RSQ(RC[1]:RC[3],RC[4]:RC[6]) -> 1 | C523: 1 | D523: 2 | E523: 1 | F523: 1 | G523: 2 | H523: 1 | J523: 6 | K523: RSQ | L523: RSQ
A524: 0 | B524: =RSQ(RC[1]:RC[3],RC[4]:RC[6]) -> 0 | C524: 1 | D524: 2 | E524: 3 | F524: 1 | G524: 2 | H524: 1 | J524: 6
A525: 0.25 | B525: =RSQ(RC[1]:RC[3],RC[4]:RC[6]) -> 0.25000000000000011 | C525: 1 | D525: 2 | E525: 1 | F525: 1 | G525: 2 | H525: 2 | J525: 6
A526: 0.87335266209804974 | B526: =RSQ(RC[1]:RC[3],RC[4]:RC[6]) -> 0.87335266209804974 | C526: 10 | D526: 0 | E526: 30 | F526: 1 | G526: 2 | H526: 30 | J526: 6
A527: 0.75 | B527: =RSQ(RC[1]:RC[3],RC[4]:RC[6]) -> 0.74999999999999989 | C527: 2.2 | D527: 3 | E527: 2 | F527: 3 | G527: 4 | H527: 1 | J527: 6
A528: 0.91627082016676509 | B528: =RSQ(RC[1]:RC[3],RC[4]:RC[6]) -> 0.91627082016676509 | C528: 2.4 | D528: 3.5 | E528: 2 | F528: 3 | G528: 4.8 | H528: 1 | J528: 6
A529: 0.57142857142857151 | B529: =RSQ(RC[1]:RC[3],RC[4]:RC[6]) -> 0.57142857142857151 | C529: 2 | D529: 3 | E529: 2 | F529: 3 | G529: 4 | H529: 1 | J529: 6
A530: 0.13775510204081634 | B530: =RSQ(RC[1]:RC[3],RC[4]:RC[6]) -> 0.13775510204081634 | C530: 3 | D530: 4 | E530: 22 | F530: -3 | G530: 2 | H530: 1 | J530: 6
A531: 0.66947766627309657 | B531: =RSQ(RC[1]:RC[3],RC[4]:RC[6]) -> 0.66947766627309657 | C531: 56 | D531: 51 | E531: 37.58 | F531: 71 | G531: 39 | H531: 32 | J531: 6
A532: 8.1843715287415089E-2 | B532: =RSQ(RC[1]:RC[3],RC[4]:RC[6]) -> 8.1843715287415089E-2 | C532: 123 | D532: 12312 | E532: 123123 | F532: 459 | G532: 34232 | H532: 5657 | J532: 6 | N532: long
A533: 0 | B533: =RSQ(RC[1]:RC[3],RC[4]:RC[6]) -> #DIV/0! | C533: 3 | D533: 3 | E533: 3 | F533: 3 | G533: 4 | H533: 1 | J533: 6 | K533: ... | M533: #DIV/0!
A535: 1 | B535: =RSQ(RC[1]:RC[2],RC[3]:RC[4]) -> 1 | C535: 2 | D535: 44 | E535: 34 | F535: -2 | J535: 4
A537: 0.5 | B537: =PEARSON(RC[1]:RC[3],RC[4]:RC[6]) -> 0.50000000000000011 | C537: 2 | D537: 2 | E537: 1 | F537: 2 | G537: 1 | H537: 1 | J537: 6 | K537: PEARSON | L537: PEARSON
A538: -0.8660254037844386 | B538: =PEARSON(RC[1]:RC[3],RC[4]:RC[6]) -> -0.8660254037844386 | C538: 1 | D538: 2 | E538: 1 | F538: 2 | G538: 0 | H538: 1 | J538: 6
A539: 0.81821614887088157 | B539: =PEARSON(RC[1]:RC[3],RC[4]:RC[6]) -> 0.81821614887088157 | C539: 56 | D539: 51 | E539: 37.58 | F539: 71 | G539: 39 | H539: 32 | J539: 6
A540: 0.99820694436040547 | B540: =PEARSON(RC[1]:RC[3],RC[4]:RC[6]) -> 0.99820694436040547 | C540: 12332 | D540: 2311 | E540: 232311 | F540: 3234 | G540: 3455 | H540: 12312 | J540: 6 | N540: long
A541: -0.27300239632881634 | B541: =PEARSON(RC[1]:RC[3],RC[4]:RC[6]) -> -0.27300239632881634 | C541: 3 | D541: 4 | E541: -6 | F541: -4 | G541: 2 | H541: 1 | J541: 6
A542: 0.91455388958772676 | B542: =PEARSON(RC[1]:RC[3],RC[4]:RC[6]) -> 0.91455388958772676 | C542: 2.3450000000000002 | D542: 3.45 | E542: 1.87 | F542: 3 | G542: 4 | H542: 1 | J542: 6
A543: -0.94491118252306794 | B543: =PEARSON(RC[1]:RC[3],RC[4]:RC[6]) -> -0.94491118252306794 | C543: 3 | D543: 4 | E543: 6 | F543: 2 | G543: 2 | H543: 1 | J543: 6
A544: 0.24346831983299175 | B544: =PEARSON(RC[1]:RC[3],RC[4]:RC[6]) -> 0.24346831983299175 | C544: 33 | D544: 3 | E544: 1 | F544: 3 | G544: 4 | H544: 1 | J544: 6
A545: -0.94491118252306794 | B545: =PEARSON(RC[1]:RC[3],RC[4]:RC[6]) -> -0.94491118252306794 | C545: 3 | D545: 4 | E545: 6 | F545: 2 | G545: 2 | H545: 1 | J545: 6
A546: -0.94491118252306794 | B546: =PEARSON(RC[1]:RC[3],RC[4]:RC[6]) -> -0.94491118252306794 | C546: 3 | D546: 4 | E546: 6 | F546: 2 | G546: 2 | H546: 1 | J546: 6
A547: 0.24346831983299175 | B547: =PEARSON(RC[1]:RC[3],RC[4]:RC[6]) -> 0.24346831983299175 | C547: 33 | D547: 3 | E547: 1 | F547: 3 | G547: 4 | H547: 1 | J547: 6
A548: 0 | B548: =PEARSON(RC[1]:RC[3],RC[4]:RC[6]) -> #DIV/0! | C548: 3 | D548: 3 | E548: 3 | F548: 3 | G548: 4 | H548: 1 | J548: 6 | K548: ... | M548: #DIV/0!
A550: 0.17494279632813969 | B550: =TTEST(RC[1]:RC[2],RC[3]:RC[4],RC[5],RC[6]) -> 0.17494279632813969 | C550: 1 | D550: 2 | E550: 2 | F550: 4 | G550: 1 | H550: 3 | J550: 6 | K550: TTEST | L550: TTEST
A551: 0.10241638233196894 | B551: =TTEST(RC[1]:RC[2],RC[3]:RC[4],RC[5],RC[6]) -> 0.10241638233196894 | C551: 1 | D551: 2 | E551: 2 | F551: 4 | G551: 1 | H551: 1 | J551: 6
A552: 0.15587639889012159 | B552: =TTEST(RC[1]:RC[2],RC[3]:RC[4],RC[5],RC[6]) -> 0.15587639889012159 | C552: 1 | D552: 2 | E552: 2 | F552: 4 | G552: 1 | H552: 2 | J552: 6
A553: 0.12198347391450554 | B553: =TTEST(RC[1]:RC[2],RC[3]:RC[4],RC[5],RC[6]) -> 0.12198347391450554 | C553: -11 | D553: 0 | E553: 20 | F553: 40 | G553: 2 | H553: 3 | J553: 6
A554: 0.15018832294241363 | B554: =TTEST(RC[1]:RC[2],RC[3]:RC[4],RC[5],RC[6]) -> 0.15018832294241363 | C554: 100 | D554: 89 | E554: 73 | F554: 24 | G554: 1 | H554: 3 | J554: 6
A555: 0.84282992758516606 | B555: =TTEST(RC[1]:RC[2],RC[3]:RC[4],RC[5],RC[6]) -> 0.84282992758516606 | C555: 1002 | D555: 3456 | E555: 2342 | F555: 1213 | G555: 2 | H555: 1 | J555: 6 | N555: long
A556: 3.0266341163186811E-3 | B556: =TTEST(RC[1]:RC[2],RC[3]:RC[4],RC[5],RC[6]) -> 3.0266341163186811E-3 | C556: 11233 | D556: 12321 | E556: 34556 | F556: 32423 | G556: 2 | H556: 2 | J556: 6 | N556: long
A557: 0.22492153157886419 | B557: =TTEST(RC[1]:RC[2],RC[3]:RC[4],RC[5],RC[6]) -> 0.22492153157886419 | C557: -234 | D557: 546 | E557: 5342 | F557: 0 | G557: 1 | H557: 2 | J557: 6 | N557: long
A558: 0.40907121665655194 | B558: =TTEST(RC[1]:RC[2],RC[3]:RC[4],RC[5],RC[6]) -> 0.40907121665655194 | C558: 1.34 | D558: 2.48 | E558: -2.25 | F558: 4.44 | G558: 1 | H558: 1 | J558: 6
A559: 0.4162806083912417 | B559: =TTEST(RC[1]:RC[2],RC[3]:RC[4],RC[5],RC[6]) -> 0.4162806083912417 | C559: 1.34 | D559: 2.48 | E559: -2.25 | F559: 4.44 | G559: 1 | H559: 2 | J559: 6
A560: 0.42412415824824423 | B560: =TTEST(RC[1]:RC[2],RC[3]:RC[4],RC[5],RC[6]) -> 0.42412415824824423 | C560: 1.34 | D560: 2.48 | E560: -2.25 | F560: 4.44 | G560: 1 | H560: 3 | J560: 6
A561: 1.0045910514878575E-2 | B561: =TTEST(RC[1]:RC[2],RC[3]:RC[4],RC[5],RC[6]) -> 1.0045910514878575E-2 | C561: 11233 | D561: 12321 | E561: 34556 | F561: 32423 | G561: 2 | H561: 3 | J561: 6 | N561: long
A562: 0 | B562: =TTEST(RC[1]:RC[2],RC[3]:RC[4],RC[5],RC[6]) -> #DIV/0! | C562: 1 | D562: 2 | E562: 3 | F562: 4 | G562: 2 | H562: 1 | J562: 6 | M562: #DIV/0!
A563: 0 | B563: =TTEST(RC[1]:RC[2],RC[3]:RC[4],RC[5],RC[6]) -> #DIV/0! | C563: 2 | D563: 2 | E563: 2 | F563: 2 | G563: 2 | H563: 2 | J563: 6 | M563: #DIV/0!
A564: 0 | B564: =TTEST(RC[1]:RC[2],RC[3]:RC[4],RC[5],RC[6]) -> #DIV/0! | C564: 3 | D564: 3 | E564: 4 | F564: 4 | G564: 2 | H564: 3 | J564: 6 | M564: #DIV/0!
A565: 0 | B565: =TTEST(RC[1]:RC[2],RC[3]:RC[4],RC[5],RC[6]) -> #NUM! | C565: 1 | D565: 2 | E565: 3 | F565: 4 | G565: 4 | H565: 1 | J565: 6 | K565: ... | M565: #NUM!
A567: 0.46017216272297101 | B567: =ZTEST(RC[1]:RC[4],RC[5],RC[6]) -> 0.46017216272297101 | C567: 3 | D567: 3 | E567: 7 | F567: 4 | G567: 4 | H567: 5 | J567: 6 | K567: ZTEST | L567: ZTEST
A568: 0.88493032977829178 | B568: =ZTEST(RC[1]:RC[4],RC[5],RC[6]) -> 0.88493032977829178 | C568: 3 | D568: 6 | E568: 7 | F568: 8 | G568: 9 | H568: 5 | J568: 6 | K568: ...
A570: 0.96776725996108992 | B570: =ZTEST(RC[1]:RC[4],RC[5]) -> 0.96776725996108992 | C570: 3 | D570: 3 | E570: 7 | F570: 4 | G570: 6 | J570: 5
A571: 0.13666083914614902 | B571: =ZTEST(RC[1]:RC[4],RC[5]) -> 0.13666083914614902 | C571: 3 | D571: 6 | E571: 7 | F571: 4 | G571: 4 | J571: 5 | K571: ...
A573: 0.61720275800211788 | B573: =ZTEST(RC[1]:RC[5],RC[6],RC[7]) -> 0.61720275800211788 | C573: 2 | D573: 3 | E573: 7 | F573: 4 | G573: 2 | H573: 4 | I573: 3 | J573: 7
A574: 0.91014375256050006 | B574: =ZTEST(RC[1]:RC[5],RC[6],RC[7]) -> 0.91014375256050006 | C574: -1 | D574: 0 | E574: 7 | F574: 4 | G574: 4 | H574: 4 | I574: 2 | J574: 7
A575: 0 | B575: =ZTEST(RC[1]:RC[5],RC[6],RC[7]) -> 0 | C575: 2 | D575: 3 | E575: 7 | F575: 4 | G575: 4 | H575: 0 | I575: 1 | J575: 7
A576: 3.1203709284352898E-2 | B576: =ZTEST(RC[1]:RC[5],RC[6],RC[7]) -> 3.1203709284352898E-2 | C576: 2 | D576: 3 | E576: 7 | F576: 4 | G576: 4 | H576: -1 | I576: 6 | J576: 7
A577: 0.35217539352500737 | B577: =ZTEST(RC[1]:RC[5],RC[6],RC[7]) -> 0.35217539352500737 | C577: 1993 | D577: 2231 | E577: 4565 | F577: 2311 | G577: 2312 | H577: 2324 | I577: 2112 | J577: 7
A578: 0.17574708802314143 | B578: =ZTEST(RC[1]:RC[5],RC[6],RC[7]) -> 0.17574708802314143 | C578: 2.2 | D578: 3.8 | E578: 7.5 | F578: 0 | G578: 4 | H578: 1 | I578: 6 | J578: 7
A579: 0.5 | B579: =ZTEST(RC[1]:RC[5],RC[6],RC[7]) -> 0.5 | C579: 2 | D579: 2 | E579: 2 | F579: 2 | G579: 2 | H579: 2 | I579: 2 | J579: 7 | K579: ...
A581: 1 | B581: =CHITEST(RC[1]:RC[3],RC[4]:RC[6]) -> 1 | C581: 1 | D581: 1 | E581: 1 | F581: 1 | G581: 1 | H581: 1 | J581: 6 | K581: CHITEST | L581: CHITEST
A582: 1.5888560447750184E-2 | B582: =CHITEST(RC[1]:RC[3],RC[4]:RC[6]) -> 1.5888560447750184E-2 | C582: 58 | D582: 11 | E582: 10 | F582: 45.35 | G582: 17.56 | H582: 16.09 | J582: 6
A583: 1 | B583: =CHITEST(RC[1]:RC[3],RC[4]:RC[6]) -> 1 | C583: 1 | D583: 1 | E583: 1 | F583: 1 | G583: 1 | H583: 1 | J583: 6
A584: 0.10539922456626115 | B584: =CHITEST(RC[1]:RC[3],RC[4]:RC[6]) -> 0.10539922456626115 | C584: 12 | D584: 3 | E584: 4 | F584: 18 | G584: 2 | H584: 2 | J584: 6
A585: 7.0473382134030149E-2 | B585: =CHITEST(RC[1]:RC[3],RC[4]:RC[6]) -> 7.0473382134030149E-2 | C585: 4 | D585: 0 | E585: 10 | F585: 2 | G585: 1 | H585: 16.09 | J585: 6
A586: 5.0305759849015211E-2 | B586: =CHITEST(RC[1]:RC[3],RC[4]:RC[6]) -> 5.0305759849015211E-2 | C586: 58 | D586: 11 | E586: 10 | F586: 45.35 | G586: 17.56 | H586: 10 | J586: 6
A587: 5.0305759849015211E-2 | B587: =CHITEST(RC[1]:RC[3],RC[4]:RC[6]) -> 5.0305759849015211E-2 | C587: 58 | D587: 11 | E587: 10 | F587: 45.35 | G587: 17.56 | H587: 10 | J587: 6
A588: 0.43562342027690992 | B588: =CHITEST(RC[1]:RC[3],RC[4]:RC[6]) -> 0.43562342027690992 | C588: 12345 | D588: 12345 | E588: 32345 | F588: 12312 | G588: 12323 | H588: 32123 | J588: 6
A589: 0.36720084811731268 | B589: =CHITEST(RC[1]:RC[3],RC[4]:RC[6]) -> 0.36720084811731268 | C589: -11 | D589: 17 | E589: 10.32 | F589: -12 | G589: 17.56 | H589: 16.09 | J589: 6
A590: 0 | B590: =CHITEST(RC[1]:RC[3],RC[4]:RC[6]) -> #DIV/0! | C590: 1 | D590: 1 | E590: 1 | F590: 1 | G590: 0 | H590: 1 | J590: 6 | K590: ... | M590: #DIV/0!
A592: 0.52708925723818778 | B592: =CHITEST(RC[1]:RC[2],RC[3]:RC[4]) -> 0.52708925723818778 | C592: 12 | D592: 11 | E592: 10 | F592: 11 | J592: 4
A593: 0 | B593: =CHITEST(RC[1]:RC[3],RC[4]:RC[5]) -> #N/A | C593: 58 | D593: 11 | E593: 10 | F593: 45.35 | G593: 17.56 | J593: 5 | M593: #N/A
A594: 1.073954491118552E-2 | B594: =CHITEST(RC[1]:R[1]C[3],RC[4]:R[1]C[6]) -> 1.073954491118552E-2 | C594: 58 | D594: 11 | E594: 10 | F594: 45.35 | G594: 17.56 | H594: 16.09 | J594: 6
A595: 0 | B595: =CHITEST(R[-1]C[1]:RC[3],R[-1]C[4]:RC[5]) -> #N/A | C595: 2 | D595: 3 | E595: 4 | F595: 3 | G595: 4 | H595: 5 | J595: 6 | M595: #N/A
A597: 0.4374999999989781 | B597: =FTEST(RC[1]:RC[3],RC[4]:RC[6]) -> 0.4374999999989781 | C597: 2.2 | D597: 2 | E597: 3 | F597: 4 | G597: 5 | H597: 6 | J597: 6 | K597: FTEST | L597: FTEST
A598: 0.84950825755971504 | B598: =FTEST(RC[1]:RC[3],RC[4]:RC[6]) -> 0.84950825755971504 | C598: -2 | D598: 2 | E598: 3.3 | F598: 0 | G598: 5 | H598: 6 | J598: 6
A599: 0.69999999999836493 | B599: =FTEST(RC[1]:RC[3],RC[4]:RC[6]) -> 0.69999999999836493 | C599: 0 | D599: 1 | E599: 3 | F599: -1 | G599: 3 | H599: 0 | J599: 6
A600: 0.45101173723581223 | B600: =FTEST(RC[1]:RC[3],RC[4]:RC[6]) -> 0.45101173723581223 | C600: 2210 | D600: 2131 | E600: 1232 | F600: 1233 | G600: 3243 | H600: 2133 | J600: 6 | N600: long
A601: 0.59999999999859843 | B601: =FTEST(RC[1]:RC[3],RC[4]:RC[6]) -> 0.59999999999859843 | C601: 5 | D601: 4 | E601: 3 | F601: 5 | G601: 3 | H601: 2 | J601: 6
A602: 2.4691358021585335E-10 | B602: =FTEST(RC[1]:RC[3],RC[4]:RC[6]) -> 2.4691358021585335E-10 | C602: 10000 | D602: 10000 | E602: 100000 | F602: 1 | G602: 1 | H602: 2 | J602: 6
A603: 0.99999999999766409 | B603: =FTEST(RC[1]:RC[3],RC[4]:RC[6]) -> 0.99999999999766409 | C603: 1 | D603: 5 | E603: 2 | F603: 1 | G603: 5 | H603: 2 | J603: 6
A604: 0.4374999999989781 | B604: =FTEST(RC[1]:RC[3],RC[4]:RC[6]) -> 0.4374999999989781 | C604: 2.2 | D604: 2 | E604: 3 | F604: 4 | G604: 5 | H604: 6 | J604: 6
A605: 0 | B605: =FTEST(RC[1]:RC[3],RC[4]:RC[6]) -> #DIV/0! | C605: 2 | D605: 2 | E605: 3 | F605: 3 | G605: 3 | H605: 3 | J605: 6 | K605: ... | M605: #DIV/0!
A607: 0 | B607: =FTEST(RC[1],RC[2]:RC[6]) -> #DIV/0! | C607: 2.2 | D607: 2 | E607: 3 | F607: 4 | G607: 5 | H607: 6 | J607: 6 | M607: #DIV/0!
A608: 0.16062554302354631 | B608: =FTEST(RC[1]:RC[2],RC[3]:RC[6]) -> 0.16062554302354631 | C608: 2.2 | D608: 2 | E608: 3 | F608: 4 | G608: 5 | H608: 6 | J608: 6 | N608: bigdecimal, long
A609: 0.62639435921099362 | B609: =FTEST(RC[1]:RC[3],RC[4]:RC[5]) -> 0.62639435921099362 | C609: 2.2 | D609: 2 | E609: 3 | F609: 4 | G609: 5 | J609: 5
A611: 1.3333333333333333 | B611: =STANDARDIZE(RC[1],RC[2],RC[3]) -> 1.3333333333333333 | C611: 42 | D611: 40 | E611: 1.5 | J611: 3 | K611: STANDARDIZE | L611: STANDARDIZE
A612: -1.04 | B612: =STANDARDIZE(RC[1],RC[2],RC[3]) -> -1.0399999999999998 | C612: 1.2 | D612: 3.8 | E612: 2.5 | J612: 3
A613: 0.81037277147487841 | B613: =STANDARDIZE(RC[1],RC[2],RC[3]) -> 0.81037277147487841 | C613: 3000 | D613: 2000 | E613: 1234 | J613: 3
A614: 0 | B614: =STANDARDIZE(RC[1],RC[2],RC[3]) -> 0 | C614: 0 | D614: 0 | E614: 1 | J614: 3
A615: -1.3333333333333333 | B615: =STANDARDIZE(RC[1],RC[2],RC[3]) -> -1.3333333333333333 | C615: -1 | D615: 3 | E615: 3 | J615: 3
A616: 0 | B616: =STANDARDIZE(RC[1],RC[2],RC[3]) -> #NUM! | C616: 42 | D616: 40 | E616: 0 | J616: 3 | K616: ... | M616: #NUM!
A618: 1.5240638225085019 | B618: =GAMMALN(RC[1]) -> 1.5240638225085019 | C618: 0.2 | J618: 1 | K618: GAMMALN | L618: GAMMALN
A619: -4.9872441306312076E-2 | B619: =GAMMALN(RC[1]) -> -4.9872441306312076E-2 | C619: 1.1 | J619: 1
A620: -4.1715964016475482E-11 | B620: =GAMMALN(RC[1]) -> -4.1715964016475482E-11 | C620: 1 | J620: 1
A621: 5.8548068069031812E-3 | B621: =GAMMALN(RC[1]) -> 5.8548068069031812E-3 | C621: 0.99 | J621: 1
A622: 0 | B622: =GAMMALN(RC[1]) -> #NUM! | C622: -1 | J622: 1 | M622: #NUM!
A623: 0 | B623: =GAMMALN(RC[1]) -> #NUM! | C623: 0 | J623: 1 | K623: ... | M623: #NUM!
A625: 0.8646647167633873 | B625: =EXPONDIST(RC[1],RC[2],RC[3]) -> 0.8646647167633873 | C625: 1 | D625: 2 | E625: 1 | J625: 3 | K625: EXPONDIST | L625: EXPONDIST
A626: 0.2706705664732254 | B626: =EXPONDIST(RC[1],RC[2],RC[3]) -> 0.2706705664732254 | C626: 1 | D626: 2 | E626: 0 | J626: 3 | N626: bigdecimal
A627: 0.81362602396059003 | B627: =EXPONDIST(RC[1],RC[2],RC[3]) -> 0.81362602396059003 | C627: 14 | D627: 0.12 | E627: 1 | J627: 3
A628: 2.2364877124729197E-2 | B628: =EXPONDIST(RC[1],RC[2],RC[3]) -> 2.2364877124729197E-2 | C628: 14 | D628: 0.12 | E628: 0 | J628: 3
A629: 0.99017671803371843 | B629: =EXPONDIST(RC[1],RC[2],RC[3]) -> 0.99017671803371843 | C629: 1.34 | D629: 3.45 | E629: 1 | J629: 3
A630: 3.3890322783671593E-2 | B630: =EXPONDIST(RC[1],RC[2],RC[3]) -> 3.3890322783671593E-2 | C630: 1.34 | D630: 3.45 | E630: 0 | J630: 3
A631: 0.76952203093336435 | B631: =EXPONDIST(RC[1],RC[2],RC[3]) -> 0.76952203093336435 | C631: 1223 | D631: 1.1999999999999999E-3 | E631: 1 | J631: 3
A632: 2.7657356287996281E-4 | B632: =EXPONDIST(RC[1],RC[2],RC[3]) -> 2.7657356287996281E-4 | C632: 1223 | D632: 1.1999999999999999E-3 | E632: 0 | J632: 3
A633: 0.19562755841064988 | B633: =EXPONDIST(RC[1],RC[2],RC[3]) -> 0.19562755841064988 | C633: 1.1 | D633: 2.2 | E633: 0 | J633: 3 | K633: ...
A635: 0.63212055882855767 | B635: =WEIBULL(RC[1],RC[2],RC[3],RC[4]) -> 0.63212055882855767 | C635: 1 | D635: 1 | E635: 1 | F635: 1 | J635: 4 | K635: WEIBULL | L635: WEIBULL
A636: 0 | B636: =WEIBULL(RC[1],RC[2],RC[3],RC[4]) -> 0 | C636: 0 | D636: 21 | E636: 321 | F636: 0 | J636: 4
A637: 0.10516068318563021 | B637: =WEIBULL(RC[1],RC[2],RC[3],RC[4]) -> 0.10516068318563021 | C637: 1 | D637: 2 | E637: 3 | F637: 1 | J637: 4
A638: 0.12939980299233589 | B638: =WEIBULL(RC[1],RC[2],RC[3],RC[4]) -> 0.12939980299233589 | C638: 1.1 | D638: 2.2 | E638: 3.7 | F638: 0 | J638: 4
A639: 0.10516068318563021 | B639: =WEIBULL(RC[1],RC[2],RC[3],RC[4]) -> 0.10516068318563021 | C639: 1 | D639: 2 | E639: 3 | F639: 1 | J639: 4
A640: 0.12939980299233589 | B640: =WEIBULL(RC[1],RC[2],RC[3],RC[4]) -> 0.12939980299233589 | C640: 1.1 | D640: 2.2 | E640: 3.7 | F640: 0 | J640: 4
A641: 0.92958139006927698 | B641: =WEIBULL(RC[1],RC[2],RC[3],RC[4]) -> 0.92958139006927698 | C641: 105 | D641: 20 | E641: 100 | F641: 1 | J641: 4
A642: 0 | B642: =WEIBULL(RC[1],RC[2],RC[3],RC[4]) -> #NUM! | C642: 102 | D642: 0 | E642: 100 | F642: 0 | J642: 4 | M642: #NUM!
A643: 0 | B643: =WEIBULL(RC[1],RC[2],RC[3],RC[4]) -> #NUM! | C643: 105 | D643: 20 | E643: -1 | F643: 1 | J643: 4 | M643: #NUM!
A644: 0 | B644: =WEIBULL(RC[1],RC[2],RC[3],RC[4]) -> #NUM! | C644: -0.01 | D644: 30 | E644: 100 | F644: 0 | J644: 4 | K644: ... | M644: #NUM! | N644: long
A646: 0.86730052769405319 | B646: =FISHER(RC[1]) -> 0.86730052769405319 | C646: 0.7 | J646: 1 | K646: FISHER | L646: FISHER
A647: 0 | B647: =FISHER(RC[1]) -> 0 | C647: 0 | J647: 1
A648: 3.8002011672501999 | B648: =FISHER(RC[1]) -> 3.8002011672501999 | C648: 0.999 | J648: 1
A649: 1.0000333353334718E-2 | B649: =FISHER(RC[1]) -> 1.0000333353334718E-2 | C649: 0.01 | J649: 1 | N649: bigdecimal
A650: 0.54930614433405489 | B650: =FISHER(RC[1]) -> 0.54930614433405489 | C650: 0.5 | J650: 1 | N650: bigdecimal
A651: -0.54930614433405489 | B651: =FISHER(RC[1]) -> -0.54930614433405489 | C651: -0.5 | J651: 1 | N651: bigdecimal
A652: 0.23841701736237089 | B652: =FISHER(RC[1]) -> 0.23841701736237089 | C652: 0.23400000000000001 | J652: 1
A653: 0 | B653: =FISHER(RC[1]) -> #NUM! | C653: 1 | J653: 1 | M653: #NUM!
A654: 0 | B654: =FISHER(RC[1]) -> #NUM! | C654: -1 | J654: 1 | K654: ... | M654: #NUM!