Sheet: Sheet1
A1: Expected | B1: Actual | C1: Inputs | J1: # of Inputs | K1: Name | L1: Highlight | M1: Excel says | N1: Skip for
A2: Hello world! | B2: =RC[1]&" "&RC[2] -> Hello world! | C2: Hello | D2: world! | J2: 2 | K2: Concatenation operator (&) | L2: &
A3: StartMiddleEnd | B3: =RC[1]&RC[2]&RC[3] -> StartMiddleEnd | C3: Start | D3: Middle | E3: End | J3: 3
A4: StartEnd | B4: =RC[1]&RC[2]&RC[3] -> StartEnd | C4: Start | E4: End | J4: 3
A5: MiddleEnd | B5: =RC[1]&RC[2]&RC[3] -> MiddleEnd | D5: Middle | E5: End | J5: 3
A6: StartMiddle | B6: =RC[1]&RC[2]&RC[3] -> StartMiddle | C6: Start | D6: Middle | J6: 3
A8: Hello world! | B8: =CONCATENATE(RC[1]," ",RC[2]) -> Hello world! | C8: Hello | D8: world! | J8: 2 | K8: CONCATENATE | L8: CONCATENATE
A9: StartMiddleEnd | B9: =CONCATENATE(RC[1],RC[2],RC[3]) -> StartMiddleEnd | C9: Start | D9: Middle | E9: End | J9: 3
A10: StartEnd | B10: =CONCATENATE(RC[1],RC[2],RC[3]) -> StartEnd | C10: Start | E10: End | J10: 3
A11: MiddleEnd | B11: =CONCATENATE(RC[1],RC[2],RC[3]) -> MiddleEnd | D11: Middle | E11: End | J11: 3
A12: StartMiddle | B12: =CONCATENATE(RC[1],RC[2],RC[3]) -> StartMiddle | C12: Start | D12: Middle | J12: 3
A14: text | B14: =CLEAN(RC[1]) -> text | C14: text | J14: 1 | K14: CLEAN | L14: CLEAN
A15: text | B15: =CLEAN(RC[1]) -> text | C15: text | J15: 1
A16: texts | B16: =CLEAN(RC[1]) -> texts | C16: texts | J16: 1
A17: teüxts | B17: =CLEAN(RC[1]) -> teüxts | C17: teüxts | J17: 1
A18: texttext | B18: =CLEAN(RC[1]) -> texttext | C18: texttext | J18: 1
A19: text | B19: =CLEAN(RC[1]) -> text | C19: text | J19: 1
A20: Atext | B20: =CLEAN(RC[1]) -> Atext | C20: Atext | J20: 1 | K20: ...
A22: 5 | B22: =LEN(RC[1]) -> 5 | C22: Hello | J22: 1 | K22: LEN | L22: LEN
A23: 5 | B23: =LEN(RC[1]) -> 5 | C23: world | J23: 1 | K23: ...
A24: 0 | B24: =LEN(RC[1]) -> 0 | J24: 1
A25: 5 | B25: =LEN(RC[1]) -> 5 | C25: 12.34 | J25: 1
A26: 4 | B26: =LEN(RC[1]&RC[2]) -> 4 | C26: ab | D26: cd | J26: 2
A28: abc | B28: =MID(RC[1],RC[2],RC[3]) -> abc | C28: abcdef | D28: 1 | E28: 3 | J28: 3 | K28: MID | L28: MID
A29: a | B29: =MID(RC[1],RC[2],RC[3]) -> a | C29: abcdef | D29: 1 | E29: 1 | J29: 3
A30: abcde | B30: =MID(RC[1],RC[2],RC[3]) -> abcde | C30: abcdef | D30: 1 | E30: 5 | J30: 3
A31: abcdef | B31: =MID(RC[1],RC[2],RC[3]) -> abcdef | C31: abcdef | D31: 1 | E31: 6 | J31: 3
A32: abcdef | B32: =MID(RC[1],RC[2],RC[3]) -> abcdef | C32: abcdef | D32: 1 | E32: 7 | J32: 3
B33: =MID(RC[1],RC[2],RC[3]) ->  | C33: abcdef | D33: 1 | E33: 0 | J33: 3
A34: b | B34: =MID(RC[1],RC[2],RC[3]) -> b | C34: abcdef | D34: 2 | E34: 1 | J34: 3
A35: bcde | B35: =MID(RC[1],RC[2],RC[3]) -> bcde | C35: abcdef | D35: 2 | E35: 4 | J35: 3
A36: bcdef | B36: =MID(RC[1],RC[2],RC[3]) -> bcdef | C36: abcdef | D36: 2 | E36: 5 | J36: 3
A37: bcdef | B37: =MID(RC[1],RC[2],RC[3]) -> bcdef | C37: abcdef | D37: 2 | E37: 6 | J37: 3
B38: =MID(RC[1],RC[2],RC[3]) ->  | C38: abcdef | D38: 2 | E38: 0 | J38: 3
A39: f | B39: =MID(RC[1],RC[2],RC[3]) -> f | C39: abcdef | D39: 6 | E39: 1 | J39: 3
A40: f | B40: =MID(RC[1],RC[2],RC[3]) -> f | C40: abcdef | D40: 6 | E40: 2 | J40: 3
B41: =MID(RC[1],RC[2],RC[3]) ->  | C41: abcdef | D41: 6 | E41: 0 | J41: 3
B42: =MID(RC[1],RC[2],RC[3]) ->  | C42: abcdef | D42: 7 | E42: 1 | J42: 3
B43: =MID(RC[1],RC[2],RC[3]) ->  | C43: abcdef | D43: 7 | E43: 0 | J43: 3 | K43: ...
B44: =MID(RC[1],RC[2],RC[3]) ->  | D44: 1 | E44: 2 | J44: 3
B45: =MID(RC[1],RC[2],RC[3]) -> #VALUE! | C45: abcdef | D45: 0 | E45: 7 | J45: 3 | M45: #VALUE!
B46: =MID(RC[1],RC[2],RC[3]) -> #VALUE! | C46: abcdef | D46: 1 | E46: -1 | J46: 3 | M46: #VALUE!
A48: a | B48: =LEFT(RC[1]) -> a | C48: abcdef | J48: 1 | K48: LEFT | L48: LEFT
B49: =LEFT(RC[1],RC[2]) ->  | C49: abcdef | D49: 0 | J49: 2
A50: a | B50: =LEFT(RC[1],RC[2]) -> a | C50: abcdef | D50: 1 | J50: 2
A51: ab | B51: =LEFT(RC[1],RC[2]) -> ab | C51: abcdef | D51: 2 | J51: 2
A52: abcde | B52: =LEFT(RC[1],RC[2]) -> abcde | C52: abcdef | D52: 5 | J52: 2
A53: abcdef | B53: =LEFT(RC[1],RC[2]) -> abcdef | C53: abcdef | D53: 6 | J53: 2
A54: abcdef | B54: =LEFT(RC[1],RC[2]) -> abcdef | C54: abcdef | D54: 7 | J54: 2
B55: =LEFT(RC[1],RC[2]) ->  | D55: 7 | J55: 2
B56: =LEFT(RC[1],RC[2]) -> #VALUE! | C56: abcdef | D56: -1 | J56: 2 | M56: #VALUE!
A58: f | B58: =RIGHT(RC[1]) -> f | C58: abcdef | J58: 1 | K58: RIGHT | L58: RIGHT
B59: =RIGHT(RC[1],RC[2]) ->  | C59: abcdef | D59: 0 | J59: 2
A60: f | B60: =RIGHT(RC[1],RC[2]) -> f | C60: abcdef | D60: 1 | J60: 2
A61: ef | B61: =RIGHT(RC[1],RC[2]) -> ef | C61: abcdef | D61: 2 | J61: 2
A62: bcdef | B62: =RIGHT(RC[1],RC[2]) -> bcdef | C62: abcdef | D62: 5 | J62: 2
A63: abcdef | B63: =RIGHT(RC[1],RC[2]) -> abcdef | C63: abcdef | D63: 6 | J63: 2
A64: abcdef | B64: =RIGHT(RC[1],RC[2]) -> abcdef | C64: abcdef | D64: 7 | J64: 2
B65: =RIGHT(RC[1],RC[2]) ->  | D65: 7 | J65: 2
B66: =RIGHT(RC[1],RC[2]) -> #VALUE! | C66: abcdef | D66: -1 | J66: 2 | M66: #VALUE!
A68: Hello World | B68: =SUBSTITUTE(RC[1],RC[2],RC[3]) -> Hello World | C68: Hello world | D68: w | E68: W | J68: 3 | K68: SUBSTITUTE | L68: SUBSTITUTE
A69: Hello orld | B69: =SUBSTITUTE(RC[1],RC[2],RC[3]) -> Hello orld | C69: Hello world | D69: w | J69: 3
A70: Hello world | B70: =SUBSTITUTE(RC[1],RC[2],RC[3]) -> Hello world | C70: Hello world | E70: Z | J70: 3
A71: Hella warld | B71: =SUBSTITUTE(RC[1],RC[2],RC[3]) -> Hella warld | C71: Hello world | D71: o | E71: a | J71: 3
A72: Heppo world | B72: =SUBSTITUTE(RC[1],RC[2],RC[3]) -> Heppo world | C72: Hello world | D72: ll | E72: pp | J72: 3
A73: Hello worlD! | B73: =SUBSTITUTE(RC[1],RC[2],RC[3]) -> Hello worlD! | C73: Hello world | D73: d | E73: D! | J73: 3
A74: Hell wrld | B74: =SUBSTITUTE(RC[1],RC[2],RC[3]) -> Hell wrld | C74: Hello world | D74: o | J74: 3
A75: Schmello world | B75: =SUBSTITUTE(RC[1],RC[2],RC[3]) -> Schmello world | C75: Hello world | D75: H | E75: Schm | J75: 3
A76: Hello world | B76: =SUBSTITUTE(RC[1],RC[2],RC[3]) -> Hello world | C76: Hello world | D76: l | E76: l | J76: 3
A77: Heo word | B77: =SUBSTITUTE(RC[1],RC[2],RC[3]) -> Heo word | C77: Hello world | D77: l | J77: 3
A78: Hello world | B78: =SUBSTITUTE(RC[1],RC[2],RC[3]) -> Hello world | C78: Hello world | D78: q | J78: 3
A79: Hello world | B79: =SUBSTITUTE(RC[1],RC[2],RC[3]) -> Hello world | C79: Hello world | D79: q | E79: z | J79: 3
A80: Yes! | B80: =SUBSTITUTE(RC[1],RC[2],RC[3]) -> Yes! | C80: Hello world | D80: Hello world | E80: Yes! | J80: 3
A81: bAäÄàÀáÁ | B81: =SUBSTITUTE(RC[1],RC[2],RC[3]) -> bAäÄàÀáÁ | C81: aAäÄàÀáÁ | D81: a | E81: b | J81: 3
A82: Yes! | B82: =SUBSTITUTE(RC[1],RC[2],RC[3]) -> Yes! | C82: Hello world | D82: Hello world | E82: Yes! | J82: 3
B83: =SUBSTITUTE(RC[1],RC[2],RC[3]) ->  | D83: 3 | E83: 5 | J83: 3
A84: Hello world | B84: =SUBSTITUTE(RC[1],RC[2],RC[3],RC[4]) -> #VALUE! | C84: Hello world | D84: l | E84: _ | F84: 0 | J84: 4 | M84: #VALUE!
A85: He_lo world | B85: =SUBSTITUTE(RC[1],RC[2],RC[3],RC[4]) -> He_lo world | C85: Hello world | D85: l | E85: _ | F85: 1 | J85: 4
A86: Hel_o world | B86: =SUBSTITUTE(RC[1],RC[2],RC[3],RC[4]) -> Hel_o world | C86: Hello world | D86: l | E86: _ | F86: 2 | J86: 4
A87: Hello wor_d | B87: =SUBSTITUTE(RC[1],RC[2],RC[3],RC[4]) -> Hello wor_d | C87: Hello world | D87: l | E87: _ | F87: 3 | J87: 4
A88: Hello world | B88: =SUBSTITUTE(RC[1],RC[2],RC[3],RC[4]) -> Hello world | C88: Hello world | D88: l | E88: _ | F88: 4 | J88: 4
A90: Ah! Hello world | B90: =REPLACE(RC[1],RC[2],RC[3],RC[4]) -> Ah! Hello world | C90: Hello world | D90: 1 | E90: 0 | F90: Ah! | J90: 4 | K90: REPLACE | L90: REPLACE
A91: Schmello world | B91: =REPLACE(RC[1],RC[2],RC[3],RC[4]) -> Schmello world | C91: Hello world | D91: 1 | E91: 1 | F91: Schm | J91: 4
A92: Hello people | B92: =REPLACE(RC[1],RC[2],RC[3],RC[4]) -> Hello people | C92: Hello world | D92: 7 | E92: 5 | F92: people | J92: 4
A93: Hello people | B93: =REPLACE(RC[1],RC[2],RC[3],RC[4]) -> Hello people | C93: Hello world | D93: 7 | E93: 10 | F93: people | J93: 4
A94: Hello dear world | B94: =REPLACE(RC[1],RC[2],RC[3],RC[4]) -> Hello dear world | C94: Hello world | D94: 7 | E94: 0 | F94: dear | J94: 4
A95: Hello orld | B95: =REPLACE(RC[1],RC[2],RC[3],RC[4]) -> Hello orld | C95: Hello world | D95: 7 | E95: 1 | J95: 4
A96: Hello Vorld | B96: =REPLACE(RC[1],RC[2],RC[3],RC[4]) -> Hello Vorld | C96: Hello world | D96: 7 | E96: 1 | F96: V | J96: 4
A97: Hello worldxx | B97: =REPLACE(RC[1],RC[2],RC[3],RC[4]) -> Hello worldxx | C97: Hello world | D97: 50 | E97: 1 | F97: xx | J97: 4
A98: Hello worldxx | B98: =REPLACE(RC[1],RC[2],RC[3],RC[4]) -> Hello worldxx | C98: Hello world | D98: 50 | E98: 0 | F98: xx | J98: 4
A99: new | B99: =REPLACE(RC[1],RC[2],RC[3],RC[4]) -> new | D99: 1 | E99: 4 | F99: new | J99: 4
B100: =REPLACE(RC[1],RC[2],RC[3],RC[4]) -> #VALUE! | C100: Hello world | D100: 0 | E100: 2 | F100: bla | J100: 4 | M100: #VALUE!
B101: =REPLACE(RC[1],RC[2],RC[3],RC[4]) -> #VALUE! | C101: Hello world | D101: 1 | E101: -1 | F101: bla | J101: 4 | M101: #VALUE!
A103: 1 | B103: =EXACT(RC[1],RC[2]) -> 1 | J103: 2 | K103: EXACT | L103: EXACT
A104: 0 | B104: =EXACT(RC[1],RC[2]) -> 0 | C104: Hello | D104: hello | J104: 2
A105: 1 | B105: =EXACT(RC[1],RC[2]) -> 1 | C105: Hello | D105: Hello | J105: 2
A106: 0 | B106: =EXACT(RC[1],RC[2]) -> 0 | C106: Hello | D106: HellO | J106: 2
A107: 0 | B107: =EXACT(RC[1],RC[2]) -> 0 | D107: a | J107: 2
A108: 0 | B108: =EXACT(RC[1],RC[2]) -> 0 | C108: a | J108: 2
A109: 0 | B109: =EXACT(RC[1],RC[2]) -> 0 | J109: 2
A110: 0 | B110: =EXACT(RC[1],RC[2]) -> 0 | J110: 2
A111: 0 | B111: =EXACT(RC[1],RC[2]) -> 0 | C111: a | D111: ä | J111: 2
A112: 0 | B112: =EXACT(RC[1],RC[2]) -> 0 | C112: a | D112: A | J112: 2
A113: 1 | B113: =EXACT(RC[1],RC[2]) -> 1 | C113: 123 | D113: 123 | J113: 2
A114: 1 | B114: =EXACT(RC[1],RC[2]) -> 1 | C114: 123 | D114: 123 | J114: 2
A116: 2 | B116: =FIND(RC[1],RC[2]) -> 2 | C116: e | D116: Hello world | J116: 2 | K116: FIND | L116: FIND
A117: 1 | B117: =FIND(RC[1],RC[2]) -> 1 | C117: H | D117: Hello world | J117: 2
A118: 0 | B118: =FIND(RC[1],RC[2]) -> #VALUE! | C118: X | D118: Hello world | J118: 2 | M118: #VALUE!
A119: 11 | B119: =FIND(RC[1],RC[2]) -> 11 | C119: d | D119: Hello world | J119: 2
A120: 9 | B120: =FIND(RC[1],RC[2]) -> 9 | C120: r | D120: Hello world | J120: 2
A121: 8 | B121: =FIND(RC[1],RC[2]) -> 8 | C121: or | D121: Hello world | J121: 2
A122: 10 | B122: =FIND(RC[1],RC[2]) -> 10 | C122: ld | D122: Hello world | J122: 2
A123: 1 | B123: =FIND(RC[1],RC[2]) -> 1 | C123: Hello world | D123: Hello world | J123: 2
A124: 1 | B124: =FIND(RC[1],RC[2]) -> 1 | D124: Hello world | J124: 2
A125: 1 | B125: =FIND(RC[1],RC[2]) -> 1 | J125: 2
A126: 0 | B126: =FIND(RC[1],RC[2]) -> #VALUE! | C126: x | J126: 2 | M126: #VALUE!
A127: 5 | B127: =FIND(RC[1],RC[2]) -> 5 | C127: a | D127: àÀáÁaAäÄ | J127: 2
A128: 6 | B128: =FIND(RC[1],RC[2]) -> 6 | C128: A | D128: àÀáÁaAäÄ | J128: 2
A129: 7 | B129: =FIND(RC[1],RC[2]) -> 7 | C129: ä | D129: àÀáÁaAäÄ | J129: 2
A130: 8 | B130: =FIND(RC[1],RC[2]) -> 8 | C130: Ä | D130: àÀáÁaAäÄ | J130: 2
A131: 3 | B131: =FIND(RC[1],RC[2],RC[3]) -> 3 | C131: l | D131: Hello world | E131: 2 | J131: 3
A132: 3 | B132: =FIND(RC[1],RC[2],RC[3]) -> 3 | C132: l | D132: Hello world | E132: 3 | J132: 3
A133: 4 | B133: =FIND(RC[1],RC[2],RC[3]) -> 4 | C133: l | D133: Hello world | E133: 4 | J133: 3
A134: 10 | B134: =FIND(RC[1],RC[2],RC[3]) -> 10 | C134: l | D134: Hello world | E134: 5 | J134: 3
A135: 10 | B135: =FIND(RC[1],RC[2],RC[3]) -> 10 | C135: l | D135: Hello world | E135: 10 | J135: 3
A136: 0 | B136: =FIND(RC[1],RC[2],RC[3]) -> #VALUE! | C136: l | D136: Hello world | E136: 11 | J136: 3 | M136: #VALUE!
A137: 11 | B137: =FIND(RC[1],RC[2],RC[3]) -> 11 | C137: d | D137: Hello world | E137: 11 | J137: 3
A138: 0 | B138: =FIND(RC[1],RC[2],RC[3]) -> #VALUE! | C138: d | D138: Hello world | E138: 12 | J138: 3 | M138: #VALUE!
A139: 3 | B139: =FIND(RC[1],RC[2],RC[3]) -> 3 | C139: llo | D139: Hello world | E139: 1 | J139: 3
A140: 3 | B140: =FIND(RC[1],RC[2],RC[3]) -> 3 | C140: llo | D140: Hello world | E140: 3 | J140: 3
A141: 0 | B141: =FIND(RC[1],RC[2],RC[3]) -> #VALUE! | C141: llo | D141: Hello world | E141: 4 | J141: 3 | M141: #VALUE!
A143: 2 | B143: =SEARCH(RC[1],RC[2]) -> 2 | C143: e | D143: Hello world | J143: 2 | K143: SEARCH | L143: SEARCH
A144: 1 | B144: =SEARCH(RC[1],RC[2]) -> 1 | C144: H | D144: Hello world | J144: 2
A145: 0 | B145: =SEARCH(RC[1],RC[2]) -> #VALUE! | C145: X | D145: Hello world | J145: 2 | M145: #VALUE!
A146: 11 | B146: =SEARCH(RC[1],RC[2]) -> 11 | C146: d | D146: Hello world | J146: 2
A147: 9 | B147: =SEARCH(RC[1],RC[2]) -> 9 | C147: r | D147: Hello world | J147: 2
A148: 8 | B148: =SEARCH(RC[1],RC[2]) -> 8 | C148: or | D148: Hello world | J148: 2
A149: 10 | B149: =SEARCH(RC[1],RC[2]) -> 10 | C149: ld | D149: Hello world | J149: 2
A150: 1 | B150: =SEARCH(RC[1],RC[2]) -> 1 | C150: Hello world | D150: Hello world | J150: 2
A151: 1 | B151: =SEARCH(RC[1],RC[2]) -> 1 | D151: Hello world | J151: 2
A152: 2 | B152: =SEARCH(RC[1],RC[2]) -> 2 | C152: e*o | D152: Hello world | J152: 2
A153: 5 | B153: =SEARCH(RC[1],RC[2]) -> 5 | C153: o*l | D153: Hello world | J153: 2
A154: 8 | B154: =SEARCH(RC[1],RC[2]) -> 8 | C154: o?l | D154: Hello world | J154: 2
A155: 0 | B155: =SEARCH(RC[1],RC[2]) -> #VALUE! | C155: o??l | D155: Hello world | J155: 2 | M155: #VALUE!
A156: 5 | B156: =SEARCH(RC[1],RC[2]) -> 5 | C156: ~**~?*~~. | D156: Use * or ?, escape with ~. | J156: 2
A157: 0 | B157: =SEARCH(RC[1],RC[2]) -> #VALUE! | C157: ~**~**~~. | D157: Use * or ?, escape with ~. | J157: 2 | M157: #VALUE!
A158: 7 | B158: =SEARCH(RC[1],RC[2]) -> 7 | C158: ~o~r | D158: Use * or ?, escape with ~. | J158: 2
A159: 8 | B159: =SEARCH(RC[1],RC[2]) -> 8 | C159: g ~ | D159: Trailing ~ | J159: 2
A160: 0 | B160: =SEARCH(RC[1],RC[2]) -> #VALUE! | J160: 2 | M160: #VALUE!
A161: 0 | B161: =SEARCH(RC[1],RC[2]) -> #VALUE! | C161: x | J161: 2 | M161: #VALUE!
A162: 5 | B162: =SEARCH(RC[1],RC[2]) -> 5 | C162: a | D162: àÀáÁaAäÄ | J162: 2
A163: 5 | B163: =SEARCH(RC[1],RC[2]) -> 5 | C163: A | D163: àÀáÁaAäÄ | J163: 2
A164: 7 | B164: =SEARCH(RC[1],RC[2]) -> 7 | C164: ä | D164: àÀáÁaAäÄ | J164: 2
A165: 7 | B165: =SEARCH(RC[1],RC[2]) -> 7 | C165: Ä | D165: àÀáÁaAäÄ | J165: 2
A166: 5 | B166: =SEARCH(RC[1],RC[2]) -> 5 | C166: в | D166: аАбБвВгГ | J166: 2
A167: 5 | B167: =SEARCH(RC[1],RC[2]) -> 5 | C167: В | D167: аАбБвВгГ | J167: 2
A168: 3 | B168: =SEARCH(RC[1],RC[2],RC[3]) -> 3 | C168: l | D168: Hello world | E168: 2 | J168: 3
A169: 3 | B169: =SEARCH(RC[1],RC[2],RC[3]) -> 3 | C169: l | D169: Hello world | E169: 3 | J169: 3
A170: 4 | B170: =SEARCH(RC[1],RC[2],RC[3]) -> 4 | C170: l | D170: Hello world | E170: 4 | J170: 3
A171: 10 | B171: =SEARCH(RC[1],RC[2],RC[3]) -> 10 | C171: l | D171: Hello world | E171: 5 | J171: 3
A172: 10 | B172: =SEARCH(RC[1],RC[2],RC[3]) -> 10 | C172: l | D172: Hello world | E172: 10 | J172: 3
A173: 0 | B173: =SEARCH(RC[1],RC[2],RC[3]) -> #VALUE! | C173: l | D173: Hello world | E173: 11 | J173: 3 | M173: #VALUE!
A174: 11 | B174: =SEARCH(RC[1],RC[2],RC[3]) -> 11 | C174: d | D174: Hello world | E174: 11 | J174: 3
A175: 0 | B175: =SEARCH(RC[1],RC[2],RC[3]) -> #VALUE! | C175: d | D175: Hello world | E175: 12 | J175: 3 | M175: #VALUE!
A176: 3 | B176: =SEARCH(RC[1],RC[2],RC[3]) -> 3 | C176: llo | D176: Hello world | E176: 1 | J176: 3
A177: 3 | B177: =SEARCH(RC[1],RC[2],RC[3]) -> 3 | C177: llo | D177: Hello world | E177: 3 | J177: 3
A178: 0 | B178: =SEARCH(RC[1],RC[2],RC[3]) -> #VALUE! | C178: llo | D178: Hello world | E178: 4 | J178: 3 | M178: #VALUE!
A179: 2 | B179: =SEARCH(RC[1],RC[2],RC[3]) -> 2 | C179: e*o | D179: Hello world | E179: 1 | J179: 3
A180: 2 | B180: =SEARCH(RC[1],RC[2],RC[3]) -> 2 | C180: e*o | D180: Hello world | E180: 2 | J180: 3
A181: 0 | B181: =SEARCH(RC[1],RC[2],RC[3]) -> #VALUE! | C181: e*o | D181: Hello world | E181: 3 | J181: 3 | M181: #VALUE!
A182: 8 | B182: =SEARCH(RC[1],RC[2],RC[3]) -> 8 | C182: e*o | D182: Hello Hello | E182: 5 | J182: 3
A184: hello | B184: =LOWER(RC[1]) -> hello | C184: HELLO | J184: 1 | K184: LOWER | L184: LOWER
A185: hello | B185: =LOWER(RC[1]) -> hello | C185: Hello | J185: 1
A186: hello | B186: =LOWER(RC[1]) -> hello | C186: hellO | J186: 1
A187: ààááaaää | B187: =LOWER(RC[1]) -> ààááaaää | C187: àÀáÁaAäÄ | J187: 1 | K187: ...
B188: =LOWER(RC[1]) ->  | J188: 1
A190: HELLO | B190: =UPPER(RC[1]) -> HELLO | C190: HELLO | J190: 1 | K190: UPPER | L190: UPPER
A191: HELLO | B191: =UPPER(RC[1]) -> HELLO | C191: Hello | J191: 1
A192: HELLO | B192: =UPPER(RC[1]) -> HELLO | C192: hellO | J192: 1
A193: ÀÀÁÁAAÄÄ | B193: =UPPER(RC[1]) -> ÀÀÁÁAAÄÄ | C193: àÀáÁaAäÄ | J193: 1 | K193: ...
B194: =UPPER(RC[1]) ->  | J194: 1
A196: This Is A Title | B196: =PROPER(RC[1]) -> This Is A Title | C196: this is a TITLE | J196: 1 | K196: PROPER | L196: PROPER
A197: 2-Cent'S Worth | B197: =PROPER(RC[1]) -> 2-Cent'S Worth | C197: 2-cent's worth | J197: 1
A198: 76Budget | B198: =PROPER(RC[1]) -> 76Budget | C198: 76BudGet | J198: 1
A199: Ààá Áaa Ää | B199: =PROPER(RC[1]) -> Ààá Áaa Ää | C199: àÀá ÁaA äÄ | J199: 1
A200: Ааб Бвв Ггд Д | B200: =PROPER(RC[1]) -> Ааб Бвв Ггд Д | C200: АаБ бВв ГгД д | J200: 1 | K200: ...
A202: *abc*abc*abc | B202: =REPT(RC[1],RC[2]) -> *abc*abc*abc | C202: *abc | D202: 3 | J202: 2 | K202: REPT | L202: REPT
A203: àÀáÁaAäÄ | B203: =REPT(RC[1],RC[2]) -> àÀáÁaAäÄ | C203: àÀáÁaAäÄ | D203: 1 | J203: 2
B204: =REPT(RC[1],RC[2]) ->  | C204: abc | D204: 0 | J204: 2 | K204: ...
A206: aaa bb c | B206: =TRIM(RC[1]) -> aaa bb c | C206: aaa bb c | J206: 1 | K206: TRIM | L206: TRIM
A207: aaa bb c | B207: =TRIM(RC[1]) -> aaa bb c | C207: aaa bb c | J207: 1 | K207: ...