Sheet: Sheet1
A1: Expected | B1: Actual | C1: Inputs | J1: # of Inputs | K1: Name | L1: Highlight | M1: Excel says | N1: Skip for
A2: Text | B2: =RC[1] -> Text | C2: Text | J2: 1 | K2: Reference to other string
A3: 0 | B3: =RC[1] -> 0 | C3: 0 | J3: 1 | K3: Numbers as returned by String valued outputs
A4: 12345.678900000001 | B4: =RC[1] -> 12345.678900000001 | C4: 12345.678900000001 | J4: 1
A5: 1200000 | B5: =RC[1] -> 1200000 | C5: 1200000 | J5: 1
A6: 123456789 | B6: =RC[1] -> 123456789 | C6: 123456789 | J6: 1
A7: 0.1 | B7: =RC[1] -> 0.1 | C7: 0.1 | J7: 1
A8: 1 | B8: =RC[1] -> 1 | C8: 1 | J8: 1 | K8: Booleans are treated as 0/1! | M8: TRUE
A9: 0 | B9: =RC[1] -> 0 | C9: 0 | J9: 1 | M9: FALSE
A10: 1 | B10: =RC[1]=RC[2] -> 1 | C10: 1 | D10: 1 | J10: 2 | M10: TRUE
A11: 0 | B11: =RC[1]=RC[2] -> 0 | C11: 1 | D11: 2 | J11: 2 | M11: FALSE
A12: 38032 | B12: =RC[1] -> 38032 | C12: 2004-02-15T00:00:00.000 | J12: 1 | K12: Date format is not respected! | M12: 15.02.2004
A14: Hello world! | B14: =RC[1]&" "&RC[2] -> Hello world! | C14: Hello | D14: world! | J14: 2 | K14: Concatenation operator (&) | L14: &
A15: StartMiddleEnd | B15: =RC[1]&RC[2]&RC[3] -> StartMiddleEnd | C15: Start | D15: Middle | E15: End | J15: 3
A16: StartEnd | B16: =RC[1]&RC[2]&RC[3] -> StartEnd | C16: Start | E16: End | J16: 3
A17: MiddleEnd | B17: =RC[1]&RC[2]&RC[3] -> MiddleEnd | D17: Middle | E17: End | J17: 3
A18: StartMiddle | B18: =RC[1]&RC[2]&RC[3] -> StartMiddle | C18: Start | D18: Middle | J18: 3
A20: Zero is 0 | B20: =RC[1]&" is "&RC[2] -> Zero is 0 | C20: Zero | D20: 0 | J20: 2 | K20: Value conversion with concatenation
A21: Fraction is 12345,6789 | B21: =RC[1]&" is "&RC[2] -> Fraction is 12345,6789 | C21: Fraction | D21: 12345.678900000001 | J21: 2
A22: Exponent is 1200000 | B22: =RC[1]&" is "&RC[2] -> Exponent is 1200000 | C22: Exponent | D22: 1200000 | J22: 2
A23: Integer is 123456789 | B23: =RC[1]&" is "&RC[2] -> Integer is 123456789 | C23: Integer | D23: 123456789 | J23: 2
A24: Percent is 0,1 | B24: =RC[1]&" is "&RC[2] -> Percent is 0,1 | C24: Percent | D24: 0.1 | J24: 2
A25: Bool is 1 | B25: ="Bool is "&RC[1] -> Bool is TRUE | C25: 1 | J25: 1 | M25: Bool is TRUE
A26: Bool is 0 | B26: ="Bool is "&RC[1] -> Bool is FALSE | C26: 0 | J26: 1 | M26: Bool is FALSE
A27: Bool is 1 | B27: ="Bool is "&(RC[1]=RC[2]) -> Bool is TRUE | C27: 1 | D27: 1 | J27: 2 | M27: Bool is TRUE
A28: Bool is 0 | B28: ="Bool is "&(RC[1]=RC[2]) -> Bool is FALSE | C28: 1 | D28: 2 | J28: 2 | M28: Bool is FALSE
A29: Date is 38032 | B29: ="Date is "&RC[1] -> Date is 38032 | C29: 2004-02-15T00:00:00.000 | J29: 1 | K29: Excel converts date as number too!
A31: 5 | B31: =LEN(RC[1]) -> 5 | C31: Hello | J31: 1 | K31: LEN | L31: LEN
A32: 5 | B32: =LEN(RC[1]) -> 5 | C32: world | J32: 1 | K32: ...
A33: 0 | B33: =LEN(RC[1]) -> 0 | J33: 1
A34: 5 | B34: =LEN(RC[1]) -> 5 | C34: 12.34 | J34: 1
A35: 4 | B35: =LEN(RC[1]&RC[2]) -> 4 | C35: ab | D35: cd | J35: 2
A37: abc | B37: =MID(RC[1],RC[2],RC[3]) -> abc | C37: abcdef | D37: 1 | E37: 3 | J37: 3 | K37: MID | L37: MID
A38: a | B38: =MID(RC[1],RC[2],RC[3]) -> a | C38: abcdef | D38: 1 | E38: 1 | J38: 3
A39: abcde | B39: =MID(RC[1],RC[2],RC[3]) -> abcde | C39: abcdef | D39: 1 | E39: 5 | J39: 3
A40: abcdef | B40: =MID(RC[1],RC[2],RC[3]) -> abcdef | C40: abcdef | D40: 1 | E40: 6 | J40: 3
A41: abcdef | B41: =MID(RC[1],RC[2],RC[3]) -> abcdef | C41: abcdef | D41: 1 | E41: 7 | J41: 3
B42: =MID(RC[1],RC[2],RC[3]) ->  | C42: abcdef | D42: 1 | E42: 0 | J42: 3
A43: b | B43: =MID(RC[1],RC[2],RC[3]) -> b | C43: abcdef | D43: 2 | E43: 1 | J43: 3
A44: bcde | B44: =MID(RC[1],RC[2],RC[3]) -> bcde | C44: abcdef | D44: 2 | E44: 4 | J44: 3
A45: bcdef | B45: =MID(RC[1],RC[2],RC[3]) -> bcdef | C45: abcdef | D45: 2 | E45: 5 | J45: 3
A46: bcdef | B46: =MID(RC[1],RC[2],RC[3]) -> bcdef | C46: abcdef | D46: 2 | E46: 6 | J46: 3
B47: =MID(RC[1],RC[2],RC[3]) ->  | C47: abcdef | D47: 2 | E47: 0 | J47: 3
A48: f | B48: =MID(RC[1],RC[2],RC[3]) -> f | C48: abcdef | D48: 6 | E48: 1 | J48: 3
A49: f | B49: =MID(RC[1],RC[2],RC[3]) -> f | C49: abcdef | D49: 6 | E49: 2 | J49: 3
B50: =MID(RC[1],RC[2],RC[3]) ->  | C50: abcdef | D50: 6 | E50: 0 | J50: 3
B51: =MID(RC[1],RC[2],RC[3]) ->  | C51: abcdef | D51: 7 | E51: 1 | J51: 3
B52: =MID(RC[1],RC[2],RC[3]) ->  | C52: abcdef | D52: 7 | E52: 0 | J52: 3
B53: =MID(RC[1],RC[2],RC[3]) ->  | D53: 1 | E53: 2 | J53: 3
A54: 2,3 | B54: =MID(RC[1],RC[2],RC[3]) -> 2,3 | C54: 12.34 | D54: 2 | E54: 3 | J54: 3
B55: =MID(RC[1],RC[2],RC[3]) -> #VALUE! | C55: abcdef | D55: 0 | E55: 7 | J55: 3 | M55: #VALUE!
B56: =MID(RC[1],RC[2],RC[3]) -> #VALUE! | C56: abcdef | D56: 1 | E56: -1 | J56: 3 | M56: #VALUE!
A58: a | B58: =LEFT(RC[1]) -> a | C58: abcdef | J58: 1 | K58: LEFT | L58: LEFT
B59: =LEFT(RC[1],RC[2]) ->  | C59: abcdef | D59: 0 | J59: 2
A60: a | B60: =LEFT(RC[1],RC[2]) -> a | C60: abcdef | D60: 1 | J60: 2
A61: ab | B61: =LEFT(RC[1],RC[2]) -> ab | C61: abcdef | D61: 2 | J61: 2
A62: abcde | B62: =LEFT(RC[1],RC[2]) -> abcde | C62: abcdef | D62: 5 | J62: 2
A63: abcdef | B63: =LEFT(RC[1],RC[2]) -> abcdef | C63: abcdef | D63: 6 | J63: 2
A64: abcdef | B64: =LEFT(RC[1],RC[2]) -> abcdef | C64: abcdef | D64: 7 | J64: 2
B65: =LEFT(RC[1],RC[2]) ->  | D65: 7 | J65: 2
B66: =LEFT(RC[1],RC[2]) -> #VALUE! | C66: abcdef | D66: -1 | J66: 2 | M66: #VALUE!
A68: f | B68: =RIGHT(RC[1]) -> f | C68: abcdef | J68: 1 | K68: RIGHT | L68: RIGHT
B69: =RIGHT(RC[1],RC[2]) ->  | C69: abcdef | D69: 0 | J69: 2
A70: f | B70: =RIGHT(RC[1],RC[2]) -> f | C70: abcdef | D70: 1 | J70: 2
A71: ef | B71: =RIGHT(RC[1],RC[2]) -> ef | C71: abcdef | D71: 2 | J71: 2
A72: bcdef | B72: =RIGHT(RC[1],RC[2]) -> bcdef | C72: abcdef | D72: 5 | J72: 2
A73: abcdef | B73: =RIGHT(RC[1],RC[2]) -> abcdef | C73: abcdef | D73: 6 | J73: 2
A74: abcdef | B74: =RIGHT(RC[1],RC[2]) -> abcdef | C74: abcdef | D74: 7 | J74: 2
B75: =RIGHT(RC[1],RC[2]) ->  | D75: 7 | J75: 2
B76: =RIGHT(RC[1],RC[2]) -> #VALUE! | C76: abcdef | D76: -1 | J76: 2 | M76: #VALUE!
A78: Hello World | B78: =SUBSTITUTE(RC[1],RC[2],RC[3]) -> Hello World | C78: Hello world | D78: w | E78: W | J78: 3 | K78: SUBSTITUTE | L78: SUBSTITUTE
A79: Hello orld | B79: =SUBSTITUTE(RC[1],RC[2],RC[3]) -> Hello orld | C79: Hello world | D79: w | J79: 3
A80: Hello world | B80: =SUBSTITUTE(RC[1],RC[2],RC[3]) -> Hello world | C80: Hello world | E80: Z | J80: 3
A81: Hella warld | B81: =SUBSTITUTE(RC[1],RC[2],RC[3]) -> Hella warld | C81: Hello world | D81: o | E81: a | J81: 3
A82: Heppo world | B82: =SUBSTITUTE(RC[1],RC[2],RC[3]) -> Heppo world | C82: Hello world | D82: ll | E82: pp | J82: 3
A83: Hello worlD! | B83: =SUBSTITUTE(RC[1],RC[2],RC[3]) -> Hello worlD! | C83: Hello world | D83: d | E83: D! | J83: 3
A84: Hell wrld | B84: =SUBSTITUTE(RC[1],RC[2],RC[3]) -> Hell wrld | C84: Hello world | D84: o | J84: 3
A85: Schmello world | B85: =SUBSTITUTE(RC[1],RC[2],RC[3]) -> Schmello world | C85: Hello world | D85: H | E85: Schm | J85: 3
A86: Hello world | B86: =SUBSTITUTE(RC[1],RC[2],RC[3]) -> Hello world | C86: Hello world | D86: l | E86: l | J86: 3
A87: Heo word | B87: =SUBSTITUTE(RC[1],RC[2],RC[3]) -> Heo word | C87: Hello world | D87: l | J87: 3
A88: Hello world | B88: =SUBSTITUTE(RC[1],RC[2],RC[3]) -> Hello world | C88: Hello world | D88: q | J88: 3
A89: Hello world | B89: =SUBSTITUTE(RC[1],RC[2],RC[3]) -> Hello world | C89: Hello world | D89: q | E89: z | J89: 3
A90: Yes! | B90: =SUBSTITUTE(RC[1],RC[2],RC[3]) -> Yes! | C90: Hello world | D90: Hello world | E90: Yes! | J90: 3
A91: bAäÄàÀáÁ | B91: =SUBSTITUTE(RC[1],RC[2],RC[3]) -> bAäÄàÀáÁ | C91: aAäÄàÀáÁ | D91: a | E91: b | J91: 3
A92: Yes! | B92: =SUBSTITUTE(RC[1],RC[2],RC[3]) -> Yes! | C92: Hello world | D92: Hello world | E92: Yes! | J92: 3
A93: 12,54 | B93: =SUBSTITUTE(RC[1],RC[2],RC[3]) -> 12,54 | C93: 12.34 | D93: 3 | E93: 5 | J93: 3
B94: =SUBSTITUTE(RC[1],RC[2],RC[3]) ->  | D94: 3 | E94: 5 | J94: 3
A95: Hello world | B95: =SUBSTITUTE(RC[1],RC[2],RC[3],RC[4]) -> #VALUE! | C95: Hello world | D95: l | E95: _ | F95: 0 | J95: 4 | M95: #VALUE!
A96: He_lo world | B96: =SUBSTITUTE(RC[1],RC[2],RC[3],RC[4]) -> He_lo world | C96: Hello world | D96: l | E96: _ | F96: 1 | J96: 4
A97: Hel_o world | B97: =SUBSTITUTE(RC[1],RC[2],RC[3],RC[4]) -> Hel_o world | C97: Hello world | D97: l | E97: _ | F97: 2 | J97: 4
A98: Hello wor_d | B98: =SUBSTITUTE(RC[1],RC[2],RC[3],RC[4]) -> Hello wor_d | C98: Hello world | D98: l | E98: _ | F98: 3 | J98: 4
A99: Hello world | B99: =SUBSTITUTE(RC[1],RC[2],RC[3],RC[4]) -> Hello world | C99: Hello world | D99: l | E99: _ | F99: 4 | J99: 4
A101: Ah! Hello world | B101: =REPLACE(RC[1],RC[2],RC[3],RC[4]) -> Ah! Hello world | C101: Hello world | D101: 1 | E101: 0 | F101: Ah! | J101: 4 | K101: REPLACE | L101: REPLACE
A102: Schmello world | B102: =REPLACE(RC[1],RC[2],RC[3],RC[4]) -> Schmello world | C102: Hello world | D102: 1 | E102: 1 | F102: Schm | J102: 4
A103: Hello people | B103: =REPLACE(RC[1],RC[2],RC[3],RC[4]) -> Hello people | C103: Hello world | D103: 7 | E103: 5 | F103: people | J103: 4
A104: Hello people | B104: =REPLACE(RC[1],RC[2],RC[3],RC[4]) -> Hello people | C104: Hello world | D104: 7 | E104: 10 | F104: people | J104: 4
A105: Hello dear world | B105: =REPLACE(RC[1],RC[2],RC[3],RC[4]) -> Hello dear world | C105: Hello world | D105: 7 | E105: 0 | F105: dear | J105: 4
A106: Hello orld | B106: =REPLACE(RC[1],RC[2],RC[3],RC[4]) -> Hello orld | C106: Hello world | D106: 7 | E106: 1 | J106: 4
A107: Hello Vorld | B107: =REPLACE(RC[1],RC[2],RC[3],RC[4]) -> Hello Vorld | C107: Hello world | D107: 7 | E107: 1 | F107: V | J107: 4
A108: Hello worldxx | B108: =REPLACE(RC[1],RC[2],RC[3],RC[4]) -> Hello worldxx | C108: Hello world | D108: 50 | E108: 1 | F108: xx | J108: 4
A109: Hello worldxx | B109: =REPLACE(RC[1],RC[2],RC[3],RC[4]) -> Hello worldxx | C109: Hello world | D109: 50 | E109: 0 | F109: xx | J109: 4
A110: new | B110: =REPLACE(RC[1],RC[2],RC[3],RC[4]) -> new | D110: 1 | E110: 4 | F110: new | J110: 4
B111: =REPLACE(RC[1],RC[2],RC[3],RC[4]) -> #VALUE! | C111: Hello world | D111: 0 | E111: 2 | F111: bla | J111: 4 | M111: #VALUE!
B112: =REPLACE(RC[1],RC[2],RC[3],RC[4]) -> #VALUE! | C112: Hello world | D112: 1 | E112: -1 | F112: bla | J112: 4 | M112: #VALUE!
A114: 1 | B114: =EXACT(RC[1],RC[2]) -> 1 | J114: 2 | K114: EXACT | L114: EXACT
A115: 0 | B115: =EXACT(RC[1],RC[2]) -> 0 | C115: Hello | D115: hello | J115: 2
A116: 1 | B116: =EXACT(RC[1],RC[2]) -> 1 | C116: Hello | D116: Hello | J116: 2
A117: 0 | B117: =EXACT(RC[1],RC[2]) -> 0 | C117: Hello | D117: HellO | J117: 2
A118: 0 | B118: =EXACT(RC[1],RC[2]) -> 0 | D118: a | J118: 2
A119: 0 | B119: =EXACT(RC[1],RC[2]) -> 0 | C119: a | J119: 2
A120: 0 | B120: =EXACT(RC[1],RC[2]) -> 0 | J120: 2
A121: 0 | B121: =EXACT(RC[1],RC[2]) -> 0 | J121: 2
A122: 0 | B122: =EXACT(RC[1],RC[2]) -> 0 | C122: a | D122: ä | J122: 2
A123: 0 | B123: =EXACT(RC[1],RC[2]) -> 0 | C123: a | D123: A | J123: 2
A124: 1 | B124: =EXACT(RC[1],RC[2]) -> 1 | C124: 123 | D124: 123 | J124: 2
A125: 1 | B125: =EXACT(RC[1],RC[2]) -> 1 | C125: 12.34 | D125: 12,34 | J125: 2
A127: 2 | B127: =FIND(RC[1],RC[2]) -> 2 | C127: e | D127: Hello world | J127: 2 | K127: FIND | L127: FIND
A128: 1 | B128: =FIND(RC[1],RC[2]) -> 1 | C128: H | D128: Hello world | J128: 2
A129: 0 | B129: =FIND(RC[1],RC[2]) -> #VALUE! | C129: X | D129: Hello world | J129: 2 | M129: #VALUE!
A130: 11 | B130: =FIND(RC[1],RC[2]) -> 11 | C130: d | D130: Hello world | J130: 2
A131: 9 | B131: =FIND(RC[1],RC[2]) -> 9 | C131: r | D131: Hello world | J131: 2
A132: 8 | B132: =FIND(RC[1],RC[2]) -> 8 | C132: or | D132: Hello world | J132: 2
A133: 10 | B133: =FIND(RC[1],RC[2]) -> 10 | C133: ld | D133: Hello world | J133: 2
A134: 1 | B134: =FIND(RC[1],RC[2]) -> 1 | C134: Hello world | D134: Hello world | J134: 2
A135: 1 | B135: =FIND(RC[1],RC[2]) -> 1 | D135: Hello world | J135: 2
A136: 1 | B136: =FIND(RC[1],RC[2]) -> 1 | J136: 2
A137: 0 | B137: =FIND(RC[1],RC[2]) -> #VALUE! | C137: x | J137: 2 | M137: #VALUE!
A138: 5 | B138: =FIND(RC[1],RC[2]) -> 5 | C138: a | D138: àÀáÁaAäÄ | J138: 2
A139: 6 | B139: =FIND(RC[1],RC[2]) -> 6 | C139: A | D139: àÀáÁaAäÄ | J139: 2
A140: 7 | B140: =FIND(RC[1],RC[2]) -> 7 | C140: ä | D140: àÀáÁaAäÄ | J140: 2
A141: 8 | B141: =FIND(RC[1],RC[2]) -> 8 | C141: Ä | D141: àÀáÁaAäÄ | J141: 2
A142: 3 | B142: =FIND(RC[1],RC[2],RC[3]) -> 3 | C142: l | D142: Hello world | E142: 2 | J142: 3
A143: 3 | B143: =FIND(RC[1],RC[2],RC[3]) -> 3 | C143: l | D143: Hello world | E143: 3 | J143: 3
A144: 4 | B144: =FIND(RC[1],RC[2],RC[3]) -> 4 | C144: l | D144: Hello world | E144: 4 | J144: 3
A145: 10 | B145: =FIND(RC[1],RC[2],RC[3]) -> 10 | C145: l | D145: Hello world | E145: 5 | J145: 3
A146: 10 | B146: =FIND(RC[1],RC[2],RC[3]) -> 10 | C146: l | D146: Hello world | E146: 10 | J146: 3
A147: 0 | B147: =FIND(RC[1],RC[2],RC[3]) -> #VALUE! | C147: l | D147: Hello world | E147: 11 | J147: 3 | M147: #VALUE!
A148: 11 | B148: =FIND(RC[1],RC[2],RC[3]) -> 11 | C148: d | D148: Hello world | E148: 11 | J148: 3
A149: 0 | B149: =FIND(RC[1],RC[2],RC[3]) -> #VALUE! | C149: d | D149: Hello world | E149: 12 | J149: 3 | M149: #VALUE!
A150: 3 | B150: =FIND(RC[1],RC[2],RC[3]) -> 3 | C150: llo | D150: Hello world | E150: 1 | J150: 3
A151: 3 | B151: =FIND(RC[1],RC[2],RC[3]) -> 3 | C151: llo | D151: Hello world | E151: 3 | J151: 3
A152: 0 | B152: =FIND(RC[1],RC[2],RC[3]) -> #VALUE! | C152: llo | D152: Hello world | E152: 4 | J152: 3 | M152: #VALUE!
A154: 2 | B154: =SEARCH(RC[1],RC[2]) -> 2 | C154: e | D154: Hello world | J154: 2 | K154: SEARCH | L154: SEARCH
A155: 1 | B155: =SEARCH(RC[1],RC[2]) -> 1 | C155: H | D155: Hello world | J155: 2
A156: 0 | B156: =SEARCH(RC[1],RC[2]) -> #VALUE! | C156: X | D156: Hello world | J156: 2 | M156: #VALUE!
A157: 11 | B157: =SEARCH(RC[1],RC[2]) -> 11 | C157: d | D157: Hello world | J157: 2
A158: 9 | B158: =SEARCH(RC[1],RC[2]) -> 9 | C158: r | D158: Hello world | J158: 2
A159: 8 | B159: =SEARCH(RC[1],RC[2]) -> 8 | C159: or | D159: Hello world | J159: 2
A160: 10 | B160: =SEARCH(RC[1],RC[2]) -> 10 | C160: ld | D160: Hello world | J160: 2
A161: 1 | B161: =SEARCH(RC[1],RC[2]) -> 1 | C161: Hello world | D161: Hello world | J161: 2
A162: 1 | B162: =SEARCH(RC[1],RC[2]) -> 1 | D162: Hello world | J162: 2
A163: 2 | B163: =SEARCH(RC[1],RC[2]) -> 2 | C163: e*o | D163: Hello world | J163: 2
A164: 5 | B164: =SEARCH(RC[1],RC[2]) -> 5 | C164: o*l | D164: Hello world | J164: 2
A165: 8 | B165: =SEARCH(RC[1],RC[2]) -> 8 | C165: o?l | D165: Hello world | J165: 2
A166: 0 | B166: =SEARCH(RC[1],RC[2]) -> #VALUE! | C166: o??l | D166: Hello world | J166: 2 | M166: #VALUE!
A167: 5 | B167: =SEARCH(RC[1],RC[2]) -> 5 | C167: ~**~?*~~. | D167: Use * or ?, escape with ~. | J167: 2
A168: 0 | B168: =SEARCH(RC[1],RC[2]) -> #VALUE! | C168: ~**~**~~. | D168: Use * or ?, escape with ~. | J168: 2 | M168: #VALUE!
A169: 7 | B169: =SEARCH(RC[1],RC[2]) -> 7 | C169: ~o~r | D169: Use * or ?, escape with ~. | J169: 2
A170: 8 | B170: =SEARCH(RC[1],RC[2]) -> 8 | C170: g ~ | D170: Trailing ~ | J170: 2
A171: 0 | B171: =SEARCH(RC[1],RC[2]) -> #VALUE! | J171: 2 | M171: #VALUE!
A172: 0 | B172: =SEARCH(RC[1],RC[2]) -> #VALUE! | C172: x | J172: 2 | M172: #VALUE!
A173: 5 | B173: =SEARCH(RC[1],RC[2]) -> 5 | C173: a | D173: àÀáÁaAäÄ | J173: 2
A174: 5 | B174: =SEARCH(RC[1],RC[2]) -> 5 | C174: A | D174: àÀáÁaAäÄ | J174: 2
A175: 7 | B175: =SEARCH(RC[1],RC[2]) -> 7 | C175: ä | D175: àÀáÁaAäÄ | J175: 2
A176: 7 | B176: =SEARCH(RC[1],RC[2]) -> 7 | C176: Ä | D176: àÀáÁaAäÄ | J176: 2
A177: 5 | B177: =SEARCH(RC[1],RC[2]) -> 5 | C177: в | D177: аАбБвВгГ | J177: 2
A178: 5 | B178: =SEARCH(RC[1],RC[2]) -> 5 | C178: В | D178: аАбБвВгГ | J178: 2
A179: 3 | B179: =SEARCH(RC[1],RC[2],RC[3]) -> 3 | C179: l | D179: Hello world | E179: 2 | J179: 3
A180: 3 | B180: =SEARCH(RC[1],RC[2],RC[3]) -> 3 | C180: l | D180: Hello world | E180: 3 | J180: 3
A181: 4 | B181: =SEARCH(RC[1],RC[2],RC[3]) -> 4 | C181: l | D181: Hello world | E181: 4 | J181: 3
A182: 10 | B182: =SEARCH(RC[1],RC[2],RC[3]) -> 10 | C182: l | D182: Hello world | E182: 5 | J182: 3
A183: 10 | B183: =SEARCH(RC[1],RC[2],RC[3]) -> 10 | C183: l | D183: Hello world | E183: 10 | J183: 3
A184: 0 | B184: =SEARCH(RC[1],RC[2],RC[3]) -> #VALUE! | C184: l | D184: Hello world | E184: 11 | J184: 3 | M184: #VALUE!
A185: 11 | B185: =SEARCH(RC[1],RC[2],RC[3]) -> 11 | C185: d | D185: Hello world | E185: 11 | J185: 3
A186: 0 | B186: =SEARCH(RC[1],RC[2],RC[3]) -> #VALUE! | C186: d | D186: Hello world | E186: 12 | J186: 3 | M186: #VALUE!
A187: 3 | B187: =SEARCH(RC[1],RC[2],RC[3]) -> 3 | C187: llo | D187: Hello world | E187: 1 | J187: 3
A188: 3 | B188: =SEARCH(RC[1],RC[2],RC[3]) -> 3 | C188: llo | D188: Hello world | E188: 3 | J188: 3
A189: 0 | B189: =SEARCH(RC[1],RC[2],RC[3]) -> #VALUE! | C189: llo | D189: Hello world | E189: 4 | J189: 3 | M189: #VALUE!
A190: 2 | B190: =SEARCH(RC[1],RC[2],RC[3]) -> 2 | C190: e*o | D190: Hello world | E190: 1 | J190: 3
A191: 2 | B191: =SEARCH(RC[1],RC[2],RC[3]) -> 2 | C191: e*o | D191: Hello world | E191: 2 | J191: 3
A192: 0 | B192: =SEARCH(RC[1],RC[2],RC[3]) -> #VALUE! | C192: e*o | D192: Hello world | E192: 3 | J192: 3 | M192: #VALUE!
A193: 8 | B193: =SEARCH(RC[1],RC[2],RC[3]) -> 8 | C193: e*o | D193: Hello Hello | E193: 5 | J193: 3
A195: hello | B195: =LOWER(RC[1]) -> hello | C195: HELLO | J195: 1 | K195: LOWER | L195: LOWER
A196: hello | B196: =LOWER(RC[1]) -> hello | C196: Hello | J196: 1
A197: hello | B197: =LOWER(RC[1]) -> hello | C197: hellO | J197: 1
A198: ààááaaää | B198: =LOWER(RC[1]) -> ààááaaää | C198: àÀáÁaAäÄ | J198: 1
A199: 12,3 | B199: =LOWER(RC[1]) -> 12,3 | C199: 12.3 | J199: 1
B200: =LOWER(RC[1]) ->  | J200: 1
A202: HELLO | B202: =UPPER(RC[1]) -> HELLO | C202: HELLO | J202: 1 | K202: UPPER | L202: UPPER
A203: HELLO | B203: =UPPER(RC[1]) -> HELLO | C203: Hello | J203: 1
A204: HELLO | B204: =UPPER(RC[1]) -> HELLO | C204: hellO | J204: 1
A205: ÀÀÁÁAAÄÄ | B205: =UPPER(RC[1]) -> ÀÀÁÁAAÄÄ | C205: àÀáÁaAäÄ | J205: 1
A206: 12,3 | B206: =UPPER(RC[1]) -> 12,3 | C206: 12.3 | J206: 1
B207: =UPPER(RC[1]) ->  | J207: 1
A209: This Is A Title | B209: =PROPER(RC[1]) -> This Is A Title | C209: this is a TITLE | J209: 1 | K209: PROPER | L209: PROPER
A210: 2-Cent'S Worth | B210: =PROPER(RC[1]) -> 2-Cent'S Worth | C210: 2-cent's worth | J210: 1
A211: 76Budget | B211: =PROPER(RC[1]) -> 76Budget | C211: 76BudGet | J211: 1
A212: Ààá Áaa Ää | B212: =PROPER(RC[1]) -> Ààá Áaa Ää | C212: àÀá ÁaA äÄ | J212: 1
A213: Ааб Бвв Ггд Д | B213: =PROPER(RC[1]) -> Ааб Бвв Ггд Д | C213: АаБ бВв ГгД д | J213: 1
A215: *abc*abc*abc | B215: =REPT(RC[1],RC[2]) -> *abc*abc*abc | C215: *abc | D215: 3 | J215: 2 | K215: REPT | L215: REPT
A216: àÀáÁaAäÄ | B216: =REPT(RC[1],RC[2]) -> àÀáÁaAäÄ | C216: àÀáÁaAäÄ | D216: 1 | J216: 2
B217: =REPT(RC[1],RC[2]) ->  | C217: abc | D217: 0 | J217: 2
A219: aaa bb c | B219: =TRIM(RC[1]) -> aaa bb c | C219: aaa bb c | J219: 1 | K219: TRIM | L219: TRIM
A220: aaa bb c | B220: =TRIM(RC[1]) -> aaa bb c | C220: aaa bb c | J220: 1
A222: 12 | B222: =RC[2] -> 12 | C222: 1 | D222: =1.2*10^RC[-1] -> 12 | J222: 1 | K222: Plain vs. scientific format with String valued outputs | L222: xx
A223: 120 | B223: =RC[2] -> 120 | C223: 2 | D223: =1.2*10^RC[-1] -> 120 | J223: 1
A224: 1200 | B224: =RC[2] -> 1200 | C224: 3 | D224: =1.2*10^RC[-1] -> 1200 | J224: 1
A225: 12000 | B225: =RC[2] -> 12000 | C225: 4 | D225: =1.2*10^RC[-1] -> 12000 | J225: 1
A226: 120000 | B226: =RC[2] -> 120000 | C226: 5 | D226: =1.2*10^RC[-1] -> 120000 | J226: 1
A227: 1200000 | B227: =RC[2] -> 1200000 | C227: 6 | D227: =1.2*10^RC[-1] -> 1200000 | J227: 1
A228: 12000000 | B228: =RC[2] -> 12000000 | C228: 7 | D228: =1.2*10^RC[-1] -> 12000000 | J228: 1 | N228: long
A229: 120000000 | B229: =RC[2] -> 120000000 | C229: 8 | D229: =1.2*10^RC[-1] -> 120000000 | J229: 1 | N229: long
A230: 1200000000 | B230: =RC[2] -> 1200000000 | C230: 9 | D230: =1.2*10^RC[-1] -> 1200000000 | J230: 1 | N230: long
A231: 12000000000 | B231: =RC[2] -> 12000000000 | C231: 10 | D231: =1.2*10^RC[-1] -> 12000000000 | J231: 1 | N231: long
A232: 120000000000 | B232: =RC[2] -> 120000000000 | C232: 11 | D232: =1.2*10^RC[-1] -> 120000000000 | J232: 1 | N232: long
A233: 1200000000000 | B233: =RC[2] -> 1200000000000 | C233: 12 | D233: =1.2*10^RC[-1] -> 1200000000000 | J233: 1 | N233: long
A234: 12000000000000 | B234: =RC[2] -> 12000000000000 | C234: 13 | D234: =1.2*10^RC[-1] -> 12000000000000 | J234: 1 | N234: long
A235: 120000000000000 | B235: =RC[2] -> 120000000000000 | C235: 14 | D235: =1.2*10^RC[-1] -> 120000000000000 | J235: 1 | N235: long
A236: 1200000000000000 | B236: =RC[2] -> 1200000000000000 | C236: 15 | D236: =1.2*10^RC[-1] -> 1200000000000000 | J236: 1 | N236: long
A237: 1.2E+16 | B237: =RC[2] -> 1.2E+16 | C237: 16 | D237: =1.2*10^RC[-1] -> 1.2E+16 | J237: 1 | N237: long
A238: 1.2E+17 | B238: =RC[2] -> 1.2E+17 | C238: 17 | D238: =1.2*10^RC[-1] -> 1.2E+17 | J238: 1 | N238: long
A239: 1.2E+18 | B239: =RC[2] -> 1.2E+18 | C239: 18 | D239: =1.2*10^RC[-1] -> 1.2E+18 | J239: 1 | N239: long
A240: 1.2E+19 | B240: =RC[2] -> 1.2E+19 | C240: 19 | D240: =1.2*10^RC[-1] -> 1.2E+19 | J240: 1 | N240: long
A241: 1.2E+20 | B241: =RC[2] -> 1.2E+20 | C241: 20 | D241: =1.2*10^RC[-1] -> 1.2E+20 | J241: 1 | N241: long jre14
A242: 1.2E+21 | B242: =RC[2] -> 1.2E+21 | C242: 21 | D242: =1.2*10^RC[-1] -> 1.2E+21 | J242: 1 | N242: long jre14
A243: 1.234E+19 | B243: =RC[2] -> 1.234E+19 | C243: 18 | D243: =12.34*10^RC[-1] -> 1.234E+19 | J243: 1 | N243: long
A244: 1.234E+20 | B244: =RC[2] -> 1.234E+20 | C244: 19 | D244: =12.34*10^RC[-1] -> 1.234E+20 | J244: 1 | N244: long jre14
A245: -1.234E+19 | B245: =RC[2] -> -1.234E+19 | C245: 18 | D245: =-(12.34*10^RC[-1]) -> -1.234E+19 | J245: 1 | N245: long
A246: -1.234E+20 | B246: =RC[2] -> -1.234E+20 | C246: 19 | D246: =-(12.34*10^RC[-1]) -> -1.234E+20 | J246: 1 | N246: long jre14
A248: Str 12 | B248: ="Str "&RC[2] -> Str 12 | C248: 1 | D248: =1.2*10^RC[-1] -> 12 | J248: 1 | K248: Plain vs. scientific format with & | L248: &
A249: Str 120 | B249: ="Str "&RC[2] -> Str 120 | C249: 2 | D249: =1.2*10^RC[-1] -> 120 | J249: 1
A250: Str 1200 | B250: ="Str "&RC[2] -> Str 1200 | C250: 3 | D250: =1.2*10^RC[-1] -> 1200 | J250: 1
A251: Str 12000 | B251: ="Str "&RC[2] -> Str 12000 | C251: 4 | D251: =1.2*10^RC[-1] -> 12000 | J251: 1
A252: Str 120000 | B252: ="Str "&RC[2] -> Str 120000 | C252: 5 | D252: =1.2*10^RC[-1] -> 120000 | J252: 1
A253: Str 1200000 | B253: ="Str "&RC[2] -> Str 1200000 | C253: 6 | D253: =1.2*10^RC[-1] -> 1200000 | J253: 1
A254: Str 12000000 | B254: ="Str "&RC[2] -> Str 12000000 | C254: 7 | D254: =1.2*10^RC[-1] -> 12000000 | J254: 1 | N254: long
A255: Str 120000000 | B255: ="Str "&RC[2] -> Str 120000000 | C255: 8 | D255: =1.2*10^RC[-1] -> 120000000 | J255: 1 | N255: long
A256: Str 1200000000 | B256: ="Str "&RC[2] -> Str 1200000000 | C256: 9 | D256: =1.2*10^RC[-1] -> 1200000000 | J256: 1 | N256: long
A257: Str 12000000000 | B257: ="Str "&RC[2] -> Str 12000000000 | C257: 10 | D257: =1.2*10^RC[-1] -> 12000000000 | J257: 1 | N257: long
A258: Str 120000000000 | B258: ="Str "&RC[2] -> Str 120000000000 | C258: 11 | D258: =1.2*10^RC[-1] -> 120000000000 | J258: 1 | N258: long
A259: Str 1200000000000 | B259: ="Str "&RC[2] -> Str 1200000000000 | C259: 12 | D259: =1.2*10^RC[-1] -> 1200000000000 | J259: 1 | N259: long
A260: Str 12000000000000 | B260: ="Str "&RC[2] -> Str 12000000000000 | C260: 13 | D260: =1.2*10^RC[-1] -> 12000000000000 | J260: 1 | N260: long
A261: Str 120000000000000 | B261: ="Str "&RC[2] -> Str 120000000000000 | C261: 14 | D261: =1.2*10^RC[-1] -> 120000000000000 | J261: 1 | N261: long
A262: Str 1200000000000000 | B262: ="Str "&RC[2] -> Str 1200000000000000 | C262: 15 | D262: =1.2*10^RC[-1] -> 1200000000000000 | J262: 1 | N262: long
A263: Str 12000000000000000 | B263: ="Str "&RC[2] -> Str 12000000000000000 | C263: 16 | D263: =1.2*10^RC[-1] -> 1.2E+16 | J263: 1 | N263: long
A264: Str 120000000000000000 | B264: ="Str "&RC[2] -> Str 120000000000000000 | C264: 17 | D264: =1.2*10^RC[-1] -> 1.2E+17 | J264: 1 | N264: long
A265: Str 1200000000000000000 | B265: ="Str "&RC[2] -> Str 1200000000000000000 | C265: 18 | D265: =1.2*10^RC[-1] -> 1.2E+18 | J265: 1 | N265: long
A266: Str 12000000000000000000 | B266: ="Str "&RC[2] -> Str 12000000000000000000 | C266: 19 | D266: =1.2*10^RC[-1] -> 1.2E+19 | J266: 1 | N266: long
A267: Str 1,2E+20 | B267: ="Str "&RC[2] -> Str 1,2E+20 | C267: 20 | D267: =1.2*10^RC[-1] -> 1.2E+20 | J267: 1 | N267: long jre14
A268: Str 1,2E+21 | B268: ="Str "&RC[2] -> Str 1,2E+21 | C268: 21 | D268: =1.2*10^RC[-1] -> 1.2E+21 | J268: 1 | N268: long jre14
A269: Str 12340000000000000000 | B269: ="Str "&RC[2] -> Str 12340000000000000000 | C269: 18 | D269: =12.34*10^RC[-1] -> 1.234E+19 | J269: 1 | N269: long
A270: Str 1,234E+20 | B270: ="Str "&RC[2] -> Str 1,234E+20 | C270: 19 | D270: =12.34*10^RC[-1] -> 1.234E+20 | J270: 1 | N270: long jre14
A271: Str -12340000000000000000 | B271: ="Str "&RC[2] -> Str -12340000000000000000 | C271: 18 | D271: =-(12.34*10^RC[-1]) -> -1.234E+19 | J271: 1 | N271: long
A272: Str -1,234E+20 | B272: ="Str "&RC[2] -> Str -1,234E+20 | C272: 19 | D272: =-(12.34*10^RC[-1]) -> -1.234E+20 | J272: 1 | N272: long jre14
A274: Hello world! | B274: =CONCATENATE(RC[1]," ",RC[2]) -> Hello world! | C274: Hello | D274: world! | J274: 2 | K274: CONCATENATE | L274: CONCATENATE
A275: StartMiddleEnd | B275: =CONCATENATE(RC[1],RC[2],RC[3]) -> StartMiddleEnd | C275: Start | D275: Middle | E275: End | J275: 3
A276: StartEnd | B276: =CONCATENATE(RC[1],RC[2],RC[3]) -> StartEnd | C276: Start | E276: End | J276: 3
A277: MiddleEnd | B277: =CONCATENATE(RC[1],RC[2],RC[3]) -> MiddleEnd | D277: Middle | E277: End | J277: 3
A278: StartMiddle | B278: =CONCATENATE(RC[1],RC[2],RC[3]) -> StartMiddle | C278: Start | D278: Middle | J278: 3
A280: Zero is 0 | B280: =CONCATENATE(RC[1]," is ",RC[2]) -> Zero is 0 | C280: Zero | D280: 0 | J280: 2
A281: Fraction is 12345,6789 | B281: =CONCATENATE(RC[1]," is ",RC[2]) -> Fraction is 12345,6789 | C281: Fraction | D281: 12345.678900000001 | J281: 2
A282: Exponent is 12000000000 | B282: =CONCATENATE(RC[1]," is ",RC[2]) -> Exponent is 12000000000 | C282: Exponent | D282: 12000000000 | J282: 2
A283: Integer is 123456789 | B283: =CONCATENATE(RC[1]," is ",RC[2]) -> Integer is 123456789 | C283: Integer | D283: 123456789 | J283: 2
A284: Percent is 0,1 | B284: =CONCATENATE(RC[1]," is ",RC[2]) -> Percent is 0,1 | C284: Percent | D284: 0.1 | J284: 2
A285: Date is 38032 | B285: =CONCATENATE("Date is ",RC[1]) -> Date is 38032 | C285: 2004-02-15T00:00:00.000 | J285: 1
A286: Bool is 1 | B286: =CONCATENATE("Bool is ",RC[1]) -> Bool is TRUE | C286: 1 | J286: 1 | M286: Bool is TRUE
A287: Bool is 0 | B287: =CONCATENATE("Bool is ",RC[1]) -> Bool is FALSE | C287: 0 | J287: 1 | M287: Bool is FALSE
A288: Bool is 1 | B288: =CONCATENATE("Bool is ",RC[1]=RC[2]) -> Bool is TRUE | C288: 1 | D288: 1 | J288: 2 | M288: Bool is TRUE
A289: Bool is 0 | B289: =CONCATENATE("Bool is ",RC[1]=RC[2]) -> Bool is FALSE | C289: 1 | D289: 2 | J289: 2 | M289: Bool is FALSE
A291: Str 12 | B291: =CONCATENATE("Str ",RC[2]) -> Str 12 | C291: 1 | D291: =1.2*10^RC[-1] -> 12 | J291: 1 | K291: Plain vs. scientific format
A292: Str 120 | B292: =CONCATENATE("Str ",RC[2]) -> Str 120 | C292: 2 | D292: =1.2*10^RC[-1] -> 120 | J292: 1
A293: Str 1200 | B293: =CONCATENATE("Str ",RC[2]) -> Str 1200 | C293: 3 | D293: =1.2*10^RC[-1] -> 1200 | J293: 1
A294: Str 12000 | B294: =CONCATENATE("Str ",RC[2]) -> Str 12000 | C294: 4 | D294: =1.2*10^RC[-1] -> 12000 | J294: 1
A295: Str 120000 | B295: =CONCATENATE("Str ",RC[2]) -> Str 120000 | C295: 5 | D295: =1.2*10^RC[-1] -> 120000 | J295: 1
A296: Str 1200000 | B296: =CONCATENATE("Str ",RC[2]) -> Str 1200000 | C296: 6 | D296: =1.2*10^RC[-1] -> 1200000 | J296: 1
A297: Str 12000000 | B297: =CONCATENATE("Str ",RC[2]) -> Str 12000000 | C297: 7 | D297: =1.2*10^RC[-1] -> 12000000 | J297: 1 | N297: long
A298: Str 120000000 | B298: =CONCATENATE("Str ",RC[2]) -> Str 120000000 | C298: 8 | D298: =1.2*10^RC[-1] -> 120000000 | J298: 1 | N298: long
A299: Str 1200000000 | B299: =CONCATENATE("Str ",RC[2]) -> Str 1200000000 | C299: 9 | D299: =1.2*10^RC[-1] -> 1200000000 | J299: 1 | N299: long
A300: Str 12000000000 | B300: =CONCATENATE("Str ",RC[2]) -> Str 12000000000 | C300: 10 | D300: =1.2*10^RC[-1] -> 12000000000 | J300: 1 | N300: long
A301: Str 120000000000 | B301: =CONCATENATE("Str ",RC[2]) -> Str 120000000000 | C301: 11 | D301: =1.2*10^RC[-1] -> 120000000000 | J301: 1 | N301: long
A302: Str 1200000000000 | B302: =CONCATENATE("Str ",RC[2]) -> Str 1200000000000 | C302: 12 | D302: =1.2*10^RC[-1] -> 1200000000000 | J302: 1 | N302: long
A303: Str 12000000000000 | B303: =CONCATENATE("Str ",RC[2]) -> Str 12000000000000 | C303: 13 | D303: =1.2*10^RC[-1] -> 12000000000000 | J303: 1 | N303: long
A304: Str 120000000000000 | B304: =CONCATENATE("Str ",RC[2]) -> Str 120000000000000 | C304: 14 | D304: =1.2*10^RC[-1] -> 120000000000000 | J304: 1 | N304: long
A305: Str 1200000000000000 | B305: =CONCATENATE("Str ",RC[2]) -> Str 1200000000000000 | C305: 15 | D305: =1.2*10^RC[-1] -> 1200000000000000 | J305: 1 | N305: long
A306: Str 12000000000000000 | B306: =CONCATENATE("Str ",RC[2]) -> Str 12000000000000000 | C306: 16 | D306: =1.2*10^RC[-1] -> 1.2E+16 | J306: 1 | N306: long
A307: Str 120000000000000000 | B307: =CONCATENATE("Str ",RC[2]) -> Str 120000000000000000 | C307: 17 | D307: =1.2*10^RC[-1] -> 1.2E+17 | J307: 1 | N307: long
A308: Str 1200000000000000000 | B308: =CONCATENATE("Str ",RC[2]) -> Str 1200000000000000000 | C308: 18 | D308: =1.2*10^RC[-1] -> 1.2E+18 | J308: 1 | N308: long
A309: Str 12000000000000000000 | B309: =CONCATENATE("Str ",RC[2]) -> Str 12000000000000000000 | C309: 19 | D309: =1.2*10^RC[-1] -> 1.2E+19 | J309: 1 | N309: long
A310: Str 1,2E+20 | B310: =CONCATENATE("Str ",RC[2]) -> Str 1,2E+20 | C310: 20 | D310: =1.2*10^RC[-1] -> 1.2E+20 | J310: 1 | N310: long jre14
A311: Str 1,2E+21 | B311: =CONCATENATE("Str ",RC[2]) -> Str 1,2E+21 | C311: 21 | D311: =1.2*10^RC[-1] -> 1.2E+21 | J311: 1 | N311: long jre14