Sheet: Sheet1
A1: Function Evaluation Test Cases for SEJ | C1: Look at the formulas in this column to see what SEJ supports!
C2: Use "Tools > Formula Auditing > Formula Auditing Mode" to show them all at once.
A4: Name | B4: Expected | C4: Actual | D4: # of Inputs | E4: Inputs
A6: Constant basic operators | B6: 3 | C6: =1+2 -> 3
B7: 7 | C7: =1+2*3 -> 7
B8: 8 | C8: =10-4/2 -> 8
B9: -2 | C9: =-5 - -3 -> -2
B10: 0.09 | C10: =(3+4)% + 2% -> 9.0000000000000011E-2
B11: 24 | C11: =2^3 + 2^(1+3) -> 24
A13: Constant comparisons | B13: 1 | C13: =IF( 1 = 1, 1, 0 ) -> 1
B14: 0 | C14: =IF( 1 = 2, 1, 0 ) -> 0
B15: 0 | C15: =IF( 1 <> 1, 1, 0 ) -> 0
B16: 1 | C16: =IF( 1 <> 2, 1, 0 ) -> 1
B17: 0 | C17: =IF( 1 > 2, 1, 0 ) -> 0
B18: 1 | C18: =IF( 2 > 1, 1, 0 ) -> 1
B19: 1 | C19: =IF( 1 < 2, 1, 0 ) -> 1
B20: 0 | C20: =IF( 2 < 1, 1, 0 ) -> 0
B21: 1 | C21: =IF( 1 >= 1, 1, 0 ) -> 1
B22: 0 | C22: =IF( 1 >= 2, 1, 0 ) -> 0
B23: 1 | C23: =IF( 2 >= 1, 1, 0 ) -> 1
B24: 1 | C24: =IF( 1 <= 1, 1, 0 ) -> 1
B25: 1 | C25: =IF( 1 <= 2, 1, 0 ) -> 1
B26: 0 | C26: =IF( 2 <= 1, 1, 0 ) -> 0
A28: Precision | B28: 12 | C28: =12.0049 -> 12.004899999999999
B29: 12.01 | C29: =12.005 -> 12.005000000000001
B30: 13 | C30: =12.999 -> 12.999000000000001
B31: 12.01 | C31: =12.0149 -> 12.014900000000001
B32: 12.02 | C32: =12.015 -> 12.015000000000001
B33: 12 | C33: =12.0001 -> 12.0001
B34: -12 | C34: =-12.0049 -> -12.004899999999999
B35: -12.01 | C35: =-12.005 -> -12.005000000000001
B36: -13 | C36: =-12.999 -> -12.999000000000001
B37: -12 | C37: =-12.0001 -> -12.0001
A39: Precision only on final output | B39: 0.21 | C39: =RC[2]+RC[3] -> 0.20799999999999999 | D39: 2 | E39: 0.104 | F39: 0.104
B40: 0.41 | C40: =RC[2]+RC[3] -> 0.40799999999999997 | D40: 2 | E40: 0.20399999999999999 | F40: 0.20399999999999999
A42: Basic operators | B42: 3 | C42: =RC[2]+RC[3] -> 3 | D42: 2 | E42: 1 | F42: 2
B44: 7 | C44: =RC[2]+RC[3]*RC[4] -> 7 | D44: 3 | E44: 1 | F44: 2 | G44: 3
B46: 8 | C46: =RC[2]-RC[3]/RC[4] -> 8 | D46: 3 | E46: 10 | F46: 4 | G46: 2
B48: 9.6666666669999994 | C48: =RC[2]-RC[3]/RC[4] -> 9.6666666666666661 | D48: 3 | E48: 10 | F48: 1 | G48: 3
B50: -2 | C50: =-RC[2] - -RC[3] -> -2 | D50: 2 | E50: 5 | F50: 3
B52: 0.09 | C52: =(RC[2]+RC[3])% + RC[4]% -> 9.0000000000000011E-2 | D52: 3 | E52: 3 | F52: 4 | G52: 2
B54: 24 | C54: =RC[2]^RC[3] + RC[4]^(RC[5]+RC[6]) -> 24 | D54: 5 | E54: 2 | F54: 3 | G54: 2 | H54: 1 | I54: 3
A69: Sums | B69: 6 | C69: =SUM(RC[2]:RC[4]) -> 6 | D69: 3 | E69: 1 | F69: 2 | G69: 3
B70: 15 | C70: =SUM(RC[2]:RC[4]) -> 15 | D70: 3 | E70: 4 | F70: 5 | G70: 6
B71: 16 | C71: =SUM(RC[2]:RC[4]) -> 16 | D71: 3 | E71: 4 | F71: =R[-2]C -> 2 | G71: 10
B73: 1 | C73: =SUM(RC[2]) -> 1 | D73: 1 | E73: 1
B75: 3 | C75: =SUM(RC[2],RC[3]) -> 3 | D75: 2 | E75: 1 | F75: 2
B76: 9 | C76: =SUM(RC[2],RC[3]) -> 9 | D76: 2 | E76: 4 | F76: 5
B77: 21 | C77: =SUM(RC[2],RC[3]) -> 21 | D77: 2 | E77: =R[-2]C -> 1 | F77: 20
B79: 6 | C79: =SUM(RC[2],RC[3],RC[4]) -> 6 | D79: 3 | E79: 1 | F79: 2 | G79: 3
B81: 10 | C81: =SUM(RC[2],RC[3],RC[4],RC[5]) -> 10 | D81: 4 | E81: 1 | F81: 2 | G81: 3 | H81: 4
A83: Sum with 2D range | B83: 21 | C83: =SUM(R[-14]C[2]:R[-13]C[4]) -> 21
A85: Count with 2D range | B85: 6 | C85: =COUNT(R[-16]C[2]:R[-15]C[4]) -> 6
A87: Sum over named range | B87: 15 | C87: =SUM(Summands) -> 15 | D87: 3 | E87: 4 | F87: 5 | G87: 6
B88: 9 | C88: =SUM(RC[2]:RC[4]) -> 9 | D88: 3 | E88: 1 | F88: =R[-1]C -> 5 | G88: 3
A90: Sum with range past right edge | B90: 3 | C90: =SUM(RC[2]:RC[7]) -> 3 | D90: 6 | E90: 1 | F90: 2
A92: Computation involving empty cells | B92: 1 | C92: =RC[2]+RC[3]-RC[4] -> 1 | D92: 3 | E92: 1
B93: 17 | C93: =RC[2]+RC[3]-RC[4] -> 17 | D93: 3 | F93: 17
B94: 2 | C94: =RC[2]+RC[3]-RC[4] -> 2 | D94: 3 | E94: 2
B96: 0 | C96: =RC[2]*RC[3] -> 0 | D96: 2 | E96: 3
A98: Sum involving empty cells | B98: 1 | C98: =SUM(RC[2]:RC[4],RC[6],RC[8]) -> 1 | D98: 7 | E98: 1
B99: 6 | C99: =SUM(RC[2]:RC[4],RC[6],RC[8]) -> 6 | D99: 7 | F99: 2 | I99: 4
A101: Names | B101: 100 | C101: =MYCELL -> 100 | D101: 1 | E101: 100
B103: 200 | C103: =_MY_CELL_ + _MY_CELL -> 200 | D103: 1 | E103: 100
B105: 100 | C105: =_MY.CELL.1X -> 100 | D105: 1 | E105: 100
B107: 100 | C107: =MY23.43CELL -> 100 | D107: 1 | E107: 100
B109: 100 | C109: =_12345 -> 100 | D109: 1 | E109: 100
B111: 400 | C111: =A1B+A1_+A1.1+A_1+A.1 -> 400 | D111: 5 | E111: 100 | F111: 90 | G111: 80 | H111: 70 | I111: 60
A113: Products | B113: 6 | C113: =PRODUCT(RC[2]:RC[4]) -> 6 | D113: 3 | E113: 1 | F113: 2 | G113: 3
B114: 120 | C114: =PRODUCT(RC[2]:RC[4]) -> 120 | D114: 3 | E114: 4 | F114: 5 | G114: 6
B115: 80 | C115: =PRODUCT(RC[2]:RC[4]) -> 80 | D115: 3 | E115: 4 | F115: =R[-2]C -> 2 | G115: 10
B117: 1 | C117: =PRODUCT(RC[2]) -> 1 | D117: 1 | E117: 1
B119: 2 | C119: =PRODUCT(RC[2],RC[3]) -> 2 | D119: 2 | E119: 1 | F119: 2
B120: 20 | C120: =PRODUCT(RC[2],RC[3]) -> 20 | D120: 2 | E120: 4 | F120: 5
B121: 20 | C121: =PRODUCT(RC[2],RC[3]) -> 20 | D121: 2 | E121: =R[-2]C -> 1 | F121: 20
B123: 6 | C123: =PRODUCT(RC[2],RC[3],RC[4]) -> 6 | D123: 3 | E123: 1 | F123: 2 | G123: 3
B125: 24 | C125: =PRODUCT(RC[2],RC[3],RC[4],RC[5]) -> 24 | D125: 4 | E125: 1 | F125: 2 | G125: 3 | H125: 4
A127: Counts | B127: 3 | C127: =COUNT(RC[2]:RC[4]) -> 3 | D127: 3 | E127: 1 | F127: 2 | G127: 3
B128: 3 | C128: =COUNT(RC[2]:RC[4]) -> 3 | D128: 3 | E128: 4 | F128: 5 | G128: 6
B129: 3 | C129: =COUNT(RC[2]:RC[4]) -> 3 | D129: 3 | E129: 4 | F129: =R[-2]C -> 2 | G129: 10
B131: 1 | C131: =COUNT(RC[2]) -> 1 | D131: 1 | E131: 1
B133: 2 | C133: =COUNT(RC[2],RC[3]) -> 2 | D133: 2 | E133: 1 | F133: 2
B134: 2 | C134: =COUNT(RC[2],RC[3]) -> 2 | D134: 2 | E134: 4 | F134: 5
B135: 2 | C135: =COUNT(RC[2],RC[3]) -> 2 | D135: 2 | E135: =R[-2]C -> 1 | F135: 20
B137: 3 | C137: =COUNT(RC[2],RC[3],RC[4]) -> 3 | D137: 3 | E137: 1 | F137: 2 | G137: 3
B139: 4 | C139: =COUNT(RC[2],RC[3],RC[4],RC[5]) -> 4 | D139: 4 | E139: 1 | F139: 2 | G139: 3 | H139: 4
A141: Averages | B141: 2 | C141: =AVERAGE(RC[2]:RC[4]) -> 2 | D141: 3 | E141: 1 | F141: 2 | G141: 3
B142: 5 | C142: =AVERAGE(RC[2]:RC[4]) -> 5 | D142: 3 | E142: 4 | F142: 5 | G142: 6
B143: 5.3333333329999997 | C143: =AVERAGE(RC[2]:RC[4]) -> 5.333333333333333 | D143: 3 | E143: 4 | F143: =R[-2]C -> 2 | G143: 10
B145: 1 | C145: =AVERAGE(RC[2]) -> 1 | D145: 1 | E145: 1
B147: 1.5 | C147: =AVERAGE(RC[2],RC[3]) -> 1.5 | D147: 2 | E147: 1 | F147: 2
B148: 4.5 | C148: =AVERAGE(RC[2],RC[3]) -> 4.5 | D148: 2 | E148: 4 | F148: 5
B149: 10.5 | C149: =AVERAGE(RC[2],RC[3]) -> 10.5 | D149: 2 | E149: =R[-2]C -> 1 | F149: 20
B151: 2 | C151: =AVERAGE(RC[2],RC[3],RC[4]) -> 2 | D151: 3 | E151: 1 | F151: 2 | G151: 3
B153: 2.5 | C153: =AVERAGE(RC[2],RC[3],RC[4],RC[5]) -> 2.5 | D153: 4 | E153: 1 | F153: 2 | G153: 3 | H153: 4
A155: MIN | B155: 1 | C155: =MIN(RC[2]:RC[4]) -> 1 | D155: 3 | E155: 1 | F155: 2 | G155: 3
B156: 4 | C156: =MIN(RC[2]:RC[4]) -> 4 | D156: 3 | E156: 5 | F156: 6 | G156: 4
B157: 2 | C157: =MIN(RC[2]:RC[4]) -> 2 | D157: 3 | E157: 4 | F157: 10 | G157: 2
B159: 1 | C159: =MIN(RC[2]) -> 1 | D159: 1 | E159: 1
B161: 1 | C161: =MIN(RC[2],RC[3]) -> 1 | D161: 2 | E161: 2 | F161: 1
B162: 4 | C162: =MIN(RC[2],RC[3]) -> 4 | D162: 2 | E162: 4 | F162: 5
B163: 2 | C163: =MIN(RC[2],RC[3]) -> 2 | D163: 2 | E163: =R[-2]C -> 2 | F163: 20
B165: 1 | C165: =MIN(RC[2],RC[3],RC[4]) -> 1 | D165: 3 | E165: 1 | F165: 2 | G165: 3
B167: 1 | C167: =MIN(RC[2],RC[3],RC[4],RC[5]) -> 1 | D167: 4 | E167: 1 | F167: 2 | G167: 3 | H167: 4
A169: MAX | B169: 3 | C169: =MAX(RC[2]:RC[4]) -> 3 | D169: 3 | E169: 1 | F169: 2 | G169: 3
B170: 6 | C170: =MAX(RC[2]:RC[4]) -> 6 | D170: 3 | E170: 4 | F170: 5 | G170: 6
B171: 10 | C171: =MAX(RC[2]:RC[4]) -> 10 | D171: 3 | E171: 4 | F171: =R[-2]C -> 2 | G171: 10
B173: 1 | C173: =MAX(RC[2]) -> 1 | D173: 1 | E173: 1
B175: 2 | C175: =MAX(RC[2],RC[3]) -> 2 | D175: 2 | E175: 1 | F175: 2
B176: 5 | C176: =MAX(RC[2],RC[3]) -> 5 | D176: 2 | E176: 4 | F176: 5
B177: 20 | C177: =MAX(RC[2],RC[3]) -> 20 | D177: 2 | E177: =R[-2]C -> 1 | F177: 20
B179: 3 | C179: =MAX(RC[2],RC[3],RC[4]) -> 3 | D179: 3 | E179: 1 | F179: 2 | G179: 3
B181: 4 | C181: =MAX(RC[2],RC[3],RC[4],RC[5]) -> 4 | D181: 4 | E181: 1 | F181: 2 | G181: 3 | H181: 4
A183: Operator precedence | B183: 7 | C183: =RC[2]+RC[3]*RC[4] -> 7 | D183: 3 | E183: 1 | F183: 2 | G183: 3
B184: 34 | C184: =RC[2]+RC[3]*RC[4] -> 34 | D184: 3 | E184: 4 | F184: 5 | G184: 6
B185: 11 | C185: =RC[2]+RC[3]*RC[4] -> 11 | D185: 3 | E185: 5 | F185: =R[-2]C -> 2 | G185: =R[-2]C -> 3
B186: 5 | C186: =RC[2]+RC[3]*RC[4] -> 5 | D186: 3 | E186: 3 | F186: =R[-3]C -> 2 | G186: 1
A188: Parenthesis to override precedence | B188: 9 | C188: =(RC[2]+RC[3])*RC[4] -> 9 | D188: 3 | E188: 1 | F188: 2 | G188: 3
B189: 54 | C189: =(RC[2]+RC[3])*RC[4] -> 54 | D189: 3 | E189: 4 | F189: 5 | G189: 6
B190: 21 | C190: =(RC[2]+RC[3])*RC[4] -> 21 | D190: 3 | E190: 5 | F190: =R[-2]C -> 2 | G190: =R[-2]C -> 3
B191: 5 | C191: =(RC[2]+RC[3])*RC[4] -> 5 | D191: 3 | E191: 3 | F191: =R[-3]C -> 2 | G191: 1
A193: Negation and subtraction | B193: -1 | C193: =-RC[2]--2--RC[3] -> -1 | D193: 2 | E193: -2 | F193: -5
B194: 5 | C194: =-RC[2]--2--RC[3] -> 5 | D194: 2 | E194: 2 | F194: 5
A196: ROUND function | B196: 12300 | C196: =ROUND(RC[2],RC[3]) -> 12300 | D196: 2 | E196: 12345 | F196: -2
B197: 12 | C197: =ROUND(RC[2],RC[3]) -> 12 | D197: 2 | E197: 12.004899999999999 | F197: 2
B198: 12.01 | C198: =ROUND(RC[2],RC[3]) -> 12.01 | D198: 2 | E198: 12.005000000000001 | F198: 2
B199: 13 | C199: =ROUND(RC[2],RC[3]) -> 13 | D199: 2 | E199: 12.999000000000001 | F199: 2
B200: 12 | C200: =ROUND(RC[2],RC[3]) -> 12 | D200: 2 | E200: 12.0001 | F200: 2
B201: -12 | C201: =ROUND(RC[2],RC[3]) -> -12 | D201: 2 | E201: -12.004899999999999 | F201: 2
B202: -12.01 | C202: =ROUND(RC[2],RC[3]) -> -12.01 | D202: 2 | E202: -12.005000000000001 | F202: 2
B203: -13 | C203: =ROUND(RC[2],RC[3]) -> -13 | D203: 2 | E203: -12.999000000000001 | F203: 2
B204: -12 | C204: =ROUND(RC[2],RC[3]) -> -12 | D204: 2 | E204: -12.0001 | F204: 2
A206: Date functions | B206: TODAY | C206: =TODAY() -> 2007-09-13T00:00:00.000
A208: True and False | B208: 1 | C208: 1
B209: 0 | C209: 0
B210: 1 | C210: =TRUE -> 1
B211: 0 | C211: =FALSE -> 0
B212: 100 | C212: =IF(TRUE,100,10) -> 100
B213: 10 | C213: =IF(FALSE,100,10) -> 10
A215: IF BoolCell | B215: 1 | C215: =RC[2] -> 1 | D215: 1 | E215: 1
B216: 0 | C216: =RC[2] -> 0 | D216: 2 | E216: 0
A218: IF GT | B218: 10 | C218: =IF(RC[2]>RC[3],100,10) -> 10 | D218: 2 | E218: 10 | F218: 20
B219: 100 | C219: =IF(RC[2]>RC[3],100,10) -> 100 | D219: 2 | E219: 50 | F219: 40
B220: 10 | C220: =IF(RC[2]>RC[3],100,10) -> 10 | D220: 2 | E220: 50 | F220: 50
A222: IF LT | B222: 100 | C222: =IF(RC[2]<RC[3],100,10) -> 100 | D222: 2 | E222: 10 | F222: 20
B223: 10 | C223: =IF(RC[2]<RC[3],100,10) -> 10 | D223: 2 | E223: 50 | F223: 40
B224: 10 | C224: =IF(RC[2]<RC[3],100,10) -> 10 | D224: 2 | E224: 50 | F224: 50
A226: IF GE | B226: 10 | C226: =IF(RC[2]>=RC[3],100,10) -> 10 | D226: 2 | E226: 10 | F226: 20
B227: 100 | C227: =IF(RC[2]>=RC[3],100,10) -> 100 | D227: 2 | E227: 50 | F227: 40
B228: 100 | C228: =IF(RC[2]>=RC[3],100,10) -> 100 | D228: 2 | E228: 50 | F228: 50
A230: IF LE | B230: 100 | C230: =IF(RC[2]<=RC[3],100,10) -> 100 | D230: 2 | E230: 10 | F230: 20
B231: 10 | C231: =IF(RC[2]<=RC[3],100,10) -> 10 | D231: 2 | E231: 50 | F231: 40
B232: 100 | C232: =IF(RC[2]<=RC[3],100,10) -> 100 | D232: 2 | E232: 50 | F232: 50
A234: IF EQ | B234: 10 | C234: =IF(RC[2]=RC[3],100,10) -> 10 | D234: 2 | E234: 10 | F234: 20
B235: 10 | C235: =IF(RC[2]=RC[3],100,10) -> 10 | D235: 2 | E235: 50 | F235: 40
B236: 100 | C236: =IF(RC[2]=RC[3],100,10) -> 100 | D236: 2 | E236: 50 | F236: 50
A238: IF NE | B238: 100 | C238: =IF(RC[2]<>RC[3],100,10) -> 100 | D238: 2 | E238: 10 | F238: 20
B239: 100 | C239: =IF(RC[2]<>RC[3],100,10) -> 100 | D239: 2 | E239: 50 | F239: 40
B240: 10 | C240: =IF(RC[2]<>RC[3],100,10) -> 10 | D240: 2 | E240: 50 | F240: 50
A242: IF NOT NE | B242: 10 | C242: =IF(NOT(RC[2]<>RC[3]),100,10) -> 10 | D242: 2 | E242: 10 | F242: 20
B243: 10 | C243: =IF(NOT(RC[2]<>RC[3]),100,10) -> 10 | D243: 2 | E243: 50 | F243: 40
B244: 100 | C244: =IF(NOT(RC[2]<>RC[3]),100,10) -> 100 | D244: 2 | E244: 50 | F244: 50
A246: IF NOT EQ | B246: 100 | C246: =IF(NOT(RC[2]=RC[3]),100,10) -> 100 | D246: 2 | E246: 10 | F246: 20
B247: 100 | C247: =IF(NOT(RC[2]=RC[3]),100,10) -> 100 | D247: 2 | E247: 50 | F247: 40
B248: 10 | C248: =IF(NOT(RC[2]=RC[3]),100,10) -> 10 | D248: 2 | E248: 50 | F248: 50
A250: IF AND | B250: 100 | C250: =IF(AND(RC[2]=RC[3],RC[4]=RC[5]),100,10) -> 100 | D250: 4 | E250: 10 | F250: 10 | G250: 20 | H250: 20
B251: 10 | C251: =IF(AND(RC[2]=RC[3],RC[4]=RC[5]),100,10) -> 10 | D251: 4 | E251: 5 | F251: 10 | G251: 20 | H251: 20
B252: 10 | C252: =IF(AND(RC[2]=RC[3],RC[4]=RC[5]),100,10) -> 10 | D252: 4 | E252: 5 | F252: 10 | G252: 15 | H252: 20
B253: 10 | C253: =IF(AND(RC[2]=RC[3],RC[4]=RC[5]),100,10) -> 10 | D253: 4 | E253: 10 | F253: 10 | G253: 15 | H253: 20
A255: IF OR | B255: 100 | C255: =IF(OR(RC[2]=RC[3],RC[4]=RC[5]),100,10) -> 100 | D255: 4 | E255: 10 | F255: 10 | G255: 20 | H255: 20
B256: 100 | C256: =IF(OR(RC[2]=RC[3],RC[4]=RC[5]),100,10) -> 100 | D256: 4 | E256: 5 | F256: 10 | G256: 20 | H256: 20
B257: 10 | C257: =IF(OR(RC[2]=RC[3],RC[4]=RC[5]),100,10) -> 10 | D257: 4 | E257: 5 | F257: 10 | G257: 15 | H257: 20
B258: 100 | C258: =IF(OR(RC[2]=RC[3],RC[4]=RC[5]),100,10) -> 100 | D258: 4 | E258: 10 | F258: 10 | G258: 15 | H258: 20
A260: IF _AND_ OR | B260: 100 | C260: =IF(OR(AND(RC[2]:RC[3]),RC[4]),100,10) -> 100 | D260: 3 | E260: 1 | F260: 1 | G260: 1
B261: 100 | C261: =IF(OR(AND(RC[2]:RC[3]),RC[4]),100,10) -> 100 | D261: 3 | E261: 1 | F261: 1 | G261: 0
B262: 100 | C262: =IF(OR(AND(RC[2]:RC[3]),RC[4]),100,10) -> 100 | D262: 3 | E262: 1 | F262: 0 | G262: 1
B263: 10 | C263: =IF(OR(AND(RC[2]:RC[3]),RC[4]),100,10) -> 10 | D263: 3 | E263: 1 | F263: 0 | G263: 0
B264: 100 | C264: =IF(OR(AND(RC[2]:RC[3]),RC[4]),100,10) -> 100 | D264: 3 | E264: 0 | F264: 1 | G264: 1
B265: 10 | C265: =IF(OR(AND(RC[2]:RC[3]),RC[4]),100,10) -> 10 | D265: 3 | E265: 0 | F265: 1 | G265: 0
B266: 100 | C266: =IF(OR(AND(RC[2]:RC[3]),RC[4]),100,10) -> 100 | D266: 3 | E266: 0 | F266: 0 | G266: 1
B267: 10 | C267: =IF(OR(AND(RC[2]:RC[3]),RC[4]),100,10) -> 10 | D267: 3 | E267: 0 | F267: 0 | G267: 0
A269: IF _OR_ AND | B269: 100 | C269: =IF(AND(OR(RC[2]:RC[3]),RC[4]),100,10) -> 100 | D269: 3 | E269: 1 | F269: 1 | G269: 1
B270: 10 | C270: =IF(AND(OR(RC[2]:RC[3]),RC[4]),100,10) -> 10 | D270: 3 | E270: 1 | F270: 1 | G270: 0
B271: 100 | C271: =IF(AND(OR(RC[2]:RC[3]),RC[4]),100,10) -> 100 | D271: 3 | E271: 1 | F271: 0 | G271: 1
B272: 10 | C272: =IF(AND(OR(RC[2]:RC[3]),RC[4]),100,10) -> 10 | D272: 3 | E272: 1 | F272: 0 | G272: 0
B273: 100 | C273: =IF(AND(OR(RC[2]:RC[3]),RC[4]),100,10) -> 100 | D273: 3 | E273: 0 | F273: 1 | G273: 1
B274: 10 | C274: =IF(AND(OR(RC[2]:RC[3]),RC[4]),100,10) -> 10 | D274: 3 | E274: 0 | F274: 1 | G274: 0
B275: 10 | C275: =IF(AND(OR(RC[2]:RC[3]),RC[4]),100,10) -> 10 | D275: 3 | E275: 0 | F275: 0 | G275: 1
B276: 10 | C276: =IF(AND(OR(RC[2]:RC[3]),RC[4]),100,10) -> 10 | D276: 3 | E276: 0 | F276: 0 | G276: 0
A278: Boolean GT | B278: 0 | C278: =RC[2]>RC[3] -> 0 | D278: 2 | E278: 10 | F278: 20
B279: 1 | C279: =RC[2]>RC[3] -> 1 | D279: 2 | E279: 50 | F279: 40
B280: 0 | C280: =RC[2]>RC[3] -> 0 | D280: 2 | E280: 50 | F280: 50
A282: Boolean LT | B282: 1 | C282: =RC[2]<RC[3] -> 1 | D282: 2 | E282: 10 | F282: 20
B283: 0 | C283: =RC[2]<RC[3] -> 0 | D283: 2 | E283: 50 | F283: 40
B284: 0 | C284: =RC[2]<RC[3] -> 0 | D284: 2 | E284: 50 | F284: 50
A286: Boolean GE | B286: 0 | C286: =RC[2]>=RC[3] -> 0 | D286: 2 | E286: 10 | F286: 20
B287: 1 | C287: =RC[2]>=RC[3] -> 1 | D287: 2 | E287: 50 | F287: 40
B288: 1 | C288: =RC[2]>=RC[3] -> 1 | D288: 2 | E288: 50 | F288: 50
A290: Boolean LE | B290: 1 | C290: =RC[2]<=RC[3] -> 1 | D290: 2 | E290: 10 | F290: 20
B291: 0 | C291: =RC[2]<=RC[3] -> 0 | D291: 2 | E291: 50 | F291: 40
B292: 1 | C292: =RC[2]<=RC[3] -> 1 | D292: 2 | E292: 50 | F292: 50
A294: Boolean EQ | B294: 0 | C294: =RC[2]=RC[3] -> 0 | D294: 2 | E294: 10 | F294: 20
B295: 0 | C295: =RC[2]=RC[3] -> 0 | D295: 2 | E295: 50 | F295: 40
B296: 1 | C296: =RC[2]=RC[3] -> 1 | D296: 2 | E296: 50 | F296: 50
A298: Boolean NE | B298: 1 | C298: =RC[2]<>RC[3] -> 1 | D298: 2 | E298: 10 | F298: 20
B299: 1 | C299: =RC[2]<>RC[3] -> 1 | D299: 2 | E299: 50 | F299: 40
B300: 0 | C300: =RC[2]<>RC[3] -> 0 | D300: 2 | E300: 50 | F300: 50
A302: Boolean NOT NE | B302: 0 | C302: =NOT(RC[2]<>RC[3]) -> 0 | D302: 2 | E302: 10 | F302: 20
B303: 0 | C303: =NOT(RC[2]<>RC[3]) -> 0 | D303: 2 | E303: 50 | F303: 40
B304: 1 | C304: =NOT(RC[2]<>RC[3]) -> 1 | D304: 2 | E304: 50 | F304: 50
A306: Boolean NOT EQ | B306: 1 | C306: =NOT(RC[2]=RC[3]) -> 1 | D306: 2 | E306: 10 | F306: 20
B307: 1 | C307: =NOT(RC[2]=RC[3]) -> 1 | D307: 2 | E307: 50 | F307: 40
B308: 0 | C308: =NOT(RC[2]=RC[3]) -> 0 | D308: 2 | E308: 50 | F308: 50
A310: Boolean AND | B310: 1 | C310: =AND(RC[2]=RC[3],RC[4]=RC[5]) -> 1 | D310: 4 | E310: 10 | F310: 10 | G310: 20 | H310: 20
B311: 0 | C311: =AND(RC[2]=RC[3],RC[4]=RC[5]) -> 0 | D311: 4 | E311: 5 | F311: 10 | G311: 20 | H311: 20
B312: 0 | C312: =AND(RC[2]=RC[3],RC[4]=RC[5]) -> 0 | D312: 4 | E312: 5 | F312: 10 | G312: 15 | H312: 20
B313: 0 | C313: =AND(RC[2]=RC[3],RC[4]=RC[5]) -> 0 | D313: 4 | E313: 10 | F313: 10 | G313: 15 | H313: 20
A315: Boolean OR | B315: 1 | C315: =OR(RC[2]=RC[3],RC[4]=RC[5]) -> 1 | D315: 4 | E315: 10 | F315: 10 | G315: 20 | H315: 20
B316: 1 | C316: =OR(RC[2]=RC[3],RC[4]=RC[5]) -> 1 | D316: 4 | E316: 5 | F316: 10 | G316: 20 | H316: 20
B317: 0 | C317: =OR(RC[2]=RC[3],RC[4]=RC[5]) -> 0 | D317: 4 | E317: 5 | F317: 10 | G317: 15 | H317: 20
B318: 1 | C318: =OR(RC[2]=RC[3],RC[4]=RC[5]) -> 1 | D318: 4 | E318: 10 | F318: 10 | G318: 15 | H318: 20
A320: Boolean _AND_ OR | B320: 1 | C320: =OR(AND(RC[2]:RC[3]),RC[4]) -> 1 | D320: 3 | E320: 1 | F320: 1 | G320: 1
B321: 1 | C321: =OR(AND(RC[2]:RC[3]),RC[4]) -> 1 | D321: 3 | E321: 1 | F321: 1 | G321: 0
B322: 1 | C322: =OR(AND(RC[2]:RC[3]),RC[4]) -> 1 | D322: 3 | E322: 1 | F322: 0 | G322: 1
B323: 0 | C323: =OR(AND(RC[2]:RC[3]),RC[4]) -> 0 | D323: 3 | E323: 1 | F323: 0 | G323: 0
B324: 1 | C324: =OR(AND(RC[2]:RC[3]),RC[4]) -> 1 | D324: 3 | E324: 0 | F324: 1 | G324: 1
B325: 0 | C325: =OR(AND(RC[2]:RC[3]),RC[4]) -> 0 | D325: 3 | E325: 0 | F325: 1 | G325: 0
B326: 1 | C326: =OR(AND(RC[2]:RC[3]),RC[4]) -> 1 | D326: 3 | E326: 0 | F326: 0 | G326: 1
B327: 0 | C327: =OR(AND(RC[2]:RC[3]),RC[4]) -> 0 | D327: 3 | E327: 0 | F327: 0 | G327: 0
A329: Boolean _OR_ AND | B329: 1 | C329: =AND(OR(RC[2]:RC[3]),RC[4]) -> 1 | D329: 3 | E329: 1 | F329: 1 | G329: 1
B330: 0 | C330: =AND(OR(RC[2]:RC[3]),RC[4]) -> 0 | D330: 3 | E330: 1 | F330: 1 | G330: 0
B331: 1 | C331: =AND(OR(RC[2]:RC[3]),RC[4]) -> 1 | D331: 3 | E331: 1 | F331: 0 | G331: 1
B332: 0 | C332: =AND(OR(RC[2]:RC[3]),RC[4]) -> 0 | D332: 3 | E332: 1 | F332: 0 | G332: 0
B333: 1 | C333: =AND(OR(RC[2]:RC[3]),RC[4]) -> 1 | D333: 3 | E333: 0 | F333: 1 | G333: 1
B334: 0 | C334: =AND(OR(RC[2]:RC[3]),RC[4]) -> 0 | D334: 3 | E334: 0 | F334: 1 | G334: 0
B335: 0 | C335: =AND(OR(RC[2]:RC[3]),RC[4]) -> 0 | D335: 3 | E335: 0 | F335: 0 | G335: 1
B336: 0 | C336: =AND(OR(RC[2]:RC[3]),RC[4]) -> 0 | D336: 3 | E336: 0 | F336: 0 | G336: 0
A338: MATCH function | B338: 0 | C338: =MATCH(RC[2],RC[3]:RC[5],1) -> #N/A | D338: 4 | E338: 99 | F338: 100 | G338: 200 | H338: 500
B339: 1 | C339: =MATCH(RC[2],RC[3]:RC[5],1) -> 1 | D339: 4 | E339: 100 | F339: =R[-1]C -> 100 | G339: =R[-1]C -> 200 | H339: =R[-1]C -> 500
B340: 1 | C340: =MATCH(RC[2],RC[3]:RC[5],1) -> 1 | D340: 4 | E340: 101 | F340: =R[-2]C -> 100 | G340: =R[-2]C -> 200 | H340: =R[-2]C -> 500
B341: 1 | C341: =MATCH(RC[2],RC[3]:RC[5],1) -> 1 | D341: 4 | E341: 199 | F341: 100 | G341: 200 | H341: 500
B342: 2 | C342: =MATCH(RC[2],RC[3]:RC[5],1) -> 2 | D342: 4 | E342: 200 | F342: 100 | G342: 200 | H342: 500
B343: 2 | C343: =MATCH(RC[2],RC[3]:RC[5],1) -> 2 | D343: 4 | E343: 201 | F343: 100 | G343: 200 | H343: 500
B344: 3 | C344: =MATCH(RC[2],RC[3]:RC[5],1) -> 3 | D344: 4 | E344: 500 | F344: 100 | G344: 200 | H344: 500
B345: 3 | C345: =MATCH(RC[2],RC[3]:RC[5],1) -> 3 | D345: 4 | E345: 501 | F345: 100 | G345: 200 | H345: 500
B346: 2 | C346: =MATCH(RC[2],RC[3]:RC[5]) -> 2 | D346: 4 | E346: 25 | F346: 10 | G346: 20 | H346: 30
B348: 3 | C348: =MATCH(RC[2],RC[3]:RC[5],-1) -> 3 | D348: 4 | E348: 99 | F348: 500 | G348: 200 | H348: 100
B349: 3 | C349: =MATCH(RC[2],RC[3]:RC[5],-1) -> 3 | D349: 4 | E349: 100 | F349: =R[-1]C -> 500 | G349: =R[-1]C -> 200 | H349: =R[-1]C -> 100
B350: 2 | C350: =MATCH(RC[2],RC[3]:RC[5],-1) -> 2 | D350: 4 | E350: 101 | F350: =R[-2]C -> 500 | G350: =R[-2]C -> 200 | H350: =R[-2]C -> 100
B351: 2 | C351: =MATCH(RC[2],RC[3]:RC[5],-1) -> 2 | D351: 4 | E351: 199 | F351: 500 | G351: 200 | H351: 100
B352: 2 | C352: =MATCH(RC[2],RC[3]:RC[5],-1) -> 2 | D352: 4 | E352: 200 | F352: 500 | G352: 200 | H352: 100
B353: 1 | C353: =MATCH(RC[2],RC[3]:RC[5],-1) -> 1 | D353: 4 | E353: 201 | F353: 500 | G353: 200 | H353: 100
B354: 1 | C354: =MATCH(RC[2],RC[3]:RC[5],-1) -> 1 | D354: 4 | E354: 500 | F354: 500 | G354: 200 | H354: 100
B355: 0 | C355: =MATCH(RC[2],RC[3]:RC[5],-1) -> #N/A | D355: 4 | E355: 501 | F355: 500 | G355: 200 | H355: 100
B356: 1 | C356: =MATCH(RC[2],RC[3]:RC[5],-1) -> 1 | D356: 4 | E356: 25 | F356: 30 | G356: 20 | H356: 10
B358: 0 | C358: =MATCH(RC[2],RC[3]:RC[5],0) -> #N/A | D358: 4 | E358: 99 | F358: 100 | G358: 200 | H358: 500
B359: 1 | C359: =MATCH(RC[2],RC[3]:RC[5],0) -> 1 | D359: 4 | E359: 100 | F359: =R[-1]C -> 100 | G359: =R[-1]C -> 200 | H359: =R[-1]C -> 500
B360: 0 | C360: =MATCH(RC[2],RC[3]:RC[5],0) -> #N/A | D360: 4 | E360: 101 | F360: =R[-2]C -> 100 | G360: =R[-2]C -> 200 | H360: =R[-2]C -> 500
B361: 0 | C361: =MATCH(RC[2],RC[3]:RC[5],0) -> #N/A | D361: 4 | E361: 199 | F361: 100 | G361: 200 | H361: 500
B362: 2 | C362: =MATCH(RC[2],RC[3]:RC[5],0) -> 2 | D362: 4 | E362: 200 | F362: 100 | G362: 200 | H362: 500
B363: 0 | C363: =MATCH(RC[2],RC[3]:RC[5],0) -> #N/A | D363: 4 | E363: 201 | F363: 100 | G363: 200 | H363: 500
B364: 3 | C364: =MATCH(RC[2],RC[3]:RC[5],0) -> 3 | D364: 4 | E364: 500 | F364: 100 | G364: 200 | H364: 500
B365: 0 | C365: =MATCH(RC[2],RC[3]:RC[5],0) -> #N/A | D365: 4 | E365: 501 | F365: 100 | G365: 200 | H365: 500
B366: 0 | C366: =MATCH(RC[2],RC[3]:RC[5],0) -> #N/A | D366: 4 | E366: 25 | F366: 10 | G366: 20 | H366: 30
A368: INDEX function | B368: 6 | C368: =INDEX(RC[2]:RC[4],2) -> 6 | D368: 3 | E368: 5 | F368: 6 | G368: 7
B369: 9 | C369: =INDEX(RC[2]:RC[4],2) -> 9 | D369: 3 | E369: 8 | F369: 9 | G369: 10
B371: 5 | C371: =INDEX(RC[3]:RC[5],RC[2]) -> 5 | D371: 4 | E371: 2 | F371: 4 | G371: 5 | H371: 6
B372: 8 | C372: =INDEX(RC[3]:RC[5],RC[2]) -> 8 | D372: 4 | E372: 3 | F372: 6 | G372: 7 | H372: 8
B373: 6 | C373: =INDEX(RC[3]:RC[5],RC[2]) -> 6 | D373: 4 | E373: 1 | F373: 6 | G373: 7 | H373: 8
B374: 0 | C374: =INDEX(RC[3]:RC[5],RC[2]) -> #VALUE! | D374: 4 | E374: 0 | F374: 6 | G374: 7 | H374: 8
B375: 0 | C375: =INDEX(RC[3]:RC[5],RC[2]) -> #REF! | D375: 4 | E375: 4 | F375: 6 | G375: 7 | H375: 8
B377: 0 | C377: =INDEX(RC[3]:RC[5],RC[2]) -> 0 | D377: 4 | E377: 2
B378: 5 | C378: =INDEX(RC[3]:RC[5],RC[2]) -> 5 | D378: 4 | E378: =R[-1]C -> 2 | G378: 5
B380: 9 | C380: =INDEX(R[-12]C[2]:R[-11]C[4],2,2) -> 9
B382: 6 | C382: =INDEX(RC[2]:RC[4],3) -> 6 | D382: 3 | E382: 4 | F382: 5 | G382: 6
A384: INDEX 2-dim static vals | B384: 11 | C384: =INDEX(R384C[4]:R385C[5],RC[2],RC[3]) -> 11 | D384: 2 | E384: 1 | F384: 1 | G384: 11 | H384: 13
B385: 13 | C385: =INDEX(R384C[4]:R385C[5],RC[2],RC[3]) -> 13 | D385: 2 | E385: 1 | F385: 2 | G385: 12 | H385: 14
B386: 12 | C386: =INDEX(R384C[4]:R385C[5],RC[2],RC[3]) -> 12 | D386: 2 | E386: 2 | F386: 1
B387: 14 | C387: =INDEX(R384C[4]:R385C[5],RC[2],RC[3]) -> 14 | D387: 2 | E387: 2 | F387: 2
A389: INDEX 2-dim static index | B389: 11 | C389: =INDEX(RC[2]:R[1]C[3],1,1) -> 11 | D389: 2 | E389: 11 | F389: 13
E390: 12 | F390: 14
A392: INDEX 2-dim dynamic index and vals | B392: 11 | C392: =INDEX(R384C[4]:R385C[5],RC[2],RC[3]) -> 11 | D392: 4 | E392: 1 | F392: 1 | G392: 11 | H392: 13
G393: 12 | H393: 14
F395: 11 | G395: 13
A396: INDEX 2-dim dynamic index out of range | B396: 0 | C396: =INDEX(R395C[3]:R396C[4],RC[2],1) -> #VALUE! | D396: 1 | E396: -1 | F396: 12 | G396: 14
B397: 0 | C397: =INDEX(R395C[3]:R396C[4],RC[2],1) -> #VALUE! | D397: 1 | E397: 0
B398: 11 | C398: =INDEX(R395C[3]:R396C[4],RC[2],1) -> 11 | D398: 1 | E398: 1
B399: 12 | C399: =INDEX(R395C[3]:R396C[4],RC[2],1) -> 12 | D399: 1 | E399: 2
B400: 0 | C400: =INDEX(R395C[3]:R396C[4],RC[2],1) -> #REF! | D400: 1 | E400: 3
A402: Format in string concatenation | B402: is -12345.6789 | C402: ="is " & RC[2] -> is -12345.6789 | D402: 1 | E402: -12345.678900000001
B403: is 1E+20 | C403: ="is " & RC[2] -> is 1E+20 | D403: 1 | E403: 1E+20
A405: IF involving strings | B405: Yes | C405: =IF(RC[2]="Hello",RC[3],RC[4]) -> Yes | D405: 3 | E405: Hello | F405: Yes | G405: No