Sheet: Sheet1
A1: Input Block | B1: Actual | C1: Expected | D1: References
A2: One | B2: 100 | C2: 13
A3: Two | B3: 110 | C3: 14
A4: Aug 1, 1994 | B4: 2000-01-01T00:00:00.000 | C4: 1994-08-01T00:00:00.000 | D4: 1995-01-01T00:00:00.000
A5: Fact(5) | B5: 100 | C5: =FACT(5) -> 120
A6: Computation Block
A7: DateIf | B7: =IF(DATE_1994_8_1<R[-3]C4,100,10) -> 10 | C7: =IF(R[-3]C<R[-3]C4,100,10) -> 100
A8: Sum | B8: =SUM(R[-6]C:R[-5]C) -> 210 | C8: =SUM(R[-6]C:R[-5]C) -> 27
A9: Results Block
A10: A | B10: =SUM(R[-3]C:R[-2]C) -> 220 | C10: =SUM(R[-3]C:R[-2]C) -> 127
A11: B | B11: =R[-1]C+R[-6]C -> 320 | C11: =R[-1]C+R[-6]C -> 247
A12: WHEN | B12: =R[-8]C-1 -> 1999-12-31T00:00:00.000 | C12: =R[-8]C-1 -> 1994-07-31T00:00:00.000
A13: ISOK | B13: =IF(R[-2]C=247,1,0) -> 0 | C13: =IF(R[-2]C=247,1,0) -> 1