Sheet: Sheet1
C1: Menge | D1: Preis | E1: Total exkl. | F1: MWSt-Satz | G1: Anteil | H1: Betrag | I1: MWSt-Satz | J1: Anteil | K1: Betrag | L1: Total inkl.
B3: Position 1 | C3: 3 | D3: 3100 | E3: =RC[-2]*RC[-1] -> 9300 | F3: 7.5999999999999998E-2 | G3: 0.8 | H3: =RC5*RC[-1]*RC[-2] -> 565.43999999999994 | I3: 0.02 | J3: 0.2 | K3: =RC5*RC[-1]*RC[-2] -> 37.2 | L3: =RC[-7]+SUM(RC[-4],RC[-1]) -> 9902.64
B4: Position 2 | C4: 5 | D4: 480 | E4: =RC[-2]*RC[-1] -> 2400 | F4: 7.5999999999999998E-2 | G4: 1 | H4: =RC5*RC[-1]*RC[-2] -> 182.4 | K4: =RC5*RC[-1]*RC[-2] -> 0 | L4: =RC[-7]+SUM(RC[-4],RC[-1]) -> 2582.4
B6: TOTAL | L6: =SUM(R[-3]C:R[-2]C) -> 12485.039999999999
B8: MWSt | C8: 7.5999999999999998E-2
C9: 0.02

Sheet: Sheet2
A1: Category | B1: Amount | C1: Totals
A3: One | C3: =SUM(R[1]C[-1]:R[3]C[-1]) -> 600
B4: 100
B5: 200
B6: 300
A8: Two | C8: =SUM(R[1]C[-1]:R[3]C[-1]) -> 220
B9: 50
B10: 80
B11: 90
C13: =SUM(R[-10]C:R[-2]C) -> 820