Sheet: Sheet1
A2: Inputs
A3: I_One | B3: 10
A4: I_Two | B4: 20
A5: I_Three | B5: 30
A7: Intermediates
A8: OneTwo | B8: =SUM(I_One,I_Two) -> 30
A9: TwoThree | B9: =SUM(I_Two,I_Three) -> 50
A11: Outputs
A12: O_OneTwoThree | B12: =SUM(R[-9]C:R[-7]C) -> 60
A13: O_SumInter | B13: =SUM(R[-5]C:R[-4]C) -> 80
A14: Complex | B14: =SUM(R[-11]C:R[-9]C)-1 -> 59