Sheet: Sheet1
A1: Name | B1: Base salary | C1: Overtime | D1: Total | E1: Bonus % | F1: Bonus amt
A2: Ann | B2: 5600 | C2: 20 | D2: =RC[-2]+RC[-1]*R6C[-2] -> 6600 | E2: =RC[-1]/R5C[-1] -> 0.36164383561643837 | F2: =R7C[-4]*RC[-1] -> 7232.8767123287671
A3: Beth | B3: 5400 | C3: 15 | D3: =RC[-2]+RC[-1]*R6C[-2] -> 6150 | E3: =RC[-1]/R5C[-1] -> 0.33698630136986302 | F3: =R7C[-4]*RC[-1] -> 6739.7260273972606
A4: Charlie | B4: 5500 | C4: 0 | D4: =RC[-2]+RC[-1]*R6C[-2] -> 5500 | E4: =RC[-1]/R5C[-1] -> 0.30136986301369861 | F4: =R7C[-4]*RC[-1] -> 6027.3972602739723
A5: Total | D5: =SUM(R[-3]C:R[-1]C) -> 18250
A6: Overtime rate | B6: 50
A7: Bonus total | B7: 20000