Sheet: Sheet1
A1: Sections | B1: Inputs | D1: Intermediates
A2: OrdersForLastNDays(90) | B2: OrderTotal | C2: OrderDate | D2: days back | E2: weight | F2: value
B3: 450 | C3: =R11C[-1]-89 -> 2007-06-16T00:00:00.000 | D3: =R11C[-2]-RC[-1] -> 89 | E3: =(90-RC[-1])/90 -> 1.1111111111111112E-2 | F3: =RC[-4]*RC[-1] -> 5
B4: 1320 | C4: =R11C[-1]-70 -> 2007-07-05T00:00:00.000 | D4: =R11C[-2]-RC[-1] -> 70 | E4: =(90-RC[-1])/90 -> 0.22222222222222221 | F4: =RC[-4]*RC[-1] -> 293.33333333333331
B5: 1540 | C5: =R11C[-1]-45 -> 2007-07-30T00:00:00.000 | D5: =R11C[-2]-RC[-1] -> 45 | E5: =(90-RC[-1])/90 -> 0.5 | F5: =RC[-4]*RC[-1] -> 770
B6: 60 | C6: =R11C[-1]-30 -> 2007-08-14T00:00:00.000 | D6: =R11C[-2]-RC[-1] -> 30 | E6: =(90-RC[-1])/90 -> 0.66666666666666663 | F6: =RC[-4]*RC[-1] -> 40
B7: 5870 | C7: =R11C[-1]-3 -> 2007-09-10T00:00:00.000 | D7: =R11C[-2]-RC[-1] -> 3 | E7: =(90-RC[-1])/90 -> 0.96666666666666667 | F7: =RC[-4]*RC[-1] -> 5674.333333333333
A9: Intermediates
A10: total value | B10: =SUM(R[-7]C[4]:R[-3]C[4]) -> 6782.6666666666661
A11: current date | B11: =TODAY() -> 2007-09-13T00:00:00.000
A13: Outputs
A14: Rating | B14: =MATCH(R[-4]C,RC[1]:RC[5]) -> 3 | C14: 0 | D14: 2000 | E14: 5000 | F14: 7500 | G14: 10000