Sheet: Sheet1
A1: Vertically repeating section: | B1: Name | C1: Value
B2: One | C2: 1
B3: Two | C3: 2
B4: Three | C4: 3
A6: This works:
A7: Aggregate entire column | B7: =SUM(R[-5]C[1]:R[-3]C[1]) -> 6
A9: This is an error:
A10: No aggregation | B10: =R[-8]C[1] -> 1
A11: Not entire column (end bad) | B11: =SUM(R[-9]C[1]:R[-8]C[1]) -> 3
A12: Not entire column (start bad) | B12: =SUM(R[-9]C[1]:R[-8]C[1]) -> 5
A13: Not entire column (both bad) | B13: =SUM(R[-10]C[1]:R[-10]C[1]) -> 2
A14: Not entire column (single cell) | B14: =SUM(R[-11]C[1]) -> 2