Sheet: Sheet1
A1: Vertically repeating section: | B1: Name | C1: Value | D1: RepValue | E1: SubName | F1: SubValue | G1: SubRef | H1: InnerRef | I1: InnerSum | J1: SelfSum | K1: OuterSum | L1: Value2 | M1: Outer cells
A2: Outer cells: | C2: -1 | D2: -1 | F2: -10
B3: One | C3: 1 | D3: 1 | E3: One.A | F3: 10 | G3: =RC[-1]+RC[-4] -> 11 | H3: =RC[-5]+1 -> 2 | I3: =SUM(RC[-3]:R[1]C[-2]) -> 62 | J3: =SUM(R3C[-7]:R6C[-7]) + RC[-7] -> 7 | K3: =SUM(R2C[-5]:R11C[-5]) + RC[-8] -> 241 | L3: 3 | M3: 4711
D4: 1 | E4: One.B | F4: 20 | G4: =RC[-1]+R[-1]C[-4] -> 21 | M4: 4712
B5: Two | C5: 2 | D5: 2 | E5: Two.A | F5: 30 | G5: =RC[-1]+RC[-4] -> 32 | H5: =RC[-5]+1 -> 3 | I5: =SUM(RC[-3]:RC[-2]) -> 62 | J5: =SUM(R3C[-7]:R6C[-7]) + RC[-7] -> 8 | K5: =SUM(R2C[-5]:R11C[-5]) + RC[-8] -> 242 | L5: 2 | M5: 4713
B6: Three | C6: 3 | D6: 3 | E6: Three.A | F6: 40 | G6: =RC[-1]+RC[-4] -> 43 | H6: =RC[-5]+1 -> 4 | I6: =SUM(RC[-3]:RC[-2]) -> 83 | J6: =SUM(R3C[-7]:R6C[-7]) + RC[-7] -> 9 | K6: =SUM(R2C[-5]:R11C[-5]) + RC[-8] -> 243 | L6: 1 | M6: 4714
A7: Outer cells: | C7: 4 | D7: 4 | F7: 50
A8: Another vertical section: | B8: Eins | C8: 1 | D8: 1 | F8: 10 | G8: 1 | H8: 2 | I8: 3
A9: with horizontal section to the right: | B9: Zwei | C9: 2 | D9: 2 | F9: 20 | G9: 0.1 | H9: 0.2 | I9: 0.3
B10: Drei | C10: 3 | D10: 3 | F10: 30 | G10: 0.01 | H10: 0.02 | I10: 0.03
A11: Outer cells: | C11: 5 | D11: 5 | F11: 40
A14: This works:
A15: Nested sum | B15: =SUM(R[-12]C[4]:R[-9]C[4]) -> 100
A16: Sum spanning multiple sections | B16: =SUM(R[-14]C[1]:R[-5]C[1]) -> 20
A17: Sum spanning multiple sections (shaped) | B17: =SUM(R[-15]C[1]:R[-6]C[2]) -> 41
A18: Sum spanning multiple and nested sections | B18: =SUM(R[-16]C[4]:R[-7]C[4]) -> 240
A19: Sum over inner refs | B19: =SUM(R[-16]C[6]:R[-13]C[6]) -> 9
A20: Sum over inner sums | B20: =SUM(R[-17]C[7]:R[-14]C[7]) -> 207
A21: Sum over inner self sums | B21: =SUM(R[-18]C[8]:R[-15]C[8]) -> 24
A22: Sum over inner outer nested sums | B22: =SUM(R[-19]C[9]:R[-16]C[9]) -> 726
A23: Sum over nested and inner section in parallel | B23: =SUM(R[-20]C[5]:R[-17]C[6]) -> 116
A24: Sum over section and cells in parallel | B24: =SUM(R[-21]C[10]:R[-18]C[11]) -> 18856
A25: Sum over mixed section extents | B25: =SUM(R[-17]C[4]:R[-15]C[7]) -> 66.66
A27: Errors:
A28: Only nested inner section summed | B28: =SUM(R[-25]C[4]:R[-24]C[4]) -> 30
A29: Only part of section summed | B29: =SUM(R[-27]C[1]:R[-24]C[1]) -> 2
A30: ... Again | B30: =SUM(R[-26]C[1]:R[-23]C[1]) -> 9
A31: Mixed sections not fully covered | B31: =SUM(R[-23]C[4]:R[-23]C[7]) -> 16
A32: ... Again | B32: =SUM(R[-24]C[4]:R[-22]C[5]) -> 61.11