Sheet: Sheet1
A1: Inputs
A3: byte | B3: 1
A4: short | B4: 2
A5: int | B5: 3
A6: long | B6: 4
A7: double | B7: 5
A8: float | B8: 6
A9: boolean | B9: 1
A11: boxedbyte | B11: 1
A12: boxedshort | B12: 2
A13: boxedint | B13: 3
A14: boxedlong | B14: 4
A15: boxeddouble | B15: 5
A16: boxedfloat | B16: 6
A17: boxedboolean | B17: 1
A19: bigdecimal | B19: 7
A20: biginteger | B20: 8
A21: date | B21: 1971-04-19T00:00:00.000
A22: dateMs | B22: 1971-04-19T00:00:00.000
A23: boxedDateMs | B23: 1971-04-19T00:00:00.000
A24: time | B24: 1899-12-31T03:00:00.000
A25: boxedTime | B25: 1899-12-31T03:00:00.000
A27: nullbyte | B27: 0
A28: nullshort | B28: 0
A29: nullint | B29: 0
A30: nulllong | B30: 0
A31: nulldouble | B31: 0
A32: nullfloat | B32: 0
A33: nullboolean | B33: 0
A34: nullbigdecimal | B34: 0
A35: nullbiginteger | B35: 0
A36: nulldate | B36: 1899-12-31T00:00:00.000
A37: nulltime | B37: 1899-12-31T00:00:00.000
A39: long7 | B39: 123
A40: boxedlong7 | B40: 456
A41: nulllong7 | B41: 0
A43: string | B43: blabla
A45: Outputs
A47: calcbyte | B47: =R[-44]C+R[-36]C+R[-20]C -> 2
A48: calcshort | B48: =R[-44]C+R[-36]C+R[-20]C -> 4
A49: calcint | B49: =R[-44]C+R[-36]C+R[-20]C -> 6
A50: calclong | B50: =R[-44]C+R[-36]C+R[-20]C -> 8
A51: calcdouble | B51: =R[-44]C+R[-36]C+R[-20]C -> 10
A52: calcfloat | B52: =R[-44]C+R[-36]C+R[-20]C -> 12
A53: calcboolean | B53: =IF(NOT(OR(R[-44]C,R[-36]C,R[-20]C)),1,0) -> 0
A55: calcboxedbyte | B55: =R[-52]C+R[-44]C+R[-28]C -> 2
A56: calcboxedshort | B56: =R[-52]C+R[-44]C+R[-28]C -> 4
A57: calcboxedint | B57: =R[-52]C+R[-44]C+R[-28]C -> 6
A58: calcboxedlong | B58: =R[-52]C+R[-44]C+R[-28]C -> 8
A59: calcboxeddouble | B59: =R[-52]C+R[-44]C+R[-28]C -> 10
A60: calcboxedfloat | B60: =R[-52]C+R[-44]C+R[-28]C -> 12
A61: calcboxedboolean | B61: =IF(NOT(OR(R[-52]C,R[-44]C,R[-28]C)),1,0) -> 0
A63: calcbigdecimal | B63: =R[-44]C+1+R[-29]C -> 8
A64: calcbiginteger | B64: =R[-44]C+1+R[-29]C -> 9
A65: calcdate | B65: =R[-44]C+1+R[-29]C -> 1971-04-20T00:00:00.000
A66: calcdatems | B66: =R[-44]C+1+R[-30]C -> 1971-04-20T00:00:00.000
A67: calcboxeddatems | B67: =R[-44]C+1+R[-31]C -> 1971-04-20T00:00:00.000
A68: calctime | B68: =R[-44]C*2+R[-31]C -> 1899-12-31T06:00:00.000
A69: calcboxedtime | B69: =R[-44]C*2+R[-32]C -> 1899-12-31T06:00:00.000
A71: calclong5 | B71: =SUM(R[-32]C:R[-30]C) -> 579
A72: calcboxedlong5 | B72: =SUM(R[-33]C:R[-31]C) -> 579
A74: calcstring | B74: =R[-31]C -> blabla