Sheet: Sheet1
A1: Inputs
A2: Insured amount | B2: 15000
A3: Age | B3: 62
A5: Outputs
A6: Cost per year | B6: =VLOOKUP(TRUE,R[3]C[1]:R[39]C[9],9,FALSE) -> 600
A8: Lookup Table | B8: AgeUpTo | C8: Match | D8: AgeUpTo (Copy) | E8: InsuredAmountUpTo | F8: Percentage | G8: Style | H8: Style 1 | I8: Style 2 | J8: Style 3 | K8: Insured amount
B9: 20 | C9: =AND(Age<=RC[1],InsuredAmount<=RC[2]) -> 0 | D9: =RC[-2] -> 20 | E9: 5000 | F9: 0.03 | G9: 1 | H9: =RC[-3]*RC[-2] -> 150 | I9: =InsuredAmount * (2% + ABS(Age-50)/25 *1%) -> 372 | J9: =InsuredAmount*RC[-4] -> 450 | K9: =INDEX(RC[-3]:RC[-1],RC[-4]) -> 150
C10: =AND(Age<=RC[1],InsuredAmount<=RC[2]) -> 0 | D10: =R[-1]C[-2] -> 20 | E10: 6000 | F10: 0.03 | G10: 1 | H10: =RC[-3]*RC[-2] -> 180 | I10: =InsuredAmount * (2% + ABS(Age-50)/25 *1%) -> 372 | J10: =InsuredAmount*RC[-4] -> 450 | K10: =INDEX(RC[-3]:RC[-1],RC[-4]) -> 180
C11: =AND(Age<=RC[1],InsuredAmount<=RC[2]) -> 0 | D11: =R[-2]C[-2] -> 20 | E11: 8000 | F11: 0.03 | G11: 1 | H11: =RC[-3]*RC[-2] -> 240 | I11: =InsuredAmount * (2% + ABS(Age-50)/25 *1%) -> 372 | J11: =InsuredAmount*RC[-4] -> 450 | K11: =INDEX(RC[-3]:RC[-1],RC[-4]) -> 240
C12: =AND(Age<=RC[1],InsuredAmount<=RC[2]) -> 0 | D12: =R[-3]C[-2] -> 20 | E12: 10000 | F12: 0.04 | G12: 1 | H12: =RC[-3]*RC[-2] -> 400 | I12: =InsuredAmount * (2% + ABS(Age-50)/25 *1%) -> 372 | J12: =InsuredAmount*RC[-4] -> 600 | K12: =INDEX(RC[-3]:RC[-1],RC[-4]) -> 400
C13: =AND(Age<=RC[1],InsuredAmount<=RC[2]) -> 0 | D13: =R[-4]C[-2] -> 20 | E13: 13000 | F13: 0.04 | G13: 1 | H13: =RC[-3]*RC[-2] -> 520 | I13: =InsuredAmount * (2% + ABS(Age-50)/25 *1%) -> 372 | J13: =InsuredAmount*RC[-4] -> 600 | K13: =INDEX(RC[-3]:RC[-1],RC[-4]) -> 520
C14: =AND(Age<=RC[1],InsuredAmount<=RC[2]) -> 0 | D14: =R[-5]C[-2] -> 20 | E14: 16000 | F14: 0.04 | G14: 1 | H14: =RC[-3]*RC[-2] -> 640 | I14: =InsuredAmount * (2% + ABS(Age-50)/25 *1%) -> 372 | J14: =InsuredAmount*RC[-4] -> 600 | K14: =INDEX(RC[-3]:RC[-1],RC[-4]) -> 640
C15: =AND(Age<=RC[1],InsuredAmount<=RC[2]) -> 0 | D15: =R[-6]C[-2] -> 20 | E15: 20000 | F15: 0.05 | G15: 1 | H15: =RC[-3]*RC[-2] -> 1000 | I15: =InsuredAmount * (2% + ABS(Age-50)/25 *1%) -> 372 | J15: =InsuredAmount*RC[-4] -> 750 | K15: =INDEX(RC[-3]:RC[-1],RC[-4]) -> 1000
C16: =AND(Age<=RC[1],InsuredAmount<=RC[2]) -> 0 | D16: =R[-7]C[-2] -> 20 | E16: 25000 | F16: 0.05 | G16: 1 | H16: =RC[-3]*RC[-2] -> 1250 | I16: =InsuredAmount * (2% + ABS(Age-50)/25 *1%) -> 372 | J16: =InsuredAmount*RC[-4] -> 750 | K16: =INDEX(RC[-3]:RC[-1],RC[-4]) -> 1250
C17: =AND(Age<=RC[1],InsuredAmount<=RC[2]) -> 0 | D17: =R[-8]C[-2] -> 20 | E17: 30000 | F17: 0.05 | G17: 1 | H17: =RC[-3]*RC[-2] -> 1500 | I17: =InsuredAmount * (2% + ABS(Age-50)/25 *1%) -> 372 | J17: =InsuredAmount*RC[-4] -> 750 | K17: =INDEX(RC[-3]:RC[-1],RC[-4]) -> 1500
B18: 22 | C18: =AND(Age<=RC[1],InsuredAmount<=RC[2]) -> 0 | D18: =RC[-2] -> 22 | E18: 5000 | F18: 0.03 | G18: 1 | H18: =RC[-3]*RC[-2] -> 150 | I18: =InsuredAmount * (2% + ABS(Age-50)/25 *1%) -> 372 | J18: =InsuredAmount*RC[-4] -> 450 | K18: =INDEX(RC[-3]:RC[-1],RC[-4]) -> 150
C19: =AND(Age<=RC[1],InsuredAmount<=RC[2]) -> 0 | D19: =R[-1]C[-2] -> 22 | E19: 6000 | F19: 0.03 | G19: 1 | H19: =RC[-3]*RC[-2] -> 180 | I19: =InsuredAmount * (2% + ABS(Age-50)/25 *1%) -> 372 | J19: =InsuredAmount*RC[-4] -> 450 | K19: =INDEX(RC[-3]:RC[-1],RC[-4]) -> 180
C20: =AND(Age<=RC[1],InsuredAmount<=RC[2]) -> 0 | D20: =R[-2]C[-2] -> 22 | E20: 8000 | F20: 0.03 | G20: 1 | H20: =RC[-3]*RC[-2] -> 240 | I20: =InsuredAmount * (2% + ABS(Age-50)/25 *1%) -> 372 | J20: =InsuredAmount*RC[-4] -> 450 | K20: =INDEX(RC[-3]:RC[-1],RC[-4]) -> 240
C21: =AND(Age<=RC[1],InsuredAmount<=RC[2]) -> 0 | D21: =R[-3]C[-2] -> 22 | E21: 10000 | F21: 0.03 | G21: 1 | H21: =RC[-3]*RC[-2] -> 300 | I21: =InsuredAmount * (2% + ABS(Age-50)/25 *1%) -> 372 | J21: =InsuredAmount*RC[-4] -> 450 | K21: =INDEX(RC[-3]:RC[-1],RC[-4]) -> 300
C22: =AND(Age<=RC[1],InsuredAmount<=RC[2]) -> 0 | D22: =R[-4]C[-2] -> 22 | E22: 13000 | F22: 0.03 | G22: 1 | H22: =RC[-3]*RC[-2] -> 390 | I22: =InsuredAmount * (2% + ABS(Age-50)/25 *1%) -> 372 | J22: =InsuredAmount*RC[-4] -> 450 | K22: =INDEX(RC[-3]:RC[-1],RC[-4]) -> 390
C23: =AND(Age<=RC[1],InsuredAmount<=RC[2]) -> 0 | D23: =R[-5]C[-2] -> 22 | E23: 16000 | F23: 0.03 | G23: 1 | H23: =RC[-3]*RC[-2] -> 480 | I23: =InsuredAmount * (2% + ABS(Age-50)/25 *1%) -> 372 | J23: =InsuredAmount*RC[-4] -> 450 | K23: =INDEX(RC[-3]:RC[-1],RC[-4]) -> 480
C24: =AND(Age<=RC[1],InsuredAmount<=RC[2]) -> 0 | D24: =R[-6]C[-2] -> 22 | E24: 20000 | F24: 0.04 | G24: 1 | H24: =RC[-3]*RC[-2] -> 800 | I24: =InsuredAmount * (2% + ABS(Age-50)/25 *1%) -> 372 | J24: =InsuredAmount*RC[-4] -> 600 | K24: =INDEX(RC[-3]:RC[-1],RC[-4]) -> 800
C25: =AND(Age<=RC[1],InsuredAmount<=RC[2]) -> 0 | D25: =R[-7]C[-2] -> 22 | E25: 25000 | F25: 0.04 | G25: 1 | H25: =RC[-3]*RC[-2] -> 1000 | I25: =InsuredAmount * (2% + ABS(Age-50)/25 *1%) -> 372 | J25: =InsuredAmount*RC[-4] -> 600 | K25: =INDEX(RC[-3]:RC[-1],RC[-4]) -> 1000
C26: =AND(Age<=RC[1],InsuredAmount<=RC[2]) -> 0 | D26: =R[-8]C[-2] -> 22 | E26: 30000 | F26: 0.04 | G26: 1 | H26: =RC[-3]*RC[-2] -> 1200 | I26: =InsuredAmount * (2% + ABS(Age-50)/25 *1%) -> 372 | J26: =InsuredAmount*RC[-4] -> 600 | K26: =INDEX(RC[-3]:RC[-1],RC[-4]) -> 1200
B27: 25 | C27: =AND(Age<=RC[1],InsuredAmount<=RC[2]) -> 0 | D27: =RC[-2] -> 25 | E27: 5000 | F27: 0.03 | G27: 1 | H27: =RC[-3]*RC[-2] -> 150 | I27: =InsuredAmount * (2% + ABS(Age-50)/25 *1%) -> 372 | J27: =InsuredAmount*RC[-4] -> 450 | K27: =INDEX(RC[-3]:RC[-1],RC[-4]) -> 150
C28: =AND(Age<=RC[1],InsuredAmount<=RC[2]) -> 0 | D28: =R[-1]C[-2] -> 25 | E28: 6000 | F28: 0.03 | G28: 1 | H28: =RC[-3]*RC[-2] -> 180 | I28: =InsuredAmount * (2% + ABS(Age-50)/25 *1%) -> 372 | J28: =InsuredAmount*RC[-4] -> 450 | K28: =INDEX(RC[-3]:RC[-1],RC[-4]) -> 180
C29: =AND(Age<=RC[1],InsuredAmount<=RC[2]) -> 0 | D29: =R[-2]C[-2] -> 25 | E29: 8000 | F29: 0.03 | G29: 1 | H29: =RC[-3]*RC[-2] -> 240 | I29: =InsuredAmount * (2% + ABS(Age-50)/25 *1%) -> 372 | J29: =InsuredAmount*RC[-4] -> 450 | K29: =INDEX(RC[-3]:RC[-1],RC[-4]) -> 240
C30: =AND(Age<=RC[1],InsuredAmount<=RC[2]) -> 0 | D30: =R[-3]C[-2] -> 25 | E30: 10000 | F30: 0.03 | G30: 1 | H30: =RC[-3]*RC[-2] -> 300 | I30: =InsuredAmount * (2% + ABS(Age-50)/25 *1%) -> 372 | J30: =InsuredAmount*RC[-4] -> 450 | K30: =INDEX(RC[-3]:RC[-1],RC[-4]) -> 300
C31: =AND(Age<=RC[1],InsuredAmount<=RC[2]) -> 0 | D31: =R[-4]C[-2] -> 25 | E31: 13000 | F31: 0.03 | G31: 1 | H31: =RC[-3]*RC[-2] -> 390 | I31: =InsuredAmount * (2% + ABS(Age-50)/25 *1%) -> 372 | J31: =InsuredAmount*RC[-4] -> 450 | K31: =INDEX(RC[-3]:RC[-1],RC[-4]) -> 390
C32: =AND(Age<=RC[1],InsuredAmount<=RC[2]) -> 0 | D32: =R[-5]C[-2] -> 25 | E32: 16000 | F32: 0.03 | G32: 1 | H32: =RC[-3]*RC[-2] -> 480 | I32: =InsuredAmount * (2% + ABS(Age-50)/25 *1%) -> 372 | J32: =InsuredAmount*RC[-4] -> 450 | K32: =INDEX(RC[-3]:RC[-1],RC[-4]) -> 480
C33: =AND(Age<=RC[1],InsuredAmount<=RC[2]) -> 0 | D33: =R[-6]C[-2] -> 25 | E33: 20000 | F33: 0.03 | G33: 1 | H33: =RC[-3]*RC[-2] -> 600 | I33: =InsuredAmount * (2% + ABS(Age-50)/25 *1%) -> 372 | J33: =InsuredAmount*RC[-4] -> 450 | K33: =INDEX(RC[-3]:RC[-1],RC[-4]) -> 600
C34: =AND(Age<=RC[1],InsuredAmount<=RC[2]) -> 0 | D34: =R[-7]C[-2] -> 25 | E34: 25000 | F34: 0.03 | G34: 1 | H34: =RC[-3]*RC[-2] -> 750 | I34: =InsuredAmount * (2% + ABS(Age-50)/25 *1%) -> 372 | J34: =InsuredAmount*RC[-4] -> 450 | K34: =INDEX(RC[-3]:RC[-1],RC[-4]) -> 750
C35: =AND(Age<=RC[1],InsuredAmount<=RC[2]) -> 0 | D35: =R[-8]C[-2] -> 25 | E35: 30000 | F35: 0.03 | G35: 1 | H35: =RC[-3]*RC[-2] -> 900 | I35: =InsuredAmount * (2% + ABS(Age-50)/25 *1%) -> 372 | J35: =InsuredAmount*RC[-4] -> 450 | K35: =INDEX(RC[-3]:RC[-1],RC[-4]) -> 900
B36: 60 | C36: =AND(Age<=RC[1],InsuredAmount<=RC[2]) -> 0 | D36: =RC[-2] -> 60 | E36: 30000 | F36: =2% + ABS(Age-50)/25 *1% -> 2.4799999999999999E-2 | G36: 2 | H36: =RC[-3]*RC[-2] -> 744 | I36: =InsuredAmount * (2% + ABS(Age-50)/25 *1%) -> 372 | J36: =InsuredAmount*RC[-4] -> 372 | K36: =INDEX(RC[-3]:RC[-1],RC[-4]) -> 372
B37: 200 | C37: =AND(Age<=RC[1],InsuredAmount<=RC[2]) -> 0 | D37: =RC[-2] -> 200 | E37: 5000 | F37: 0.03 | G37: 3 | H37: =RC[-3]*RC[-2] -> 150 | I37: =InsuredAmount * (2% + ABS(Age-50)/25 *1%) -> 372 | J37: =InsuredAmount*RC[-4] -> 450 | K37: =INDEX(RC[-3]:RC[-1],RC[-4]) -> 450
C38: =AND(Age<=RC[1],InsuredAmount<=RC[2]) -> 0 | D38: =R[-1]C[-2] -> 200 | E38: 6000 | F38: 0.03 | G38: 3 | H38: =RC[-3]*RC[-2] -> 180 | I38: =InsuredAmount * (2% + ABS(Age-50)/25 *1%) -> 372 | J38: =InsuredAmount*RC[-4] -> 450 | K38: =INDEX(RC[-3]:RC[-1],RC[-4]) -> 450
C39: =AND(Age<=RC[1],InsuredAmount<=RC[2]) -> 0 | D39: =R[-2]C[-2] -> 200 | E39: 8000 | F39: 0.03 | G39: 3 | H39: =RC[-3]*RC[-2] -> 240 | I39: =InsuredAmount * (2% + ABS(Age-50)/25 *1%) -> 372 | J39: =InsuredAmount*RC[-4] -> 450 | K39: =INDEX(RC[-3]:RC[-1],RC[-4]) -> 450
C40: =AND(Age<=RC[1],InsuredAmount<=RC[2]) -> 0 | D40: =R[-3]C[-2] -> 200 | E40: 10000 | F40: 0.04 | G40: 3 | H40: =RC[-3]*RC[-2] -> 400 | I40: =InsuredAmount * (2% + ABS(Age-50)/25 *1%) -> 372 | J40: =InsuredAmount*RC[-4] -> 600 | K40: =INDEX(RC[-3]:RC[-1],RC[-4]) -> 600
C41: =AND(Age<=RC[1],InsuredAmount<=RC[2]) -> 0 | D41: =R[-4]C[-2] -> 200 | E41: 13000 | F41: 0.04 | G41: 3 | H41: =RC[-3]*RC[-2] -> 520 | I41: =InsuredAmount * (2% + ABS(Age-50)/25 *1%) -> 372 | J41: =InsuredAmount*RC[-4] -> 600 | K41: =INDEX(RC[-3]:RC[-1],RC[-4]) -> 600
C42: =AND(Age<=RC[1],InsuredAmount<=RC[2]) -> 1 | D42: =R[-5]C[-2] -> 200 | E42: 16000 | F42: 0.04 | G42: 3 | H42: =RC[-3]*RC[-2] -> 640 | I42: =InsuredAmount * (2% + ABS(Age-50)/25 *1%) -> 372 | J42: =InsuredAmount*RC[-4] -> 600 | K42: =INDEX(RC[-3]:RC[-1],RC[-4]) -> 600
C43: =AND(Age<=RC[1],InsuredAmount<=RC[2]) -> 1 | D43: =R[-6]C[-2] -> 200 | E43: 20000 | F43: 0.05 | G43: 3 | H43: =RC[-3]*RC[-2] -> 1000 | I43: =InsuredAmount * (2% + ABS(Age-50)/25 *1%) -> 372 | J43: =InsuredAmount*RC[-4] -> 750 | K43: =INDEX(RC[-3]:RC[-1],RC[-4]) -> 750
C44: =AND(Age<=RC[1],InsuredAmount<=RC[2]) -> 1 | D44: =R[-7]C[-2] -> 200 | E44: 25000 | F44: 0.05 | G44: 3 | H44: =RC[-3]*RC[-2] -> 1250 | I44: =InsuredAmount * (2% + ABS(Age-50)/25 *1%) -> 372 | J44: =InsuredAmount*RC[-4] -> 750 | K44: =INDEX(RC[-3]:RC[-1],RC[-4]) -> 750
C45: =AND(Age<=RC[1],InsuredAmount<=RC[2]) -> 1 | D45: =R[-8]C[-2] -> 200 | E45: 30000 | F45: 0.05 | G45: 3 | H45: =RC[-3]*RC[-2] -> 1500 | I45: =InsuredAmount * (2% + ABS(Age-50)/25 *1%) -> 372 | J45: =InsuredAmount*RC[-4] -> 750 | K45: =INDEX(RC[-3]:RC[-1],RC[-4]) -> 750