Sheet: Sheet1
A1: Inputs
A2: Insured amount | B2: 15000
A3: Age | B3: 62
A5: Outputs
A6: Cost per year | B6: =INDEX(R[5]C:R[7]C,R[4]C) -> 600
A8: Helpers
A9: Matching row | B9: =MATCH(TRUE,R[7]C[1]:R[43]C[1],0) -> 34
A10: Computation style | B10: =INDEX(R[6]C[5]:R[42]C[5],R[-1]C) -> 3
A11: Style 1 | B11: =INDEX(R[5]C[3]:R[41]C[3],R[-2]C)*INDEX(R[5]C[4]:R[41]C[4],R[-2]C) -> 640 | C11: Amount rounded up; percentage from table
A12: Style 2 | B12: =InsuredAmount * (2% + ABS(Age-50)/25 *1%) -> 372 | C12: Exact amount; percentage computed from age
A13: Style 3 | B13: =InsuredAmount*INDEX(R[3]C[4]:R[39]C[4],R[-4]C) -> 600 | C13: Exact amount; percentage from table
A15: Lookup Table | B15: AgeUpTo | C15: Match | D15: AgeUpTo (Copy) | E15: InsuredAmountUpTo | F15: Percentage | G15: Style
B16: 20 | C16: =AND(Age<=RC[1],InsuredAmount<=RC[2]) -> 0 | D16: =RC[-2] -> 20 | E16: 5000 | F16: 0.03 | G16: 1
C17: =AND(Age<=RC[1],InsuredAmount<=RC[2]) -> 0 | D17: =R[-1]C[-2] -> 20 | E17: 6000 | F17: 0.03 | G17: 1
C18: =AND(Age<=RC[1],InsuredAmount<=RC[2]) -> 0 | D18: =R[-2]C[-2] -> 20 | E18: 8000 | F18: 0.03 | G18: 1
C19: =AND(Age<=RC[1],InsuredAmount<=RC[2]) -> 0 | D19: =R[-3]C[-2] -> 20 | E19: 10000 | F19: 0.04 | G19: 1
C20: =AND(Age<=RC[1],InsuredAmount<=RC[2]) -> 0 | D20: =R[-4]C[-2] -> 20 | E20: 13000 | F20: 0.04 | G20: 1
C21: =AND(Age<=RC[1],InsuredAmount<=RC[2]) -> 0 | D21: =R[-5]C[-2] -> 20 | E21: 16000 | F21: 0.04 | G21: 1
C22: =AND(Age<=RC[1],InsuredAmount<=RC[2]) -> 0 | D22: =R[-6]C[-2] -> 20 | E22: 20000 | F22: 0.05 | G22: 1
C23: =AND(Age<=RC[1],InsuredAmount<=RC[2]) -> 0 | D23: =R[-7]C[-2] -> 20 | E23: 25000 | F23: 0.05 | G23: 1
C24: =AND(Age<=RC[1],InsuredAmount<=RC[2]) -> 0 | D24: =R[-8]C[-2] -> 20 | E24: 30000 | F24: 0.05 | G24: 1
B25: 22 | C25: =AND(Age<=RC[1],InsuredAmount<=RC[2]) -> 0 | D25: =RC[-2] -> 22 | E25: 5000 | F25: 0.03 | G25: 1
C26: =AND(Age<=RC[1],InsuredAmount<=RC[2]) -> 0 | D26: =R[-1]C[-2] -> 22 | E26: 6000 | F26: 0.03 | G26: 1
C27: =AND(Age<=RC[1],InsuredAmount<=RC[2]) -> 0 | D27: =R[-2]C[-2] -> 22 | E27: 8000 | F27: 0.03 | G27: 1
C28: =AND(Age<=RC[1],InsuredAmount<=RC[2]) -> 0 | D28: =R[-3]C[-2] -> 22 | E28: 10000 | F28: 0.03 | G28: 1
C29: =AND(Age<=RC[1],InsuredAmount<=RC[2]) -> 0 | D29: =R[-4]C[-2] -> 22 | E29: 13000 | F29: 0.03 | G29: 1
C30: =AND(Age<=RC[1],InsuredAmount<=RC[2]) -> 0 | D30: =R[-5]C[-2] -> 22 | E30: 16000 | F30: 0.03 | G30: 1
C31: =AND(Age<=RC[1],InsuredAmount<=RC[2]) -> 0 | D31: =R[-6]C[-2] -> 22 | E31: 20000 | F31: 0.04 | G31: 1
C32: =AND(Age<=RC[1],InsuredAmount<=RC[2]) -> 0 | D32: =R[-7]C[-2] -> 22 | E32: 25000 | F32: 0.04 | G32: 1
C33: =AND(Age<=RC[1],InsuredAmount<=RC[2]) -> 0 | D33: =R[-8]C[-2] -> 22 | E33: 30000 | F33: 0.04 | G33: 1
B34: 25 | C34: =AND(Age<=RC[1],InsuredAmount<=RC[2]) -> 0 | D34: =RC[-2] -> 25 | E34: 5000 | F34: 0.03 | G34: 1
C35: =AND(Age<=RC[1],InsuredAmount<=RC[2]) -> 0 | D35: =R[-1]C[-2] -> 25 | E35: 6000 | F35: 0.03 | G35: 1
C36: =AND(Age<=RC[1],InsuredAmount<=RC[2]) -> 0 | D36: =R[-2]C[-2] -> 25 | E36: 8000 | F36: 0.03 | G36: 1
C37: =AND(Age<=RC[1],InsuredAmount<=RC[2]) -> 0 | D37: =R[-3]C[-2] -> 25 | E37: 10000 | F37: 0.03 | G37: 1
C38: =AND(Age<=RC[1],InsuredAmount<=RC[2]) -> 0 | D38: =R[-4]C[-2] -> 25 | E38: 13000 | F38: 0.03 | G38: 1
C39: =AND(Age<=RC[1],InsuredAmount<=RC[2]) -> 0 | D39: =R[-5]C[-2] -> 25 | E39: 16000 | F39: 0.03 | G39: 1
C40: =AND(Age<=RC[1],InsuredAmount<=RC[2]) -> 0 | D40: =R[-6]C[-2] -> 25 | E40: 20000 | F40: 0.03 | G40: 1
C41: =AND(Age<=RC[1],InsuredAmount<=RC[2]) -> 0 | D41: =R[-7]C[-2] -> 25 | E41: 25000 | F41: 0.03 | G41: 1
C42: =AND(Age<=RC[1],InsuredAmount<=RC[2]) -> 0 | D42: =R[-8]C[-2] -> 25 | E42: 30000 | F42: 0.03 | G42: 1
B43: 60 | C43: =AND(Age<=RC[1],InsuredAmount<=RC[2]) -> 0 | D43: =RC[-2] -> 60 | E43: 30000 | F43: =2% + ABS(Age-50)/25 *1% -> 2.4799999999999999E-2 | G43: 2
B44: 200 | C44: =AND(Age<=RC[1],InsuredAmount<=RC[2]) -> 0 | D44: =RC[-2] -> 200 | E44: 5000 | F44: 0.03 | G44: 3
C45: =AND(Age<=RC[1],InsuredAmount<=RC[2]) -> 0 | D45: =R[-1]C[-2] -> 200 | E45: 6000 | F45: 0.03 | G45: 3
C46: =AND(Age<=RC[1],InsuredAmount<=RC[2]) -> 0 | D46: =R[-2]C[-2] -> 200 | E46: 8000 | F46: 0.03 | G46: 3
C47: =AND(Age<=RC[1],InsuredAmount<=RC[2]) -> 0 | D47: =R[-3]C[-2] -> 200 | E47: 10000 | F47: 0.04 | G47: 3
C48: =AND(Age<=RC[1],InsuredAmount<=RC[2]) -> 0 | D48: =R[-4]C[-2] -> 200 | E48: 13000 | F48: 0.04 | G48: 3
C49: =AND(Age<=RC[1],InsuredAmount<=RC[2]) -> 1 | D49: =R[-5]C[-2] -> 200 | E49: 16000 | F49: 0.04 | G49: 3
C50: =AND(Age<=RC[1],InsuredAmount<=RC[2]) -> 1 | D50: =R[-6]C[-2] -> 200 | E50: 20000 | F50: 0.05 | G50: 3
C51: =AND(Age<=RC[1],InsuredAmount<=RC[2]) -> 1 | D51: =R[-7]C[-2] -> 200 | E51: 25000 | F51: 0.05 | G51: 3
C52: =AND(Age<=RC[1],InsuredAmount<=RC[2]) -> 1 | D52: =R[-8]C[-2] -> 200 | E52: 30000 | F52: 0.05 | G52: 3