Sheet: Sheet1
A1: Inputs
A2: Insured amount | B2: 15000
A3: Age | B3: 21
A5: Outputs
A6: Cost per year | B6: =INDEX(R[6]C[5]:R[42]C[5],R[3]C) -> 480
A8: Helpers
A9: Matching row | B9: =MATCH(TRUE,R[3]C[1]:R[39]C[1],0) -> 15
A11: Lookup Table | B11: AgeUpTo | C11: Match | D11: AgeUpTo (Copy) | E11: InsuredAmountUpTo | F11: Percentage | G11: InsuranceCostPerYear
B12: 20 | C12: =AND(Age<=RC[1],InsuredAmount<=RC[2]) -> 0 | D12: =RC[-2] -> 20 | E12: 5000 | F12: 0.03 | G12: =RC[-2]*RC[-1] -> 150
C13: =AND(Age<=RC[1],InsuredAmount<=RC[2]) -> 0 | D13: =R[-1]C[-2] -> 20 | E13: 6000 | F13: 0.03 | G13: =RC[-2]*RC[-1] -> 180
C14: =AND(Age<=RC[1],InsuredAmount<=RC[2]) -> 0 | D14: =R[-2]C[-2] -> 20 | E14: 8000 | F14: 0.03 | G14: =RC[-2]*RC[-1] -> 240
C15: =AND(Age<=RC[1],InsuredAmount<=RC[2]) -> 0 | D15: =R[-3]C[-2] -> 20 | E15: 10000 | F15: 0.04 | G15: =RC[-2]*RC[-1] -> 400 | H15: Here we switch the percentage.
C16: =AND(Age<=RC[1],InsuredAmount<=RC[2]) -> 0 | D16: =R[-4]C[-2] -> 20 | E16: 13000 | F16: 0.04 | G16: =RC[-2]*RC[-1] -> 520
C17: =AND(Age<=RC[1],InsuredAmount<=RC[2]) -> 0 | D17: =R[-5]C[-2] -> 20 | E17: 16000 | F17: 0.04 | G17: =RC[-2]*RC[-1] -> 640
C18: =AND(Age<=RC[1],InsuredAmount<=RC[2]) -> 0 | D18: =R[-6]C[-2] -> 20 | E18: 20000 | F18: 0.05 | G18: =RC[-2]*RC[-1] -> 1000 | H18: Again.
C19: =AND(Age<=RC[1],InsuredAmount<=RC[2]) -> 0 | D19: =R[-7]C[-2] -> 20 | E19: 25000 | F19: 0.05 | G19: =RC[-2]*RC[-1] -> 1250
C20: =AND(Age<=RC[1],InsuredAmount<=RC[2]) -> 0 | D20: =R[-8]C[-2] -> 20 | E20: 30000 | F20: 0.05 | G20: =RC[-2]*RC[-1] -> 1500
B21: 22 | C21: =AND(Age<=RC[1],InsuredAmount<=RC[2]) -> 0 | D21: =RC[-2] -> 22 | E21: 5000 | F21: 0.03 | G21: =RC[-2]*RC[-1] -> 150 | H21: The next age group is similar, but with different percentages.
C22: =AND(Age<=RC[1],InsuredAmount<=RC[2]) -> 0 | D22: =R[-1]C[-2] -> 22 | E22: 6000 | F22: 0.03 | G22: =RC[-2]*RC[-1] -> 180
C23: =AND(Age<=RC[1],InsuredAmount<=RC[2]) -> 0 | D23: =R[-2]C[-2] -> 22 | E23: 8000 | F23: 0.03 | G23: =RC[-2]*RC[-1] -> 240
C24: =AND(Age<=RC[1],InsuredAmount<=RC[2]) -> 0 | D24: =R[-3]C[-2] -> 22 | E24: 10000 | F24: 0.03 | G24: =RC[-2]*RC[-1] -> 300
C25: =AND(Age<=RC[1],InsuredAmount<=RC[2]) -> 0 | D25: =R[-4]C[-2] -> 22 | E25: 13000 | F25: 0.03 | G25: =RC[-2]*RC[-1] -> 390
C26: =AND(Age<=RC[1],InsuredAmount<=RC[2]) -> 1 | D26: =R[-5]C[-2] -> 22 | E26: 16000 | F26: 0.03 | G26: =RC[-2]*RC[-1] -> 480
C27: =AND(Age<=RC[1],InsuredAmount<=RC[2]) -> 1 | D27: =R[-6]C[-2] -> 22 | E27: 20000 | F27: 0.04 | G27: =RC[-2]*RC[-1] -> 800
C28: =AND(Age<=RC[1],InsuredAmount<=RC[2]) -> 1 | D28: =R[-7]C[-2] -> 22 | E28: 25000 | F28: 0.04 | G28: =RC[-2]*RC[-1] -> 1000
C29: =AND(Age<=RC[1],InsuredAmount<=RC[2]) -> 1 | D29: =R[-8]C[-2] -> 22 | E29: 30000 | F29: 0.04 | G29: =RC[-2]*RC[-1] -> 1200
B30: 25 | C30: =AND(Age<=RC[1],InsuredAmount<=RC[2]) -> 0 | D30: =RC[-2] -> 25 | E30: 5000 | F30: 0.03 | G30: =RC[-2]*RC[-1] -> 150 | H30: Similar again, different percentages again.
C31: =AND(Age<=RC[1],InsuredAmount<=RC[2]) -> 0 | D31: =R[-1]C[-2] -> 25 | E31: 6000 | F31: 0.03 | G31: =RC[-2]*RC[-1] -> 180
C32: =AND(Age<=RC[1],InsuredAmount<=RC[2]) -> 0 | D32: =R[-2]C[-2] -> 25 | E32: 8000 | F32: 0.03 | G32: =RC[-2]*RC[-1] -> 240
C33: =AND(Age<=RC[1],InsuredAmount<=RC[2]) -> 0 | D33: =R[-3]C[-2] -> 25 | E33: 10000 | F33: 0.03 | G33: =RC[-2]*RC[-1] -> 300
C34: =AND(Age<=RC[1],InsuredAmount<=RC[2]) -> 0 | D34: =R[-4]C[-2] -> 25 | E34: 13000 | F34: 0.03 | G34: =RC[-2]*RC[-1] -> 390
C35: =AND(Age<=RC[1],InsuredAmount<=RC[2]) -> 1 | D35: =R[-5]C[-2] -> 25 | E35: 16000 | F35: 0.03 | G35: =RC[-2]*RC[-1] -> 480
C36: =AND(Age<=RC[1],InsuredAmount<=RC[2]) -> 1 | D36: =R[-6]C[-2] -> 25 | E36: 20000 | F36: 0.03 | G36: =RC[-2]*RC[-1] -> 600
C37: =AND(Age<=RC[1],InsuredAmount<=RC[2]) -> 1 | D37: =R[-7]C[-2] -> 25 | E37: 25000 | F37: 0.03 | G37: =RC[-2]*RC[-1] -> 750
C38: =AND(Age<=RC[1],InsuredAmount<=RC[2]) -> 1 | D38: =R[-8]C[-2] -> 25 | E38: 30000 | F38: 0.03 | G38: =RC[-2]*RC[-1] -> 900
B39: 60 | C39: =AND(Age<=RC[1],InsuredAmount<=RC[2]) -> 1 | D39: =RC[-2] -> 60 | E39: 30000 | F39: =2% + ABS(Age-50)/25 *1% -> 3.1600000000000003E-2 | G39: =InsuredAmount*RC[-1] -> 474.00000000000006 | H39: Complete switch of structure here.
B40: 200 | C40: =AND(Age<=RC[1],InsuredAmount<=RC[2]) -> 0 | D40: =RC[-2] -> 200 | E40: 5000 | F40: 0.03 | G40: =InsuredAmount*RC[-1] -> 450 | H40: Percentages again, but no fixed amounts.
C41: =AND(Age<=RC[1],InsuredAmount<=RC[2]) -> 0 | D41: =R[-1]C[-2] -> 200 | E41: 6000 | F41: 0.03 | G41: =InsuredAmount*RC[-1] -> 450
C42: =AND(Age<=RC[1],InsuredAmount<=RC[2]) -> 0 | D42: =R[-2]C[-2] -> 200 | E42: 8000 | F42: 0.03 | G42: =InsuredAmount*RC[-1] -> 450
C43: =AND(Age<=RC[1],InsuredAmount<=RC[2]) -> 0 | D43: =R[-3]C[-2] -> 200 | E43: 10000 | F43: 0.04 | G43: =InsuredAmount*RC[-1] -> 600
C44: =AND(Age<=RC[1],InsuredAmount<=RC[2]) -> 0 | D44: =R[-4]C[-2] -> 200 | E44: 13000 | F44: 0.04 | G44: =InsuredAmount*RC[-1] -> 600
C45: =AND(Age<=RC[1],InsuredAmount<=RC[2]) -> 1 | D45: =R[-5]C[-2] -> 200 | E45: 16000 | F45: 0.04 | G45: =InsuredAmount*RC[-1] -> 600
C46: =AND(Age<=RC[1],InsuredAmount<=RC[2]) -> 1 | D46: =R[-6]C[-2] -> 200 | E46: 20000 | F46: 0.05 | G46: =InsuredAmount*RC[-1] -> 750
C47: =AND(Age<=RC[1],InsuredAmount<=RC[2]) -> 1 | D47: =R[-7]C[-2] -> 200 | E47: 25000 | F47: 0.05 | G47: =InsuredAmount*RC[-1] -> 750
C48: =AND(Age<=RC[1],InsuredAmount<=RC[2]) -> 1 | D48: =R[-8]C[-2] -> 200 | E48: 30000 | F48: 0.05 | G48: =InsuredAmount*RC[-1] -> 750